B6: PODER JUDICIAL DE LA NACION
B7: JURISDICCIÓN FEDERAL COMODORO RIVADAVIA
B8: CUADRO XII
B9: INDICE DE LITIGIOSIDAD EN LOS JUZGADOS FEDERALES DE PRIMERA INSTANCIA -AÑO 2001-
B12: 1- COMPETENCIA PENAL
B14: Dependencias | C14: Causas ingresadas | D14: Cantidad de habitantes en la | E14: Causas ingresadas
D15: jurisdicción | E15: c/10.000 hab.
B16: Juzgado Federal de Primera Instancia de Comodoro Rivadavia | C16: 318 | D16: 198373 | E16: =+(C16/$D$16)*10000 -> 16.030407363905372
B17: Juzgado Federal de Primera Instancia de Rawson | C17: 1425 | D17: 190886 | E17: =+(C17/$D$17)*10000 -> 74.651886466267825
B18: Juzgado Federal de Primera Instancia de Rio Gallegos | C18: 369 | D18: 157510 | E18: =+(C18/$D$18)*10000 -> 23.427083994667004
B19: Juzgado Federal de Primera Instancia de Ushuaia | C19: 168 | D19: 45598 | E19: =+(C19/$D$19)*10000 -> 36.843721215842798
B20: Juzgado Federal de Primera Instancia de Rio Grande | C20: 163 | D20: 55201 | E20: =+(C20/D20)*10000 -> 29.528450571547619
B21: TOTAL | C21: =SUM(C16:C20) -> 2443 | D21: 656567 | E21: =+(C21/D21)*10000 -> 37.208693096058745
B23: FUENTE: INDEC (Censo Nacional de Población, Hogares y Viviendas 2001 e Instituto Geografico Militar).
B24: Oficina de Estadísticas del Poder Judicial de la Nación.
B27: 2- COMPETENCIA CIVIL
B29: Dependencias | C29: Causas ingresadas | D29: Cantidad de habitantes en la | E29: Causas ingresadas
D30: jurisdicción | E30: c/10.000 hab.
B31: Juzgado Federal de Primera Instancia de Comodoro Rivadavia | C31: 3055 | D31: 198373 | E31: =+(C31/$D$31)*10000 -> 154.00281288280158
B32: Juzgado Federal de Primera Instancia de Rawson | C32: 1780 | D32: 190886 | E32: =+(C32/$D$32)*10000 -> 93.249373971899459
B33: Juzgado Federal de Primera Instancia de Rio Gallegos | C33: 1940 | D33: 157510 | E33: =+(C33/$D$33)*10000 -> 123.16678306139292
B34: Juzgado Federal de Primera Instancia de Ushuaia | C34: 739 | D34: 45598 | E34: =+(C34/$D$34)*10000 -> 162.06851177683231
B35: Juzgado Federal de Primera Instancia de Rio Grande | C35: 528 | D35: 55201 | E35: =+(C35/D35)*10000 -> 95.650441115197182
B36: TOTAL | C36: =SUM(C31:C35) -> 8042 | D36: 656567 | E36: =+(C36/D36)*10000 -> 122.48559552947377
B38: FUENTE: INDEC (Censo Nacional de Población, Hogares y Viviendas 2001 e Instituto Geografico Militar).
B39: Oficina de Estadísticas del Poder Judicial de la Nación.