B6: PODER JUDICIAL DE LA NACION
B7: JURISDICCION FEDERAL COMODORO RIVADAVIA
B9: CUADRO III
B10: DISTRIBUCION DE LOS CARGOS PERMANENTES Y CONTRATADOS -AÑO 2001-
C13: Cámara Federal de Apelaciones de Comodoro Rivadavia | E13: Tribunal Oral en lo Criminal Federal de Comodoro Rivadavia | G13: Tribunal Oral en lo Criminal Federal de Tierra del Fuego | I13: Tribunal Oral en lo Criminal Federal de Rio Gallegos (sin habilitar) | K13: Juzgado Federal de Primera Instancia de Comodoro Rivadavia | M13: Juzgado Federal de Primera Instancia de Rawson | O13: Juzgado Federal de Primera Instancia de Rio Gallegos | Q13: Juzgado Federal de Primera Instancia de Ushuaia | S13: Juzgado Federal de Primera Instancia de Rio Grande
C14: P | D14: C | E14: P | F14: C | G14: P | H14: C | I14: P | J14: C | K14: P | L14: C | M14: P | N14: C | O14: P | P14: C | Q14: P | R14: C | S14: P | T14: C
B15: Juez (1ª o 2ª
B16: instancia) | C16: 3 | E16: 3 | G16: 3 | K16: 1 | M16: 1 | O16: 1 | Q16: 1 | S16: 1
B17: Secretario (1ª o 2ª instancia)
C18: 3 | D18: 2 | E18: 1 | G18: 1 | K18: 4 | L18: 1 | M18: 3 | N18: 2 | O18: 4 | Q18: 6 | S18: 4
B19: Prosecretario Administrativo
C20: 6 | E20: 2 | G20: 2 | K20: 4 | L20: 1 | M20: 3 | O20: 4 | Q20: 8 | S20: 4
B21: Oficial Mayor
C22: 6 | E22: 3 | G22: 3 | K22: 3 | M22: 4 | O22: 5 | Q22: 9 | S22: 9
B23: Oficial Mayor Relator
S24: 2
B25: Oficial
M26: 1 | O26: 1 | Q26: 3
B27: Escribiente
C28: 2 | E28: 1 | G28: 1 | K28: 5 | M28: 5 | O28: 4 | Q28: 10 | S28: 4
B29: Escribiente Auxiliar
C30: 2 | E30: 1 | G30: 1 | K30: 3 | M30: 3 | O30: 2 | Q30: 6 | S30: 3
B31: Auxiliar
C32: 4 | K32: 6 | L32: 1 | M32: 4 | O32: 5 | Q32: 8 | S32: 5
B33: Auxiliar Administrativo
B35: Oficial
B36: de Servicio/Medio Oficial | C36: 2
B37: Ayudante
C38: 8 | E38: 1 | G38: 1 | H38: 1 | K38: 5 | M38: 4 | O38: 4 | Q38: 4 | S38: 2
B39: Auxiliar de Servicio
B41: Total | F41: =SUM(F13:F40) -> 0 | H41: =SUM(H13:H40) -> 1 | P41: =SUM(P13:P40) -> 0
C42: =SUM(C16:C40) -> 36 | D42: =SUM(D16:D40) -> 2 | E42: =SUM(E16:E41) -> 12 | G42: =SUM(G16:G41) -> 12 | K42: =SUM(K16:K40) -> 31 | L42: =SUM(L16:L40) -> 3 | M42: =SUM(M16:M40) -> 28 | N42: =SUM(N16:N40) -> 2 | O42: =SUM(O16:O41) -> 30 | Q42: =SUM(Q16:Q41) -> 55 | R42: =SUM(R16:R41) -> 0 | S42: =SUM(S16:S41) -> 34 | T42: =SUM(T16:T41) -> 0
B43: FUENTE: División Programación Presupuestaria. Consejo de la Magistratura.
B44: Oficina de Estadísticas del Poder Judicial de la Nación.