B6: PODER JUDICIAL DE LA NACION
B7: JURISDICCION FEDERAL COMODORO RIVADAVIA
B9: COMPETENCIA PENAL
B10: CUADRO VII
B12: CAUSAS INGRESADAS Y ELEVADAS A JUICIO EN LOS JUZGADOS DE 1RA. INSTANCIA -AÑO 2001-
C14: TOTAL DE CAUSAS INGRESADAS | D14: TOTAL DE CAUSAS ELEVADAS A JUICIO (*) | E14: PORCENTAJE DE CAUSAS ELEVADAS A JUICIO
B16: Juzgado Federal de Primera Instancia de Comodoro Rivadavia | C16: 318 | D16: 29 | E16: =+D16/C16 -> 9.1194968553459113E-2
B17: Juzgado Federal de Primera Instancia de Rawson | C17: 1425 | D17: 21 | E17: =+D17/C17 -> 1.4736842105263158E-2
B18: Juzgado Federal de Primera Instancia de Rio Gallegos | C18: 369 | D18: 16 | E18: =+D18/C18 -> 4.3360433604336043E-2
B19: Juzgado Federal de Primera Instancia de Ushuaia | C19: 168 | D19: 4 | E19: =+D19/C19 -> 2.3809523809523808E-2
B20: Juzgado Federal de Primera Instancia de Rio Grande | C20: 163 | D20: 11 | E20: =+D20/C20 -> 6.7484662576687116E-2
B21: Total | C21: =SUM(C16:C20) -> 2443 | D21: =SUM(D16:D20) -> 81 | E21: =+D21/C21 -> 3.3155955792058947E-2
B22: REFERENCIAS: (*) En estas cifras se incluyen causas de años anteriores y las elevaciones a juicio en causas correccionales
B23: que se resuelven en la misma instancia.
B24: FUENTE: Oficina de Estadísticas del Poder Judicial de la Nación.