B6: PODER JUDICIAL DE LA NACION
B7: JURISDICCION FEDERAL COMODORO RIVADAVIA
B9: COMPETENCIA PENAL
B10: CUADRO IX
B11: DISTRIBUCION PORCENTUAL SEGÚN EL TIPO DE DELITO DE LAS CAUSAS INGRESADAS, ELEVADAS A JUICIO Y PERSONAS CONDENADAS EN LOS JUZGADOS FEDERALES -AÑO 2001-
C13: CAUSAS | D13: % | E13: CAUSAS | F13: % | G13: PERSONAS | H13: %
B14: BIEN PROTEGIDO | C14: INGRESADAS | E14: ELEVADAS | G14: CONDENADAS
B15: DELITOS CONTRA LAS PERSONAS | C15: 300 | D15: =+(C15/C$31) -> 0.12279983626688498 | E15: 3 | F15: =+E15/E$31 -> 3.7037037037037035E-2 | G15: 2 | H15: =+G15/G$31 -> 3.3333333333333333E-2
B16: HOMICIDIOS | C16: 4 | D16: =+(C16/C$31) -> 1.637331150225133E-3 | F16: =+E16/E$31 -> 0 | H16: =+G16/G$31 -> 0
B17: DELITOS CONTRA EL HONOR | C17: 1 | D17: =+(C17/C$31) -> 4.0933278755628325E-4 | F17: =+E17/E$31 -> 0 | H17: =+G17/G$31 -> 0
B18: DELITOS CONTRA LA INTEGRIDAD SEXUAL | D18: =+(C18/C$31) -> 0 | F18: =+E18/E$31 -> 0 | H18: =+G18/G$31 -> 0
B19: DELITOS CONTRA EL ESTADO CIVIL | D19: =+(C19/C$31) -> 0 | F19: =+E19/E$31 -> 0 | H19: =+G19/G$31 -> 0
B20: DELITOS CONTRA LA LIBERTAD | C20: 25 | D20: =+(C20/C$31) -> 1.0233319688907082E-2 | E20: 1 | F20: =+E20/E$31 -> 1.2345679012345678E-2 | H20: =+G20/G$31 -> 0
B21: DELITOS CONTRA LA PROPIEDAD | C21: 122 | D21: =+(C21/C$31) -> 4.9938600081866555E-2 | E21: 3 | F21: =+E21/E$31 -> 3.7037037037037035E-2 | G21: 8 | H21: =+G21/G$31 -> 0.13333333333333333
B22: DELITOS CONTRA LA SEGURIDAD PUBLICA | C22: 44 | D22: =+(C22/C$31) -> 1.8010642652476462E-2 | F22: =+E22/E$31 -> 0 | H22: =+G22/G$31 -> 0
B23: DELITOS CONTRA EL ORDEN PUBLICO | C23: 5 | D23: =+(C23/C$31) -> 2.0466639377814161E-3 | F23: =+E23/E$31 -> 0 | H23: =+G23/G$31 -> 0
B24: DELITOS CONTRA LA SEG. DE LA NACION | C24: 5 | D24: =+(C24/C$31) -> 2.0466639377814161E-3 | F24: =+E24/E$31 -> 0 | H24: =+G24/G$31 -> 0
B25: DELITOS CONTRA LOS POD. PUB. Y ORD. CONTITUC. | D25: =+(C25/C$31) -> 0 | F25: =+E25/E$31 -> 0 | H25: =+G25/G$31 -> 0
B26: DELITOS CONTRA LA ADMINISTRACION PUBLICA | C26: 71 | D26: =+(C26/C$31) -> 2.9062627916496112E-2 | E26: 8 | F26: =+E26/E$31 -> 9.8765432098765427E-2 | G26: 4 | H26: =+G26/G$31 -> 6.6666666666666666E-2
B27: DELITOS CONTRA LA FE PUBLICA | C27: 351 | D27: =+(C27/C$31) -> 0.14367580843225541 | E27: 20 | F27: =+E27/E$31 -> 0.24691358024691357 | G27: 11 | H27: =+G27/G$31 -> 0.18333333333333332
B28: INFRACCION LEY 23.737 (ESTUPEFACIENTES) | C28: 308 | D28: =+(C28/C$31) -> 0.12607449856733524 | E28: 38 | F28: =+E28/E$31 -> 0.46913580246913578 | G28: 27 | H28: =+G28/G$31 -> 00.45
B29: INFRACCION LEYES ESPECIALES Y DEC. LEYES | C29: =1095+78+4+3 -> 1180 | D29: =+(C29/C$31) -> 0.48301268931641422 | E29: =1+7 -> 8 | F29: =+E29/E$31 -> 9.8765432098765427E-2 | G29: 8 | H29: =+G29/G$31 -> 0.13333333333333333
B30: D.G.I. | C30: 27 | D30: =+(C30/C$31) -> 1.1051985264019648E-2 | F30: =+E30/E$31 -> 0 | H30: =+G30/G$31 -> 0
B31: TOTAL | C31: =SUM(C15:C30) -> 2443 | D31: =SUM(D15:D30) -> 1 | E31: =SUM(E15:E30) -> 81 | F31: =SUM(F15:F30) -> 1 | G31: =SUM(G15:G30) -> 60 | H31: =SUM(H15:H30) -> 1
B32: REFERENCIAS: (*) En causa tramitadas en los Juzgados de 1ra. Instancia y en los Tribunales Orales en lo Criminal Federal.
B33: FUENTE: Oficina de Estadísticas del Poder Judicial de la Nación.