B6: PODER JUDICIAL DE LA NACION
B7: JURISDICCION FEDERAL COMODORO RIVADAVIA
B9: CUADRO VI
B10: DISTRIBUCION ANUAL DEL GASTO POR TODO CONCEPTO -AÑO 2001-
C12: Cámara, Tribunal Oral y Juzgados | D12: %
B13: HABERES | C13: 10036828.74 | D13: =+C13/C$17 -> 0.94483419726686069
B14: BIENES DE CONSUMO | C14: 74230.86 | D14: =+C14/C$17 -> 6.9878501304913888E-3
B15: SERVICIOS NO PERSONALES | C15: 511787 | D15: =+C15/C$17 -> 4.8177952602647955E-2
B16: BIENES DE USO
B17: Total | C17: =SUM(C13:C16) -> 10622846.6 | D17: =SUM(D13:D16) -> 1
B18: NOTA: Los datos consignados corresponden a la ejecución presupuestaria del año 2001.
B19: FUENTE: Departamento de Contaduría y Oficina de Estadísticas del Poder Judicial de la Nación.