B6: PODER JUDICIAL DE LA NACION
B7: JURISDICCION FEDERAL COMODORO RIVADAVIA
B9: CUADRO II
B10: DENSIDAD DE POBLACION POR COMPETENCIA TERRITORIAL -AÑO 2001-
C13: POBLACION TOTAL (2001) | D13: SUPERFICIE (Km2) | E13: DENSIDAD DE
E14: POBLACION (hab/km2)
B15: Cámara Federal de Apelaciones | C15: 656567 | D15: 464515 | E15: =+C15/D15 -> 1.4134462826819372
B16: de Comodoro Rivadavia
B17: Tribunal Oral en lo Criminal Federal | C17: 398259 | D17: 245198 | E17: =+C17/D17 -> 1.6242342922862341
B18: de Comodoro Rivadavia
B19: Tribunal Oral en lo Criminal Federal
B20: de Tierra del Fuego | C20: 100799 | D20: 21571 | E20: =+C20/D20 -> 4.6728941634602013
B21: Tribunal Oral en lo Criminal Federal
B22: de Rio Gallegos -Santa Cruz- (sin habilitar) | C22: 157510 | D22: 197747 | E22: =+C22/D22 -> 0.79652282967630361
B23: Juzgado Federal de Primera Instancia
B24: de Comodoro Rivadavia | C24: 198373 | D24: 97110 | E24: =+C24/D24 -> 2.04276593553702
B25: Juzgado Federal de Primera Instancia
B26: de Rawson | C26: =141246+58640 -> 199886 | D26: =135148+12940 -> 148088 | E26: =+C26/D26 -> 1.3497785100750905
B27: Juzgado Federal de Primera Instancia
B28: de Rio Gallegos -Santa Cruz- | C28: 157510 | D28: 197747 | E28: =+C28/D28 -> 0.79652282967630361
B29: Juzgado Federal de Primera Instancia
B30: de Ushuaia | C30: 45598 | D30: 9390 | E30: =+C30/D30 -> 4.8560170394036213
B31: Juzgado Federal de Primera Instancia
B32: de Rio Grande | C32: 55201 | D32: 12181 | E32: =+C32/D32 -> 4.531729743042443
B33: FUENTE: INDEC (Censo Nacional de Población, Hogares y Viviendas 2001) e Instituto Geográfico Militar
B34: Oficina de Estadísticas del Poder Judicial de la Nación.