B6: PODER JUDICIAL DE LA NACION
B7: JURISDICCION FEDERAL COMODORO RIVADAVIA
B9: CUADRO V
B10: DISTRIBUCION ANUAL DEL GASTO EN CONCEPTO DE LIQUIDACION DE HABERES -AÑO 2001-
C12: Gasto (Haberes) | D12: %
B13: Cámara Federal de Apelaciones de Comodoro Rivadavia | C13: 1768683.9568948816 | D13: =+C13/C$21 -> 0.17621940183617016
B14: Tribunal Oral en lo Criminal Federal de Comodoro Rivadavia | C14: 806548.21796226164 | D14: =+C14/C$21 -> 8.0358870202488039E-2
B15: Juzgado Federal de Primera Instancia de Comodoro Rivadavia | C15: 1282047.9089404275 | D15: =+C15/C$21 -> 0.12773436133577262
B16: Juzgado Federal de Primera Instancia de Rawson | C16: 1204778.4063357844 | D16: =+C16/C$21 -> 0.12003576403912859
B17: Juzgado Federal de Primera Instancia de Rio Gallegos | C17: 1260089.4709791511 | D17: =+C17/C$21 -> 0.12554657488149498
B18: Tribunal Oral en lo Criminal Federal de Tierra del Fuego | C18: 917325.16243613593 | D18: =+C18/C$21 -> 9.1395916598666194E-2
B19: Juzgado Federal de Primera Instancia de Ushuaia | C19: 1694616.7942415057 | D19: =+C19/C$21 -> 0.16883986348077368
B20: Juzgado Federal de Primera Instancia de Rio Grande | C20: 1102738.8222098523 | D20: =+C20/C$21 -> 0.10986924762550569
B21: TOTAL | C21: =SUM(C13:C20) -> 10036828.74 | D21: =SUM(D13:D20) -> 1
B22: NOTA: Los datos registrados corresponden a la ejecución presupuestaria del año 2001.
B23: FUENTE: Departamento de Contaduría y Oficina de Estadísticas del Poder Judicial de la Nación.