B6: PODER JUDICIAL DE LA NACION
B7: JURISDICCIÓN FEDERAL COMODORO RIVADAVIA
B8: COMPETENCIA CIVIL
B9: CUADRO XI
B10: DISTRIBUCION PORCENTUAL, SEGÚN EL OBJETO DE LITIGIO, DE LOS EXPEDIENTES INGRESADOS, RESUELTOS O SALIDOS Y SENTENCIAS DICTADAS EN LOS JUZGADOS FEDERALES DE PRIMERA INSTANCIA -AÑO 2001-
B13: OBJETO | C13: INGRESADOS | D13: % | E13: RESUELTOS O SALIDOS | F13: % | G13: SENTENCIAS DEFINITIVAS | H13: % | I13: SENTENCIAS INTERLOCUTORIAS | J13: %
B14: ORDINARIOS | C14: 107 | D14: =+C14/C$27 -> 1.330514797314101E-2 | E14: 65 | F14: =+E14/E$27 -> 1.7520215633423181E-2 | G14: 33 | H14: =+G14/G$27 -> 9.8389982110912346E-3 | I14: 53 | J14: =+I14/I$27 -> 2.3235423060061378E-2
B15: SUMARIOS | C15: 102 | D15: =+C15/C$27 -> 1.2683412086545635E-2 | E15: 94 | F15: =+E15/E$27 -> 2.5336927223719677E-2 | G15: 51 | H15: =+G15/G$27 -> 1.520572450805009E-2 | I15: 189 | J15: =+I15/I$27 -> 8.2858395440596228E-2
B16: SUMARISIMOS | C16: 6 | D16: =+C16/C$27 -> 7.4608306391444918E-4 | E16: 7 | F16: =+E16/E$27 -> 1.8867924528301887E-3 | G16: 6 | H16: =+G16/G$27 -> 1.7889087656529517E-3 | I16: 9 | J16: =+I16/I$27 -> 3.9456378781236303E-3
B17: EJECUTIVOS | C17: 923 | D17: =+C17/C$27 -> 0.1147724446655061 | E17: 212 | F17: =+E17/E$27 -> 5.7142857142857141E-2 | G17: 331 | H17: =+G17/G$27 -> 9.8688133571854506E-2 | I17: 254 | J17: =+I17/I$27 -> 0.11135466900482245
B18: EJECUCIONES FISCALES | C18: 4895 | D18: =+C18/C$27 -> 0.60867943297687144 | E18: 1894 | F18: =+E18/E$27 -> 0.51051212938005386 | G18: 1931 | H18: =+G18/G$27 -> 0.5757304710793083 | I18: 870 | J18: =+I18/I$27 -> 0.38141166155195089
B19: LABORALES | C19: 69 | D19: =+C19/C$27 -> 8.5799552350161647E-3 | E19: 141 | F19: =+E19/E$27 -> 3.8005390835579515E-2 | G19: 30 | H19: =+G19/G$27 -> 8.9445438282647581E-3 | I19: 104 | J19: =+I19/I$27 -> 4.559403770276195E-2
B20: CIUDADANIA | C20: 709 | D20: =+C20/C$27 -> 8.8162148719224079E-2 | E20: 946 | F20: =+E20/E$27 -> 0.25498652291105123 | G20: 795 | H20: =+G20/G$27 -> 0.2370304114490161 | I20: 72 | J20: =+I20/I$27 -> 3.1565103024989043E-2
B21: AMPAROS (LEY 16.986) | C21: 874 | D21: =+C21/C$27 -> 0.10867943297687142 | E21: 233 | F21: =+E21/E$27 -> 6.2803234501347713E-2 | G21: 140 | H21: =+G21/G$27 -> 4.1741204531902207E-2 | I21: 646 | J21: =+I21/I$27 -> 0.28320911880754057
B22: AMPAROS POR MORA | C22: 9 | D22: =+C22/C$27 -> 1.1191245958716736E-3 | E22: 2 | F22: =+E22/E$27 -> 5.3908355795148253E-4 | G22: 2 | H22: =+G22/G$27 -> 5.963029218843172E-4 | I22: 9 | J22: =+I22/I$27 -> 3.9456378781236303E-3
B23: EXPROPIACIONES | C23: 0 | D23: =+C23/C$27 -> 0 | E23: 0 | F23: =+E23/E$27 -> 0 | G23: 0 | H23: =+G23/G$27 -> 0 | I23: 0 | J23: =+I23/I$27 -> 0
B24: LEY 24.463 (ART. 15 SEG. SOC.) | C24: 173 | D24: =+C24/C$27 -> 2.1512061676199949E-2 | E24: 40 | F24: =+E24/E$27 -> 1.078167115902965E-2 | G24: 15 | H24: =+G24/G$27 -> 4.4722719141323791E-3 | I24: 17 | J24: =+I24/I$27 -> 7.4528715475668562E-3
B25: LEYES ESPECIALES | C25: 6 | D25: =+C25/C$27 -> 7.4608306391444918E-4 | E25: 8 | F25: =+E25/E$27 -> 2.1563342318059301E-3 | G25: 0 | H25: =+G25/G$27 -> 0 | I25: 1 | J25: =+I25/I$27 -> 4.3840420868040335E-4
B26: CAUTELARES | C26: 169 | D26: =+C26/C$27 -> 2.101467296692365E-2 | E26: 68 | F26: =+E26/E$27 -> 1.8328840970350403E-2 | G26: 20 | H26: =+G26/G$27 -> 5.9630292188431726E-3 | I26: 57 | J26: =+I26/I$27 -> 2.4989039894782988E-2
B27: TOTAL | C27: =SUM(C14:C26) -> 8042 | D27: =SUM(D14:D26) -> 1 | E27: =SUM(E14:E26) -> 3710 | F27: =SUM(F14:F26) -> 1 | G27: =SUM(G14:G26) -> 3354 | H27: =SUM(H14:H26) -> 1 | I27: =SUM(I14:I26) -> 2281 | J27: =SUM(J14:J26) -> 1
B28: FUENTE:Oficina de Estadísticas del Poder Judicial de la Nación.