B6: PODER JUDICIAL DE LA NACION
B7: JURISDICCION FEDERAL COMODORO RIVADAVIA
B9: CUADRO IV
B10: DISTRIBUCION DE LOS CARGOS POR DEPENDENCIA -AÑO 2001-
C12: Distribución de los cargos actuales | D12: Distribución
D13: Porcentual
B14: Cámara Federal de Apelaciones de Comodoro Rivadavia | C14: 38 | D14: =+C14/C$22 -> 0.15447154471544716
B15: Tribunal Oral en lo Criminal Federal de Comodoro Rivadavia | C15: 12 | D15: =+C15/C$22 -> 4.878048780487805E-2
B16: Tribunal Oral en lo Criminal Federal de Tierra del Fuego | C16: 13 | D16: =+C16/C$22 -> 5.2845528455284556E-2
B17: Juzgado Federal de Primera Instancia de Comodoro Rivadavia | C17: 34 | D17: =+C17/C$22 -> 0.13821138211382114
B18: Juzgado Federal de Primera Instancia de Rawson | C18: 30 | D18: =+C18/C$22 -> 0.12195121951219512
B19: Juzgado Federal de Primera Instancia de Rio Gallegos | C19: 30 | D19: =+C19/C$22 -> 0.12195121951219512
B20: Juzgado Federal de Primera Instancia de Ushuaia | C20: 55 | D20: =+C20/C$22 -> 0.22357723577235772
B21: Juzgado Federal de Primera Instancia de Rio Grande | C21: 34 | D21: =+C21/C$22 -> 0.13821138211382114
B22: TOTAL | C22: =SUM(C14:C21) -> 246 | D22: =SUM(D14:D21) -> 1
B23: FUENTE: Oficina de Estadísticas del Poder Judicial de la Nación.