C4: CUADRO D
C7: CAMARA NACIONAL DE CASACION PENAL, JUSTICIA PENAL ORAL ORDINARIA, JUSTICIA PENAL ORAL FEDERAL
C8: DE LA CAPITAL FEDERAL Y DEL INTERIOR DEL PAIS Y JUSTICIA DE EJECUCION PENAL
C10: CUADRO COMPARATIVO DE LOS EXPEDIENTES INGRESADOS EN EL PERIODO 1993/2002
C13: PODER JUDICIAL DE LA NACION | D13: AÑOS
D14: 1993 | G14: 1994 | J14: 1995 | M14: 1996 | P14: 1997 | S14: 1998 | V14: 1999 | Y14: 2000 | AB14: 2001 | AE14: 2002
D15: CANT. | E15: TOTAL | F15: PROMEDIO | G15: CANT. | H15: TOTAL | I15: PROMEDIO | J15: CANT. | K15: TOTAL | L15: PROMEDIO | M15: CANT. | N15: TOTAL | O15: PROMEDIO | P15: CANT. | Q15: TOTAL | R15: PROMEDIO | S15: CANT. | T15: TOTAL | U15: PROMEDIO | V15: CANT. | W15: TOTAL | X15: PROMEDIO | Y15: CANT. | Z15: TOTAL | AA15: PROMEDIO | AB15: CANT. | AC15: TOTAL | AD15: PROMEDIO | AE15: CANT. | AF15: TOTAL | AG15: PROMEDIO | AH15: TOTAL
D16: SALAS | E16: INGRE. | F16: POR SALA | G16: SALAS | H16: INGRE. | I16: POR SALA | J16: SALAS | K16: INGRE. | L16: POR SALA | M16: SALAS | N16: INGRE. | O16: POR SALA | P16: SALAS | Q16: INGRE. | R16: POR SALA | S16: SALAS | T16: INGRE. | U16: POR SALA | V16: SALAS | W16: INGRE. | X16: POR SALA | Y16: SALAS | Z16: INGRE. | AA16: POR SALA | AB16: SALAS | AC16: INGRE. | AD16: POR SALA | AE16: SALAS | AF16: INGRE. | AG16: POR SALA | AH16: 1993/2002
C17: CAMARA NAC. DE CASACION PENAL | D17: 4 | E17: 162 | F17: =E17/D17 -> 40.5 | G17: 4 | H17: 434 | I17: =H17/G17 -> 108.5 | J17: 4 | K17: 1029 | L17: =K17/J17 -> 257.25 | M17: 4 | N17: 802 | O17: =N17/M17 -> 200.5 | P17: 4 | Q17: 870 | R17: =Q17/P17 -> 217.5 | S17: 4 | T17: 862 | U17: =T17/S17 -> 215.5 | V17: 4 | W17: 979 | X17: =W17/V17 -> 244.75 | Y17: 4 | Z17: 915 | AA17: =Z17/Y17 -> 228.75 | AB17: 4 | AC17: 936 | AD17: =AC17/AB17 -> 234 | AE17: 4 | AF17: 831 | AG17: =AF17/AE17 -> 207.75 | AH17: =E17+H17+K17+N17+Q17+T17+W17+Z17+AC17+AF17 -> 7820
C18: JUSTICIA PENAL | D18: CANT. | E18: TOTAL | F18: PROMEDIO | G18: CANT. | H18: TOTAL | I18: PROMEDIO | J18: CANT. | K18: TOTAL | L18: PROMEDIO | M18: CANT. | N18: TOTAL | O18: PROMEDIO | P18: CANT. | Q18: TOTAL | R18: PROMEDIO | S18: CANT. | T18: TOTAL | U18: PROMEDIO | V18: CANT. | W18: TOTAL | X18: PROMEDIO | Y18: CANT. | Z18: TOTAL | AA18: PROMEDIO | AB18: CANT. | AC18: TOTAL | AD18: PROMEDIO | AE18: CANT. | AF18: TOTAL | AG18: PROMEDIO | AH18: TOTAL
C19: ORAL ORDINARIA | D19: TRIB. | E19: INGRE. | F19: POR TRIB. | G19: TRIB. | H19: INGRE. | I19: POR TRIB. | J19: TRIB. | K19: INGRE. | L19: POR TRIB. | M19: TRIB. | N19: INGRE. | O19: POR TRIB. | P19: TRIB. | Q19: INGRE. | R19: POR TRIB. | S19: TRIB. | T19: INGRE. | U19: POR TRIB. | V19: TRIB. | W19: INGRE. | X19: POR TRIB. | Y19: TRIB. | Z19: INGRE. | AA19: POR TRIB. | AB19: TRIB. | AC19: INGRE. | AD19: POR TRIB. | AE19: TRIB. | AF19: INGRE. | AG19: POR TRIB. | AH19: 1993/2002
C20: TRIB. ORALES EN LO CRIMINAL | D20: 21 | E20: 2516 | F20: =E20/D20 -> 119.80952380952381 | G20: 29 | H20: 2782 | I20: =H20/G20 -> 95.931034482758619 | J20: 30 | K20: 3308 | L20: =K20/J20 -> 110.26666666666667 | M20: 30 | N20: 3638 | O20: =N20/M20 -> 121.26666666666667 | P20: 30 | Q20: 3782 | R20: =Q20/P20 -> 126.06666666666666 | S20: 30 | T20: 4516 | U20: =T20/S20 -> 150.53333333333333 | V20: 30 | W20: 5095 | X20: =W20/V20 -> 169.83333333333334 | Y20: 30 | Z20: 6065 | AA20: =Z20/Y20 -> 202.16666666666666 | AB20: 30 | AC20: 6421 | AD20: =AC20/AB20 -> 214.03333333333333 | AE20: 30 | AF20: 7096 | AG20: =AF20/AE20 -> 236.53333333333333 | AH20: =E20+H20+K20+N20+Q20+T20+W20+Z20+AC20+AF20 -> 45219
C21: TRIB. ORALES DE MENORES | D21: 3 | E21: 244 | F21: =E21/D21 -> 81.333333333333329 | G21: 3 | H21: 468 | I21: =H21/G21 -> 156 | J21: 3 | K21: 597 | L21: =K21/J21 -> 199 | M21: 3 | N21: 636 | O21: =N21/M21 -> 212 | P21: 3 | Q21: 749 | R21: =Q21/P21 -> 249.66666666666666 | S21: 3 | T21: 916 | U21: =T21/S21 -> 305.33333333333331 | V21: 3 | W21: 1023 | X21: =W21/V21 -> 341 | Y21: 3 | Z21: 1066 | AA21: =Z21/Y21 -> 355.33333333333331 | AB21: 3 | AC21: 1165 | AD21: =AC21/AB21 -> 388.33333333333331 | AE21: 3 | AF21: 1236 | AG21: =AF21/AE21 -> 412 | AH21: =E21+H21+K21+N21+Q21+T21+W21+Z21+AC21+AF21 -> 8100
C22: TRIB. ORALES EN LO PENAL ECONOMICO | D22: 3 | E22: 75 | F22: =E22/D22 -> 25 | G22: 3 | H22: 79 | I22: =H22/G22 -> 26.333333333333332 | J22: 3 | K22: 111 | L22: =K22/J22 -> 37 | M22: 3 | N22: 113 | O22: =N22/M22 -> 37.666666666666664 | P22: 3 | Q22: 220 | R22: =Q22/P22 -> 73.333333333333329 | S22: 3 | T22: 316 | U22: =T22/S22 -> 105.33333333333333 | V22: 3 | W22: 307 | X22: =W22/V22 -> 102.33333333333333 | Y22: 3 | Z22: 343 | AA22: =Z22/Y22 -> 114.33333333333333 | AB22: 3 | AC22: 364 | AD22: =AC22/AB22 -> 121.33333333333333 | AE22: 3 | AF22: 548 | AG22: =AF22/AE22 -> 182.66666666666666 | AH22: =E22+H22+K22+N22+Q22+T22+W22+Z22+AC22+AF22 -> 2476
C23: JUSTICIA PENAL ORAL FEDERAL | D23: CANT. | E23: TOTAL | F23: PROMEDIO | G23: CANT. | H23: TOTAL | I23: PROMEDIO | J23: CANT. | K23: TOTAL | L23: PROMEDIO | M23: CANT. | N23: TOTAL | O23: PROMEDIO | P23: CANT. | Q23: TOTAL | R23: PROMEDIO | S23: CANT. | T23: TOTAL | U23: PROMEDIO | V23: CANT. | W23: TOTAL | X23: PROMEDIO | Y23: CANT. | Z23: TOTAL | AA23: PROMEDIO | AB23: CANT. | AC23: TOTAL | AD23: PROMEDIO | AE23: CANT. | AF23: TOTAL | AG23: PROMEDIO | AH23: TOTAL
C24: DE LA CAPITAL FEDERAL | D24: TRIB. | E24: INGRE. | F24: POR TRIB. | G24: TRIB. | H24: INGRE. | I24: POR TRIB. | J24: TRIB. | K24: INGRE. | L24: POR TRIB. | M24: TRIB. | N24: INGRE. | O24: POR TRIB. | P24: TRIB. | Q24: INGRE. | R24: POR TRIB. | S24: TRIB. | T24: INGRE. | U24: POR TRIB. | V24: TRIB. | W24: INGRE. | X24: POR TRIB. | Y24: TRIB. | Z24: INGRE. | AA24: POR TRIB. | AB24: TRIB. | AC24: INGRE. | AD24: POR TRIB. | AE24: TRIB. | AF24: INGRE. | AG24: POR TRIB. | AH24: 1993/2002
C25: TRIB. ORALES EN LO CRIMINAL FEDERAL | D25: 6 | E25: 113 | F25: =E25/D25 -> 18.833333333333332 | G25: 6 | H25: 271 | I25: =H25/G25 -> 45.166666666666664 | J25: 6 | K25: 333 | L25: =K25/J25 -> 55.5 | M25: 6 | N25: 482 | O25: =N25/M25 -> 80.333333333333329 | P25: 6 | Q25: 460 | R25: =Q25/P25 -> 76.666666666666671 | S25: 6 | T25: 457 | U25: =T25/S25 -> 76.166666666666671 | V25: 6 | W25: 511 | X25: =W25/V25 -> 85.166666666666671 | Y25: 6 | Z25: 601 | AA25: =Z25/Y25 -> 100.16666666666667 | AB25: 6 | AC25: 554 | AD25: =AC25/AB25 -> 92.333333333333329 | AE25: 6 | AF25: 688 | AG25: =AF25/AE25 -> 114.66666666666667 | AH25: =E25+H25+K25+N25+Q25+T25+W25+Z25+AC25+AF25 -> 4470
C26: JUSTICIA PENAL ORAL FEDERAL | D26: CANT. | E26: TOTAL | F26: PROMEDIO | G26: CANT. | H26: TOTAL | I26: PROMEDIO | J26: CANT. | K26: TOTAL | L26: PROMEDIO | M26: CANT. | N26: TOTAL | O26: PROMEDIO | P26: CANT. | Q26: TOTAL | R26: PROMEDIO | S26: CANT. | T26: TOTAL | U26: PROMEDIO | V26: CANT. | W26: TOTAL | X26: PROMEDIO | Y26: CANT. | Z26: TOTAL | AA26: PROMEDIO | AB26: CANT. | AC26: TOTAL | AD26: PROMEDIO | AE26: CANT. | AF26: TOTAL | AG26: PROMEDIO | AH26: TOTAL
C27: DEL INTERIOR | D27: TRIB. | E27: INGRE. | F27: POR TRIB. | G27: TRIB. | H27: INGRE. | I27: POR TRIB. | J27: TRIB. | K27: INGRE. | L27: POR TRIB. | M27: TRIB. | N27: INGRE. | O27: POR TRIB. | P27: TRIB. | Q27: INGRE. | R27: POR TRIB. | S27: TRIB. | T27: INGRE. | U27: POR TRIB. | V27: TRIB. | W27: INGRE. | X27: POR TRIB. | Y27: TRIB. | Z27: INGRE. | AA27: POR TRIB. | AB27: TRIB. | AC27: INGRE. | AD27: POR TRIB. | AE27: TRIB. | AF27: INGRE. | AG27: POR TRIB. | AH27: 1993/2002
C28: TRIB. ORALES EN LO CRIMINAL FEDERAL | D28: 11 | E28: 894 | F28: =E28/D28 -> 81.272727272727266 | G28: 21 | H28: 1468 | I28: =H28/G28 -> 69.904761904761898 | J28: 28 | K28: 2146 | L28: =K28/J28 -> 76.642857142857139 | M28: 32 | N28: 1909 | O28: =N28/M28 -> 59.65625 | P28: 32 | Q28: 1939 | R28: =Q28/P28 -> 60.59375 | S28: 33 | T28: 2186 | U28: =T28/S28 -> 66.242424242424249 | V28: 33 | W28: 2619 | X28: =W28/V28 -> 79.36363636363636 | Y28: 33 | Z28: 2884 | AA28: =Z28/Y28 -> 87.393939393939391 | AB28: 33 | AC28: 2963 | AD28: =AC28/AB28 -> 89.787878787878782 | AE28: 33 | AF28: 3420 | AG28: =AF28/AE28 -> 103.63636363636364 | AH28: =E28+H28+K28+N28+Q28+T28+W28+Z28+AC28+AF28 -> 22428
C29: JUSTICIA DE EJECUCION PENAL | D29: CANT. | E29: TOTAL | F29: PROMEDIO | G29: CANT. | H29: TOTAL | I29: PROMEDIO | J29: CANT. | K29: TOTAL | L29: PROMEDIO | M29: CANT. | N29: TOTAL | O29: PROMEDIO | P29: CANT. | Q29: TOTAL | R29: PROMEDIO | S29: CANT. | T29: TOTAL | U29: PROMEDIO | V29: CANT. | W29: TOTAL | X29: PROMEDIO | Y29: CANT. | Z29: TOTAL | AA29: PROMEDIO | AB29: CANT. | AC29: TOTAL | AD29: PROMEDIO | AE29: CANT. | AF29: TOTAL | AG29: PROMEDIO | AH29: TOTAL
D30: JUZG. | E30: INGRE. | F30: POR JUZG. | G30: JUZG. | H30: INGRE. | I30: POR JUZG. | J30: JUZG. | K30: INGRE. | L30: POR JUZG. | M30: JUZG. | N30: INGRE. | O30: POR JUZG. | P30: JUZG. | Q30: INGRE. | R30: POR JUZG. | S30: JUZG. | T30: INGRE. | U30: POR JUZG. | V30: JUZG. | W30: INGRE. | X30: POR JUZG. | Y30: JUZG. | Z30: INGRE. | AA30: POR JUZG. | AB30: JUZG. | AC30: INGRE. | AD30: POR JUZG. | AE30: JUZG. | AF30: INGRE. | AG30: POR JUZG. | AH30: 1993/2002
C31: JUZGADOS DE EJECUCION PENAL | D31: 2 | E31: 1090 | F31: =E31/D31 -> 545 | G31: 3 | H31: 2611 | I31: =H31/G31 -> 870.33333333333337 | J31: 3 | K31: 2524 | L31: =K31/J31 -> 841.33333333333337 | M31: 3 | N31: 3122 | O31: =N31/M31 -> 1040.6666666666667 | P31: 3 | Q31: 5307 | R31: =Q31/P31 -> 1769 | S31: 3 | T31: 4294 | U31: =T31/S31 -> 1431.3333333333333 | V31: 3 | W31: =1996+1391+2240 -> 5627 | X31: =W31/V31 -> 1875.6666666666667 | Y31: 3 | Z31: 5103 | AA31: =Z31/Y31 -> 1701 | AB31: 3 | AC31: 8079 | AD31: =AC31/AB31 -> 2693 | AE31: 3 | AF31: 8142 | AG31: =AF31/AE31 -> 2714 | AH31: =E31+H31+K31+N31+Q31+T31+W31+Z31+AC31+AF31 -> 45899
C32: JUECES DE EJECUCION DE LOS TRIBUNALES | AH32: =E32+H32+K32+N32+Q32+T32+W32+Z32+AC32+AF32 -> 0
C33: ORALES EN LO CRIMINAL FEDERAL DEL | AH33: =E33+H33+K33+N33+Q33+T33+W33+Z33+AC33+AF33 -> 0
C34: INTERIOR (#) | D34: 11 | F34: =E34/D34 -> 0 | G34: 21 | H34: 699 | I34: =H34/G34 -> 33.285714285714285 | J34: 28 | K34: 1131 | L34: =K34/J34 -> 40.392857142857146 | M34: 32 | N34: 1198 | O34: =N34/M34 -> 37.4375 | P34: 32 | Q34: 1236 | R34: =Q34/P34 -> 38.625 | S34: 33 | T34: 1180 | U34: =T34/S34 -> 35.757575757575758 | V34: 33 | W34: 1326 | X34: =W34/V34 -> 40.18181818181818 | Y34: 33 | Z34: 1752 | AA34: =Z34/Y34 -> 53.090909090909093 | AB34: 33 | AC34: 1895 | AD34: =AC34/AB34 -> 57.424242424242422 | AE34: 33 | AF34: 1863 | AG34: =AF34/AE34 -> 56.454545454545453 | AH34: =E34+H34+K34+N34+Q34+T34+W34+Z34+AC34+AF34 -> 12280
C37: REFERENCIAS: Para hallar el promedio anual de expedientes ingresados, se procedió a dividir el total de expedientes ingresados por la cantidad de salas, tribunales, juzgados o jueces según correspondiera.
C38: (#) Se deja constancia que para el año 1993 dicha información no se relevaba de forma desagregada.
C40: VER Gráficos
C42: OFICINA DE ESTADISTICAS, PODER JUDICIAL DE LA NACION