B6: PODER JUDICIAL DE LA NACION
B7: JURISDICCION FEDERAL POSADAS
B9: CUADRO III
B10: DISTRIBUCION DE LOS CARGOS PERMANENTES Y CONTRATADOS -AÑO 2001-
C13: Cámara Federal de Apelaciones de Posadas | E13: Tribunal Oral en lo Criminal Federal de Posadas | G13: Juzgado Federal de Primera Instancia en lo Criminal y Correccional de Posadas | I13: Juzgado Federal de Primera Instancia en lo Civil y Comercial y Cont. Adm. de Posadas | K13: Juzgado Federal de Primera Intancia de Eldorado
C14: P | D14: C | E14: P | F14: C | G14: P | H14: C | I14: P | J14: C | K14: P | L14: C
B15: Juez (1ª o 2ª
B16: instancia) | C16: 5 | E16: 3 | G16: 1 | I16: 1 | K16: 1
B17: Secretario (1ª o 2ª instancia) | I17: 3 | K17: 3
C18: 2 | E18: 1 | G18: 3 | J18: 1
B19: Prosecretario
B20: de Cámara | C20: 1
B21: Prosecretario Administrativo | I21: 3 | K21: 3
C22: 7 | E22: 2 | G22: 4 | H22: 1
B23: Oficial Mayor | I23: 5 | K23: 3
C24: 7 | E24: 3 | G24: 7
B25: Oficial Mayor Relator
B27: Oficial | I27: 1 | K27: 1
G28: 1
B29: Escribiente | I29: 2 | K29: 4
C30: 3 | E30: 1 | G30: 5
B31: Escribiente Auxiliar | I31: 2 | K31: 2
C32: 3 | E32: 1 | G32: 3
B33: Auxiliar
C34: 2 | G34: 5 | I34: 7 | K34: 3
B35: Auxiliar Administrativo
B37: Oficial
B38: de Servicio
B39: Ayudante
C40: 5 | E40: 1 | G40: 3 | I40: 2 | K40: 2
B41: Auxiliar de Servicio
B43: Total | I43: =SUM(I13:I42) -> 26 | K43: =SUM(K13:K42) -> 22 | L43: =SUM(L13:L42) -> 0
C44: =SUM(C16:C42) -> 35 | D44: =SUM(D16:D42) -> 0 | E44: =SUM(E16:E43) -> 12 | F44: =SUM(F16:F43) -> 0 | G44: =SUM(G16:G43) -> 32 | H44: =SUM(H16:H43) -> 1 | J44: =SUM(J16:J43) -> 1
B45: FUENTE: División Programación Presupuestaria. Consejo de la Magistratura.
B46: Oficina de Estadísticas del Poder Judicial de la Nación.