B6: PODER JUDICIAL DE LA NACION
B7: JURISDICCION FEDERAL POSADAS
B9: COMPETENCIA PENAL
B10: CUADRO IX
B11: DISTRIBUCION PORCENTUAL SEGÚN EL TIPO DE DELITO DE LAS CAUSAS INGRESADAS, ELEVADAS A JUICIO Y PERSONAS CONDENADAS EN LOS JUZGADOS FEDERALES -AÑO 2001-
C13: CAUSAS | D13: % | E13: CAUSAS | F13: % | G13: PERSONAS | H13: %
B14: DELITOS | C14: INGRESADAS | E14: ELEVADAS | G14: CONDENADAS
B15: DELITOS CONTRA LAS PERSONAS | C15: 11 | D15: =+(C15/C$31) -> 5.9717698154180239E-3 | F15: =+E15/E$31 -> 0 | H15: =+G15/G$31 -> 0
B16: HOMICIDIOS | C16: 1 | D16: =+(C16/C$31) -> 5.428881650380022E-4 | F16: =+E16/E$31 -> 0 | H16: =+G16/G$31 -> 0
B17: DELITOS CONTRA EL HONOR | D17: =+(C17/C$31) -> 0 | F17: =+E17/E$31 -> 0 | H17: =+G17/G$31 -> 0
B18: DELITOS CONTRA LA INTEGRIDAD SEXUAL | C18: 1 | D18: =+(C18/C$31) -> 5.428881650380022E-4 | F18: =+E18/E$31 -> 0 | H18: =+G18/G$31 -> 0
B19: DELITOS CONTRA EL ESTADO CIVIL | C19: 1 | D19: =+(C19/C$31) -> 5.428881650380022E-4 | F19: =+E19/E$31 -> 0 | H19: =+G19/G$31 -> 0
B20: DELITOS CONTRA LA LIBERTAD | C20: 5 | D20: =+(C20/C$31) -> 2.7144408251900108E-3 | F20: =+E20/E$31 -> 0 | H20: =+G20/G$31 -> 0
B21: DELITOS CONTRA LA PROPIEDAD | C21: 65 | D21: =+(C21/C$31) -> 3.5287730727470143E-2 | F21: =+E21/E$31 -> 0 | H21: =+G21/G$31 -> 0
B22: DELITOS CONTRA LA SEGURIDAD PUBLICA | C22: 145 | D22: =+(C22/C$31) -> 7.8718783930510308E-2 | F22: =+E22/E$31 -> 0 | H22: =+G22/G$31 -> 0
B23: DELITOS CONTRA EL ORDEN PUBLICO | D23: =+(C23/C$31) -> 0 | F23: =+E23/E$31 -> 0 | H23: =+G23/G$31 -> 0
B24: DELITOS CONTRA LA SEG. DE LA NACION | D24: =+(C24/C$31) -> 0 | F24: =+E24/E$31 -> 0 | H24: =+G24/G$31 -> 0
B25: DELITOS CONTRA LOS POD .PUB. Y ORD. CONTITUC. | D25: =+(C25/C$31) -> 0 | F25: =+E25/E$31 -> 0 | H25: =+G25/G$31 -> 0
B26: DELITOS CONTRA LA ADMINISTRACION PUBLICA | C26: 328 | D26: =+(C26/C$31) -> 0.17806731813246471 | E26: 6 | F26: =+E26/E$31 -> 7.0588235294117646E-2 | G26: 10 | H26: =+G26/G$31 -> 8.6956521739130432E-2
B27: DELITOS CONTRA LA FE PUBLICA | C27: 405 | D27: =+(C27/C$31) -> 0.21986970684039087 | E27: 7 | F27: =+E27/E$31 -> 8.2352941176470587E-2 | H27: =+G27/G$31 -> 0
B28: INFRACCION LEY 23.737 (ESTUPEFACIENTES) | C28: 268 | D28: =+(C28/C$31) -> 0.14549402823018459 | E28: 47 | F28: =+E28/E$31 -> 0.55294117647058827 | G28: =2+95 -> 97 | H28: =+G28/G$31 -> 0.84347826086956523
B29: INFRACCION LEYES ESPECIALES Y DEC. LEYES | C29: =562+24 -> 586 | D29: =+(C29/C$31) -> 0.31813246471226925 | E29: 25 | F29: =+E29/E$31 -> 0.29411764705882354 | G29: 8 | H29: =+G29/G$31 -> 6.9565217391304349E-2
B30: D.G.I. | C30: 26 | D30: =+(C30/C$31) -> 1.4115092290988056E-2 | F30: =+E30/E$31 -> 0 | H30: =+G30/G$31 -> 0
B31: TOTAL | C31: =SUM(C15:C30) -> 1842 | D31: =SUM(D15:D30) -> 1 | E31: =SUM(E15:E30) -> 85 | F31: =SUM(F15:F30) -> 1 | G31: =SUM(G15:G30) -> 115 | H31: =SUM(H15:H30) -> 1
B32: REFERENCIAS: (*) En causa tramitadas en los Juzgados de 1ra. Instancia y en los Tribunales Orales en lo Criminal Federal.
B33: FUENTE: Oficina de Estadísticas del Poder Judicial de la Nación.