B6: PODER JUDICIAL DE LA NACION
B7: JURISDICCION FEDERAL POSADAS
B9: CUADRO VI
B10: DISTRIBUCION ANUAL DEL GASTO POR TODO CONCEPTO -AÑO 2001-
C13: Cámara, Tribunal Oral y Juzgados | D13: %
B14: HABERES | C14: 4503025.53 | D14: =+C14/C$18 -> 0.89843228525227337
B15: BIENES DE CONSUMO | C15: 33860 | D15: =+C15/C$18 -> 6.7556617158779416E-3
B16: SERVICIOS NO PERSONALES | C16: 475206.76 | D16: =+C16/C$18 -> 9.4812053031848698E-2
B17: BIENES DE USO | D17: =+C17/C$18 -> 0
B18: Total | C18: =SUM(C14:C17) -> 5012092.29 | D18: =SUM(D14:D17) -> 1
B19: NOTA: Los datos consignados corresponden a la ejecución presupuestaria del año 2001.
B20: FUENTE: Departamento de Contaduría y Oficina de Estadísticas del Poder Judicial de la Nación.