B6: PODER JUDICIAL DE LA NACION
B7: JURISDICCION FEDERAL POSADAS
B10: CUADRO IV
B11: DISTRIBUCION DE LOS CARGOS POR DEPENDENCIA -AÑO 2001-
C12: Distribución de los cargos actuales | D12: Distribución
D13: Porcentual
B14: Cámara Federal de Apelaciones de Posadas | C14: 35 | D14: =+C14/C$19 -> 0.27131782945736432
B15: Tribunal Oral en lo Criminal Federal de Posadas | C15: 12 | D15: =+C15/C$19 -> 9.3023255813953487E-2
B16: Juzgado Federal de Primera Instancia en lo Criminal y Correccional de Posadas | C16: 33 | D16: =+C16/C$19 -> 0.2558139534883721
B17: Juzgado Federal de Primera Instancia en lo Civil y Comercial y Cont. Adm. de Posadas | C17: 27 | D17: =+C17/C$19 -> 0.20930232558139536
B18: Juzgado Federal de Primera Instancia de Eldorado | C18: 22 | D18: =+C18/C$19 -> 0.17054263565891473
B19: TOTAL | C19: =SUM(C14:C18) -> 129 | D19: =SUM(D14:D18) -> 1
B20: FUENTE: Oficina de Estadísticas del Poder Judicial de la Nación.