B6: PODER JUDICIAL DE LA NACION
B7: JURISDICCION FEDERAL POSADAS
B9: CUADRO V
B10: DISTRIBUCION ANUAL DEL GASTO EN CONCEPTO DE LIQUIDACION DE HABERES -AÑO 2001-
C12: Gasto (Haberes) | D12: %
B13: Cámara Federal de Apelaciones de Posadas | C13: 1470581.8363864019 | D13: =+C13/C$17 -> 0.32657639326917209
B14: Tribunal Oral en lo Criminal Federal de Posadas | C14: 614380.42075721663 | D14: =+C14/C$17 -> 0.1364372501697135
B15: Juzgados Federales de Primera Instancia de Posadas | C15: 1709377.6903828951 | D15: =+C15/C$17 -> 0.37960648435028865
B16: Juzgado Federal de Primera Instancia de Eldorado | C16: 708685.58247348596 | D16: =+C16/C$17 -> 0.15737987221082578
B17: TOTAL | C17: =SUM(C13:C16) -> 4503025.53 | D17: =SUM(D13:D16) -> 1
B18: NOTA: Los datos registrados corresponden a la ejecución presupuestaria del año 2001.
B19: FUENTE: Departamento de Contaduría y Oficina de Estadísticas del Poder Judicial de la Nación.