B6: PODER JUDICIAL DE LA NACION
B7: JURISDICCIÓN FEDERAL POSADAS
B8: COMPETENCIA CIVIL
B9: CUADRO XI
B10: DISTRIBUCION PORCENTUAL, SEGÚN EL OBJETO DE LITIGIO, DE LOS EXPEDIENTES INGRESADOS, RESUELTOS O SALIDOS Y SENTENCIAS DICTADAS EN LOS JUZGADOS FEDERALES DE PRIMERA INSTANCIA -AÑO 2001-
B13: OBJETO | C13: INGRESADOS | D13: % | E13: RESUELTOS O SALIDOS | F13: % | G13: SENTENCIAS DEFINITIVAS | H13: % | I13: SENTENCIAS INTERLOCUTORIAS | J13: %
B14: ORDINARIOS | C14: 572 | D14: =+C14/C$27 -> 0.13283790060380865 | E14: 110 | F14: =+E14/E$27 -> 7.523939808481532E-2 | G14: 15 | H14: =+G14/G$27 -> 1.2919896640826873E-2 | I14: 98 | J14: =+I14/I$27 -> 3.8997214484679667E-2
B15: SUMARIOS | C15: 52 | D15: =+C15/C$27 -> 1.2076172782164421E-2 | E15: 41 | F15: =+E15/E$27 -> 2.8043775649794801E-2 | G15: 19 | H15: =+G15/G$27 -> 1.636520241171404E-2 | I15: 60 | J15: =+I15/I$27 -> 2.3875845602865101E-2
B16: SUMARISIMOS | C16: 4 | D16: =+C16/C$27 -> 9.2893636785880169E-4 | E16: 4 | F16: =+E16/E$27 -> 2.7359781121751026E-3 | G16: 1 | H16: =+G16/G$27 -> 8.6132644272179156E-4 | I16: 2 | J16: =+I16/I$27 -> 7.9586152009550337E-4
B17: EJECUTIVOS | C17: 193 | D17: =+C17/C$27 -> 4.482117974918718E-2 | E17: 30 | F17: =+E17/E$27 -> 2.0519835841313269E-2 | G17: 24 | H17: =+G17/G$27 -> 2.0671834625322998E-2 | I17: 292 | J17: =+I17/I$27 -> 0.11619578193394349
B18: EJECUCIONES FISCALES | C18: 3187 | D18: =+C18/C$27 -> 0.74013005109150021 | E18: 1091 | F18: =+E18/E$27 -> 0.74623803009575929 | G18: 955 | H18: =+G18/G$27 -> 0.82256675279931091 | I18: 1994 | J18: =+I18/I$27 -> 0.79347393553521683
B19: LABORALES | C19: 17 | D19: =+C19/C$27 -> 3.9479795633999074E-3 | E19: 11 | F19: =+E19/E$27 -> 7.523939808481532E-3 | G19: 10 | H19: =+G19/G$27 -> 8.6132644272179162E-3 | I19: 1 | J19: =+I19/I$27 -> 3.9793076004775168E-4
B20: CIUDADANIA | C20: 84 | D20: =+C20/C$27 -> 1.9507663725034836E-2 | E20: 96 | F20: =+E20/E$27 -> 6.5663474692202461E-2 | G20: 45 | H20: =+G20/G$27 -> 3.875968992248062E-2 | I20: 12 | J20: =+I20/I$27 -> 4.7751691205730204E-3
B21: AMPAROS (LEY 16.986) | C21: 86 | D21: =+C21/C$27 -> 1.9972131908964234E-2 | E21: 31 | F21: =+E21/E$27 -> 2.1203830369357045E-2 | G21: 25 | H21: =+G21/G$27 -> 2.1533161068044791E-2 | I21: 7 | J21: =+I21/I$27 -> 2.7855153203342618E-3
B22: AMPAROS POR MORA | C22: 2 | D22: =+C22/C$27 -> 4.6446818392940084E-4 | E22: 1 | F22: =+E22/E$27 -> 6.8399452804377564E-4 | G22: 1 | H22: =+G22/G$27 -> 8.6132644272179156E-4 | J22: =+I22/I$27 -> 0
B23: EXPROPIACIONES | C23: 11 | D23: =+C23/C$27 -> 2.5545750116117046E-3 | E23: 13 | F23: =+E23/E$27 -> 8.8919288645690833E-3 | G23: 49 | H23: =+G23/G$27 -> 4.2204995693367789E-2 | J23: =+I23/I$27 -> 0
B24: LEY 24.463 (ART. 15 SEG. SOC.) | C24: 17 | D24: =+C24/C$27 -> 3.9479795633999074E-3 | E24: 18 | F24: =+E24/E$27 -> 1.2311901504787962E-2 | G24: 14 | H24: =+G24/G$27 -> 1.2058570198105082E-2 | I24: 1 | J24: =+I24/I$27 -> 3.9793076004775168E-4
B25: LEYES ESPECIALES | C25: 30 | D25: =+C25/C$27 -> 6.9670227589410123E-3 | E25: 6 | F25: =+E25/E$27 -> 4.1039671682626538E-3 | G25: 3 | H25: =+G25/G$27 -> 2.5839793281653748E-3 | I25: 1 | J25: =+I25/I$27 -> 3.9793076004775168E-4
B26: CAUTELARES | C26: 51 | D26: =+C26/C$27 -> 1.1843938690199722E-2 | E26: 10 | F26: =+E26/E$27 -> 6.8399452804377564E-3 | H26: =+G26/G$27 -> 0 | I26: 45 | J26: =+I26/I$27 -> 1.7906884202148827E-2
B27: TOTAL | C27: =SUM(C14:C26) -> 4306 | D27: =SUM(D14:D26) -> 1 | E27: =SUM(E14:E26) -> 1462 | F27: =SUM(F14:F26) -> 1 | G27: =SUM(G14:G26) -> 1161 | H27: =SUM(H14:H26) -> 1 | I27: =SUM(I14:I26) -> 2513 | J27: =SUM(J14:J26) -> 1
B28: FUENTE:Oficina de Estadísticas del Poder Judicial de la Nación.