B6: PODER JUDICIAL DE LA NACION
B7: JURISDICCIÓN FEDERAL POSADAS
B9: CUADRO II
B10: DENSIDAD DE POBLACION POR COMPETENCIA TERRITORIAL -AÑO 2001-
C12: POBLACION TOTAL (2001) | D12: SUPERFICIE (Km2) | E12: DENSIDAD DE
E13: POBLACION (hab/km2)
B14: Cámara Federal de Apelaciones de Posadas
C15: 963869 | D15: 29801 | E15: =+C15/D15 -> 32.343511962685817
B16: Tribunal Oral en lo Criminal Federal de Posadas
C17: 963869 | D17: 29801 | E17: =+C17/D17 -> 32.343511962685817
B18: Juzgado Federal de Primera Instancia en lo | C18: 696737 | D18: 15143 | E18: =+C18/D18 -> 46.010499900944332
B19: Criminal y Correccional de Posadas
B20: Juzgado Federal de Primera Instancia en lo | C20: 696737 | D20: 15143 | E20: =+C20/D20 -> 46.010499900944332
B21: Civil y Comercial y Cont. Adm. de Posadas
B22: Juzgado Federal de | C22: 267132 | D22: 14658 | E22: =+C22/D22 -> 18.224314367580842
B23: Primera Instancia de
B24: Eldorado
B25: FUENTE: INDEC (Censo Nacional de Población, Hogares y Viviendas 2001) e Instituto Geográfico Militar
B26: Oficina de Estadísticas del Poder Judicial de la Nación.