B6: PODER JUDICIAL DE LA NACION
B7: JURISDICCIÓN FEDERAL POSADAS
B8: CUADRO XII
B9: INDICE DE LITIGIOSIDAD EN LOS JUZGADOS FEDERALES DE PRIMERA INSTANCIA -AÑO 2001-
B12: 1- COMPETENCIA PENAL
B14: Dependencias | C14: Causas ingresadas | D14: Cantidad de habitantes en la | E14: Causas ingresadas
D15: jurisdicción | E15: c/10.000 hab.
B16: Juzgado Federal de Primera Instancia en lo Criminal y Correccional de Posadas | C16: 1104 | D16: 696737 | E16: =+(C16/$D$16)*10000 -> 15.845290260169905
B17: Juzgado Federal de Primera Instancia de Eldorado | C17: 738 | D17: 267132 | E17: =+(C17/$D$17)*10000 -> 27.626791249270024
B18: TOTAL | C18: =SUM(C16:C17) -> 1842 | D18: 963869 | E18: =+(C18/D18)*10000 -> 19.110480781101995
B20: FUENTE: INDEC (Censo Nacional de Población, Hogares y Viviendas 2001 e Instituto Geografico Militar). Oficina de Estadísticas del Poder Judicial de la Nación.
B23: 2- COMPETENCIA CIVIL
B25: Dependencias | C25: Causas ingresadas | D25: Cantidad de habitantes en la jurisdicción | E25: Causas ingresadas
E26: c/10.000 hab.
B27: Juzgado Federal de Primera Instancia en lo Civil y Comercial y Cont. Adm. de Posadas | C27: 3258 | D27: 696737 | E27: =+(C27/$D$27)*10000 -> 46.760829409088366
B28: Juzgado Federal de Primera Instancia de Eldorado | C28: 1048 | D28: 267132 | E28: =+(C28/$D$28)*10000 -> 39.231540961023015
B29: TOTAL | C29: =SUM(C27:C28) -> 4306 | D29: 963869 | E29: =+(C29/D29)*10000 -> 44.674120653325296
B31: FUENTE: INDEC (Censo Nacional de Población, Hogares y Viviendas 2001 e Instituto Geografico Militar). Oficina de Estadísticas del Poder Judicial de la Nación.