B6: PODER JUDICIAL DE LA NACION
B7: JURISDICCION FEDERAL POSADAS
B9: COMPETENCIA PENAL
B10: CUADRO VII
B12: CAUSAS INGRESADAS Y ELEVADAS A JUICIO EN LOS JUZGADOS DE 1RA. INSTANCIA -AÑO 2001-
C14: TOTAL DE CAUSAS INGRESADAS | D14: TOTAL DE CAUSAS ELEVADAS A JUICIO (*) | E14: PORCENTAJE DE CAUSAS ELEVADAS A JUICIO
B16: Juzgado Federal de Primera Instancia en lo Criminal y Correcc. de Posadas | C16: 1104 | D16: 66 | E16: =+D16/C16 -> 5.9782608695652176E-2
B17: Juzgado Federal de Primera Instancia de Eldorado | C17: 738 | D17: 19 | E17: =+D17/C17 -> 2.5745257452574527E-2
B18: Total | C18: =SUM(C16:C17) -> 1842 | D18: =SUM(D16:D17) -> 85 | E18: =+D18/C18 -> 4.6145494028230184E-2
B19: REFERENCIAS: (*) En estas cifras se incluyen causas de años anteriores y las elevaciones a juicio en causas correccionales que se resuelven en la misma instancia.
B20: FUENTE: Oficina de Estadísticas del Poder Judicial de la Nación.