B6: PODER JUDICIAL DE LA NACION
B7: JURISDICCIÓN FEDERAL GENERAL ROCA
B8: COMPETENCIA CIVIL
B9: CUADRO XI
B10: DISTRIBUCION PORCENTUAL, SEGÚN EL OBJETO DE LITIGIO, DE LOS EXPEDIENTES INGRESADOS, RESUELTOS O SALIDOS Y SENTENCIAS DICTADAS EN LOS JUZGADOS FEDERALES DE PRIMERA INSTANCIA -AÑO 2001-
B13: OBJETO | C13: INGRESADOS | D13: % | E13: RESUELTOS O SALIDOS | F13: % | G13: SENTENCIAS DEFINITIVAS | H13: % | I13: SENTENCIAS INTERLOCUTORIAS | J13: %
B14: ORDINARIOS | C14: 115 | D14: =+C14/C$27 -> 1.5199577055247158E-2 | E14: 283 | F14: =+E14/E$27 -> 4.6416270296867311E-2 | G14: 103 | H14: =+G14/G$27 -> 2.0803878004443548E-2 | I14: 193 | J14: =+I14/I$27 -> 7.5273010920436811E-2
B15: SUMARIOS | C15: 143 | D15: =+C15/C$27 -> 1.8900343642611683E-2 | E15: 212 | F15: =+E15/E$27 -> 3.4771198950303429E-2 | G15: 58 | H15: =+G15/G$27 -> 1.1714805089880832E-2 | I15: 115 | J15: =+I15/I$27 -> 4.4851794071762874E-2
B16: SUMARISIMOS | C16: 15 | D16: =+C16/C$27 -> 1.9825535289452814E-3 | E16: 14 | F16: =+E16/E$27 -> 2.2962112514351321E-3 | G16: 6 | H16: =+G16/G$27 -> 1.211876388608362E-3 | I16: 32 | J16: =+I16/I$27 -> 1.2480499219968799E-2
B17: EJECUTIVOS | C17: 616 | D17: =+C17/C$27 -> 8.1416864922019563E-2 | E17: 373 | F17: =+E17/E$27 -> 6.1177628341807448E-2 | G17: 373 | H17: =+G17/G$27 -> 7.5338315491819838E-2 | I17: 184 | J17: =+I17/I$27 -> 7.1762870514820595E-2
B18: EJECUCIONES FISCALES | C18: 5103 | D18: =+C18/C$27 -> 0.67446471054718482 | E18: 3727 | F18: =+E18/E$27 -> 0.61128423814990984 | G18: 3828 | H18: =+G18/G$27 -> 0.77317713593213488 | I18: 1490 | J18: =+I18/I$27 -> 0.58112324492979717
B19: LABORALES | C19: 36 | D19: =+C19/C$27 -> 4.7581284694686752E-3 | E19: 305 | F19: =+E19/E$27 -> 5.0024602263408234E-2 | G19: 68 | H19: =+G19/G$27 -> 1.3734599070894769E-2 | I19: 134 | J19: =+I19/I$27 -> 5.2262090483619343E-2
B20: CIUDADANIA | C20: 325 | D20: =+C20/C$27 -> 4.29553264604811E-2 | E20: 608 | F20: =+E20/E$27 -> 9.9721174348040023E-2 | G20: 281 | H20: =+G20/G$27 -> 5.6756210866491616E-2 | I20: 27 | J20: =+I20/I$27 -> 1.0530421216848674E-2
B21: AMPAROS (LEY 16.986) | C21: 740 | D21: =+C21/C$27 -> 9.7805974094633888E-2 | E21: 305 | F21: =+E21/E$27 -> 5.0024602263408234E-2 | G21: 166 | H21: =+G21/G$27 -> 3.3528580084831346E-2 | I21: 208 | J21: =+I21/I$27 -> 8.1123244929797195E-2
B22: AMPAROS POR MORA | C22: 19 | D22: =+C22/C$27 -> 2.5112344699973568E-3 | E22: 14 | F22: =+E22/E$27 -> 2.2962112514351321E-3 | G22: 10 | H22: =+G22/G$27 -> 2.0197939810139365E-3 | I22: 1 | J22: =+I22/I$27 -> 3.9001560062402497E-4
B23: EXPROPIACIONES | D23: =+C23/C$27 -> 0 | E23: 1 | F23: =+E23/E$27 -> 1.6401508938822371E-4 | G23: 1 | H23: =+G23/G$27 -> 2.0197939810139365E-4 | I23: 1 | J23: =+I23/I$27 -> 3.9001560062402497E-4
B24: LEY 24.463 (ART. 15 SEG. SOC.) | C24: 19 | D24: =+C24/C$27 -> 2.5112344699973568E-3 | E24: 64 | F24: =+E24/E$27 -> 1.0496965720846317E-2 | G24: 28 | H24: =+G24/G$27 -> 5.6554231468390224E-3 | I24: 65 | J24: =+I24/I$27 -> 2.5351014040561622E-2
B25: LEYES ESPECIALES | C25: 86 | D25: =+C25/C$27 -> 1.1366640232619614E-2 | E25: 77 | F25: =+E25/E$27 -> 1.2629161882893225E-2 | G25: 17 | H25: =+G25/G$27 -> 3.4336497677236923E-3 | I25: 65 | J25: =+I25/I$27 -> 2.5351014040561622E-2
B26: CAUTELARES | C26: 349 | D26: =+C26/C$27 -> 4.6127412106793553E-2 | E26: 114 | F26: =+E26/E$27 -> 1.8697720190257505E-2 | G26: 12 | H26: =+G26/G$27 -> 2.4237527772167241E-3 | I26: 49 | J26: =+I26/I$27 -> 1.9110764430577222E-2
B27: TOTAL | C27: =SUM(C14:C26) -> 7566 | D27: =SUM(D14:D26) -> 1 | E27: =SUM(E14:E26) -> 6097 | F27: =SUM(F14:F26) -> 1 | G27: =SUM(G14:G26) -> 4951 | H27: =SUM(H14:H26) -> 1 | I27: =SUM(I14:I26) -> 2564 | J27: =SUM(J14:J26) -> 1
B28: FUENTE:Oficina de Estadísticas del Poder Judicial de la Nación.