B6: PODER JUDICIAL DE LA NACION
B7: JURISDICCION FEDERAL GENERAL ROCA
B9: COMPETENCIA PENAL
B10: CUADRO VII
B12: CAUSAS INGRESADAS Y ELEVADAS A JUICIO EN LOS JUZGADOS DE 1RA. INSTANCIA -AÑO 2001-
C14: TOTAL DE CAUSAS INGRESADAS | D14: TOTAL DE CAUSAS ELEVADAS A JUICIO (*) | E14: PORCENTAJE DE CAUSAS ELEVADAS A JUICIO
B16: Juzgado Federal de Primera Instancia de General Roca | C16: 565 | D16: 17 | E16: =+D16/C16 -> 3.0088495575221239E-2
B17: Juzgado Federal de Primera Instancia de Viedma | C17: 292 | D17: 2 | E17: =+D17/C17 -> 6.8493150684931503E-3
B18: Juzgado Federal de Primera Instancia de Neuquén N°2 | C18: 776 | D18: 35 | E18: =+D18/C18 -> 4.5103092783505154E-2
B19: Juzgado Federal de Primera Instancia de Bariloche | C19: 309 | D19: 5 | E19: =+D19/C19 -> 1.6181229773462782E-2
B20: Juzgado Federal de Primera Instancia de Zapala | C20: 243 | D20: 6 | E20: =+D20/C20 -> 2.4691358024691357E-2
B21: Total | C21: =SUM(C16:C20) -> 2185 | D21: =SUM(D16:D20) -> 65 | E21: =+D21/C21 -> 2.9748283752860413E-2
B22: REFERENCIAS: (*) En estas cifras se incluyen causas de años anteriores y las elevaciones a juicio en causas correccionales que se resuelven en la misma instancia.
B23: FUENTE: Oficina de Estadísticas del Poder Judicial de la Nación.