B6: PODER JUDICIAL DE LA NACION
B7: JURISDICCION FEDERAL GENERAL ROCA
B9: CUADRO II
B10: DENSIDAD DE POBLACION POR COMPETENCIA TERRITORIAL -AÑO 2001-
C13: POBLACION TOTAL (2001) | D13: SUPERFICIE (Km2) | E13: DENSIDAD DE
E14: POBLACION (hab/km2)
B15: Cámara Federal de Apelaciones | C15: 1080655 | D15: 322776 | E15: =+C15/D15 -> 3.3480029494138348
B16: de General Roca
B17: Tribunal Oral en lo Criminal Federal | C17: 607340 | D17: 228698 | E17: =+C17/D17 -> 2.6556419382766792
B18: de General Roca
B19: Tribunal Oral en lo Criminal Federal
B20: de Neuquén | C20: 473315 | D20: 94078 | E20: =+C20/D20 -> 5.0310912221773423
B21: Juzgado Federal de Primera Instancia | C21: 332030 | D21: 72887 | E21: =+C21/D21 -> 4.5554076858699082
B22: de General Roca
B23: Juzgado Federal de Primera Instancia
B24: de Viedma | C24: 89241 | D24: 78647 | E24: =+C24/D24 -> 1.134703167317253
B25: Juzgados Federales de Primera Instancia
B26: de Neuquén Nros. 1 y 2 | C26: 335707 | D26: 27727 | E26: =+C26/D26 -> 12.107584664767195
B27: Juzgado Federal de Primera Instancia
B28: de Bariloche | C28: 186069 | D28: 77164 | E28: =+C28/D28 -> 2.4113446684982636
B29: Juzgado Federal de Primera Instancia
B30: de Zapala | C30: 137608 | D30: 66351 | E30: =+C30/D30 -> 2.0739401064038221
B31: FUENTE: INDEC (Censo Nacional de Población, Hogares y Viviendas 2001) e Instituto Geográfico Militar
B32: Oficina de Estadísticas del Poder Judicial de la Nación.