B6: PODER JUDICIAL DE LA NACION
B7: JURISDICCION FEDERAL GENERAL ROCA
B9: CUADRO V
B10: DISTRIBUCION ANUAL DEL GASTO EN CONCEPTO DE LIQUIDACION DE
B11: HABERES -AÑO 2001
C12: Gasto (Haberes) | D12: %
B13: Cámara Federal de Apelaciones de General Roca | C13: 1141298.8341988174 | D13: =+C13/C$22 -> 0.14504434392513005
B14: Tribunal Oral en lo Criminal Federal de General Roca | C14: 826976.46468478628 | D14: =+C14/C$22 -> 0.10509802968994621
B15: Tribunal Oral en lo Criminal Federal de Neuquén | C15: 760505.05127923388 | D15: =+C15/C$22 -> 9.6650371409498947E-2
B16: Juzgado Federal de Primera Instancia de General Roca | C16: 919342.18023159553 | D16: =+C16/C$22 -> 0.1168365193923972
B17: Juzgado Federal de Primera Instancia de Bariloche | C17: 864831.95928366762 | D17: =+C17/C$22 -> 0.10990897421519011
B18: Juzgado Federal de Primera Instancia de Neuquén N° 1 | C18: 1258826.0899183224 | D18: =+C18/C$22 -> 0.15998054046573479
B19: Juzgado Federal de Primera Instancia de Neuquén N° 2 | C19: 327006.68070864119 | D19: =+C19/C$22 -> 4.1558326392066414E-2
B20: Juzgado Federal de Primera Instancia de Zapala | C20: 790943.91174718994 | D20: =+C20/C$22 -> 0.1005187575097113
B21: Juzgado Federal de Primera Instancia de Viedma | C21: 978888.88794774574 | D21: =+C21/C$22 -> 0.12440413700032503
B22: TOTAL | C22: =SUM(C13:C21) -> 7868620.0599999996 | D22: =SUM(D13:D21) -> 1
B23: NOTA: Los datos registrados corresponden a la ejecución presupuestaria del año 2001.
B24: FUENTE: Departamento de Contaduría y Oficina de Estadísticas del Poder Judicial de la Nación.