B6: PODER JUDICIAL DE LA NACION
B7: JURISDICCION FEDERAL GENERAL ROCA
B8: CUADRO IV
B9: DISTRIBUCION DE LOS CARGOS POR DEPENDENCIA -AÑO 2001-
C10: Distribución de los cargos actuales | D10: Distribución
D11: Porcentual
B12: Cámara Federal de Apelaciones de General Roca | C12: 26 | D12: =+C12/C$20 -> 0.12206572769953052
B13: Tribunal Oral en lo Criminal Federal de General Roca | C13: 13 | D13: =+C13/C$20 -> 6.1032863849765258E-2
B14: Tribunal Oral en lo Criminal Federal de Neuquén | C14: 15 | D14: =+C14/C$20 -> 7.0422535211267609E-2
B15: Juzgado Federal de Primera Instancia de General Roca | C15: 30 | D15: =+C15/C$20 -> 0.14084507042253522
B16: Juzgado Federal de Primera Instancia de Bariloche | C16: 26 | D16: =+C16/C$20 -> 0.12206572769953052
B17: Juzgado Federal de Primera Instancia de Neuquén Nros 1 y 2 | C17: 51 | D17: =+C17/C$20 -> 0.23943661971830985
B18: Juzgado Federal de Primera Instancia de Zapala | C18: 24 | D18: =+C18/C$20 -> 0.11267605633802817
B19: Juzgado Federal de Primera Instancia de Viedma | C19: 28 | D19: =+C19/C$20 -> 0.13145539906103287
B20: TOTAL | C20: =SUM(C12:C19) -> 213 | D20: =SUM(D12:D19) -> 1
B21: FUENTE: Oficina de Estadísticas del Poder Judicial de la Nación.