B6: PODER JUDICIAL DE LA NACION
B7: JURISDICCION FEDERAL GENERAL ROCA
B9: CUADRO VI
B10: DISTRIBUCION ANUAL DEL GASTO POR TODO CONCEPTO -AÑO 2001-
C13: Cámara, Tribunal Oral y Juzgados | D13: %
B14: HABERES | C14: 7868620.0599999996 | D14: =+C14/C$18 -> 0.92754855773457034
B15: BIENES DE CONSUMO | C15: 81607.21 | D15: =+C15/C$18 -> 9.6198125413418691E-3
B16: SERVICIOS NO PERSONALES | C16: 533016 | D16: =+C16/C$18 -> 6.2831629724087831E-2
B17: BIENES DE USO
B18: Total | C18: =SUM(C14:C17) -> 8483243.2699999996 | D18: =SUM(D14:D17) -> 1
B19: NOTA: Los datos consignados corresponden a la ejecución presupuestaria del año 2001.
B20: FUENTE: Departamento de Contaduría y Oficina de Estadísticas del Poder Judicial de la Nación.