B6: PODER JUDICIAL DE LA NACION
B7: JURISDICCION FEDERAL GENERAL ROCA
B9: CUADRO III
B10: DISTRIBUCION DE LOS CARGOS PERMANENTES Y CONTRATADOS -AÑO 2001-
C13: Cámara Federal de Apelaciones de Gral Roca | E13: Tribunal Oral en lo Criminal Federal de Gral Roca | G13: Tribunal Oral en lo Criminal Federal de Neuquén | I13: Juzgado Federal de Primera Instancia de Gral Roca | K13: Juzgado Federal de Primera Instancia de Bariloche | M13: Juzgado Federal de Primera Instancia de Neuquén Nros 1 y 2 | O13: Juzgado Federal de Primera Instancia de Zapala | Q13: Juzgado Federal de Primera Instancia de Viedma
C14: P | D14: C | E14: P | F14: C | G14: P | H14: C | I14: P | J14: C | K14: P | L14: C | M14: P | N14: C | O14: P | P14: C | Q14: P | R14: C
B15: Juez (1ª o 2ª
B16: instancia) | C16: 3 | E16: 3 | G16: 3 | I16: 1 | K16: 1 | M16: 2 | O16: 1 | Q16: 1
B17: Secretario (1ª o 2ª instancia)
C18: 2 | E18: 1 | G18: 1 | H18: 1 | I18: 3 | K18: 3 | M18: 4 | N18: 2 | O18: 2 | P18: 1 | Q18: 3
B19: Prosecretario Administrativo
B20: Jefe
B21: Prosecretario
B22: de Cámara | C22: 1
B23: Prosecretario Administrativo
C24: 5 | E24: 2 | G24: 2 | I24: 3 | K24: 4 | M24: 5 | O24: 2 | P24: 1 | Q24: 3
B25: Oficial Mayor
C26: 3 | E26: 3 | G26: 3 | I26: 3 | J26: 1 | K26: 3 | M26: 6 | O26: 2 | P26: 2 | Q26: 3
B27: Oficial Mayor Relator
B29: Oficial
G30: 1 | I30: 1 | K30: 1 | M30: 2 | O30: 1 | Q30: 1
B31: Escribiente
C32: 3 | E32: 1 | G32: 1 | I32: 4 | K32: 5 | M32: 9 | N32: 1 | O32: 3 | Q32: 5
B33: Escribiente Auxiliar
C34: 2 | E34: 1 | G34: 1 | I34: 3 | K34: 3 | M34: 5 | O34: 2 | Q34: 3
B35: Auxiliar
C36: 2 | I36: 6 | J36: 3 | K36: 4 | M36: 8 | O36: 4 | P36: 1 | Q36: 4
B37: Auxiliar Administrativo
H38: 1
B39: Jefe de Sección /
B40: Encargado de Sección
B41: Oficial
B42: de Servicio / Medio Oficial | C42: 1 | Q42: 1
B43: Ayudante
C44: 4 | E44: 1 | G44: 1 | I44: 2 | K44: 2 | M44: 6 | N44: 1 | O44: 2 | Q44: 4
B45: Auxiliar de Servicio
B47: Total
C48: =SUM(C16:C46) -> 26 | D48: =SUM(D16:D46) -> 0 | E48: =SUM(E16:E46) -> 12 | F48: =SUM(F16:F46) -> 0 | G48: =SUM(G16:G46) -> 13 | H48: =SUM(H16:H46) -> 2 | I48: =SUM(I16:I46) -> 26 | J48: =SUM(J16:J46) -> 4 | K48: =SUM(K16:K46) -> 26 | L48: =SUM(L16:L46) -> 0 | M48: =SUM(M16:M46) -> 47 | N48: =SUM(N16:N46) -> 4 | O48: =SUM(O16:O46) -> 19 | P48: =SUM(P16:P46) -> 5 | Q48: =SUM(Q16:Q46) -> 28 | R48: =SUM(R16:R46) -> 0
B49: FUENTE: División Programación Presupuestaria. Consejo de la Magistratura.
B50: Oficina de Estadísticas del Poder Judicial de la Nación.