B6: PODER JUDICIAL DE LA NACION
B7: JURISDICCION FEDERAL GENERAL ROCA
B9: COMPETENCIA PENAL
B10: CUADRO IX
B11: DISTRIBUCION PORCENTUAL SEGÚN EL TIPO DE DELITO DE LAS CAUSAS INGRESADAS, ELEVADAS A JUICIO Y PERSONAS CONDENADAS EN LOS JUZGADOS FEDERALES -AÑO 2001-
C13: CAUSAS | D13: % | E13: CAUSAS | F13: % | G13: PERSONAS | H13: %
B14: DELITOS | C14: INGRESADAS | E14: ELEVADAS | G14: CONDENADAS(*)
B15: DELITOS CONTRA LAS PERSONAS | C15: 45 | D15: =+(C15/C$31) -> 2.0594965675057208E-2 | E15: 4 | F15: =+E15/E$31 -> 6.1538461538461542E-2 | H15: =+G15/G$31 -> 0
B16: HOMICIDIOS | D16: =+(C16/C$31) -> 0 | F16: =+E16/E$31 -> 0 | H16: =+G16/G$31 -> 0
B17: DELITOS CONTRA EL HONOR | C17: 1 | D17: =+(C17/C$31) -> 4.5766590389016021E-4 | F17: =+E17/E$31 -> 0 | H17: =+G17/G$31 -> 0
B18: DELITOS CONTRA LA INTEGRIDAD SEXUAL | D18: =+(C18/C$31) -> 0 | F18: =+E18/E$31 -> 0 | H18: =+G18/G$31 -> 0
B19: DELITOS CONTRA EL ESTADO CIVIL | D19: =+(C19/C$31) -> 0 | F19: =+E19/E$31 -> 0 | H19: =+G19/G$31 -> 0
B20: DELITOS CONTRA LA LIBERTAD | C20: 41 | D20: =+(C20/C$31) -> 1.8764302059496567E-2 | E20: 1 | F20: =+E20/E$31 -> 1.5384615384615385E-2 | H20: =+G20/G$31 -> 0
B21: DELITOS CONTRA LA PROPIEDAD | C21: 139 | D21: =+(C21/C$31) -> 6.361556064073226E-2 | E21: 6 | F21: =+E21/E$31 -> 9.2307692307692313E-2 | G21: 21 | H21: =+G21/G$31 -> 0.29166666666666669
B22: DELITOS CONTRA LA SEGURIDAD PUBLICA | C22: 251 | D22: =+(C22/C$31) -> 0.11487414187643021 | E22: 1 | F22: =+E22/E$31 -> 1.5384615384615385E-2 | H22: =+G22/G$31 -> 0
B23: DELITOS CONTRA EL ORDEN PUBLICO | C23: 7 | D23: =+(C23/C$31) -> 3.2036613272311211E-3 | F23: =+E23/E$31 -> 0 | H23: =+G23/G$31 -> 0
B24: DELITOS CONTRA LA SEG. DE LA NACION | D24: =+(C24/C$31) -> 0 | F24: =+E24/E$31 -> 0 | H24: =+G24/G$31 -> 0
B25: DELITOS CONTRA LOS POD. PUB. Y ORD. CONTITUC. | D25: =+(C25/C$31) -> 0 | F25: =+E25/E$31 -> 0 | H25: =+G25/G$31 -> 0
B26: DELITOS CONTRA LA ADMINISTRACION PUBLICA | C26: 121 | D26: =+(C26/C$31) -> 5.5377574370709379E-2 | E26: 4 | F26: =+E26/E$31 -> 6.1538461538461542E-2 | G26: 4 | H26: =+G26/G$31 -> 5.5555555555555552E-2
B27: DELITOS CONTRA LA FE PUBLICA | C27: 486 | D27: =+(C27/C$31) -> 0.22242562929061785 | E27: 8 | F27: =+E27/E$31 -> 0.12307692307692308 | G27: 5 | H27: =+G27/G$31 -> 6.9444444444444448E-2
B28: INFRACCION LEY 23.737 (ESTUPEFACIENTES) | C28: 409 | D28: =+(C28/C$31) -> 0.18718535469107553 | E28: 41 | F28: =+E28/E$31 -> 0.63076923076923075 | G28: =4+33 -> 37 | H28: =+G28/G$31 -> 0.51388888888888884
B29: INFRACCION LEYES ESPECIALES Y DEC. LEYES | C29: =158+18+499 -> 675 | D29: =+(C29/C$31) -> 0.30892448512585813 | F29: =+E29/E$31 -> 0 | G29: 5 | H29: =+G29/G$31 -> 6.9444444444444448E-2
B30: D.G.I. | C30: 10 | D30: =+(C30/C$31) -> 4.5766590389016018E-3 | F30: =+E30/E$31 -> 0 | H30: =+G30/G$31 -> 0
B31: TOTAL | C31: =SUM(C15:C30) -> 2185 | D31: =SUM(D15:D30) -> 1 | E31: =SUM(E15:E30) -> 65 | F31: =SUM(F15:F30) -> 1 | G31: =SUM(G15:G30) -> 72 | H31: =SUM(H15:H30) -> 1
B32: REFERENCIAS: (*) En causa tramitadas en los Juzgados de 1ra. Instancia y en los Tribunales Orales en lo Criminal Federal.
B33: FUENTE: Oficina de Estadísticas del Poder Judicial de la Nación.