B6: PODER JUDICIAL DE LA NACION
B7: JURISDICCIÓN FEDERAL GENERAL ROCA
B8: CUADRO XII
B9: INDICE DE LITIGIOSIDAD EN LOS JUZGADOS FEDERALES DE PRIMERA INSTANCIA
B10: -AÑO 2001-
B12: 1- COMPETENCIA PENAL
B14: Dependencias | C14: Causas ingresadas | D14: Cantidad de habitantes en la | E14: Causas ingresadas
D15: jurisdicción | E15: c/10.000 hab.
B16: Juzgado Federal de Primera Instancia de General Roca | C16: 565 | D16: 332030 | E16: =+(C16/$D$16)*10000 -> 17.01653465048339
B17: Juzgado Federal de Primera Instancia de Viedma | C17: 292 | D17: 89241 | E17: =+(C17/$D$17)*10000 -> 32.720386369493845
B18: Juzgado Federal de Primera Instancia de Neuquén N° 2 | C18: 776 | D18: 335707 | E18: =+(C18/$D$18)*10000 -> 23.115395270280331
B19: Juzgado Federal de Primera Instancia de Bariloche | C19: 309 | D19: 186069 | E19: =+(C19/$D$19)*10000 -> 16.606742659980974
B20: Juzgado Federal de Primera Instancia de Zapala | C20: 243 | D20: 137608 | E20: =+(C20/D20)*10000 -> 17.658857043195162
B21: TOTAL | C21: =SUM(C16:C20) -> 2185 | D21: 1080655 | E21: =+(C21/D21)*10000 -> 20.219218899648826
B23: FUENTE: INDEC (Censo Nacional de Población, Hogares y Viviendas 2001 e Instituto Geografico Militar).
B24: Oficina de Estadísticas del Poder Judicial de la Nación.
B26: 2- COMPETENCIA CIVIL
B28: Dependencias | C28: Causas ingresadas | D28: Cantidad de habitantes en la jurisdicción | E28: Causas ingresadas
E29: c/10.000 hab.
B30: Juzgado Federal de Primera Instancia de General Roca | C30: 1964 | D30: 332030 | E30: =+(C30/$D$30)*10000 -> 59.151281510706866
B31: Juzgado Federal de Primera Instancia de Viedma | C31: 557 | D31: 89241 | E31: =+(C31/$D$31)*10000 -> 62.415257560986547
B32: Juzgado Federal de Primera Instancia de Neuquén N° 1 | C32: 3148 | D32: 335707 | E32: =+(C32/$D$32)*10000 -> 93.772247823250638
B33: Juzgado Federal de Primera Instancia de Bariloche | C33: 1474 | D33: 186069 | E33: =+(C33/$D$33)*10000 -> 79.217924533372027
B34: Juzgado Federal de Primera Instancia de Zapala | C34: 423 | D34: 137608 | E34: =+(C34/D34)*10000 -> 30.739491890006395
B35: TOTAL | C35: =SUM(C30:C34) -> 7566 | D35: 1080655 | E35: =+(C35/D35)*10000 -> 70.013093910637537
B37: FUENTE: INDEC (Censo Nacional de Población, Hogares y Viviendas 2001 e Instituto Geografico Militar).
B38: Oficina de Estadísticas del Poder Judicial de la Nación.