B6: PODER JUDICIAL DE LA NACION
B7: JURISDICCION FEDERAL MAR DEL PLATA
B9: COMPETENCIA CIVIL
B10: CUADRO XI
B11: DISTRIBUCION PORCENTUAL,SEGÚN EL OBJETO DE LITIGIO,DE LOS EXPEDIENTES INGRESADOS,RESUELTOS O SALIDOS Y SENTENCIAS DICTADAS EN LOS JUZGADOS FEDERALES DE PRIMERA INSTANCIA -AÑO 2001-
B13: OBJETO | C13: INGRESADOS | D13: % | E13: RESUELTOS O SALIDOS | F13: % | G13: SENTENCIAS DEFINITIVAS | H13: % | I13: SENTENCIAS INTERLOCUTORIAS | J13: %
B14: ORDINARIOS | C14: 113 | D14: =+C14/C$27 -> 1.1839899413243923E-2 | E14: 64 | F14: =+E14/E$27 -> 1.0682690702720748E-2 | G14: 48 | H14: =+G14/G$27 -> 9.2449922958397542E-3 | I14: 22 | J14: =+I14/I$27 -> 1.3538461538461539E-2
B15: SUMARIOS | C15: 198 | D15: =+C15/C$27 -> 2.0746018440905283E-2 | E15: 299 | F15: =+E15/E$27 -> 4.9908195626773497E-2 | G15: 70 | H15: =+G15/G$27 -> 1.3482280431432974E-2 | I15: 92 | J15: =+I15/I$27 -> 5.6615384615384616E-2
B16: SUMARISIMOS | C16: 18 | D16: =+C16/C$27 -> 1.8860016764459346E-3 | E16: 49 | F16: =+E16/E$27 -> 8.1789350692705719E-3 | G16: 7 | H16: =+G16/G$27 -> 1.3482280431432975E-3 | I16: 7 | J16: =+I16/I$27 -> 4.3076923076923075E-3
B17: EJECUTIVOS | C17: 1310 | D17: =+C17/C$27 -> 0.13725901089689857 | E17: 550 | F17: =+E17/E$27 -> 9.1804373226506419E-2 | G17: 194 | H17: =+G17/G$27 -> 3.7365177195685668E-2 | I17: 199 | J17: =+I17/I$27 -> 0.12246153846153846
B18: EJECUCIONES FISCALES | C18: 6281 | D18: =+C18/C$27 -> 0.65810980720871748 | E18: 3897 | F18: =+E18/E$27 -> 0.6504757135703555 | G18: 4412 | H18: =+G18/G$27 -> 0.84976887519260402 | I18: 340 | J18: =+I18/I$27 -> 0.20923076923076922
B19: LABORALES | C19: 94 | D19: =+C19/C$27 -> 9.849119865884326E-3 | E19: 362 | F19: =+E19/E$27 -> 6.0423969287264227E-2 | G19: 108 | H19: =+G19/G$27 -> 2.0801232665639446E-2 | I19: 209 | J19: =+I19/I$27 -> 0.1286153846153846
B20: CIUDADANIA | C20: 173 | D20: =+C20/C$27 -> 1.8126571668063706E-2 | E20: 19 | F20: =+E20/E$27 -> 3.171423802370222E-3 | G20: 75 | H20: =+G20/G$27 -> 1.4445300462249615E-2 | I20: 13 | J20: =+I20/I$27 -> 8.0000000000000002E-3
B21: AMPAROS (LEY 16.986) | C21: 561 | D21: =+C21/C$27 -> 5.8780385582564959E-2 | E21: 291 | F21: =+E21/E$27 -> 4.8572859288933401E-2 | G21: 20 | H21: =+G21/G$27 -> 3.852080123266564E-3 | I21: 58 | J21: =+I21/I$27 -> 3.569230769230769E-2
B22: AMPAROS POR MORA | C22: 202 | D22: =+C22/C$27 -> 2.1165129924559933E-2 | E22: 147 | F22: =+E22/E$27 -> 2.4536805207811718E-2 | G22: 40 | H22: =+G22/G$27 -> 7.7041602465331279E-3 | I22: 2 | J22: =+I22/I$27 -> 1.2307692307692308E-3
B23: EXPROPIACIONES | C23: 1 | D23: =+C23/C$27 -> 1.0477787091366304E-4 | F23: =+E23/E$27 -> 0 | H23: =+G23/G$27 -> 0 | I23: 2 | J23: =+I23/I$27 -> 1.2307692307692308E-3
B24: LEY 24.463 (ART. 15 SEG. SOC.) | C24: 416 | D24: =+C24/C$27 -> 4.3587594300083819E-2 | E24: 172 | F24: =+E24/E$27 -> 2.8709731263562011E-2 | G24: 213 | H24: =+G24/G$27 -> 4.1024653312788907E-2 | I24: 43 | J24: =+I24/I$27 -> 2.646153846153846E-2
B25: LEYES ESPECIALES | C25: 78 | D25: =+C25/C$27 -> 8.1726739312657174E-3 | E25: 18 | F25: =+E25/E$27 -> 3.0045067601402104E-3 | G25: 2 | H25: =+G25/G$27 -> 3.8520801232665641E-4 | I25: 21 | J25: =+I25/I$27 -> 1.2923076923076923E-2
B26: CAUTELARES | C26: 99 | D26: =+C26/C$27 -> 1.0373009220452641E-2 | E26: 123 | F26: =+E26/E$27 -> 2.0530796194291438E-2 | G26: 3 | H26: =+G26/G$27 -> 5.7781201848998464E-4 | I26: 617 | J26: =+I26/I$27 -> 0.37969230769230772
B27: TOTAL | C27: =SUM(C14:C26) -> 9544 | D27: =SUM(D14:D26) -> 1 | E27: =SUM(E14:E26) -> 5991 | F27: =SUM(F14:F26) -> 1 | G27: =SUM(G14:G26) -> 5192 | H27: =SUM(H14:H26) -> 1 | I27: =SUM(I14:I26) -> 1625 | J27: =SUM(J14:J26) -> 1
B28: FUENTE: Oficina de Estadísticas del Poder Judicial de la Nación.