B6: PODER JUDICIAL DE LA NACION
B7: JURISDICCION FEDERAL MAR DEL PLATA
B9: CUADRO III
B10: DISTRIBUCION DE LOS CARGOS PERMANENTES Y CONTRATADOS -AÑO 2001-
C13: Cámara Federal de Apelaciones de Mar del Plata | E13: Tribunal Oral en lo Criminal Federal de Mar del Plata | G13: Juzgados Federales de Primera Instancia de Mar del Plata Nros. 1 al 3 | I13: Juzgado Federal de Primera Instancia de Mar del Plata N° 4 (*) | K13: Juzgado Federal de Primera Instancia de Azul | M13: Juzgado Federal de Primera Instancia de Dolores | O13: Juzgado Federal de Primera Instancia de Necochea (*)
C14: P | D14: C | E14: P | F14: C | G14: P | H14: C | I14: P | J14: C | K14: P | L14: C | M14: P | N14: C | O14: P | P14: C
B15: Juez (1ª o 2ª
B16: instancia) | C16: 3 | E16: 3 | G16: 3 | K16: 1 | M16: 1
B17: Secretario (1ª o 2ª instancia)
C18: 3 | D18: 1 | E18: 1 | G18: 7 | K18: 4 | L18: 1 | M18: 3
B19: Prosecretario
B20: de Cámara | C20: 1
B21: Prosecretario Administrativo
B22: Administrativo | C22: 6 | D22: 1 | E22: 2 | G22: 10 | K22: 4 | L22: 1 | M22: 3
B23: Oficial Mayor
C24: 9 | D24: 2 | E24: 3 | G24: 10 | K24: 5 | L24: 1 | M24: 3
B25: Oficial Mayor Relator
B27: Oficial
C28: 1 | G28: 4 | K28: 1 | M28: 1
B29: Escribiente
C30: 4 | E30: 1 | G30: 17 | K30: 3 | M30: 3
B31: Escribiente Auxiliar
C32: 2 | D32: 1 | E32: 1 | G32: 5 | K32: 3 | M32: 2
B33: Auxiliar
C34: 5 | G34: 16 | K34: 5 | M34: 4
B35: Auxiliar Administrativo
B37: Oficial
B38: de Servicio/Medio Oficial | C38: 1
B39: Ayudante
C40: 4 | E40: 2 | G40: 8 | K40: 2 | M40: 2
B41: Auxiliar de Servicio
B43: Total | C43: =SUM(C15:C42) -> 39 | D43: =SUM(D15:D42) -> 5 | E43: =SUM(E15:E42) -> 13 | F43: =SUM(F15:F42) -> 0 | G43: =SUM(G15:G42) -> 80 | H43: =SUM(H15:H42) -> 0 | I43: =SUM(I15:I42) -> 0 | J43: =SUM(J15:J42) -> 0 | K43: =SUM(K15:K42) -> 28 | L43: =SUM(L15:L42) -> 3 | M43: =SUM(M15:M42) -> 22 | N43: =SUM(N15:N42) -> 0 | O43: =SUM(O15:O42) -> 0 | P43: =SUM(P15:P42) -> 0
B44: FUENTE: División Programación Presupuestaria.Consejo de la Magistratura. Oficina de Estadísticas del Poder Judicial de la Nación.
B45: REF: (*) Sin habilitar