B6: PODER JUDICIAL DE LA NACION
B7: JURISDICCION FEDERAL MAR DEL PLATA
B8: CUADRO VI
B10: DISTRIBUCION DEL GASTO POR TODO CONCEPTO
B11: -AÑO 2001-
C13: Cámara, Tribunal Oral y Juzgados | D13: %
B14: HABERES | C14: 5912975.0099999998 | D14: =+C14/C$18 -> 0.94758496470437825
B15: BIENES DE CONSUMO | C15: 62871.3 | D15: =+C15/C$18 -> 1.0075452456785941E-2
B16: SERVICIOS NO PERSONALES | C16: 264201 | D16: =+C16/C$18 -> 4.2339582838835883E-2
B17: BIENES DE USO
B18: Total | C18: =SUM(C14:C16) -> 6240047.3099999996 | D18: =SUM(D14:D16) -> 1
B19: Nota: Los datos registrados corresponde a la ejecución presupuestaria del año 2001.
B20: Fuente: Departamento de Contaduría y Oficina de Estadísticas del Poder Judicial de la Nación.