B6: PODER JUDICIAL DE LA NACION
B7: JURISDICCION FEDERAL MAR DEL PLATA
B9: COMPETENCIA PENAL
B10: CUADRO VII
B11: CAUSAS INGRESADAS Y ELEVADAS A JUICIO EN LOS JUZGADOS DE 1RA. INSTANCIA
B12: AÑO 2001
C14: TOTAL DE CAUSAS INGRESADAS | D14: TOTAL DE CAUSAS ELEVADAS A JUICIO (*) | E14: PORCENTAJE DE CAUSAS ELEVADAS A JUICIO
B16: Juzgado Federal de Primera Instancia de Mar del Plata Nº 1 | C16: 1071 | D16: 80 | E16: =+D16/C16 -> 7.4696545284780577E-2
B17: Juzgado Federal de Primera Instancia de Mar del Plata Nº 3 | C17: 902 | D17: 41 | E17: =+D17/C17 -> 4.5454545454545456E-2
B18: Juzgado Federal de Primera Instancia de Azul | C18: 645 | D18: 34 | E18: =+D18/C18 -> 5.2713178294573643E-2
B19: Juzgado Federal de Primera Instancia de Dolores | C19: 876 | D19: 36 | E19: =+D19/C19 -> 4.1095890410958902E-2
B20: Total | C20: =SUM(C16:C19) -> 3494 | D20: =SUM(D16:D19) -> 191 | E20: =+D20/C20 -> 5.4665140240412136E-2
B21: (*): En estas cifras se incluyen causas de años anteriores y las elevaciones a juicio en causas correccionales que se resuelven en la misma instancia.
B22: FUENTE: Oficina de Estadísticas del Poder Judicial de la Nación.