B6: PODER JUDICIAL DE LA NACION
B7: JURISDICCION FEDERAL MAR DEL PLATA
B8: CUADRO V
B10: DISTRIBUCION ANUAL DEL GASTO EN CONCEPTO DE LIQUIDACION DE HABERES -AÑO 2001-
C12: Gasto (Haberes) | D12: %
B13: Cámara Federal de Apelaciones de Mar del Plata | C13: 1764811.6259444773 | D13: =+C13/$C$20 -> 0.29846424565634638
B14: Tribunal Oral en lo Criminal Federal de Mar del Plata | C14: 617642.34862331033 | D14: =+C14/$C$20 -> 0.10445543023245592
B15: Juzgado Federal de Primera Instancia de Mar del Plata N° 1 | C15: 572265.17633676785 | D15: =+C15/$C$20 -> 9.6781260764497612E-2
B16: Juzgado Federal de Primera Instancia de Mar del Plata N° 2 | C16: 883286.86420341872 | D16: =+C16/$C$20 -> 0.14938112586466332
B17: Juzgado Federal de Primera Instancia de Mar del Plata N° 3 | C17: 537750.76814810338 | D17: =+C17/$C$20 -> 9.0944197673533442E-2
B18: Juzgado Federal de Primera Instancia de Azul | C18: 1043357.7228567309 | D18: =+C18/$C$20 -> 0.17645224630447592
B19: Juzgado Federal de Primera Instancia de Dolores | C19: 493860.50388719095 | D19: =+C19/$C$20 -> 8.3521493504027336E-2
B20: TOTAL | C20: =SUM(C13:C19) -> 5912975.0099999998 | D20: =SUM(D13:D19) -> 1
B21: Nota: Los datos registrados corresponde a la ejecución presupuestaria del año 2001.
B22: Fuente: Departamento de Contaduría y Oficina de Estadísticas del Poder Judicial de la Nación.