B6: PODER JUDICIAL DE LA NACION
B7: JURISDICCION FEDERAL MAR DEL PLATA
B9: COMPETENCIA PENAL
B10: CUADRO IX
B11: DISTRIBUCION PORCENTUAL,SEGÚN ELTIPO DE DELITO, DE LAS CAUSAS INGRESADAS, ELEVADAS A JUICIO Y PERSONAS CONDENADAS EN LOS JUZGADOS FEDERALES -AÑO 2001-
C13: CAUSAS | D13: % | E13: CAUSAS | F13: % | G13: PERSONAS | H13: %
B14: BIEN PROTEGIDO | C14: INGRESADAS | E14: ELEVADAS | G14: CONDENADAS (*)
B15: DELITOS CONTRA LAS PERSONAS | C15: 20 | D15: =+(C15/C$31) -> 5.7240984544934172E-3 | F15: =+E15/E$31 -> 0 | H15: =+G15/G$31 -> 0
B16: HOMICIDIOS | D16: =+(C16/C$31) -> 0 | F16: =+E16/E$31 -> 0 | H16: =+G16/G$31 -> 0
B17: DELITOS CONTRA EL HONOR | C17: 1 | D17: =+(C17/C$31) -> 2.8620492272467084E-4 | F17: =+E17/E$31 -> 0 | H17: =+G17/G$31 -> 0
B18: DELITOS CONTRA LA INTEGRIDAD SEXUAL | D18: =+(C18/C$31) -> 0 | F18: =+E18/E$31 -> 0 | H18: =+G18/G$31 -> 0
B19: DELITOS CONTRA EL ESTADO CIVIL | D19: =+(C19/C$31) -> 0 | F19: =+E19/E$31 -> 0 | H19: =+G19/G$31 -> 0
B20: DELITOS CONTRA LA LIBERTAD | C20: 25 | D20: =+(C20/C$31) -> 7.155123068116772E-3 | E20: 1 | F20: =+E20/E$31 -> 5.235602094240838E-3 | H20: =+G20/G$31 -> 0
B21: DELITOS CONTRA LA PROPIEDAD | C21: 60 | D21: =+(C21/C$31) -> 1.7172295363480253E-2 | E21: 1 | F21: =+E21/E$31 -> 5.235602094240838E-3 | G21: 5 | H21: =+G21/G$31 -> 5.4945054945054944E-2
B22: DELITOS CONTRA LA SEGURIDAD PUBLICA | C22: 95 | D22: =+(C22/C$31) -> 2.7189467658843731E-2 | F22: =+E22/E$31 -> 0 | H22: =+G22/G$31 -> 0
B23: DELITOS CONTRA EL ORDEN PUBLICO | C23: 19 | D23: =+(C23/C$31) -> 5.4378935317687463E-3 | F23: =+E23/E$31 -> 0 | H23: =+G23/G$31 -> 0
B24: DELITOS CONTRA LA SEG. DE LA NACION | C24: 1 | D24: =+(C24/C$31) -> 2.8620492272467084E-4 | F24: =+E24/E$31 -> 0 | H24: =+G24/G$31 -> 0
B25: DELITOS CONTRA LOS POD. PUB. Y ORD. CONTITUC. | C25: 2 | D25: =+(C25/C$31) -> 5.7240984544934168E-4 | F25: =+E25/E$31 -> 0 | H25: =+G25/G$31 -> 0
B26: DELITOS CONTRA LA ADMINISTRACION PUBLICA | C26: 137 | D26: =+(C26/C$31) -> 3.9210074413279908E-2 | E26: 5 | F26: =+E26/E$31 -> 2.6178010471204188E-2 | G26: 1 | H26: =+G26/G$31 -> 1.098901098901099E-2
B27: DELITOS CONTRA LA FE PUBLICA | C27: 843 | D27: =+(C27/C$31) -> 0.24127074985689753 | E27: 22 | F27: =+E27/E$31 -> 0.11518324607329843 | H27: =+G27/G$31 -> 0
B28: INFRACCION LEY 23.737 (ESTUPEFACIENTES) | C28: 1758 | D28: =+(C28/C$31) -> 0.50314825414997133 | E28: 156 | F28: =+E28/E$31 -> 0.81675392670157065 | G28: =44+41 -> 85 | H28: =+G28/G$31 -> 0.93406593406593408
B29: INFRACCION LEYES ESPECIALES Y DEC. LEYES | C29: =88+162+1 -> 251 | D29: =+(C29/C$31) -> 7.1837435603892386E-2 | E29: 6 | F29: =+E29/E$31 -> 3.1413612565445025E-2 | H29: =+G29/G$31 -> 0
B30: D.G.I. | C30: 282 | D30: =+(C30/C$31) -> 8.0709788208357183E-2 | F30: =+E30/E$31 -> 0 | H30: =+G30/G$31 -> 0
B31: TOTAL | C31: =SUM(C15:C30) -> 3494 | D31: =SUM(D15:D30) -> 1 | E31: =SUM(E15:E30) -> 191 | F31: =SUM(F15:F30) -> 1 | G31: =SUM(G15:G30) -> 91 | H31: =SUM(H15:H30) -> 1
B32: REFERENCIA (*): En causas tramitadas en los Juzgados de Primera Instancia y en el Tribunal Oral en lo Criminal Federal.
B33: FUENTE: Oficina de Estadísticas del Poder Judicial de la Nación.