B6: PODER JUDICIAL DE LA NACION
B7: JURISDICCION FEDERAL MAR DEL PLATA
B8: CUADRO IV
B10: DISTRIBUCION DE LOS CARGOS POR DEPENDENCIA -AÑO 2001-
C12: Distribución de los cargos actuales | D12: Distribución
D13: Porcentual
B14: Cámara Federal de Apelaciones de Mar del Plata | C14: =39+5 -> 44 | D14: =+C14/C$19 -> 0.23157894736842105
B15: Tribunal Oral en lo Criminal Federal de Mar del Plata | C15: 13 | D15: =+C15/C$19 -> 6.8421052631578952E-2
B16: Juzgados Federales de Primera Instancia de Mar del Plata Nros.1 al 3 | C16: 80 | D16: =+C16/C$19 -> 0.42105263157894735
B17: Juzgado Federal de Primera Instancia de Azul | C17: =28+3 -> 31 | D17: =+C17/C$19 -> 0.16315789473684211
B18: Juzgado Federal de Primera Instancia de Dolores | C18: 22 | D18: =+C18/C$19 -> 0.11578947368421053
B19: TOTAL | C19: =SUM(C14:C18) -> 190 | D19: =SUM(D14:D18) -> 1
B20: Fuente: Oficina de Estadísticas del Poder Judicial de la Nación