B6: PODER JUDICIAL DE LA NACION
B7: JURISDICCIÓN FEDERAL MAR DEL PLATA
B8: CUADRO XII
B9: INDICE DE LITIGIOSIDAD EN LOS JUZGADOS FEDERALES DE PRIMERA INSTANCIA -AÑO 2001-
B14: 1- COMPETENCIA PENAL
B16: Dependencias | C16: Causas ingresadas | D16: Cantidad de habitantes en la jurisdicción | E16: Causas ingresadas
E17: c/10.000 hab.
B18: Juzgado Federal de Primera Instancia de Mar del Plata N° 1 | C18: 1071 | D18: 773462 | E18: =+(C18/$D$18)*10000 -> 13.846834104325744
B19: Juzgado Federal de Primera Instancia de Mar del Plata N° 3 | C19: 902 | E19: =+(C19/$D$18)*10000 -> 11.661852812420003
B20: Juzgado Federal de Primera Instancia de Azul | C20: 645 | D20: 478733 | E20: =+(C20/D20)*10000 -> 13.473063273265057
B21: Juzgado Federal de Primera Instancia de Dolores | C21: 876 | D21: 249505 | E21: =+(C21/D21)*10000 -> 35.10951684334983
B22: TOTAL | C22: =SUM(C18:C21) -> 3494 | D22: =+D18+D20+D21 -> 1501700 | E22: =+(C22/D22)*10000 -> 23.266964107345007
B24: FUENTE: INDEC (Censo Nacional de Población, Hogares y Viviendas 2001 e Instituto Geografico Militar). Oficina de Estadísticas del
B25: Poder Judicial de la Nación.
B27: 2- COMPETENCIA CIVIL
B29: Dependencias | C29: Causas ingresadas | D29: Cantidad de habitantes en la jurisdicción | E29: Causas ingresadas
E30: c/10.000 hab.
B31: Juzgado Federal de Primera Instancia de Mar del Plata N ° 2 | C31: 6345 | D31: 773462 | E31: =+(C31/D31)*10000 -> 82.033765071845806
B32: Juzgado Federal de Primera Instancia de Azul | C32: 2068 | D32: 478733 | E32: =+(C32/D32)*10000 -> 43.197356355212612
B33: Juzgado Federal de Primera Instancia de Dolores | C33: 1131 | D33: 249505 | E33: =+(C33/D33)*10000 -> 45.329752910763311
B34: TOTAL | C34: =SUM(C31:C33) -> 9544 | D34: =SUM(D31:D33) -> 1501700 | E34: =+(C34/D34)*10000 -> 63.554638076846246
B36: FUENTE: INDEC (Censo Nacional de Población, Hogares y Viviendas 2001 e Instituto Geografico Militar). Oficina de Estadísticas del
B37: Poder Judicial de la Nación.