B6: PODER JUDICIAL DE LA NACION
B7: JURISDICCION FEDERAL MAR DEL PLATA
B9: CUADRO II
B11: DENSIDAD DE POBLACION POR COMPETENCIA TERRITORIAL -AÑO 2001-
C13: POBLACION TOTAL (2001) | D13: SUPERFICIE (Km2) | E13: DENSIDAD DE
E14: POBLACION (hab/km2)
B15: Cámara Federal de Apelaciones | C15: =1467140+34560 -> 1501700 | D15: =112944+4795 -> 117739 | E15: =+C15/D15 -> 12.754482372026262
B16: de Mar del Plata
B17: Tribunal Oral en lo Criminal Federal | C17: 1501700 | D17: 117739 | E17: =+C17/D17 -> 12.754482372026262
B18: de Mar del Plata
B20: Juzgados Federales de Primera Instancia | C20: 773462 | D20: 22587 | E20: =+C20/D20 -> 34.243679992916277
B21: de Mar del Plata Nros. 1, 2, 3 y 4
B22: Juzgado Federal de Primera Instancia
B23: de Azul | C23: 478733 | D23: 62202 | E23: =+C23/D23 -> 7.6964245522652002
B24: Juzgado Federal de Primera Instancia
B25: de Dolores | C25: 249505 | D25: 32950 | E25: =+C25/D25 -> 7.5722306525037935
B26: Juzgado Federal de Primera Instancia de
B27: Necochea (sin habilitar) | C27: ------- | D27: ------- | E27: -------
B28: FUENTE: INDEC (Censo Nacional de Población, Hogares y Viviendas 2001) E INSTITUTO GEOGRAFICO MILITAR .
B29: Oficina de Estadísticas del Poder Judicial de la Nación.