C3: II - INDICADORES DE GESTION - AÑO 2004
C5: Cuadro A.II.b)
C7: Capital Federal
C9: Competencia Civil - Juzgados
D11: Casos Existentes | E11: Total de resueltos | F11: Casos ingresadas | G11: Sentencias | H11: Cantidad de jueces
C12: Juzgados | D12: al comienzo del año | E12: en el año | F12: en el año | G12: dictadas en el año | H12: de 1ra. Instancia
D13: (a) | E13: (b) | F13: ( c ) | G13: (d) | H13: (e)
C14: Civil | D14: 314147 | E14: 67377 | F14: 106564 | G14: 33353 | H14: 110
C15: Seguridad Social | D15: 77313 | E15: 37652 | F15: 25996 | G15: 30303 | H15: 10
C16: Civil y Comercial Federal | D16: 45279 | E16: 17661 | F16: 16606 | G16: 10299 | H16: 11
C17: Contencioso Administrativo Federal | D17: 385238 | E17: 48313 | F17: 35541 | G17: 45228 | H17: 12
C18: Del Trabajo | D18: 29500 | E18: 24293 | F18: 20295 | G18: 15639 | H18: 80
C19: Comercial (*) | D19: 433002 | E19: 81117 | F19: 102390 | G19: 81117 | H19: 26
C20: Total | D20: =SUM(D14:D19) -> 1284479 | E20: =SUM(E14:E19) -> 276413 | F20: =SUM(F14:F19) -> 307392 | G20: =SUM(G14:G19) -> 215939 | H20: =SUM(H14:H19) -> 249
C21: INDICADORES\INDI2004\CAPCIVIL04\HOJA C
C22: OFICINA DE ESTADISTICAS
C24: REFERENCIAS: (*): Los datos consignados en la columna (a) responden a los "En trámite" a fin del año 2003.