C3: II - INDICADORES DE GESTION - AÑO 2004
C5: Cuadro A.II.a)
C7: Capital Federal
C9: Competencia Civil - Cámaras de Apelación
C11: Indices
C13: Cámaras de | D13: Indice de | E13: Promedio de
C14: Apelación | D14: apelación | E14: resolución
D15: (a/b) | E15: (c/d)
C16: Civil | D16: =+A!D14/A!E14 -> 0.40666696350386633 | E16: =+A!F14/A!G14 -> 742.43589743589746
C17: Seguridad Social | D17: =+A!D15/A!E15 -> 0.52459364708382028 | E17: =+A!F15/A!G15 -> 2705.2222222222222
C18: Civil y Comercial Federal | D18: =+A!D16/A!E16 -> 0.28690334635637849 | E18: =+A!F16/A!G16 -> 444.77777777777777
C19: Contencioso Administrativo Federal | D19: =+A!D17/A!E17 -> 0.68087264297394079 | E19: =+A!F17/A!G17 -> 2683.6
C20: Del Trabajo | D20: =+A!D18/A!E18 -> 0.57675050426048657 | E20: =+A!F18/A!G18 -> 612.66666666666663
C21: Comercial | D21: =+A!D19/A!E19 -> 0.30213148908366927 | E21: =+A!F19/A!G19 -> 1637.8
C22: INDICADORES\INDI2004\CAPCIVIL04\HOJA B
C23: OFICINA DE ESTADISTICAS