C3: II - INDICADORES DE GESTION - AÑO 2004
C5: Cuadro A.II.b)
C7: Capital Federal
C9: Competencia Civil - Juzgados
C11: Indices
D13: Indice de | E13: Indice de | F13: Indice de | G13: Indice de | H13: Promedio | I13: Indice de
C14: Juzgados | D14: congestión | E14: descongestión | F14: cumplimiento | G14: duración | H14: de resolución | I14: sentencias
D15: (a/b) | E15: (b/c) | F15: ( b / (a+c) ) | G15: ( (a+c-1) / b ) | H15: (b/e) | I15: (d/b)
C16: Civil | D16: =+'C'!D14/'C'!E14 -> 4.6625257877317186 | E16: =+'C'!E14/'C'!F14 -> 0.63226793288540217 | F16: =+'C'!E14/('C'!D14+'C'!F14) -> 0.16015031696342619 | G16: =+('C'!D14+'C'!F14-1)/'C'!E14 -> 6.2441189129821746 | H16: =+'C'!E14/'C'!H14 -> 612.5181818181818 | I16: =+'C'!G14/'C'!E14 -> 0.49502055597607492
C17: Seguridad Social | D17: =+'C'!D15/'C'!E15 -> 2.0533570593859558 | E17: =+'C'!E15/'C'!F15 -> 1.448376673334359 | F17: =+'C'!E15/('C'!D15+'C'!F15) -> 0.36446001800423972 | G17: =+('C'!D15+'C'!F15-1)/'C'!E15 -> 2.7437586316795919 | H17: =+'C'!E15/'C'!H15 -> 3765.2 | I17: =+'C'!G15/'C'!E15 -> 0.80481780516307233
C18: Civil y Comercial Federal | D18: =+'C'!D16/'C'!E16 -> 2.5637846101579753 | E18: =+'C'!E16/'C'!F16 -> 1.0635312537636998 | F18: =+'C'!E16/('C'!D16+'C'!F16) -> 0.28538418033449142 | G18: =+('C'!D16+'C'!F16-1)/'C'!E16 -> 3.5039918464413113 | H18: =+'C'!E16/'C'!H16 -> 1605.5454545454545 | I18: =+'C'!G16/'C'!E16 -> 0.58314931204348563
C19: Contencioso Administrativo Federal | D19: =+'C'!D17/'C'!E17 -> 7.9737958727464662 | E19: =+'C'!E17/'C'!F17 -> 1.3593596128415071 | F19: =+'C'!E17/('C'!D17+'C'!F17) -> 0.11481799234277376 | G19: =+('C'!D17+'C'!F17-1)/'C'!E17 -> 8.7094156852192999 | H19: =+'C'!E17/'C'!H17 -> 4026.0833333333335 | I19: =+'C'!G17/'C'!E17 -> 0.93614555088692486
C20: Del Trabajo | D20: =+'C'!D18/'C'!E18 -> 1.2143415798789774 | E20: =+'C'!E18/'C'!F18 -> 1.1969943335796995 | F20: =+'C'!E18/('C'!D18+'C'!F18) -> 0.4878602269304147 | G20: =+('C'!D18+'C'!F18-1)/'C'!E18 -> 2.0497262585930103 | H20: =+'C'!E18/'C'!H18 -> 303.66250000000002 | I20: =+'C'!G18/'C'!E18 -> 0.64376569382126536
C21: Comercial | D21: =+'C'!D19/'C'!E19 -> 5.3379932689818412 | E21: =+'C'!E19/'C'!F19 -> 0.79223556987987109 | F21: =+'C'!E19/('C'!D19+'C'!F19) -> 0.15150954814416354 | G21: =+('C'!D19+'C'!F19-1)/'C'!E19 -> 6.6002317639952164 | H21: =+'C'!E19/'C'!H19 -> 3119.8846153846152 | I21: =+'C'!G19/'C'!E19 -> 1
C22: INDICADORES\INDI2004\CAPCIVIL04\HOJA D
C23: OFICINA DE ESTADISTICAS