B5: CUADRO A
B7: CUADRO COMPARATIVO DE LOS EXPEDIENTES TRAMITADOS EN LA
B8: CORTE SUPREMA DE JUSTICIA DE LA NACION EN EL PERIODO 1998/2009
C11: AÑOS
C12: 1998 | E12: 1999 (*) | G12: 2000 (*) | I12: 2001 | K12: 2002 (#) | M12: 2003 | O12: 2004 | Q12: 2005 | S12: 2006 (+) | U12: 2007 (+) | W12: 2008 | Y12: 2009
C13: INGRESADOS | D13: RESUELTOS | E13: INGRESADOS | F13: RESUELTOS | G13: INGRESADOS | H13: RESUELTOS | I13: INGRESADOS | J13: RESUELTOS | K13: INGRESADOS | L13: RESUELTOS | M13: INGRESADOS | N13: RESUELTOS | O13: INGRESADOS | P13: RESUELTOS | Q13: INGRESADOS | R13: RESUELTOS | S13: INGRESADOS | T13: RESUELTOS | U13: INGRESADOS | V13: RESUELTOS | W13: INGRESADOS | X13: RESUELTOS | Y13: INGRESADOS | Z13: RESUELTOS
B14: TOTAL C.S.J.N. | C14: =SUM(C15:C16) -> 7888 | D14: =SUM(D15:D16) -> 45799 | E14: =SUM(E15:E16) -> 13595 | F14: =SUM(F15:F16) -> 15872 | G14: =SUM(G15:G16) -> 17290 | H14: =SUM(H15:H16) -> 15454 | I14: =SUM(I15:I16) -> 14262 | J14: =SUM(J15:J16) -> 15263 | K14: =SUM(K15:K16) -> 41860 | L14: =SUM(L15:L16) -> 36526 | M14: =SUM(M15:M16) -> 31290 | N14: =SUM(N15:N16) -> 18980 | O14: =SUM(O15:O16) -> 37881 | P14: =SUM(P15:P16) -> 20963 | Q14: =SUM(Q15:Q16) -> 36460 | R14: =SUM(R15:R16) -> 20485 | S14: =SUM(S15:S16) -> 30544 | T14: =SUM(T15:T16) -> 14668 | U14: =SUM(U15:U16) -> 20041 | V14: =SUM(V15:V16) -> 59644 | W14: =SUM(W15:W16) -> 16463 | X14: =SUM(X15:X16) -> 39646 | Y14: =SUM(Y15:Y16) -> 13177 | Z14: =SUM(Z15:Z16) -> 27449
B15: SECRETARIAS JUDICIALES | C15: 6276 | D15: 5732 | E15: 11396 | F15: 6893 | G15: 7003 | H15: =6167+372+39 -> 6578 | I15: 7273 | J15: 6788 | K15: 30170 | L15: 28644 | M15: 14146 | N15: 7554 | O15: 25627 | P15: 7891 | Q15: 31492 | R15: 9455 | S15: 25901 | T15: 10874 | U15: 17285 | V15: 56996 | W15: 12722 | X15: 34363 | Y15: 9631 | Z15: 18596
B16: PREVISIONALES | C16: 1612 | D16: 40067 | E16: 2199 | F16: 8979 | G16: 10287 | H16: =8271+569+36 -> 8876 | I16: 6989 | J16: 8475 | K16: 11690 | L16: 7882 | M16: 17144 | N16: 11426 | O16: 12254 | P16: 13072 | Q16: 4968 | R16: 11030 | S16: 4643 | T16: 3794 | U16: 2756 | V16: 2648 | W16: 3741 | X16: 5283 | Y16: 3546 | Z16: 8853
B17: APEN0109/EVOL2009/EVOLUCION
B19: Referidas: (#): Las cifras de ingresados y resueltos del año 2002 resultan influídas por la gran cantidad de amparos tramitados, estos resultan ser aproximadamente 22.000.
B20: (*): Las cifras consignadas en la columna de ingresados del año 1999 responden a la utilización errónea de los códigos previstos en en el sistema para el registro de las causas previsionales. Por ello se corrige y soluciona, como podrá observarse,
B21: al extraer los datos del año 2000.
B22: (+): Datos provisorios.
B27: OFICINA DE ESTADISTICAS, PODER JUDICIAL DE LA NACION
B30: VER GRAFICOS