B6: PODER JUDICIAL DE LA NACION
B7: JURISDICCION FEDERAL TUCUMAN
B9: CUADRO VI
B10: DISTRIBUCION ANUAL DEL GASTO POR TODO CONCEPTO -AÑO 2001-
C13: Cámara, Tribunal Oral y Juzgados | D13: %
B14: HABERES | C14: 8015161.6699999999 | D14: =+C14/C$18 -> 0.94996111484021428
B15: BIENES DE CONSUMO | C15: 78193.97 | D15: =+C15/C$18 -> 9.2675898470033317E-3
B16: SERVICIOS NO PERSONALES | C16: 344002 | D16: =+C16/C$18 -> 4.0771295312782306E-2
B17: BIENES DE USO | D17: =+C17/C$18 -> 0
B18: Total | C18: =SUM(C14:C17) -> 8437357.6400000006 | D18: =SUM(D14:D17) -> 1
B19: NOTA: Los datos consignados corresponden a la ejecución presupuestaria del año 2001.
B20: FUENTE: Departamento de Contaduría y Oficina de Estadísticas del Poder Judicial de la Nación.