B6: PODER JUDICIAL DE LA NACION
B7: JURISDICCION FEDERAL TUCUMAN
B9: CUADRO III
B10: DISTRIBUCION DE LOS CARGOS PERMANENTES Y CONTRATADOS -AÑO 2001-
C13: Cámara Federal de Apelaciones deTucumán | E13: Tribunal Oral en lo Criminal Federal de Tucumán | G13: Tribunal Oral en lo Criminal Federal de Santiago del Estero | I13: Tribunal Oral en lo Criminal Federal de Catamarca | K13: Juzgados Federales de Primera Instancia de Tucumán Nros 1 y 2 | M13: Juzgado Federal de Primera Instancia de Santiago del Estero | O13: Juzgado Federal de Primera Instancia de Catamarca
C14: P | D14: C | E14: P | F14: C | G14: P | H14: C | I14: P | J14: C | K14: P | L14: C | M14: P | N14: C | O14: P | P14: C
B15: Juez (1ª o 2ª
B16: instancia) | C16: 5 | E16: 3 | G16: 3 | I16: 3 | K16: 2 | M16: 1 | O16: 1
B17: Secretario (1ª o 2ª instancia)
C18: 5 | D18: 3 | E18: 1 | G18: 1 | I18: 1 | K18: 9 | M18: 4 | O18: 3 | P18: 2
B19: Prosecretario Administrativo
B20: Jefe
B21: Prosecretario
B22: de Cámara | C22: 1
B23: Prosecretario Administrativo
C24: 4 | D24: 1 | E24: 2 | G24: 1 | I24: 2 | K24: 8 | M24: 4 | O24: 4
B25: Oficial Mayor
C26: 11 | D26: 5 | E26: 3 | G26: 3 | I26: 3 | K26: 6 | M26: 4 | O26: 4 | P26: 1
B27: Oficial Mayor Relator
B29: Oficial
C30: 4 | K30: 2 | M30: 1 | O30: 1
B31: Escribiente | F31: 1
C32: 4 | D32: 3 | E32: 1 | I32: 1 | K32: 8 | M32: 4 | O32: 4
B33: Escribiente Auxiliar
C34: 4 | E34: 1 | I34: 1 | K34: 6 | M34: 4 | O34: 2
B35: Auxiliar
C36: 8 | D36: 1 | K36: 26 | M36: 6
B37: Auxiliar Administrativo
O38: 3 | P38: 2
B39: Jefe de Sección /
B40: Encargado de Sección
B41: Oficial
B42: de Servicio / Medio Oficial | C42: 3 | E42: 1 | M42: 1
B43: Ayudante
C44: 10 | E44: 1 | I44: 1 | J44: 1 | K44: 7 | M44: 19 | O44: 2
B45: Auxiliar de Servicio
B47: Total | C47: =SUM(C15:C46) -> 59 | D47: =SUM(D15:D46) -> 13 | E47: =SUM(E15:E46) -> 13 | F47: =SUM(F15:F46) -> 1 | G47: =SUM(G15:G46) -> 8 | H47: =SUM(H15:H46) -> 0 | I47: =SUM(I15:I46) -> 12 | J47: =SUM(J15:J46) -> 1 | K47: =SUM(K15:K46) -> 74 | L47: =SUM(L15:L46) -> 0 | M47: =SUM(M15:M46) -> 48 | N47: =SUM(N15:N46) -> 0 | O47: =SUM(O15:O46) -> 24 | P47: =SUM(P15:P46) -> 5
B48: FUENTE: División Programación Presupuestaria. Consejo de la Magistratura.
B49: Oficina de Estadísticas del Poder Judicial de la Nación.