B6: PODER JUDICIAL DE LA NACION
B7: JURISDICCION FEDERAL TUCUMAN
B9: CUADRO IV
B10: DISTRIBUCION DE LOS CARGOS POR DEPENDENCIA -AÑO 2001-
C12: Distribución de los cargos actuales | D12: Distribución
D13: Porcentual
B14: Cámara Federal de Apelaciones de Tucumán | C14: 72 | D14: =+C14/C$21 -> 0.27906976744186046
B15: Tribunal Oral en lo Criminal Federal de Tucumán | C15: 14 | D15: =+C15/C$21 -> 5.4263565891472867E-2
B16: Tribunal Oral en lo Criminal Federal de Santiago del Estero | C16: 8 | D16: =+C16/C$21 -> 3.1007751937984496E-2
B17: Tribunal Oral en lo Criminal Federal de Catamarca | C17: 13 | D17: =+C17/C$21 -> 5.0387596899224806E-2
B18: Juzgados Federales de Primera Instancia de Tucumán Nros 1 y 2 | C18: 74 | D18: =+C18/C$21 -> 0.2868217054263566
B19: Juzgado Federal de Primera Instancia de Santiago del Estero | C19: 48 | D19: =+C19/C$21 -> 0.18604651162790697
B20: Juzgado Federal de Primera Instancia de Catamarca | C20: 29 | D20: =+C20/C$21 -> 0.1124031007751938
B21: TOTAL | C21: =SUM(C14:C20) -> 258 | D21: =SUM(D14:D20) -> 1
B22: FUENTE: Oficina de Estadísticas del Poder Judicial de la Nación.