B6: PODER JUDICIAL DE LA NACION
B7: JURISDICCION FEDERAL TUCUMAN
B9: CUADRO V
B10: DISTRIBUCION ANUAL DEL GASTO EN CONCEPTO DE LIQUIDACION DE HABERES -AÑO 2001-
C12: Gasto (Haberes) | D12: %
B13: Cámara Federal de Apelaciones de Tucumán | C13: 2245417.6763807782 | D13: =+C13/C$21 -> 0.28014627387806362
B14: Tribunal Oral en lo Criminal Federal de Tucumán | C14: 627253.81058747077 | D14: =+C14/C$21 -> 7.8258410299473183E-2
B15: Tribunal Oral en lo Criminal Federal de Santiago del Estero | C15: 437077.36418826599 | D15: =+C15/C$21 -> 5.4531322284390789E-2
B16: Tribunal Oral en lo Criminal Federal de Catamarca | C16: 640753.81450325972 | D16: =+C16/C$21 -> 7.9942718672979626E-2
B17: Juzgado Federal de Primera Instancia de Tucumán N° 1 | C17: 1025094.471354614 | D17: =+C17/C$21 -> 0.12789442229112438
B18: Juzgado Federal de Primera Instancia de Tucumán N° 2 | C18: 934330.32680870919 | D18: =+C18/C$21 -> 0.11657036567407242
B19: Juzgado Federal de Primera Instancia de Santiago del Estero | C19: 1251150.033109131 | D19: =+C19/C$21 -> 0.15609791600237688
B20: Juzgado Federal de Primera Instancia de Catamarca | C20: 854084.17306777183 | D20: =+C20/C$21 -> 0.10655857089751898
B21: TOTAL | C21: =SUM(C13:C20) -> 8015161.6700000018 | D21: =SUM(D13:D20) -> 1
B22: NOTA: Los datos registrados corresponden a la ejecución presupuestaria del año 2001.
B23: FUENTE: Departamento de Contaduría y Oficina de Estadísticas del Poder Judicial de la Nación.