B6: PODER JUDICIAL DE LA NACION
B7: JURISDICCIÓN FEDERAL TUCUMAN
B8: CUADRO XII
B9: INDICE DE LITIGIOSIDAD EN LOS JUZGADOS FEDERALES DE PRIMERA INSTANCIA -AÑO 2001-
B12: 1- COMPETENCIA PENAL
B14: Dependencias | C14: Causas ingresadas | D14: Cantidad de habitantes en la | E14: Causas ingresadas
D15: jurisdicción | E15: c/10.000 hab.
B16: Juzgado Federal de Primera Instancia de Tucumán N° 1 | C16: 1165 | D16: 1336664 | E16: =+(C16/$D$16)*10000 -> 8.7157281111782758
B17: Juzgado Federal de Primera Instancia de Tucumán N° 2 | C17: 643 | D17: 1336664 | E17: =+(C17/$D$17)*10000 -> 4.8104834124357359
B18: Juzgado Federal de Primera Instancia de Santiago del Estero | C18: 419 | D18: 806347 | E18: =+(C18/$D$18)*10000 -> 5.1962740606711497
B19: Juzgado Federal de Primera Instancia de Catamarca | C19: 450 | D19: 333661 | E19: =+(C19/$D$19)*10000 -> 13.486742532090954
B20: TOTAL | C20: =SUM(C16:C19) -> 2677 | D20: 2476672 | E20: =+(C20/D20)*10000 -> 10.808859630988682
B22: FUENTE: INDEC (Censo Nacional de Población, Hogares y Viviendas 2001 e Instituto Geografico Militar).
B23: Oficina de Estadísticas del Poder Judicial de la Nación.
B26: 2- COMPETENCIA CIVIL
B28: Dependencias | C28: Causas ingresadas | D28: Cantidad de habitantes en la jurisdicción | E28: Causas ingresadas
E29: c/10.000 hab.
B30: Juzgado Federal de Primera Instancia de Tucumán N° 1 | C30: 2703 | D30: 1336664 | E30: =+(C30/$D$30)*10000 -> 20.221985480270284
B31: Juzgado Federal de Primera Instancia de Tucumán N° 2 | C31: 2622 | D31: 1336664 | E31: =+(C31/$D$31)*10000 -> 19.615999233913683
B32: Juzgado Federal de Primera Instancia de Santiago del Estero | C32: 1638 | D32: 806347 | E32: =+(C32/$D$32)*10000 -> 20.313835110690558
B33: Juzgado Federal de Primera Instancia de Catamarca | C33: 1905 | D33: 333661 | E33: =+(C33/$D$33)*10000 -> 57.09387671918504
B34: TOTAL | C34: =SUM(C30:C33) -> 8868 | D34: 2476672 | E34: =+(C34/D34)*10000 -> 35.806114011060004
B36: FUENTE: INDEC (Censo Nacional de Población, Hogares y Viviendas 2001 e Instituto Geografico Militar).
B37: Oficina de Estadísticas del Poder Judicial de la Nación.