B6: PODER JUDICIAL DE LA NACION
B7: JURISDICCION FEDERAL TUCUMAN
B9: COMPETENCIA PENAL
B10: CUADRO IX
B11: DISTRIBUCION PORCENTUAL SEGÚN EL TIPO DE DELITO DE LAS CAUSAS INGRESADAS, ELEVADAS A JUICIO Y PERSONAS CONDENADAS EN LOS JUZGADOS FEDERALES -AÑO 2001-
C13: CAUSAS | D13: % | E13: CAUSAS | F13: % | G13: PERSONAS | H13: %
B14: DELITOS | C14: INGRESADAS | E14: ELEVADAS | G14: CONDENADAS
B15: DELITOS CONTRA LAS PERSONAS | C15: 20 | D15: =+(C15/C$31) -> 7.4710496824803886E-3 | F15: =+E15/E$31 -> 0 | H15: =+G15/G$31 -> 0
B16: HOMICIDIOS | D16: =+(C16/C$31) -> 0 | F16: =+E16/E$31 -> 0 | H16: =+G16/G$31 -> 0
B17: DELITOS CONTRA EL HONOR | D17: =+(C17/C$31) -> 0 | F17: =+E17/E$31 -> 0 | H17: =+G17/G$31 -> 0
B18: DELITOS CONTRA LA INTEGRIDAD SEXUAL | D18: =+(C18/C$31) -> 0 | F18: =+E18/E$31 -> 0 | H18: =+G18/G$31 -> 0
B19: DELITOS CONTRA EL ESTADO CIVIL | D19: =+(C19/C$31) -> 0 | F19: =+E19/E$31 -> 0 | H19: =+G19/G$31 -> 0
B20: DELITOS CONTRA LA LIBERTAD | C20: 27 | D20: =+(C20/C$31) -> 1.0085917071348524E-2 | F20: =+E20/E$31 -> 0 | H20: =+G20/G$31 -> 0
B21: DELITOS CONTRA LA PROPIEDAD | C21: 212 | D21: =+(C21/C$31) -> 7.9193126634292121E-2 | E21: 19 | F21: =+E21/E$31 -> 0.15447154471544716 | G21: 2 | H21: =+G21/G$31 -> 4.1666666666666664E-2
B22: DELITOS CONTRA LA SEGURIDAD PUBLICA | C22: 106 | D22: =+(C22/C$31) -> 3.9596563317146061E-2 | F22: =+E22/E$31 -> 0 | H22: =+G22/G$31 -> 0
B23: DELITOS CONTRA EL ORDEN PUBLICO | C23: 4 | D23: =+(C23/C$31) -> 1.4942099364960778E-3 | F23: =+E23/E$31 -> 0 | H23: =+G23/G$31 -> 0
B24: DELITOS CONTRA LA SEG. DE LA NACION | D24: =+(C24/C$31) -> 0 | F24: =+E24/E$31 -> 0 | H24: =+G24/G$31 -> 0
B25: DELITOS CONTRA LOS POD. PUB. Y ORD. CONTITUC. | D25: =+(C25/C$31) -> 0 | F25: =+E25/E$31 -> 0 | H25: =+G25/G$31 -> 0
B26: DELITOS CONTRA LA ADMINISTRACION PUBLICA | C26: 136 | D26: =+(C26/C$31) -> 5.0803137840866638E-2 | E26: 20 | F26: =+E26/E$31 -> 0.16260162601626016 | G26: 2 | H26: =+G26/G$31 -> 4.1666666666666664E-2
B27: DELITOS CONTRA LA FE PUBLICA | C27: 391 | D27: =+(C27/C$31) -> 0.1460590212924916 | E27: 17 | F27: =+E27/E$31 -> 0.13821138211382114 | G27: 6 | H27: =+G27/G$31 -> 0.125
B28: INFRACCION LEY 23.737 (ESTUPEFACIENTES) | C28: 523 | D28: =+(C28/C$31) -> 0.19536794919686215 | E28: 46 | F28: =+E28/E$31 -> 0.37398373983739835 | G28: 35 | H28: =+G28/G$31 -> 0.72916666666666663
B29: INFRACCION LEYES ESPECIALES Y DEC. LEYES | C29: =900+40+140+139 -> 1219 | D29: =+(C29/C$31) -> 0.45536047814717967 | E29: =19+2 -> 21 | F29: =+E29/E$31 -> 0.17073170731707318 | G29: 3 | H29: =+G29/G$31 -> 6.25E-2
B30: D.G.I. | C30: 39 | D30: =+(C30/C$31) -> 1.4568546880836758E-2 | F30: =+E30/E$31 -> 0 | H30: =+G30/G$31 -> 0
B31: TOTAL | C31: =SUM(C15:C30) -> 2677 | D31: =SUM(D15:D30) -> 1 | E31: =SUM(E15:E30) -> 123 | F31: =SUM(F15:F30) -> 1 | G31: =SUM(G15:G30) -> 48 | H31: =SUM(H15:H30) -> 1
B32: REFERENCIAS: (*) En causa tramitadas en los Juzgados de 1ra. Instancia y en los Tribunales Orales en lo Criminal Federal.
B33: FUENTE: Oficina de Estadísticas del Poder Judicial de la Nación.