B6: PODER JUDICIAL DE LA NACION
B7: JURISDICCION FEDERAL TUCUMAN
B9: CUADRO II
B10: DENSIDAD DE POBLACION POR COMPETENCIA TERRITORIAL -AÑO 2001-
C13: POBLACION TOTAL (2001) | D13: SUPERFICIE (Km2) | E13: DENSIDAD DE
E14: POBLACION (hab/km2)
B15: Cámara Federal de Apelaciones | C15: 2476672 | D15: 261477 | E15: =+C15/D15 -> 9.4718541210125551
B16: de Tucumán
B17: Tribunal Oral en lo Criminal Federal | C17: 1336664 | D17: 22524 | E17: =+C17/D17 -> 59.343988634345585
B18: de Tucumán
B19: Tribunal Oral en lo Criminal Federal
B20: de Catamarca | C20: 333661 | D20: 102602 | E20: =+C20/D20 -> 3.2519931385353114
B21: Tribunal Oral en lo Criminal Federal
B22: de Santiago del Estero | C22: 806347 | D22: 136351 | E22: =+C22/D22 -> 5.9137593416989978
B23: Juzgado Federal de Primera Instancia | C23: 1336664 | D23: 22524 | E23: =+C23/D23 -> 59.343988634345585
B24: de Tucumán N° 1
B25: Juzgado Federal de Primera Instancia
B26: de Tucumán N° 2 | C26: 1336664 | D26: 22524 | E26: =+C26/D26 -> 59.343988634345585
B27: Juzgado Federal de Primera Instancia
B28: de Catamarca | C28: 333661 | D28: 102602 | E28: =+C28/D28 -> 3.2519931385353114
B29: Juzgado Federal de Primera Instancia
B30: de Santiago del Estero | C30: 806347 | D30: 136351 | E30: =+C30/D30 -> 5.9137593416989978
B31: FUENTE: INDEC (Censo Nacional de Población, Hogares y Viviendas 2001) e Instituto Geográfico Militar
B32: Oficina de Estadísticas del Poder Judicial de la Nación.