B6: PODER JUDICIAL DE LA NACION
B7: JURISDICCIÓN FEDERAL TUCUMAN
B8: COMPETENCIA CIVIL
B9: CUADRO XI
B10: DISTRIBUCION PORCENTUAL, SEGÚN EL OBJETO DE LITIGIO, DE LOS EXPEDIENTES INGRESADOS, RESUELTOS O SALIDOS Y SENTENCIAS DICTADAS EN LOS JUZGADOS FEDERALES DE PRIMERA INSTANCIA -AÑO 2001-
B13: OBJETO | C13: INGRESADOS | D13: % | E13: RESUELTOS O SALIDOS | F13: % | G13: SENTENCIAS DEFINITIVAS | H13: % | I13: SENTENCIAS INTERLOCUTORIAS | J13: %
B14: ORDINARIOS | C14: 913 | D14: =+C14/C$27 -> 0.10295444294091115 | E14: 494 | F14: =+E14/E$27 -> 8.9330922242314648E-2 | G14: 115 | H14: =+G14/G$27 -> 5.026223776223776E-2 | I14: 704 | J14: =+I14/I$27 -> 0.11686586985391766
B15: SUMARIOS | C15: 237 | D15: =+C15/C$27 -> 2.6725304465493909E-2 | E15: 178 | F15: =+E15/E$27 -> 3.2188065099457507E-2 | G15: 80 | H15: =+G15/G$27 -> 3.4965034965034968E-2 | I15: 180 | J15: =+I15/I$27 -> 2.9880478087649404E-2
B16: SUMARISIMOS | C16: 6 | D16: =+C16/C$27 -> 6.7658998646820032E-4 | E16: 13 | F16: =+E16/E$27 -> 2.3508137432188066E-3 | G16: 4 | H16: =+G16/G$27 -> 1.7482517482517483E-3 | I16: 15 | J16: =+I16/I$27 -> 2.4900398406374502E-3
B17: EJECUTIVOS | C17: 946 | D17: =+C17/C$27 -> 0.10667568786648625 | E17: 424 | F17: =+E17/E$27 -> 7.6672694394213384E-2 | G17: 338 | H17: =+G17/G$27 -> 0.14772727272727273 | I17: 868 | J17: =+I17/I$27 -> 0.14409030544488713
B18: EJECUCIONES FISCALES | C18: 5429 | D18: =+C18/C$27 -> 0.61220117275597652 | E18: 3548 | F18: =+E18/E$27 -> 0.64159132007233277 | G18: 1481 | H18: =+G18/G$27 -> 0.64729020979020979 | I18: 3390 | J18: =+I18/I$27 -> 0.5627490039840638
B19: LABORALES | C19: 35 | D19: =+C19/C$27 -> 3.9467749210645017E-3 | E19: 163 | F19: =+E19/E$27 -> 2.9475587703435804E-2 | G19: 39 | H19: =+G19/G$27 -> 1.7045454545454544E-2 | I19: 87 | J19: =+I19/I$27 -> 1.444223107569721E-2
B20: CIUDADANIA | C20: 19 | D20: =+C20/C$27 -> 2.142534957149301E-3 | E20: 133 | F20: =+E20/E$27 -> 2.4050632911392405E-2 | G20: 16 | H20: =+G20/G$27 -> 6.993006993006993E-3 | J20: =+I20/I$27 -> 0
B21: AMPAROS (LEY 16.986) | C21: 749 | D21: =+C21/C$27 -> 8.4460983310780335E-2 | E21: 114 | F21: =+E21/E$27 -> 2.0614828209764919E-2 | G21: 29 | H21: =+G21/G$27 -> 1.2674825174825174E-2 | I21: 630 | J21: =+I21/I$27 -> 0.10458167330677291
B22: AMPAROS POR MORA | C22: 96 | D22: =+C22/C$27 -> 1.0825439783491205E-2 | E22: 12 | F22: =+E22/E$27 -> 2.16998191681736E-3 | G22: 50 | H22: =+G22/G$27 -> 2.1853146853146852E-2 | I22: 15 | J22: =+I22/I$27 -> 2.4900398406374502E-3
B23: EXPROPIACIONES | D23: =+C23/C$27 -> 0 | E23: 11 | F23: =+E23/E$27 -> 1.9891500904159133E-3 | G23: 2 | H23: =+G23/G$27 -> 8.7412587412587413E-4 | I23: 9 | J23: =+I23/I$27 -> 1.4940239043824701E-3
B24: LEY 24.463 (ART. 15 SEG. SOC.) | C24: 285 | D24: =+C24/C$27 -> 3.213802435723951E-2 | E24: 163 | F24: =+E24/E$27 -> 2.9475587703435804E-2 | G24: 117 | H24: =+G24/G$27 -> 5.113636363636364E-2 | I24: 74 | J24: =+I24/I$27 -> 1.2284196547144754E-2
B25: LEYES ESPECIALES | C25: 30 | D25: =+C25/C$27 -> 3.3829499323410014E-3 | E25: 53 | F25: =+E25/E$27 -> 9.584086799276673E-3 | G25: 4 | H25: =+G25/G$27 -> 1.7482517482517483E-3 | I25: 26 | J25: =+I25/I$27 -> 4.3160690571049133E-3
B26: CAUTELARES | C26: 123 | D26: =+C26/C$27 -> 1.3870094722598106E-2 | E26: 224 | F26: =+E26/E$27 -> 4.0506329113924051E-2 | G26: 13 | H26: =+G26/G$27 -> 5.681818181818182E-3 | I26: 26 | J26: =+I26/I$27 -> 4.3160690571049133E-3
B27: TOTAL | C27: =SUM(C14:C26) -> 8868 | D27: =SUM(D14:D26) -> 1 | E27: =SUM(E14:E26) -> 5530 | F27: =SUM(F14:F26) -> 1 | G27: =SUM(G14:G26) -> 2288 | H27: =SUM(H14:H26) -> 1 | I27: =SUM(I14:I26) -> 6024 | J27: =SUM(J14:J26) -> 1
B28: FUENTE:Oficina de Estadísticas del Poder Judicial de la Nación.