B6: PODER JUDICIAL DE LA NACION
B7: JURISDICCION FEDERAL TUCUMAN
B9: COMPETENCIA PENAL
B10: CUADRO VII
B12: CAUSAS INGRESADAS Y ELEVADAS A JUICIO EN LOS JUZGADOS DE 1RA. INSTANCIA -AÑO 2001-
C14: TOTAL DE CAUSAS INGRESADAS | D14: TOTAL DE CAUSAS ELEVADAS A JUICIO (*) | E14: PORCENTAJE DE CAUSAS ELEVADAS A JUICIO
B16: Juzgado Federal de Primera Instancia de Tucumán N° 1 | C16: 1165 | D16: 16 | E16: =+D16/C16 -> 1.3733905579399141E-2
B17: Juzgado Federal de Primera Instancia de Tucumán N° 2 | C17: 643 | D17: 97 | E17: =+D17/C17 -> 0.15085536547433903
B18: Juzgado Federal de Primera Instancia de Santiago del Estero | C18: 419 | D18: 8 | E18: =+D18/C18 -> 1.9093078758949882E-2
B19: Juzgado Federal de Primera Instancia de Catamarca | C19: 450 | D19: 2 | E19: =+D19/C19 -> 4.4444444444444444E-3
B20: Total | C20: =SUM(C16:C19) -> 2677 | D20: =SUM(D16:D19) -> 123 | E20: =+D20/C20 -> 4.5946955547254392E-2
B21: REFERENCIAS: (*) En estas cifras se incluyen causas de años anteriores y las elevaciones a juicio en causas correccionales que se resuelven
B22: en la misma instancia.
B23: FUENTE: Oficina de Estadísticas del Poder Judicial de la Nación.