C3: II - INDICADORES DE GESTION - AÑO 2004
C5: Cuadro B.III.c)
C7: Interior del País
C9: Competencia Penal - Tribunales Orales Federales
C11: Indices
C13: Tribunales | D13: Indice de | E13: Indice de | F13: Promedio
C14: Orales | D14: cumplimiento | E14: sentencias | F14: de resolución
D15: ( b / (a+c) ) | E15: ( (d + e) / b) | F15: (b/f)
C16: LA PLATA Nº1 | D16: =+E!E14/(E!D14+E!F14) -> 0.21793275217932753 | E16: =+(E!G14+E!H14)/E!E14 -> 0.70857142857142852 | F16: =+E!E14/E!I14 -> 58.333333333333336
C17: LA PLATA Nº2 | D17: =+E!E15/(E!D15+E!F15) -> 0.11561382598331346 | E17: =+(E!G15+E!H15)/E!E15 -> 0.78350515463917525 | F17: =+E!E15/E!I15 -> 32.333333333333336
C18: MAR DEL PLATA | D18: =+E!E16/(E!D16+E!F16) -> 0.4293015332197615 | E18: =+(E!G16+E!H16)/E!E16 -> 0.15873015873015872 | F18: =+E!E16/E!I16 -> 84
C19: BAHIA BLANCA | D19: =+E!E17/(E!D17+E!F17) -> 0.74545454545454548 | E19: =+(E!G17+E!H17)/E!E17 -> 0.73170731707317072 | F19: =+E!E17/E!I17 -> 13.666666666666666
C20: LA PAMPA | D20: =+E!E18/(E!D18+E!F18) -> 0.76923076923076927 | E20: =+(E!G18+E!H18)/E!E18 -> 0.93333333333333335 | F20: =+E!E18/E!I18 -> 10
C21: MENDOZA Nº1 | D21: =+E!E19/(E!D19+E!F19) -> 0.31399317406143346 | E21: =+(E!G19+E!H19)/E!E19 -> 0.71739130434782605 | F21: =+E!E19/E!I19 -> 30.666666666666668
C22: MENDOZA Nº2 | D22: =+E!E20/(E!D20+E!F20) -> 0.28155339805825241 | E22: =+(E!G20+E!H20)/E!E20 -> 0.7931034482758621 | F22: =+E!E20/E!I20 -> 29
C23: SAN JUAN | D23: =+E!E21/(E!D21+E!F21) -> 0.29646017699115046 | E23: =+(E!G21+E!H21)/E!E21 -> 0.76119402985074625 | F23: =+E!E21/E!I21 -> 22.333333333333332
C24: SAN LUIS | D24: =+E!E22/(E!D22+E!F22) -> 0.90243902439024393 | E24: =+(E!G22+E!H22)/E!E22 -> 0.91891891891891897 | F24: =+E!E22/E!I22 -> 12.333333333333334
C25: ROSARIO Nº1 | D25: =+E!E23/(E!D23+E!F23) -> 0.57780612244897955 | E25: =+(E!G23+E!H23)/E!E23 -> 0.11037527593818984 | F25: =+E!E23/E!I23 -> 151
C26: ROSARIO Nº2 | D26: 0 | E26: 0 | F26: =+E!E24/E!I24 -> 0.33333333333333331
C27: SANTA FE | D27: =+E!E25/(E!D25+E!F25) -> 0.40808823529411764 | E27: =+(E!G25+E!H25)/E!E25 -> 0.84684684684684686 | F27: =+E!E25/E!I25 -> 37
C28: GENERAL ROCA | D28: =+E!E26/(E!D26+E!F26) -> 0.66666666666666663 | E28: =+(E!G26+E!H26)/E!E26 -> 0.90625 | F28: =+E!E26/E!I26 -> 10.666666666666666
C29: NEUQUEN | D29: =+E!E27/(E!D27+E!F27) -> 0.3728813559322034 | E29: =+(E!G27+E!H27)/E!E27 -> 0.93181818181818177 | F29: =+E!E27/E!I27 -> 14.666666666666666
C30: PARANA | D30: =+E!E28/(E!D28+E!F28) -> 0.29441624365482233 | E30: =+(E!G28+E!H28)/E!E28 -> 0.46551724137931033 | F30: =+E!E28/E!I28 -> 58
C31: POSADAS | D31: =+E!E29/(E!D29+E!F29) -> 0.59195402298850575 | E31: =+(E!G29+E!H29)/E!E29 -> 0.92233009708737868 | F31: =+E!E29/E!I29 -> 34.333333333333336
C32: RESISTENCIA | D32: =+E!E30/(E!D30+E!F30) -> 0.73333333333333328 | E32: =+(E!G30+E!H30)/E!E30 -> 0.69696969696969702 | F32: =+E!E30/E!I30 -> 11
C33: FORMOSA | D33: =+E!E31/(E!D31+E!F31) -> 7.6446280991735532E-2 | E33: =+(E!G31+E!H31)/E!E31 -> 0.51351351351351349 | F33: =+E!E31/E!I31 -> 12.333333333333334
C34: CORDOBA Nº1 | D34: =+E!E32/(E!D32+E!F32) -> 0.19308943089430894 | E34: =+(E!G32+E!H32)/E!E32 -> 0.76842105263157889 | F34: =+E!E32/E!I32 -> 31.666666666666668
C35: CORDOBA Nº2 | D35: =+E!E33/(E!D33+E!F33) -> 0.10766721044045677 | E35: =+(E!G33+E!H33)/E!E33 -> 0.96969696969696972 | F35: =+E!E33/E!I33 -> 22
C36: LA RIOJA | D36: =+E!E34/(E!D34+E!F34) -> 0.83333333333333337 | E36: =+(E!G34+E!H34)/E!E34 -> 00.6 | F36: =+E!E34/E!I34 -> 1.6666666666666667
C37: SAN MARTIN Nº1 | D37: =+E!E35/(E!D35+E!F35) -> 0.69377990430622005 | E37: =+(E!G35+E!H35)/E!E35 -> 0.34482758620689657 | F37: =+E!E35/E!I35 -> 48.333333333333336
C38: SAN MARTIN Nº2 | D38: =+E!E36/(E!D36+E!F36) -> 0.6383928571428571 | E38: =+(E!G36+E!H36)/E!E36 -> 0.39160839160839161 | F38: =+E!E36/E!I36 -> 47.666666666666664
C39: SAN MARTIN Nº3 | D39: =+E!E37/(E!D37+E!F37) -> 0.42209631728045327 | E39: =+(E!G37+E!H37)/E!E37 -> 0.59060402684563762 | F39: =+E!E37/E!I37 -> 49.666666666666664
C40: SAN MARTIN Nº4 | D40: =+E!E38/(E!D38+E!F38) -> 0.54216867469879515 | E40: =+(E!G38+E!H38)/E!E38 -> 0.37777777777777777 | F40: =+E!E38/E!I38 -> 45
C41: SAN MARTIN Nº5 | D41: =+E!E39/(E!D39+E!F39) -> 0.78217821782178221 | E41: =+(E!G39+E!H39)/E!E39 -> 0.97468354430379744 | F41: =+E!E39/E!I39 -> 52.666666666666664
C42: TUCUMAN | D42: =+E!E40/(E!D40+E!F40) -> 0.3949579831932773 | E42: =+(E!G40+E!H40)/E!E40 -> 0.97872340425531912 | F42: =+E!E40/E!I40 -> 15.666666666666666
C43: CATAMARCA | D43: =+E!E41/(E!D41+E!F41) -> 0.55555555555555558 | E43: =+(E!G41+E!H41)/E!E41 -> 1 | F43: =+E!E41/E!I41 -> 1.6666666666666667
C44: STGO. DEL ESTERO | D44: =+E!E42/(E!D42+E!F42) -> 0.88888888888888884 | E44: =+(E!G42+E!H42)/E!E42 -> 1 | F44: =+E!E42/E!I42 -> 2.6666666666666665
C45: SALTA | D45: =+E!E43/(E!D43+E!F43) -> 0.23003194888178913 | E45: =+(E!G43+E!H43)/E!E43 -> 0.90972222222222221 | F45: =+E!E43/E!I43 -> 48
C46: JUJUY | D46: =+E!E44/(E!D44+E!F44) -> 0.51515151515151514 | E46: =+(E!G44+E!H44)/E!E44 -> 0.95798319327731096 | F46: =+E!E44/E!I44 -> 39.666666666666664
C47: COMODORO RIVADAVIA | D47: =+E!E45/(E!D45+E!F45) -> 0.64748201438848918 | E47: =+(E!G45+E!H45)/E!E45 -> 0.94444444444444442 | F47: =+E!E45/E!I45 -> 30
C48: TIERRA DEL FUEGO | D48: =+E!E46/(E!D46+E!F46) -> 0.64102564102564108 | E48: =+(E!G46+E!H46)/E!E46 -> 00.8 | F48: =+E!E46/E!I46 -> 8.3333333333333339
C49: CORRIENTES | D49: =+E!E47/(E!D47+E!F47) -> 0.375 | E49: =+(E!G47+E!H47)/E!E47 -> 0.6811594202898551 | F49: =+E!E47/E!I47 -> 23
C50: INDICADORES\INDI2004\INTPENAL04\HOJA F
C51: OFICINA DE ESTADISTICAS