C4: II - INDICADORES DE GESTION - AÑO 2004
C6: Cuadro B.III.a)
C8: Interior del País
C10: Competencia Penal - Cámaras de Apelación
C12: Indices
C14: Cámaras de | D14: Indice de | E14: Promedio de
C15: Apelación | D15: apelación | E15: resolución
D16: ( a/b) | E16: (c/d)
C17: La Plata | D17: =+A!D15/A!E15 -> 0.20216606498194944 | E17: =+A!F15/A!G15 -> 98.555555555555557
C18: Mar del Plata | D18: =+A!D16/A!E16 -> 8.565737051792828E-2 | E18: =+A!F16/A!G16 -> 131.33333333333334
C19: Bahía Blanca | D19: =+A!D17/A!E17 -> 0.16950596252129471 | E19: =+A!F17/A!G17 -> 42.8
C20: Mendoza | D20: =+A!D18/A!E18 -> 0.22062750333778372 | E20: =+A!F18/A!G18 -> 110
C21: Rosario | D21: =+A!D19/A!E19 -> 0.14127039222492191 | E21: =+A!F19/A!G19 -> 56.333333333333336
C22: General Roca | D22: =+A!D20/A!E20 -> 6.4564564564564567E-2 | E22: =+A!F20/A!G20 -> 60.666666666666664
C23: Paraná | D23: =+A!D21/A!E21 -> 0.13349713349713349 | E23: =+A!F21/A!G21 -> 52.333333333333336
C24: Posadas | D24: =+A!D22/A!E22 -> 0.13631284916201117 | E24: =+A!F22/A!G22 -> 41.666666666666664
C25: Resistencia | D25: =+A!D23/A!E23 -> 0.16318407960199005 | E25: =+A!F23/A!G23 -> 49.333333333333336
C26: Córdoba | D26: =+A!D24/A!E24 -> 8.2348728965270318E-2 | E26: =+A!F24/A!G24 -> 44.6
C27: San Martín | D27: =+A!D25/A!E25 -> 0.15774008281020435 | E27: =+A!F25/A!G25 -> 196
C28: Tucumán | D28: =+A!D26/A!E26 -> 7.3253193087903831E-2 | E28: =+A!F26/A!G26 -> 126.33333333333333
C29: Salta | D29: =+A!D27/A!E27 -> 6.3119563018409874E-2 | E29: =+A!F27/A!G27 -> 104.66666666666667
C30: Comodoro Rivadavia | D30: =+A!D28/A!E28 -> 0.14620758483033933 | E30: =+A!F28/A!G28 -> 98.666666666666671
C31: Corrientes | D31: =+A!D29/A!E29 -> 0.13662374821173104 | E31: =+A!F29/A!G29 -> 49.666666666666664
C32: INDICADORES\INDI2004\INTPENAL04\HOJA B
C33: OFICINA DE ESTADISTICAS