C3: II - INDICADORES DE GESTION - AÑO 2004
C5: Cuadro B.III.b)
C7: Interior del País
C9: Competencia Penal - Juzgados
C11: Indices
D13: Indice de | E13: Indice de | F13: Indice de | G13: Indice de | H13: Promedio
C14: Juzgados | D14: congestión | E14: descongestión | F14: cumplimiento | G14: duración | H14: de resolución
D15: (a/b) | E15: (b/c) | F15: ( b / (a+c) ) | G15: ( (a+c-1) / b ) | H15: (b/e)
C16: La Plata | D16: =+'C'!D15/'C'!E15 -> 1.5507056120774532 | E16: =+'C'!E15/'C'!F15 -> 0.82329100243177522 | F16: =+'C'!E15/('C'!D15+'C'!F15) -> 0.36161879895561355 | G16: =+('C'!D15+'C'!F15-1)/'C'!E15 -> 2.7651788644568427 | H16: =+'C'!E15/'C'!H15 -> 468.76923076923077
C17: Mar del Plata | D17: =+'C'!D16/'C'!E16 -> 1.3610557768924303 | E17: =+'C'!E16/'C'!F16 -> 1.3650577838205302 | F17: =+'C'!E16/('C'!D16+'C'!F16) -> 0.47764034253092291 | G17: =+('C'!D16+'C'!F16-1)/'C'!E16 -> 2.0933764940239046 | H17: =+'C'!E16/'C'!H16 -> 573.71428571428567
C18: Bahía Blanca | D18: =+'C'!D17/'C'!E17 -> 1.5672913117546849 | E18: =+'C'!E17/'C'!F17 -> 0.9848993288590604 | F18: =+'C'!E17/('C'!D17+'C'!F17) -> 0.38720316622691292 | G18: =+('C'!D17+'C'!F17-1)/'C'!E17 -> 2.581771720613288 | H18: =+'C'!E17/'C'!H17 -> 293.5
C19: Mendoza | D19: =+'C'!D18/'C'!E18 -> 2.4215620827770361 | E19: =+'C'!E18/'C'!F18 -> 0.75125376128385157 | F19: =+'C'!E18/('C'!D18+'C'!F18) -> 0.2664769189718047 | G19: =+('C'!D18+'C'!F18-1)/'C'!E18 -> 3.7523364485981308 | H19: =+'C'!E18/'C'!H18 -> 332.88888888888891
C20: Rosario | D20: =+'C'!D19/'C'!E19 -> 2.397084345713294 | E20: =+'C'!E19/'C'!F19 -> 0.82361349342481416 | F20: =+'C'!E19/('C'!D19+'C'!F19) -> 0.27691272587466359 | G20: =+('C'!D19+'C'!F19-1)/'C'!E19 -> 3.6108989934050677 | H20: =+'C'!E19/'C'!H19 -> 360.125
C21: General Roca | D21: =+'C'!D20/'C'!E20 -> 1.2015765765765767 | E21: =+'C'!E20/'C'!F20 -> 1.2220183486238532 | F21: =+'C'!E20/('C'!D20+'C'!F20) -> 0.49507526482066533 | G21: =+('C'!D20+'C'!F20-1)/'C'!E20 -> 2.0195195195195197 | H21: =+'C'!E20/'C'!H20 -> 444
C22: Paraná | D22: =+'C'!D21/'C'!E21 -> 0.86486486486486491 | E22: =+'C'!E21/'C'!F21 -> 0.86411889596602975 | F22: =+'C'!E21/('C'!D21+'C'!F21) -> 0.49453219927095993 | G22: =+('C'!D21+'C'!F21-1)/'C'!E21 -> 2.0212940212940214 | H22: =+'C'!E21/'C'!H21 -> 305.25
C23: Posadas | D23: =+'C'!D22/'C'!E22 -> 22.033519553072626 | E23: =+'C'!E22/'C'!F22 -> 0.45897435897435895 | F23: =+'C'!E22/('C'!D22+'C'!F22) -> 4.1301338255652978E-2 | G23: =+('C'!D22+'C'!F22-1)/'C'!E22 -> 24.211173184357541 | H23: =+'C'!E22/'C'!H22 -> 179
C24: Resistencia | D24: =+'C'!D23/'C'!E23 -> 13.750248756218905 | E24: =+'C'!E23/'C'!F23 -> 0.49727857496288969 | F24: =+'C'!E23/('C'!D23+'C'!F23) -> 6.3446969696969696E-2 | G24: =+('C'!D23+'C'!F23-1)/'C'!E23 -> 15.760199004975124 | H24: =+'C'!E23/'C'!H23 -> 201
C25: Córdoba | D25: =+'C'!D24/'C'!E24 -> 1.6183315431435732 | E25: =+'C'!E24/'C'!F24 -> 0.70264150943396231 | F25: =+'C'!E24/('C'!D24+'C'!F24) -> 0.32878163625662155 | G25: =+('C'!D24+'C'!F24-1)/'C'!E24 -> 3.041174364482635 | H25: =+'C'!E24/'C'!H24 -> 465.5
C26: San Martín | D26: =+'C'!D25/'C'!E25 -> 1.0726592760785361 | E26: =+'C'!E25/'C'!F25 -> 0.73575078616352196 | F26: =+'C'!E25/('C'!D25+'C'!F25) -> 0.41121546657878838 | G26: =+('C'!D25+'C'!F25-1)/'C'!E25 -> 2.4316815814077737 | H26: =+'C'!E25/'C'!H25 -> 277.2962962962963
C27: Tucumán | D27: =+'C'!D26/'C'!E26 -> 2.2268970698722765 | E27: =+'C'!E26/'C'!F26 -> 0.80691118520763871 | F27: =+'C'!E26/('C'!D26+'C'!F26) -> 0.28850113796466892 | G27: =+('C'!D26+'C'!F26-1)/'C'!E26 -> 3.4658151765589782 | H27: =+'C'!E26/'C'!H26 -> 443.66666666666669
C28: Salta | D28: =+'C'!D27/'C'!E27 -> 2.6951244183694114 | E28: =+'C'!E27/'C'!F27 -> 1.483048304830483 | F28: =+'C'!E27/('C'!D27+'C'!F27) -> 0.29678775142599823 | G28: =+('C'!D27+'C'!F27-1)/'C'!E27 -> 3.3692089823993525 | H28: =+'C'!E27/'C'!H27 -> 1235.75
C29: Comodoro Rivadavia | D29: =+'C'!D28/'C'!E28 -> 0.57335329341317365 | E29: =+'C'!E28/'C'!F28 -> 0.95474035254883283 | F29: =+'C'!E28/('C'!D28+'C'!F28) -> 0.61699507389162567 | G29: =+('C'!D28+'C'!F28-1)/'C'!E28 -> 1.6202594810379241 | H29: =+'C'!E28/'C'!H28 -> 250.5
C30: Corrientes | D30: =+'C'!D29/'C'!E29 -> 3.5050071530758227 | E30: =+'C'!E29/'C'!F29 -> 0.89788053949903657 | F30: =+'C'!E29/('C'!D29+'C'!F29) -> 0.21650921480563728 | G30: =+('C'!D29+'C'!F29-1)/'C'!E29 -> 4.6180257510729614 | H30: =+'C'!E29/'C'!H29 -> 349.5
C31: INDICADORES\INDI2004\INTPENAL04\HOJA D
C32: OFICINA DE ESTADISTICAS