B6: PODER JUDICIAL DE LA NACION
B7: JURISDICCION FEDERAL SALTA
B9: CUADRO III
B10: DISTRIBUCION DE LOS CARGOS PERMANENTES Y CONTRATADOS -AÑO 2001-
C13: Cámara Federal de Apelaciones de Salta | E13: Tribunal Oral en lo Criminal Federal de Salta | G13: Tribunal Oral en lo Criminal Federal de Jujuy | I13: Juzgados Federales de Primera Instancia de Salta Nros 1 y 2 | K13: Juzgados Federales de Primera Instancia de Jujuy Nros 1 y 2 | M13: Juzgado Federal de Primera Instancia de San Ramón de la Nueva Orán (sin habilitar)
C14: P | D14: C | E14: P | F14: C | G14: P | H14: C | I14: P | J14: C | K14: P | L14: C | M14: P | N14: C
B15: Juez (1ª o 2ª
B16: instancia) | C16: 3 | E16: 3 | G16: 3 | I16: 2 | K16: 2
B17: Secretario (1ª o 2ª instancia)
C18: 2 | E18: 1 | G18: 1 | I18: 6 | K18: 6
B19: Prosecretario Administrativo
B20: Jefe
B21: Prosecretario
B22: de Cámara | C22: 1
B23: Prosecretario Administrativo | J23: 1
C24: 6 | D24: 1 | E24: 2 | G24: 2 | I24: 4 | K24: 6
B25: Oficial Mayor
C26: 4 | D26: 2 | E26: 3 | G26: 3 | I26: 8 | K26: 5
B27: Oficial Mayor Relator
B29: Oficial
C30: 3 | D30: 1 | I30: 1 | K30: 5
B31: Escribiente
C32: 8 | D32: 2 | E32: 1 | G32: 1 | I32: 5 | K32: 6
B33: Escribiente Auxiliar
C34: 3 | E34: 1 | G34: 1 | I34: 5 | K34: 4
B35: Auxiliar
C36: 7 | D36: 1 | I36: 10 | K36: 8
B37: Auxiliar Administrativo
B39: Jefe de Sección /
B40: Encargado de Sección
B41: Oficial
B42: de Servicio / Medio Oficial | C42: 1
B43: Ayudante
C44: 6 | E44: 1 | G44: 1 | H44: 1 | I44: 4 | K44: 4 | L44: 1
B45: Auxiliar de Servicio
B47: Total | C47: =SUM(C15:C46) -> 44 | D47: =SUM(D15:D46) -> 7 | E47: =SUM(E15:E46) -> 12 | F47: =SUM(F15:F46) -> 0 | G47: =SUM(G15:G46) -> 12 | H47: =SUM(H15:H46) -> 1 | I47: =SUM(I15:I46) -> 45 | J47: =SUM(J15:J46) -> 1 | K47: =SUM(K15:K46) -> 46 | L47: =SUM(L15:L46) -> 1
B48: FUENTE: División Programación Presupuestaria. Consejo de la Magistratura.
B49: Oficina de Estadísticas del Poder Judicial de la Nación.