B6: PODER JUDICIAL DE LA NACION
B7: JURISDICCION FEDERAL SALTA
B9: CUADRO IV
B10: DISTRIBUCION DE LOS CARGOS POR DEPENDENCIA -AÑO 2001-
C12: Distribución de los cargos actuales | D12: Distribución
D13: Porcentual
B14: Cámara Federal de Apelaciones de Salta | C14: 51 | D14: =+C14/C$19 -> 0.30177514792899407
B15: Tribunal Oral en lo Criminal Federal de Salta | C15: 12 | D15: =+C15/C$19 -> 7.1005917159763315E-2
B16: Tribunal Oral en lo Criminal Federal de Jujuy | C16: 13 | D16: =+C16/C$19 -> 7.6923076923076927E-2
B17: Juzgados Federales de Primera Instancia de Salta Nros 1 y 2 | C17: 46 | D17: =+C17/C$19 -> 0.27218934911242604
B18: Juzgados Federales de Primera Instancia de Jujuy Nros 1 y 2 | C18: 47 | D18: =+C18/C$19 -> 0.27810650887573962
B19: TOTAL | C19: =SUM(C14:C18) -> 169 | D19: =SUM(D14:D18) -> 1
B20: FUENTE: Oficina de Estadísticas del Poder Judicial de la Nación.