B7: PODER JUDICIAL DE LA NACION
B8: JURISDICCION FEDERAL SALTA
B10: CUADRO VI
B11: DISTRIBUCION ANUAL DEL GASTO POR TODO CONCEPTO -AÑO 2001-
C14: Cámara, Tribunal Oral y Juzgados | D14: %
B15: HABERES | C15: 5522076.6100000003 | D15: =+C15/C$19 -> 0.95792449119758105
B16: BIENES DE CONSUMO | C16: 68677.58 | D16: =+C16/C$19 -> 1.1913622451207022E-2
B17: SERVICIOS NO PERSONALES | C17: 173872 | D17: =+C17/C$19 -> 3.0161886351211958E-2
B18: BIENES DE USO
B19: Total | C19: =SUM(C15:C18) -> 5764626.1900000004 | D19: =SUM(D15:D18) -> 1
B20: NOTA: Los datos consignados corresponden a la ejecución presupuestaria del año 2001.
B21: FUENTE: Departamento de Contaduría y Oficina de Estadísticas del Poder Judicial de la Nación.