B6: PODER JUDICIAL DE LA NACION
B7: JURISDICCION FEDERAL SALTA
B9: CUADRO II
B10: DENSIDAD DE POBLACION POR COMPETENCIA TERRITORIAL -AÑO 2001-
C13: POBLACION TOTAL (2001) | D13: SUPERFICIE (Km2) | E13: DENSIDAD DE
E14: POBLACION (hab/km2)
B15: Cámara Federal de Apelaciones | C15: 1690906 | D15: 208707 | E15: =+C15/D15 -> 8.1018173803466098
B16: de Salta
B17: Tribunal Oral en lo | C17: 1079422 | D17: 155488 | E17: =+C17/D17 -> 6.9421563078822803
B18: Criminal Federal
B19: de Salta
B20: Tribunal Oral en lo
B21: Criminal Federal
B22: de Jujuy | C22: 611484 | D22: 53219 | E22: =+C22/D22 -> 11.489956594449351
B23: Juzgados Federales de Primera Instancia | C23: 1079422 | D23: 155488 | E23: =+C23/D23 -> 6.9421563078822803
B24: de Salta Nros 1 y 2
B25: Juzgados Federales de Primera Instancia
B26: de Jujuy Nros 1 y 2 | C26: 611484 | D26: 53219 | E26: =+C26/D26 -> 11.489956594449351
B27: Juzgado y Fiscalía Federal de Primera Instancia
B28: de San Ramón de la Nueva Orán (sin habilitar) | C28: ----- | D28: ----- | E28: ------
B29: FUENTE: INDEC (Censo Nacional de Población, Hogares y Viviendas 2001) e Instituto Geográfico Militar
B30: Oficina de Estadísticas del Poder Judicial de la Nación.