B7: PODER JUDICIAL DE LA NACION
B8: JURISDICCIÓN FEDERAL SALTA
B9: COMPETENCIA CIVIL
B10: CUADRO XI
B11: DISTRIBUCION PORCENTUAL, SEGÚN EL OBJETO DE LITIGIO, DE LOS EXPEDIENTES INGRESADOS, RESUELTOS O SALIDOS Y SENTENCIAS DICTADAS EN LOS JUZGADOS FEDERALES DE PRIMERA INSTANCIA -AÑO 2001-
B14: OBJETO | C14: INGRESADOS | D14: % | E14: RESUELTOS O SALIDOS | F14: % | G14: SENTENCIAS DEFINITIVAS | H14: % | I14: SENTENCIAS INTERLOCUTORIAS | J14: %
B15: ORDINARIOS | C15: 160 | D15: =+C15/C$28 -> 3.3486814566764334E-2 | E15: 274 | F15: =+E15/E$28 -> 4.7404844290657437E-2 | G15: 57 | H15: =+G15/G$28 -> 1.5334947538337369E-2 | I15: 62 | J15: =+I15/I$28 -> 3.7037037037037035E-2
B16: SUMARIOS | C16: 28 | D16: =+C16/C$28 -> 5.8601925491837585E-3 | E16: 171 | F16: =+E16/E$28 -> 2.9584775086505189E-2 | G16: 36 | H16: =+G16/G$28 -> 9.6852300242130755E-3 | I16: 22 | J16: =+I16/I$28 -> 1.3142174432497013E-2
B17: SUMARISIMOS | C17: 8 | D17: =+C17/C$28 -> 1.6743407283382169E-3 | E17: 7 | F17: =+E17/E$28 -> 1.2110726643598615E-3 | G17: 36 | H17: =+G17/G$28 -> 9.6852300242130755E-3 | I17: 18 | J17: =+I17/I$28 -> 1.0752688172043012E-2
B18: EJECUTIVOS | C18: 440 | D18: =+C18/C$28 -> 9.2088740058601931E-2 | E18: 954 | F18: =+E18/E$28 -> 0.16505190311418685 | G18: 192 | H18: =+G18/G$28 -> 5.1654560129136398E-2 | I18: 229 | J18: =+I18/I$28 -> 0.13679808841099164
B19: EJECUCIONES FISCALES | C19: 3410 | D19: =+C19/C$28 -> 0.71368773545416497 | E19: 2107 | F19: =+E19/E$28 -> 0.36453287197231832 | G19: 2707 | H19: =+G19/G$28 -> 0.72827549098735544 | I19: 977 | J19: =+I19/I$28 -> 0.58363201911589013
B20: LABORALES | C20: 14 | D20: =+C20/C$28 -> 2.9300962745918793E-3 | E20: 366 | F20: =+E20/E$28 -> 6.3321799307958476E-2 | G20: 37 | H20: =+G20/G$28 -> 9.9542641915523269E-3 | I20: 13 | J20: =+I20/I$28 -> 7.7658303464755076E-3
B21: CIUDADANIA | C21: 179 | D21: =+C21/C$28 -> 3.7463373796567605E-2 | E21: 1233 | F21: =+E21/E$28 -> 0.21332179930795847 | G21: 178 | H21: =+G21/G$28 -> 4.7888081786386871E-2 | J21: =+I21/I$28 -> 0
B22: AMPAROS (LEY 16.986) | C22: 134 | D22: =+C22/C$28 -> 2.8045207199665131E-2 | E22: 99 | F22: =+E22/E$28 -> 1.7128027681660898E-2 | G22: 34 | H22: =+G22/G$28 -> 9.1471616895345709E-3 | I22: 13 | J22: =+I22/I$28 -> 7.7658303464755076E-3
B23: AMPAROS POR MORA | C23: 27 | D23: =+C23/C$28 -> 5.650899958141482E-3 | E23: 38 | F23: =+E23/E$28 -> 6.5743944636678202E-3 | G23: 15 | H23: =+G23/G$28 -> 4.0355125100887809E-3 | I23: 5 | J23: =+I23/I$28 -> 2.9868578255675031E-3
B24: EXPROPIACIONES | D24: =+C24/C$28 -> 0 | E24: 13 | F24: =+E24/E$28 -> 2.249134948096886E-3 | G24: 2 | H24: =+G24/G$28 -> 5.3806833467850415E-4 | I24: 1 | J24: =+I24/I$28 -> 5.9737156511350056E-4
B25: LEY 24.463 (ART. 15 SEG. SOC.) | C25: 287 | D25: =+C25/C$28 -> 6.0066973629133526E-2 | E25: 261 | F25: =+E25/E$28 -> 4.5155709342560552E-2 | G25: 80 | H25: =+G25/G$28 -> 2.1522733387140166E-2 | I25: 17 | J25: =+I25/I$28 -> 1.0155316606929509E-2
B26: LEYES ESPECIALES | C26: 14 | D26: =+C26/C$28 -> 2.9300962745918793E-3 | E26: 63 | F26: =+E26/E$28 -> 1.0899653979238755E-2 | G26: 22 | H26: =+G26/G$28 -> 5.9187516814635461E-3 | I26: 67 | J26: =+I26/I$28 -> 4.0023894862604541E-2
B27: CAUTELARES | C27: 77 | D27: =+C27/C$28 -> 1.6115529510255338E-2 | E27: 194 | F27: =+E27/E$28 -> 3.3564013840830451E-2 | G27: 321 | H27: =+G27/G$28 -> 8.6359967715899918E-2 | I27: 250 | J27: =+I27/I$28 -> 0.14934289127837516
B28: TOTAL | C28: =SUM(C15:C27) -> 4778 | D28: =SUM(D15:D27) -> 1 | E28: =SUM(E15:E27) -> 5780 | F28: =SUM(F15:F27) -> 1 | G28: =SUM(G15:G27) -> 3717 | H28: =SUM(H15:H27) -> 1 | I28: =SUM(I15:I27) -> 1674 | J28: =SUM(J15:J27) -> 1
B29: FUENTE:Oficina de Estadísticas del Poder Judicial de la Nación.