B6: PODER JUDICIAL DE LA NACION
B7: JURISDICCION FEDERAL SALTA
B9: COMPETENCIA PENAL
B10: CUADRO VII
B12: CAUSAS INGRESADAS Y ELEVADAS A JUICIO EN LOS JUZGADOS DE 1RA. INSTANCIA -AÑO 2001-
C14: TOTAL DE CAUSAS INGRESADAS | D14: TOTAL DE CAUSAS ELEVADAS A JUICIO (*) | E14: PORCENTAJE DE CAUSAS ELEVADAS A JUICIO
B16: Juzgado Federal de Primera Instancia de Salta N° 1 | C16: 1209 | D16: 119 | E16: =+D16/C16 -> 9.8428453267162944E-2
B17: Juzgado Federal de Primera Instancia de Salta N° 2 | C17: 1046 | D17: 125 | E17: =+D17/C17 -> 0.11950286806883365
B18: Juzgado Federal de Primera Instancia de Jujuy N° 1 | C18: 1203 | D18: 3 | E18: =+D18/C18 -> 2.4937655860349127E-3
B19: Juzgado Federal de Primera Instancia de Jujuy N° 2 | C19: 1230 | D19: 40 | E19: =+D19/C19 -> 3.2520325203252036E-2
B20: Total | C20: =SUM(C16:C19) -> 4688 | D20: =SUM(D16:D19) -> 287 | E20: =+D20/C20 -> 6.1220136518771333E-2
B21: REFERENCIAS: (*) En estas cifras se incluyen causas de años anteriores y las elevaciones a juicio en causas correccionales que se resuelven en la
B22: misma instancia.
B23: FUENTE: Oficina de Estadísticas del Poder Judicial de la Nación.