C7: PODER JUDICIAL DE LA NACION
C8: JURISDICCION FEDERAL SALTA
C10: CUADRO V
C11: DISTRIBUCION ANUAL DEL GASTO EN CONCEPTO DE LIQUIDACION DE HABERES -AÑO 2001-
D13: Gasto (Haberes) | E13: %
C14: Cámara Federal de Apelaciones de Salta | D14: 1517079.9715196763 | E14: =+D14/D$21 -> 0.27472997545386757 | H14: 297386 | I14: =+E14*H14 -> 81700.848480323868 | J14: =+D14-I14 -> 1435379.1230393525
C15: Tribunal Oral en lo Criminal Federal de Salta | D15: 655961.94516036927 | E15: =+D15/D$21 -> 0.11878899759783833 | H15: 297386 | I15: =+E15*H15 -> 35326.184839630747 | J15: =+D15-I15 -> 620635.76032073854
C16: Tribunal Oral en lo Criminal Federal de Jujuy | D16: 671192.18555622164 | E16: =+D16/D$21 -> 0.12154706154216531 | H16: 297386 | I16: =+E16*H16 -> 36146.394443778372 | J16: =+D16-I16 -> 635045.79111244332
C17: Juzgado Federal de Primera Instancia de Salta N° 1 | D17: 617157.12077868322 | E17: =+D17/D$21 -> 0.11176178172918959 | H17: 297386 | I17: =+E17*H17 -> 33236.389221316778 | J17: =+D17-I17 -> 583920.73155736644
C18: Juzgado Federal de Primera Instancia de Salta N° 2 | D18: 639249.94355579396 | E18: =+D18/D$21 -> 0.11576259959852203 | H18: 297386 | I18: =+E18*H18 -> 34426.176444206074 | J18: =+D18-I18 -> 604823.76711158792
C19: Juzgado Federal de Primera Instancia de Jujuy N° 1 | D19: 828162.65542054747 | E19: =+D19/D$21 -> 0.14997304708174763 | H19: 297386 | I19: =+E19*H19 -> 44599.884579452599 | J19: =+D19-I19 -> 783562.7708410949
C20: Juzgado Federal de Primera Instancia de Jujuy N° 2 | D20: 593272.78800870851 | E20: =+D20/D$21 -> 0.10743653699666954 | H20: 297386 | I20: =+E20*H20 -> 31950.121991291566 | J20: =+D20-I20 -> 561322.66601741698
C21: TOTAL | D21: =SUM(D14:D20) -> 5522076.6100000003 | E21: =SUM(E14:E20) -> 1 | J21: =SUM(J14:J20) -> 5224690.61
C22: NOTA: Los datos registrados corresponden a la ejecución presupuestaria del año 2001.
C23: FUENTE: Departamento de Contaduría y Oficina de Estadísticas del Poder Judicial de la Nación.