B6: PODER JUDICIAL DE LA NACION
B7: JURISDICCIÓN FEDERAL SALTA
B8: CUADRO XII
B9: INDICE DE LITIGIOSIDAD EN LOS JUZGADOS FEDERALES DE PRIMERA INSTANCIA -AÑO 2001-
B12: 1- COMPETENCIA PENAL
B14: Dependencias | C14: Causas ingresadas | D14: Cantidad de habitantes en la | E14: Causas ingresadas
D15: jurisdicción | E15: c/10.000 hab.
B16: Juzgado Federal de Primera Instancia de Salta N° 1 | C16: 1209 | D16: 1079422 | E16: =+(C16/D16)*10000 -> 11.200438753332802
B17: Juzgado Federal de Primera Instancia de Salta N° 2 | C17: 1046 | D17: 1079422 | E17: =+(C17/D17)*10000 -> 9.6903713283590669
B18: Juzgado Federal de Primera Instancia de Jujuy N° 1 | C18: 1203 | D18: 611484 | E18: =+(C18/D18)*10000 -> 19.673450163863649
B19: Juzgado Federal de Primera Instancia de Jujuy N° 2 | C19: 1230 | D19: 611484 | E19: =+(C19/D19)*10000 -> 20.114998920658596
B20: TOTAL | C20: =SUM(C16:C19) -> 4688 | D20: 1690906 | E20: =+(C20/D20)*10000 -> 27.724781862504479
B22: FUENTE: INDEC (Censo Nacional de Población, Hogares y Viviendas 2001 e Instituto Geografico Militar). Oficina de Estadísticas del Poder Judicial de la Nación.
B25: 2- COMPETENCIA CIVIL
B27: Dependencias | C27: Causas ingresadas | D27: Cantidad de habitantes en la | E27: Causas ingresadas
D28: jurisdicción | E28: c/10.000 hab.
B29: Juzgado Federal de Primera Instancia de Salta N° 1 | C29: 1430 | D29: 1079422 | E29: =+(C29/D29)*10000 -> 13.247830783511915
B30: Juzgado Federal de Primera Instancia de Salta N° 2 | C30: 2045 | D30: 1079422 | E30: =+(C30/D30)*10000 -> 18.945324442155151
B31: Juzgado Federal de Primera Instancia de Jujuy N° 1 | C31: 614 | D31: 611484 | E31: =+(C31/D31)*10000 -> 10.041145802670226
B32: Juzgado Federal de Primera Instancia de Jujuy N° 2 | C32: 689 | D32: 611484 | E32: =+(C32/D32)*10000 -> 11.267670127100628
B33: TOTAL | C33: =SUM(C29:C32) -> 4778 | D33: 1690906 | E33: =+(C33/D33)*10000 -> 28.257040899967237
B35: FUENTE: INDEC (Censo Nacional de Población, Hogares y Viviendas 2001 e Instituto Geografico Militar). Oficina de Estadísticas del Poder Judicial de la Nación.