B6: PODER JUDICIAL DE LA NACION
B7: JURISDICCION FEDERAL SALTA
B9: COMPETENCIA PENAL
B10: CUADRO IX
B11: DISTRIBUCION PORCENTUAL SEGÚN EL TIPO DE DELITO DE LAS CAUSAS INGRESADAS, ELEVADAS A JUICIO Y PERSONAS CONDENADAS EN LOS JUZGADOS FEDERALES -AÑO 2001-
C13: CAUSAS | D13: % | E13: CAUSAS | F13: % | G13: PERSONAS | H13: %
B14: DELITOS | C14: INGRESADAS | E14: ELEVADAS | G14: CONDENADAS
B15: DELITOS CONTRA LAS PERSONAS | C15: 32 | D15: =+(C15/C$31) -> 6.8259385665529011E-3 | E15: 2 | F15: =+E15/E$31 -> 6.9686411149825784E-3 | H15: =+G15/G$31 -> 0
B16: HOMICIDIOS | C16: 3 | D16: =+(C16/C$31) -> 6.3993174061433445E-4 | E16: 3 | F16: =+E16/E$31 -> 1.0452961672473868E-2 | H16: =+G16/G$31 -> 0
B17: DELITOS CONTRA EL HONOR | C17: 2 | D17: =+(C17/C$31) -> 4.2662116040955632E-4 | F17: =+E17/E$31 -> 0 | H17: =+G17/G$31 -> 0
B18: DELITOS CONTRA LA INTEGRIDAD SEXUAL | D18: =+(C18/C$31) -> 0 | F18: =+E18/E$31 -> 0 | H18: =+G18/G$31 -> 0
B19: DELITOS CONTRA EL ESTADO CIVIL | D19: =+(C19/C$31) -> 0 | F19: =+E19/E$31 -> 0 | H19: =+G19/G$31 -> 0
B20: DELITOS CONTRA LA LIBERTAD | C20: 29 | D20: =+(C20/C$31) -> 6.1860068259385666E-3 | F20: =+E20/E$31 -> 0 | H20: =+G20/G$31 -> 0
B21: DELITOS CONTRA LA PROPIEDAD | C21: 90 | D21: =+(C21/C$31) -> 1.9197952218430035E-2 | E21: 5 | F21: =+E21/E$31 -> 1.7421602787456445E-2 | G21: 4 | H21: =+G21/G$31 -> 1.8018018018018018E-2
B22: DELITOS CONTRA LA SEGURIDAD PUBLICA | C22: 56 | D22: =+(C22/C$31) -> 1.1945392491467578E-2 | E22: 4 | F22: =+E22/E$31 -> 1.3937282229965157E-2 | H22: =+G22/G$31 -> 0
B23: DELITOS CONTRA EL ORDEN PUBLICO | C23: 27 | D23: =+(C23/C$31) -> 5.7593856655290101E-3 | F23: =+E23/E$31 -> 0 | H23: =+G23/G$31 -> 0
B24: DELITOS CONTRA LA SEG. DE LA NACION | C24: 1 | D24: =+(C24/C$31) -> 2.1331058020477816E-4 | F24: =+E24/E$31 -> 0 | H24: =+G24/G$31 -> 0
B25: DELITOS CONTRA LOS POD. PUB. Y ORD. CONTITUC. | C25: 1 | D25: =+(C25/C$31) -> 2.1331058020477816E-4 | F25: =+E25/E$31 -> 0 | H25: =+G25/G$31 -> 0
B26: DELITOS CONTRA LA ADMINISTRACION PUBLICA | C26: 133 | D26: =+(C26/C$31) -> 2.8370307167235494E-2 | E26: 10 | F26: =+E26/E$31 -> 3.484320557491289E-2 | H26: =+G26/G$31 -> 0
B27: DELITOS CONTRA LA FE PUBLICA | C27: 1668 | D27: =+(C27/C$31) -> 0.35580204778156999 | E27: 31 | F27: =+E27/E$31 -> 0.10801393728222997 | G27: 10 | H27: =+G27/G$31 -> 4.5045045045045043E-2
B28: INFRACCION LEY 23.737 (ESTUPEFACIENTES) | C28: 686 | D28: =+(C28/C$31) -> 0.14633105802047783 | E28: 204 | F28: =+E28/E$31 -> 0.71080139372822304 | G28: 197 | H28: =+G28/G$31 -> 0.88738738738738743
B29: INFRACCION LEYES ESPECIALES Y DEC. LEYES | C29: =1890+56+2 -> 1948 | D29: =+(C29/C$31) -> 0.41552901023890787 | E29: =27+1 -> 28 | F29: =+E29/E$31 -> 9.7560975609756101E-2 | G29: 11 | H29: =+G29/G$31 -> 4.954954954954955E-2
B30: D.G.I. | C30: 12 | D30: =+(C30/C$31) -> 2.5597269624573378E-3 | F30: =+E30/E$31 -> 0 | H30: =+G30/G$31 -> 0
B31: TOTAL | C31: =SUM(C15:C30) -> 4688 | D31: =SUM(D15:D30) -> 1 | E31: =SUM(E15:E30) -> 287 | F31: =SUM(F15:F30) -> 1 | G31: =SUM(G15:G30) -> 222 | H31: =SUM(H15:H30) -> 1
B32: REFERENCIAS: (*) En causa tramitadas en los Juzgados de 1ra. Instancia y en los Tribunales Orales en lo Criminal Federal.
B33: FUENTE: Oficina de Estadísticas del Poder Judicial de la Nación.