C6: I - DATOS GENERALES - AÑO 2005
C8: Poder Judicial de la Nación
C11: Población de la República Argentina (1) | D11: 38592150
C12: Producto Bruto Interno (2) | D12: 304764
C13: Abogados Matriculados (3) | D13: =47165+59940 -> 107105
C14: Personal del Poder Judicial de la Nación (4)
C15: Magistrados | D15: 843
C16: Funcionarios | D16: 3961
C17: Empleados | D17: 10376
C18: Personal Obrero y de Maestranza | D18: 3200
C19: Total | D19: =SUM(D15:D18) -> 18380
C20: Juzgados de Primera Instancia Total General | D20: 421
C21: Causas Ingresadas en Juzgados
C22: Capital Federal
C23: Penal (5) | D23: 223271
C24: Civil (6) | D24: 296113
C25: Total | D25: =+D23+D24 -> 519384
C26: Interior del País (7)
C27: Penal | D27: 52513
C28: Civil | D28: 194346
C29: Total | D29: =+D27+D28 -> 246859
C30: Total General | D30: =+D25+D29 -> 766243
C31: Presupuesto del Poder Judicial (8) | D31: 880790993
C32: Indicadores calculados
C33: Causas Ingresadas cada 10.000 habitantes | D33: =+(D30*10000)/$D$11 -> 198.54892769643567
C34: Causas civiles sobre 10.000 habitantes | D34: =+((D24+D28)*10000)/$D$11 -> 127.08776266675994
C35: Causas penales sobre 10.000 habitantes | D35: =+((D23+D27)*10000)/$D$11 -> 71.461165029675726
C36: Promedio causas ingresadas por Juzgado 1ra. Instancia | D36: =+D30/D20 -> 1820.0546318289787
C37: Empleados por magistrado | D37: =+D17/D15 -> 12.308422301304864
C38: Presupuesto por magistrado (9) | D38: =+D31/D15 -> 1044829.1731909845
C39: Presupuesto por causa ingresada (9) | D39: =+D31/D30 -> 1149.4930368042515
C40: Presupuesto del P.J.N. por habitante (9) | D40: =+D31/D11 -> 22.823060985200357
C41: Presupuesto del P.J.N. Sobre P.B.I. | D41: =+D31/(D12*1000000) -> 2.8900755765116615E-3
C42: Magistrados cada 100.000 habitantes | D42: =+(D15*100000)/D11 -> 2.1843820569727264
C43: Abogados Matriculados cada 100.000 habitantes | D43: =+(D13*100000)/D11 -> 277.53053405938772
C45: OFICINA DE ESTADISTICAS
C47: Referencias