B4: TRIBUNALES ORALES CAPITAL FEDERAL
C7: Ingresados | D7: Juicio Abreviado | E7: Suspensiones a prueba | F7: Debates
B8: Tribunales Orales Criminales | C8: =535*12 -> 6420 | D8: =204*12 -> 2448 | E8: =83*12 -> 996 | F8: =116*12 -> 1392 | H8: 1
B9: Correccional | C9: =138*12 -> 1656 | D9: =11*12 -> 132 | E9: =59*12 -> 708 | F9: =42*12 -> 504 | H9: 2
B10: Tribunales Orales Criminales Federales | C10: =46*12 -> 552 | D10: =12*12 -> 144 | E10: =10*12 -> 120 | F10: =13*12 -> 156 | H10: 3
B11: Tribunales Orales en lo Penal Económico | C11: =30*12 -> 360 | D11: =7*12 -> 84 | E11: =3*12 -> 36 | F11: =14*12 -> 168 | H11: 4
B12: Tribunales Orales de Menores | C12: =97*12 -> 1164 | D12: =34*12 -> 408 | E12: =13*12 -> 156 | F12: =14*12 -> 168 | H12: 5