B6: PODER JUDICIAL DE LA NACION
B7: JURISDICCION CAPITAL FEDERAL
B8: CUADRO E
B9: TRIBUNALES ORALES CRIMINALES -AÑO 2001-
B11: JURISDICCION | C11: Fuero | D11: Superficie en Km2 | E11: Población | F11: Densidad de población (habitantes x km2) | G11: Recursos Humanos | H11: Total de RRHH en la Jurisdicción | I11: Porcentaje de RRHH respecto de toda la jurisdicción (1º inst .+ TOC + Cam) | J11: Gasto anual en haberes (en $) | K11: Total anual en haberes en la Jurisdicción | L11: Porcentaje de gasto en haberes respecto de toda la jurisdicciòn | M11: Causas ingresadas a la etapa de juicio por mes | N11: Causas ingresadas cada 10.000 hab por mes | O11: Total de juicios abreviados por mes y porcentaje respecto de los casos ingresados por mes | Q11: Total de suspensiones a prueba por mes y porcentaje respecto del total de casos ingresados por mes(**) | S11: Total de debates por mes y porcentaje respecto de los casos ingresados por mes | U11: Delitos cometidos con mas frecuencia en la jurisdicciòn | V11: Porcentual de delitos que recibieron condena mas frecuente en la jurisdicción
B12: CAPITAL | C12: Oral Criminal | D12: 200 | E12: 2768772 | F12: 13843.9 | G12: 400 | H12: 13867 | I12: =+G12/$H$12 -> 2.8845460445662365E-2 | J12: 19702702.32 | K12: 416308044.56999999 | L12: =+J12/$K$12 -> 4.732721977628538E-2 | M12: =6421/12 -> 535.08333333333337 | N12: =(M12*10000)/2768772 -> 1.932565532060182 | O12: 204 | P12: =204/M12 -> 0.38124902663136578 | Q12: 83 | R12: =83/M12 -> 0.15511602554119294 | S12: 116 | T12: =116/M12 -> 0.21678866220214918 | U12: Delitos c/la propiedad(90%) | V12: C/la propiedad (75%)-Robo simple- y delitos c/las personas (4%)- Lesiones dolosas-
B13: FEDERAL | C13: Correccional (*) | G13: 225 | I13: =+G13/$H$12 -> 1.6225571500685081E-2 | J13: 7659872.3499999996 | L13: =+J13/$K$12 -> 1.8399529987252101E-2 | M13: =1658/12 -> 138.16666666666666 | N13: =(M13*10000)/2768772 -> 0.49901785580996433 | O13: 11 | P13: =11/M13 -> 7.9613992762364305E-2 | Q13: 59 | R13: =59/M13 -> 0.42702050663449942 | S13: 42 | T13: =42/M13 -> 0.30398069963811825 | U13: Delitos c/ la propiedad (70%) | V13: C/las personas(57%)-Lesiones culposas accidente tránsito- y C/la propiedad(26%)-Hurto simple
C14: Oral Federal | G14: 110 | I14: =+G14/$H$12 -> 7.9325016225571497E-3 | J14: 4119323.36 | L14: =+J14/$K$12 -> 9.8948925290521447E-3 | M14: =554/12 -> 46.166666666666664 | N14: =(M14*10000)/2768772 -> 0.16674058632009664 | O14: 12 | P14: =12/M14 -> 0.25992779783393505 | Q14: 10 | R14: =10/M14 -> 0.21660649819494585 | S14: 13 | T14: =13/M14 -> 0.28158844765342961 | U14: Estupefacientes (46%) y delitos c/fe pública (35%) | V14: Estupefacientes (42%)- Tenecia con fines de comercialización-, y C/la fé pública (40%)-Falsificación o uso de documentos destinados a acreditar la identidad
C15: Oral Penal Económico | G15: 36 | I15: =+G15/$H$12 -> 2.5960914401096128E-3 | J15: 2454971.61 | L15: =+J15/$K$12 -> 5.8970073771591729E-3 | M15: =364/12 -> 30.333333333333332 | N15: =(M15*10000)/2768772 -> 0.1095551866796303 | O15: 7 | P15: =7/M15 -> 0.23076923076923078 | Q15: 3 | R15: =3/M15 -> 9.8901098901098911E-2 | S15: 14 | T15: =14/M15 -> 0.46153846153846156 | U15: Art.302 C.P. (52%) Código Aduanero (26%) | V15: Art.302C.P.(56%) y Código Aduanero(34%)-Contrabando de estupefacientes
C16: Oral Menores | G16: 52 | I16: =+G16/$H$12 -> 3.7499098579361072E-3 | J16: 2428597.6 | L16: =+J16/$K$12 -> 5.8336552264044569E-3 | M16: =1165/12 -> 97.083333333333329 | N16: =(M16*10000)/2768772 -> 0.35063679253233321 | O16: 34 | P16: =34/M16 -> 0.3502145922746781 | Q16: 13 | R16: =13/M16 -> 0.13390557939914163 | S16: 14 | T16: =14/M16 -> 0.14420600858369098 | U16: Delitos c/la propiedad (89%) | V16: C/la propiedad(85%)-Robo simple-
B17: REFERENCIAS:
B18: (*) Corresponde a los datos tomados de la etapa de juicio
B19: (**) En el fuero de menores los datos corresponden al art. 4° de la ley 22278.
B20: FUENTE: Oficina de Estadísticas del Poder Judicial de la Nación.
B26: Ver Gráfico E | M26: =SUM(M12:M16)*12 -> 10162 | O26: =SUM(O12:O16)*12 -> 3216 | Q26: =SUM(Q12:Q16)*12 -> 2016 | S26: =SUM(S12:S16)*12 -> 2388