B4: TRIBUNALES ORALES DEL INTERIOR DEL PAIS
C7: Ingresados | D7: Juicio Abreviado | E7: Suspensiones a prueba | F7: Debates
B8: LA PLATA | C8: =SUM(Interior!M13:M14)*12 -> 333 | D8: =SUM(Interior!O13:O14)*12 -> 26 | E8: =SUM(Interior!Q13:Q14)*12 -> 0 | F8: =SUM(Interior!S13:S14)*12 -> 88
B9: MAR DEL PLATA | C9: =+Interior!M15*12 -> 196 | D9: =+Interior!O15*12 -> 21 | E9: =+Interior!Q15*12 -> 46 | F9: =+Interior!S15*12 -> 31
B10: BAHIA BLANCA | C10: =SUM(Interior!M16:M17)*12 -> 98 | D10: =SUM(Interior!O16:O17)*12 -> 26 | E10: =SUM(Interior!Q16:Q17)*12 -> 0 | F10: =SUM(Interior!S16:S17)*12 -> 43
B11: MENDOZA | C11: =SUM(Interior!M18:M21)*12 -> 289 | D11: =SUM(Interior!O18:O21)*12 -> 91 | E11: =SUM(Interior!Q18:Q21)*12 -> 4 | F11: =SUM(Interior!S18:S21)*12 -> 125
B12: ROSARIO | C12: =SUM(Interior!M22:M23)*12 -> 253 | D12: =SUM(Interior!O22:O23)*12 -> 48 | E12: =SUM(Interior!Q22:Q23)*12 -> 58 | F12: =SUM(Interior!S22:S23)*12 -> 109
C13: Ingresados | D13: Juicio Abreviado | E13: Suspensiones a prueba | F13: Debates
B14: GENERAL ROCA | C14: =SUM(Interior!M24:M25)*12 -> 66 | D14: =SUM(Interior!O24:O25)*12 -> 14 | E14: =SUM(Interior!Q24:Q25)*12 -> 0 | F14: =SUM(Interior!S24:S25)*12 -> 43
B15: PARANA | C15: =SUM(Interior!M26)*12 -> 189 | D15: =SUM(Interior!O26)*12 -> 0 | E15: =SUM(Interior!Q26)*12 -> 0 | F15: =SUM(Interior!S26)*12 -> 53
B16: POSADAS | C16: =SUM(Interior!M27)*12 -> 92 | D16: =SUM(Interior!O27)*12 -> 56 | E16: =SUM(Interior!Q27)*12 -> 0 | F16: =SUM(Interior!S27)*12 -> 19
B17: RESISTENCIA | C17: =SUM(Interior!M28:M29)*12 -> 123 | D17: =SUM(Interior!O28:O29)*12 -> 17 | E17: =SUM(Interior!Q28:Q29)*12 -> 0 | F17: =SUM(Interior!S28:S29)*12 -> 30
B18: CORDOBA | C18: =SUM(Interior!M30:M32)*12 -> 231 | D18: =SUM(Interior!O30:O32)*12 -> 65 | E18: =SUM(Interior!Q30:Q32)*12 -> 10 | F18: =SUM(Interior!S30:S32)*12 -> 68
C19: Ingresados | D19: Juicio Abreviado | E19: Suspensiones a prueba | F19: Debates
B20: SAN MARTIN | C20: =SUM(Interior!M33:M37)*12 -> 629 | D20: =SUM(Interior!O33:O37)*12 -> 44 | E20: =SUM(Interior!Q33:Q37)*12 -> 158 | F20: =SUM(Interior!S33:S37)*12 -> 229
B21: TUCUMAN | C21: =SUM(Interior!M38:M40)*12 -> 55 | D21: =SUM(Interior!O38:O40)*12 -> 18 | E21: =SUM(Interior!Q38:Q40)*12 -> 1 | F21: =SUM(Interior!S38:S40)*12 -> 28
B22: SALTA | C22: =SUM(Interior!M41:M42)*12 -> 280 | D22: =SUM(Interior!O41:O42)*12 -> 40 | E22: =SUM(Interior!Q41:Q42)*12 -> 0 | F22: =SUM(Interior!S41:S42)*12 -> 142
B23: COMODORO RIVADAVIA | C23: =SUM(Interior!M43:M44)*12 -> 88 | D23: =SUM(Interior!O43:O44)*12 -> 11 | E23: =SUM(Interior!Q43:Q44)*12 -> 0 | F23: =SUM(Interior!S43:S44)*12 -> 43
B24: CORRIENTES | C24: =SUM(Interior!M45)*12 -> 41 | D24: =SUM(Interior!O45)*12 -> 1 | E24: =SUM(Interior!Q45)*12 -> 0 | F24: =SUM(Interior!S45)*12 -> 18