B6: PODER JUDICIAL DE LA NACION
B7: JURISDICCIONES FEDERALES DEL INTERIOR
B8: CUADRO F
B9: TRIBUNALES ORALES EN LO CRIMINAL FEDERAL -AÑO 2001-
B11: JURISDICCION FEDERAL | C11: Tribunales Orales en lo Criminal Federal de: | D11: Superficie en Km2 | F11: Densidad de población (habitantes x km2) | G11: Recursos Humanos | H11: Total de RRHH en la Jurisdicción | I11: Porcentaje de RRHH respecto a toda la jurisdicción (1ºinst.+TOC+Cam) | J11: Gasto anual en haberes (en $) | K11: Total anual en haberes en la Jurisdicción | L11: Porcentaje de gasto en haberes respecto de toda la jurisdicciòn | M11: Causas ingresadas al Tribunal Oral por mes | N11: Causas ingresadas cada 10.000 hab por mes | O11: Total de juicios abreviados por mes y porcentaje respecto de los casos ingresados por mes | Q11: Total de suspensiones a prueba por mes y porcentaje respecto del total de casos ingresados por mes | S11: Total de debates por mes y porcentaje respecto de los casos ingresados por mes | U11: Delitos cometidos con mas frecuencia en la jurisdicciòn | V11: Porcentual de delitos que recibieron condena mas frecuente en la jurisdicción
E12: Población
B13: LA PLATA | C13: La Plata Nº 1 | D13: 75660 | E13: 4903402 | F13: =+E13/D13 -> 64.808379592915671 | G13: 26 | H13: 435 | I13: =+G13/H13 -> 5.9770114942528735E-2 | J13: 1139718.8 | K13: 12223983.470000001 | L13: =+J13/K13 -> 9.3236284456461233E-2 | M13: =144/12 -> 12 | N13: =(M13*10000)/E13 -> 2.4472804799606479E-2 | O13: =12/12 -> 1 | P13: =+O13/M13 -> 8.3333333333333329E-2 | Q13: 0 | R13: =+Q13/M13 -> 0 | S13: =47/12 -> 3.9166666666666665 | T13: =+S13/M13 -> 0.3263888888888889 | U13: Estupefacientes (63%) | V13: Estupefacientes (94%) -Tenencia simple-
C14: La Plata Nº 2 | D14: 75660 | E14: 4903402 | F14: =+E14/D14 -> 64.808379592915671 | M14: =189/12 -> 15.75 | N14: =(M14*10000)/E14 -> 3.2120556299483502E-2 | O14: =14/12 -> 1.1666666666666667 | P14: =+O14/M14 -> 7.4074074074074084E-2 | Q14: 0 | R14: =+Q14/M14 -> 0 | S14: =41/12 -> 3.4166666666666665 | T14: =+S14/M14 -> 0.21693121693121692
B15: MAR DEL PLATA | C15: Mar del Plata | D15: 117739 | E15: 1501700 | F15: =+E15/D15 -> 12.754482372026262 | G15: 13 | H15: 190 | I15: =+G15/H15 -> 6.8421052631578952E-2 | J15: 617642.35 | K15: 5912975.0099999998 | L15: =+J15/K15 -> 0.10445543046528113 | M15: =196/12 -> 16.333333333333332 | N15: =(M15*10000)/E15 -> 0.10876562118487934 | O15: =21/12 -> 1.75 | P15: =+O15/M15 -> 0.10714285714285715 | Q15: =46/12 -> 3.8333333333333335 | R15: =+Q15/M15 -> 0.23469387755102045 | S15: =31/12 -> 2.5833333333333335 | T15: =+S15/M15 -> 0.15816326530612246 | U15: Estupefacientes (82%) | V15: Estupefacientes (89%)-Tenencia con fines de comercialización-
B16: BAHIA BLANCA | C16: Bahía Blanca | D16: 84134 | E16: 642235 | F16: =+E16/D16 -> 7.6334775477214922 | G16: 13 | H16: 147 | I16: =+G16/H16 -> 8.8435374149659865E-2 | J16: 716140.95 | K16: 5771058.3200000003 | L16: =+J16/$K$16 -> 0.12409178876570423 | M16: =43/12 -> 3.5833333333333335 | N16: =(M16*10000)/E16 -> 5.5794737647953375E-2 | O16: =19/12 -> 1.5833333333333333 | P16: =+O16/M16 -> 0.44186046511627902 | Q16: 0 | R16: =+Q16/M16 -> 0 | S16: =26/12 -> 2.1666666666666665 | T16: =+S16/M16 -> 0.60465116279069764 | U16: Estupefacientes (56,16%) | V16: Delitos c/la fe pública (45,77%)-Falsificación o uso de documento público- y Estupefacientes (27,82%)-Tenencia para consumo personal-
C17: Santa Rosa | D17: 143440 | E17: 298460 | F17: =+E17/D17 -> 2.0807306190741772 | G17: 13 | I17: =+G17/H16 -> 8.8435374149659865E-2 | J17: 825140.14 | L17: =+J17/$K$16 -> 0.14297899869429842 | M17: =55/12 -> 4.583333333333333 | N17: =(M17*10000)/E17 -> 0.15356608367397082 | O17: =7/12 -> 0.58333333333333337 | P17: =+O17/M17 -> 0.12727272727272729 | Q17: 0 | R17: =+Q17/M17 -> 0 | S17: =17/12 -> 1.4166666666666667 | T17: =+S17/M17 -> 0.30909090909090914
B18: MENDOZA | C18: Mendoza Nº 1 | D18: 148827 | E18: 1576585 | F18: =+E18/D18 -> 10.59340711026897 | G18: 23 | H18: 326 | I18: =+G18/H18 -> 7.0552147239263799E-2 | J18: 633957.62 | K18: 11150052.640000001 | L18: =+J18/$K$18 -> 5.6856917224383609E-2 | M18: =98/12 -> 8.1666666666666661 | N18: =(M18*10000)/E18 -> 5.1799723241478676E-2 | O18: =21/12 -> 1.75 | P18: =+O18/M18 -> 0.2142857142857143 | Q18: 0 | R18: =+Q18/M18 -> 0 | S18: =52/12 -> 4.333333333333333 | T18: =+S18/M18 -> 0.53061224489795922 | U18: Estupefacientes (61%) Delitos c/la fe pública ((19%) | V18: Estupefacientes (68%) -Tenencia simple-
C19: Mendoza Nº 2 | D19: 148827 | E19: 1576585 | F19: =+E19/D19 -> 10.59340711026897 | J19: 535086.88 | L19: =+J19/$K$18 -> 4.7989628145827301E-2 | M19: =99/12 -> 8.25 | N19: =(M19*10000)/E19 -> 5.2328291845983567E-2 | O19: =19/12 -> 1.5833333333333333 | P19: =+O19/M19 -> 0.19191919191919191 | Q19: 0 | R19: =+Q19/M19 -> 0 | S19: =45/12 -> 3.75 | T19: =+S19/M19 -> 0.45454545454545453
C20: San Juan | D20: 89651 | E20: 622034 | F20: =+E20/D20 -> 6.9383944406643536 | G20: 13 | I20: =+G20/$H$18 -> 3.9877300613496931E-2 | J20: 689771.68 | L20: =+J20/$K$18 -> 6.1862638883469885E-2 | M20: =61/12 -> 5.083333333333333 | N20: =(M20*10000)/E20 -> 8.1721149219067327E-2 | O20: =42/12 -> 3.5 | P20: =+O20/M20 -> 0.68852459016393441 | Q20: =4/12 -> 0.33333333333333331 | R20: =+Q20/M20 -> 6.5573770491803282E-2 | S20: =12/12 -> 1 | T20: =+S20/M20 -> 0.19672131147540986
C21: San Luis | D21: 76749 | E21: 366900 | F21: =+E21/D21 -> 4.7805183129421884 | G21: 12 | I21: =+G21/$H$18 -> 3.6809815950920248E-2 | J21: 689089.34 | L21: =+J21/$K$18 -> 6.1801442759825388E-2 | M21: =31/12 -> 2.5833333333333335 | N21: =(M21*10000)/E21 -> 7.0409739256836565E-2 | O21: =9/12 -> 0.75 | P21: =+O21/M21 -> 0.29032258064516125 | Q21: 0 | R21: =+Q21/M21 -> 0 | S21: =16/12 -> 1.3333333333333333 | T21: =+S21/M21 -> 0.5161290322580645
B22: ROSARIO | C22: Rosario | D22: 71148 | E22: 3041097 | F22: =+E22/D22 -> 42.743253499747006 | G22: 12 | H22: 284 | I22: =+G22/$H$22 -> 4.2253521126760563E-2 | J22: 748165.94 | K22: 9932688.5199999996 | L22: =+J22/$K$22 -> 7.5323608355736496E-2 | M22: =166/12 -> 13.833333333333334 | N22: =(M22*10000)/E22 -> 4.5487971391025457E-2 | O22: =11/12 -> 0.91666666666666663 | P22: =+O22/M22 -> 6.6265060240963847E-2 | Q22: =53/12 -> 4.416666666666667 | R22: =+Q22/M22 -> 0.31927710843373497 | S22: =50/12 -> 4.166666666666667 | T22: =+S22/M22 -> 0.30120481927710846 | U22: Estupefacientes (66%) | V22: Estupefacientes (78%)- Tenencia con fines de comercialización-
C23: Santa Fe | D23: 34775 | E23: 944635 | F23: =+E23/D23 -> 27.164198418404027 | G23: 12 | I23: =+G23/$H$22 -> 4.2253521126760563E-2 | J23: 578500.96 | L23: =+J23/$K$22 -> 5.824213241310823E-2 | M23: =87/12 -> 7.25 | N23: =(M23*10000)/E23 -> 7.67492205984322E-2 | O23: =37/12 -> 3.0833333333333335 | P23: =+O23/M23 -> 0.42528735632183912 | Q23: =5/12 -> 0.41666666666666669 | R23: =+Q23/M23 -> 5.7471264367816091E-2 | S23: =59/12 -> 4.916666666666667 | T23: =+S23/M23 -> 0.67816091954022995
B24: GENERAL ROCA | C24: General Roca | D24: 228698 | E24: 607340 | F24: =+E24/D24 -> 2.6556419382766792 | G24: 13 | H24: 213 | I24: =+G24/$H$24 -> 6.1032863849765258E-2 | J24: 826976.46 | K24: 7868620.0599999996 | L24: =+J24/$K$24 -> 0.10509802909457036 | M24: =33/12 -> 2.75 | N24: =(M24*10000)/E24 -> 4.5279415154608621E-2 | O24: =2/12 -> 0.16666666666666666 | P24: =+O24/M24 -> 6.0606060606060601E-2 | Q24: 0 | R24: =+Q24/M24 -> 0 | S24: =26/12 -> 2.1666666666666665 | T24: =+S24/M24 -> 0.78787878787878785 | U24: Estupefacientes (44%) | V24: Estupefacientes (49%)- Tenencia simple-
C25: Neuquén | D25: 94078 | E25: 473315 | F25: =+E25/D25 -> 5.0310912221773423 | G25: 15 | I25: =+G25/$H$24 -> 7.0422535211267609E-2 | J25: 760505.05 | L25: =+J25/$K$24 -> 9.6650371246924854E-2 | M25: =33/12 -> 2.75 | N25: =(M25*10000)/E25 -> 5.8100841934018571E-2 | O25: =12/12 -> 1 | P25: =+O25/M25 -> 0.36363636363636365 | Q25: 0 | R25: =+Q25/M25 -> 0 | S25: =17/12 -> 1.4166666666666667 | T25: =+S25/M25 -> 0.51515151515151514
B26: PARANA | C26: Paraná | D26: 78781 | E26: 1156799 | F26: =+E26/D26 -> 14.683730848808723 | G26: 14 | H26: 131 | I26: =+G26/H26 -> 0.10687022900763359 | J26: 564885.67 | K26: 4454394.29 | L26: =+J26/K26 -> 0.12681537224222691 | M26: =189/12 -> 15.75 | N26: =(M26*10000)/E26 -> 0.13615156997888136 | O26: 0 | P26: =+O26/M26 -> 0 | Q26: 0 | R26: =+Q26/M26 -> 0 | S26: =53/12 -> 4.416666666666667 | T26: =+S26/M26 -> 0.28042328042328046 | U26: Delitos c/la fe pública (53%) | V26: Estupefacientes (46%)-Tenencia simple-
B27: POSADAS | C27: Posadas | D27: 29801 | E27: 963869 | F27: =+E27/D27 -> 32.343511962685817 | G27: 12 | H27: 129 | I27: =+G27/$H$27 -> 9.3023255813953487E-2 | J27: 614380.42 | K27: 4503025.53 | L27: =+J27/$K$27 -> 0.13643725000155618 | M27: =92/12 -> 7.666666666666667 | N27: =(M27*10000)/E27 -> 7.9540546139222928E-2 | O27: =56/12 -> 4.666666666666667 | P27: =+O27/M27 -> 0.60869565217391308 | Q27: 0 | R27: =+Q27/M27 -> 0 | S27: =19/12 -> 1.5833333333333333 | T27: =+S27/M27 -> 0.20652173913043476 | U27: Estupefacientes (55%) | V27: Estupefacientes (82%)-Transporte de estupefacientes simple-
B28: RESISTENCIA | C28: Resistencia | D28: 99633 | E28: 983087 | F28: =+E28/D28 -> 9.8670821916433304 | G28: 10 | H28: 163 | I28: =+G28/$H$28 -> 6.1349693251533742E-2 | J28: 667181.32 | K28: 5733600.9900000002 | L28: =+J28/$K$28 -> 0.11636340253945714 | M28: =21/12 -> 1.75 | N28: =(M28*10000)/E28 -> 1.7801069488254856E-2 | O28: =3/12 -> 0.25 | P28: =+O28/M28 -> 0.14285714285714285 | Q28: 0 | R28: =+Q28/M28 -> 0 | S28: =14/12 -> 1.1666666666666667 | T28: =+S28/M28 -> 0.66666666666666674 | U28: Delitos c/la fe pública (51%) | V28: Estupefacientes (83%)-Transporte de estupefacientes simple-
C29: Formosa | D29: 72066 | E29: 485700 | F29: =+E29/D29 -> 6.7396553159603698 | G29: 12 | I29: =+G29/$H$28 -> 7.3619631901840496E-2 | J29: 698739.99 | L29: =+J29/$K$28 -> 0.12186756476753015 | M29: =102/12 -> 8.5 | N29: =(M29*10000)/E29 -> 0.17500514721021207 | O29: =14/12 -> 1.1666666666666667 | P29: =+O29/M29 -> 0.13725490196078433 | Q29: 0 | R29: =+Q29/M29 -> 0 | S29: =16/12 -> 1.3333333333333333 | T29: =+S29/M29 -> 0.15686274509803921
B30: CORDOBA | C30: Córdoba Nº 1 | D30: 165321 | E30: 3061611 | F30: =+E30/D30 -> 18.519189939572104 | G30: 34 | H30: 409 | I30: =+G30/$H$30 -> 8.3129584352078234E-2 | J30: 1435073.53 | K30: 11750386.84 | L30: =+J30/$K$30 -> 0.12212989661879081 | M30: =119/12 -> 9.9166666666666661 | N30: =(M30*10000)/E30 -> 3.2390354838242562E-2 | O30: =57/12 -> 4.75 | P30: =+O30/M30 -> 0.47899159663865548 | Q30: =10/12 -> 0.83333333333333337 | R30: =+Q30/M30 -> 8.4033613445378158E-2 | S30: =29/12 -> 2.4166666666666665 | T30: =+S30/M30 -> 0.24369747899159663 | U30: Estupefacientes (47%) Delitos c/fe pública (36%) | V30: Estupefacientes (69%)- Tenencia simple-.
C31: Córdoba Nº 2 | D31: 165321 | E31: 3061611 | F31: =+E31/D31 -> 18.519189939572104 | J31: 606929.79 | L31: =+J31/$K$30 -> 5.1651898636555872E-2 | M31: =107/12 -> 8.9166666666666661 | N31: =(M31*10000)/E31 -> 2.9124100568839954E-2 | O31: =6/12 -> 0.5 | P31: =+O31/M31 -> 5.6074766355140193E-2 | Q31: =0/12 -> 0 | R31: =+Q31/M31 -> 0 | S31: =37/12 -> 3.0833333333333335 | T31: =+S31/M31 -> 0.34579439252336452
C32: La Rioja | D32: 89680 | E32: 289820 | F32: =+E32/D32 -> 3.2317127564674397 | G32: 13 | I32: =+G32/$H$30 -> 3.1784841075794622E-2 | J32: 446155.15 | L32: =+J32/$K$30 -> 3.7969401014205248E-2 | M32: =5/12 -> 0.41666666666666669 | N32: =(M32*10000)/E32 -> 1.4376739585489845E-2 | O32: =2/12 -> 0.16666666666666666 | P32: =+O32/M32 -> 0.4 | Q32: =0/12 -> 0 | R32: =+Q32/M32 -> 0 | S32: =2/12 -> 0.16666666666666666 | T32: =+S32/M32 -> 0.4
B33: SAN MARTIN | C33: San Martín Nº 1 | D33: 21224 | E33: 6387519 | F33: =+E33/D33 -> 300.95735959291369 | H33: 639 | J33: 701273.4 | K33: 19409130.879999999 | L33: =+J33/$K$33 -> 3.6131107793323305E-2 | M33: =115/12 -> 9.5833333333333339 | N33: =(M33*10000)/E33 -> 1.5003216950639732E-2 | O33: =5/12 -> 0.41666666666666669 | P33: =+O33/M33 -> 4.3478260869565216E-2 | Q33: =71/12 -> 5.916666666666667 | R33: =+Q33/M33 -> 0.61739130434782608 | S33: =50/12 -> 4.166666666666667 | T33: =+S33/M33 -> 0.43478260869565216 | U33: Estupefacientes (65%) | V33: Estupefacientes (81%) Tenencia con fines de comercialización
C34: San Martín Nº 2 | D34: 21224 | E34: 6387519 | F34: =+E34/D34 -> 300.95735959291369 | J34: 603707.6 | L34: =+J34/$K$33 -> 3.1104308777786964E-2 | M34: =131/12 -> 10.916666666666666 | N34: =(M34*10000)/E34 -> 1.7090621048120039E-2 | O34: =4/12 -> 0.33333333333333331 | P34: =+O34/M34 -> 3.0534351145038167E-2 | Q34: =43/12 -> 3.5833333333333335 | R34: =+Q34/M34 -> 0.32824427480916035 | S34: =18/12 -> 1.5 | T34: =+S34/M34 -> 0.13740458015267176
C35: San Martín Nº 3 | D35: 21224 | E35: 6387519 | F35: =+E35/D35 -> 300.95735959291369 | G35: 59 | I35: =+G35/H33 -> 9.2331768388106417E-2 | J35: 725016.42 | L35: =+J35/$K$33 -> 3.7354399044579996E-2 | M35: =127/12 -> 10.583333333333334 | N35: =(M35*10000)/E35 -> 1.6568770023749964E-2 | O35: =0/12 -> 0 | P35: =+O35/M35 -> 0 | Q35: =41/12 -> 3.4166666666666665 | R35: =+Q35/M35 -> 0.32283464566929132 | S35: =53/12 -> 4.416666666666667 | T35: =+S35/M35 -> 0.41732283464566927
C36: San Martín Nº 4 | D36: 21224 | E36: 6387519 | F36: =+E36/D36 -> 300.95735959291369 | J36: 619501.07 | L36: =+J36/$K$33 -> 3.1918022184000028E-2 | M36: =132/12 -> 11 | N36: =(M36*10000)/E36 -> 1.7221083804212559E-2 | O36: =2/12 -> 0.16666666666666666 | P36: =+O36/M36 -> 1.515151515151515E-2 | Q36: 0 | R36: =+Q36/M36 -> 0 | S36: =35/12 -> 2.9166666666666665 | T36: =+S36/M36 -> 0.26515151515151514
C37: San Martín Nº 5 | D37: 21224 | E37: 6387519 | F37: =+E37/D37 -> 300.95735959291369 | J37: 635882.26 | L37: =+J37/$K$33 -> 3.2762016183591217E-2 | M37: =124/12 -> 10.333333333333334 | N37: =(M37*10000)/E37 -> 1.6177381755472404E-2 | O37: =33/12 -> 2.75 | P37: =+O37/M37 -> 0.2661290322580645 | Q37: =3/12 -> 0.25 | R37: =+Q37/M37 -> 2.4193548387096774E-2 | S37: =73/12 -> 6.083333333333333 | T37: =+S37/M37 -> 0.58870967741935476
B38: TUCUMAN | C38: Tucumán | D38: 22524 | E38: 1336664 | F38: =+E38/D38 -> 59.343988634345585 | G38: 14 | H38: 258 | I38: =+G38/$H$38 -> 5.4263565891472867E-2 | J38: 627253.81 | K38: 8015161.6699999999 | L38: =+J38/$K$38 -> 7.8258410226178271E-2 | M38: =44/12 -> 3.6666666666666665 | N38: =(M38*10000)/E38 -> 2.7431476172521039E-2 | O38: =17/12 -> 1.4166666666666667 | P38: =+O38/M38 -> 0.38636363636363641 | Q38: 0 | R38: =+Q38/M38 -> 0 | S38: =19/12 -> 1.5833333333333333 | T38: =+S38/M38 -> 0.43181818181818182 | U38: Estupefacientes (38%) Delitos c/la administrac. Pública (17%) | V38: Estupefacientes (73%)- Tenencia simple-
C39: Catamarca | D39: 102602 | E39: 333661 | F39: =+E39/D39 -> 3.2519931385353114 | G39: 13 | I39: =+G39/$H$38 -> 5.0387596899224806E-2 | J39: 640753.81 | L39: =+J39/$K$38 -> 7.9942718111136998E-2 | M39: =2/12 -> 0.16666666666666666 | N39: =(M39*10000)/E39 -> 4.9950898267003534E-3 | O39: =0/12 -> 0 | P39: =+O39/M39 -> 0 | Q39: 0 | R39: =+Q39/M39 -> 0 | S39: =3/12 -> 0.25 | T39: =+S39/M39 -> 1.5
C40: Santiago del Estero | D40: 136351 | E40: 806347 | F40: =+E40/D40 -> 5.9137593416989978 | G40: 8 | I40: =+G40/$H$38 -> 3.1007751937984496E-2 | J40: 437077.36 | L40: =+J40/$K$38 -> 5.4531321761847877E-2 | M40: =9/12 -> 0.75 | N40: =(M40*10000)/E40 -> 9.3012065525139923E-3 | O40: =1/12 -> 8.3333333333333329E-2 | P40: =+O40/M40 -> 0.1111111111111111 | Q40: =1/12 -> 8.3333333333333329E-2 | R40: =+Q40/M40 -> 0.1111111111111111 | S40: =6/12 -> 0.5 | T40: =+S40/M40 -> 0.66666666666666663
B41: SALTA | C41: Salta | D41: 155488 | E41: 1079422 | F41: =+E41/D41 -> 6.9421563078822803 | G41: 12 | H41: 169 | I41: =+G41/$H$41 -> 7.1005917159763315E-2 | J41: 655961.95 | K41: 5522076.6100000003 | L41: =+J41/$K$41 -> 0.11878899847425331 | M41: =192/12 -> 16 | N41: =(M41*10000)/E41 -> 0.14822747729803543 | O41: =6/12 -> 0.5 | P41: =+O41/M41 -> 3.125E-2 | Q41: 0 | R41: =+Q41/M41 -> 0 | S41: =105/12 -> 8.75 | T41: =+S41/M41 -> 0.546875 | U41: Estupefacientes (72%) | V41: Estupefacientes (89%)-Transporte de estupefacientes simple-
C42: Jujuy | D42: 53219 | E42: 611484 | F42: =+E42/D42 -> 11.489956594449351 | G42: 13 | I42: =+G42/$H$41 -> 7.6923076923076927E-2 | J42: 671192.19 | L42: =+J42/$K$41 -> 0.12154706234689487 | M42: =88/12 -> 7.333333333333333 | N42: =(M42*10000)/E42 -> 0.11992682283319486 | O42: =34/12 -> 2.8333333333333335 | P42: =+O42/M42 -> 0.38636363636363641 | Q42: 0 | R42: =+Q42/M42 -> 0 | S42: =37/12 -> 3.0833333333333335 | T42: =+S42/M42 -> 0.42045454545454547
B43: COMODORO RIVADAVIA | C43: Comodoro Rivadavia | D43: 245198 | E43: 398259 | F43: =+E43/D43 -> 1.6242342922862341 | G43: 12 | H43: 246 | I43: =+G43/$H$43 -> 4.878048780487805E-2 | J43: 806548.22 | K43: 10036828.74 | L43: =+J43/$K$43 -> 8.0358870405514163E-2 | M43: =71/12 -> 5.916666666666667 | N43: =(M43*10000)/E43 -> 0.14856328837933774 | O43: =10/12 -> 0.83333333333333337 | P43: =+O43/M43 -> 0.14084507042253522 | Q43: 0 | R43: =+Q43/M43 -> 0 | S43: =35/12 -> 2.9166666666666665 | T43: =+S43/M43 -> 0.49295774647887319 | U43: Estupefacientes (50%) | V43: Estupefacientes (48%)- Tenencia con fines de comercialización-
C44: Tierra del Fuego | D44: 21571 | E44: 100799 | F44: =+E44/D44 -> 4.6728941634602013 | G44: 13 | I44: =+G44/$H$43 -> 5.2845528455284556E-2 | J44: 917325.16 | L44: =+J44/$K$43 -> 9.1395916355946516E-2 | M44: =17/12 -> 1.4166666666666667 | N44: =(M44*10000)/E44 -> 0.14054372232528764 | O44: =1/12 -> 8.3333333333333329E-2 | P44: =+O44/M44 -> 5.8823529411764698E-2 | Q44: 0 | R44: =+Q44/M44 -> 0 | S44: =8/12 -> 0.66666666666666663 | T44: =+S44/M44 -> 0.47058823529411759
B45: CORRIENTES | C45: Corrientes | D45: 88199 | E45: 929236 | F45: =+E45/D45 -> 10.535675007653149 | G45: 8 | H45: 119 | I45: =+G45/$H$45 -> 6.7226890756302518E-2 | J45: 559825.61 | K45: 3886181.19 | L45: =+J45/K45 -> 0.14405545769213093 | M45: =41/12 -> 3.4166666666666665 | N45: =(M45*10000)/E45 -> 3.6768556821589631E-2 | O45: =1/12 -> 8.3333333333333329E-2 | P45: =+O45/M45 -> 2.4390243902439025E-2 | Q45: 0 | R45: =+Q45/M45 -> 0 | S45: =18/12 -> 1.5 | T45: =+S45/M45 -> 0.43902439024390244 | U45: Estupefacientes (44%) | V45: Estupefacientes (75%)-Transporte de estupefacienes simple-
B46: FUENTE: Oficina de Estadísticas del Poder Judicial de la Nación.
C49: Ver Gráficos: | D49: F.1
D50: F.2
D51: F.3