B6: PODER JUDICIAL DE LA NACION
B7: JURISDICCION CAPITAL FEDERAL
B9: CUADRO C
B11: JUZGADOS NACIONALES DE PRIMERA INSTANCIA -AÑO 2001-
B13: JURISDICCION | C13: Fuero | D13: Superficie en Km2 | E13: Población | F13: Densidad de población (habitantes x km2) | G13: Recursos Humanos | H13: Total de RRHH en la Jurisdicción | I13: Porcentaje de RRHH respecto a toda la jurisdicción (1º inst .+ TOC + Cam) | J13: Gasto anual en haberes ( en $) | K13: Total anual en haberes en la Jurisdicción (1ra. Inst. + TOC + Cámara) | L13: Porcentaje de gasto en haberes respecto de toda la jurisdicción | M13: Causas ingresadas por mes en Juzgados | N13: Causas ingresadas cada 10.000 hab por mes | O13: Causas elevadas a juicio por mes | P13: Porcentaje de elevación a juicio sobre ingreso | Q13: Delitos cometidos con mas frecuencia y/o Objetos de Litigio en el Fuero
C14: Instrucción | D14: 200 | E14: 2768772 | F14: 13843.9 | G14: =594+11 -> 605 | H14: 13867 | I14: =+G14/$H$14 -> 4.3628758924064329E-2 | J14: =18065595.73+333253.31 -> 18398849.039999999 | K14: 416308045 | L14: =+J14/$K$14 -> 4.419527621667748E-2 | M14: =118644/12 -> 9887 | N14: =(M14*10000)/2768772 -> 35.708971341807846 | O14: =5327/12 -> 443.91666666666669 | P14: =+O14/M14 -> 4.4899025656586093E-2 | Q14: Delitos c/la propiedad (21,47%): Robo Simple(18%)
C15: Correccional | G15: 225 | I15: =+G15/$H$14 -> 1.6225571500685081E-2 | J15: 7659872.3499999996 | L15: =+J15/$K$14 -> 1.8399529968247431E-2 | M15: =82828/12 -> 6902.333333333333 | N15: =(M15*10000)/2768778 -> 24.929168511644246 | O15: =1658/12 -> 138.16666666666666 | P15: =+O15/M15 -> 2.0017385425218526E-2 | Q15: Delitos c/las personas (44,91%) y Delitos c/la propiedad (28,09%)
C16: Federal | G16: 375 | I16: =+G16/$H$14 -> 2.7042619167808465E-2 | J16: 8430607.1999999993 | L16: =+J16/$K$14 -> 2.0250887056482415E-2 | M16: =21960/12 -> 1830 | N16: =(M16*10000)/2768778 -> 6.6094139725178396 | O16: =431/12 -> 35.916666666666664 | P16: =+O16/M16 -> 1.9626593806921673E-2 | Q16: Estupefacientes (48,93%) y Delitos c/ el orden público(17,70%)
C17: Menores | G17: 166 | I17: =+G17/$H$14 -> 1.1970866084949881E-2 | J17: 8612310.4600000009 | L17: =+J17/$K$14 -> 2.0687350541111933E-2 | M17: =6529/12 -> 544.08333333333337 | N17: =(M17*10000)/2768778 -> 1.9650666587690793 | O17: =845/12 -> 70.416666666666671 | P17: =+O17/M17 -> 0.12942257619849901 | Q17: Delitos c/la propiedad (80,66%) y Delitos c/las personas (4,55%)
B18: CAPITAL | C18: Penal Económico | G18: 154 | I18: =+G18/$H$14 -> 1.110550227158001E-2 | J18: 4996957.94 | L18: =+J18/$K$14 -> 1.2003029967869106E-2 | M18: =4181/12 -> 348.41666666666669 | N18: =(M18*10000)/2768778 -> 1.2583770409424906 | O18: =352/12 -> 29.333333333333332 | P18: =+O18/M18 -> 8.4190385075340823E-2 | Q18: Art. 302 C.P. (29,49%) y DGI (28,44%)-Ley 11683-
B19: FEDERAL | C19: Civil | G19: 1705 | I19: =+G19/$H$14 -> 0.12295377514963583 | J19: =41330834.74+13540053.54 -> 54870888.280000001 | L19: =+J19/$K$14 -> 0.13180357415384564 | M19: =113137/12 -> 9428.0833333333339 | N19: =(M19*10000)/2768778 -> 34.051423889287385 | O19: --- | P19: --- | Q19: Patrimonial:Sucesión (15,72 %) y Ejecuciones (24,38 %). Familia: Art 482 (24,64 %) y Divorcios (25,05 %)
C20: Comercial | G20: 657 | I20: =+G20/$H$14 -> 4.7378668782000435E-2 | J20: 18465038.18 | L20: =+J20/$K$14 -> 4.4354266994768257E-2 | M20: =164295/12 -> 13691.25 | N20: =(M20*10000)/2768778 -> 49.448709864062778 | O20: --- | P20: --- | Q20: Ejecutivos (67,01 %)
C21: Trabajo | G21: 1121 | I21: =+G21/$H$14 -> 8.0839402898968779E-2 | J21: 33602154.039999999 | L21: =+J21/$K$14 -> 8.0714640141052285E-2 | M21: =22355/12 -> 1862.9166666666667 | N21: =(M21*10000)/2768778 -> 6.7282991509852605 | O21: --- | P21: --- | Q21: Rubro A (75,71 % -Despidos, Indemnizaciones, etc-) Ver Jurisdicción Capital Federal
C22: Seguridad Social | G22: 133 | I22: =+G22/$H$14 -> 9.5911155981827367E-3 | J22: 4304922.27 | L22: =+J22/$K$14 -> 1.034071361748486E-2 | M22: =51196/12 -> 4266.333333333333 | N22: =(M22*10000)/2768778 -> 15.408723029919093 | O22: --- | P22: --- | Q22: Ejecución Fiscal (37,87 %) y Reajustes Varios (20,25 %)
C23: Civil y Comercial Fed | G23: 200 | I23: =+G23/$H$14 -> 1.4422730222831182E-2 | J23: 6366129.1200000001 | L23: =+J23/$K$14 -> 1.5291871479447388E-2 | M23: =11475/12 -> 956.25 | N23: =(M23*10000)/2768778 -> 3.4536896782623958 | O23: --- | P23: --- | Q23: Ciudadanía (24,04 %) y Propiedad Industrial (11,41 %)
C24: Contencioso Adm. Fed. | G24: 219 | I24: =+G24/$H$14 -> 1.5792889594000145E-2 | J24: 6441631.9299999997 | L24: =+J24/$K$14 -> 1.5473234320994204E-2 | M24: =30358/12 -> 2529.8333333333335 | N24: =(M24*10000)/2768778 -> 9.1370031592758014 | O24: --- | P24: --- | Q24: Ejecución Fiscal (71,02 %) y Amparos (8,88 %)
B25: FUENTE: Oficina de Estadísticas del Poder Judicial de la Nación.
B29: Ver Gráfico: | C29: C.1
C30: C.2