B6: PODER JUDICIAL DE LA NACION
B7: JURISDICCIONES FEDERALES DEL INTERIOR
B9: CUADRO D
B11: JUZGADOS FEDERALES DE PRIMERA INSTANCIA -AÑO 2001-
B13: JURISDICCIONES | C13: Juzgados | D13: Superficie en Km2 | E13: Población | F13: Densidad de población (habitantes x km2) | G13: Recursos Humanos | H13: Total de RRHH en la Jurisdicción | I13: Porcentaje de RRHH respecto a toda la jurisdicción (1º inst .+ TOC + Cam) | J13: Gasto anual en haberes (en $) | K13: Total anual en haberes en la Jurisdicción | L13: Porcentaje de gasto en haberes respecto de toda la jurisdicciòn | M13: Causas ingresadas por mes en Juzgados (Competencia Penal) | N13: Causas ingresadas cada 10.000 hab por mes (Competencia Penal) | O13: Causas elevadas a juicio por mes | P13: Causas elevadas a juicio por mes | Q13: Porcentaje mensual de elevacion a juicio sobre ingreso | R13: Causas ingresadas por mes en Juzgados (Competencia Civil) | S13: Causas ingresadas cada 10.000 hab por mes (Competencia Civil) | T13: Delitos cometidos con mas frecuencia y/o Objetos de Litigio en la Jurisdicción Federal
B15: LA PLATA | C15: La Plata Nros. 1 y 3 | D15: 9470 | E15: 2263520 | F15: 239 | H15: 435 | J15: =831434.28+692567.72 -> 1524002 | K15: 12223983.470000001 | L15: =+J15/K15 -> 0.12467310707186353 | M15: =(1984+1827)/12 -> 317.58333333333331 | N15: =(M15*10000)/2263520 -> 1.4030507056855397 | P15: =49+81 -> 130 | Q15: =+P15/M15 -> 0.40934138021516664 | R15: ----- | S15: ----- | T15: Comp. Penal: Delitos c/ fé pública (37,07%)-Falsificación de moneda- y Estupefacientes (23,25%)-Tenencia simple- Comp. Civil: Ejecutivos (61,7%) y Cautelares (22,5%)
C16: La Plata Nros. 2 y 4 | D16: 9470 | E16: 2263520 | F16: 239 | G16: 128 | I16: =+G16/H15 -> 0.29425287356321839 | J16: =856203.41+834707.76 -> 1690911.17 | L16: =+J16/K15 -> 0.13832734428591303 | M16: ---- | N16: ---- | P16: ---- | Q16: ---- | R16: =(6176+4867)/12 -> 920.25 | S16: =(R16*10000)/2263520 -> 4.0655704389623244
C17: Lomas de Zamora Nros. 1 y 2 | D17: 5089 | E17: 2113836 | F17: 415 | J17: =1100235.59+613283.14 -> 1713518.73 | L17: =+J17/K15 -> 0.14017678723186297 | M17: =(1125+1339)/12 -> 205.33333333333334 | N17: =(M17*10000)/2113836 -> 0.9713777858515672 | P17: =(88+66)/12 -> 12.833333333333334 | Q17: =+P17/M17 -> 6.25E-2 | R17: ---- | S17: ----
C18: Lomas de Zamora Nº 3 | D18: 5089 | E18: 2113836 | F18: 415 | G18: 106 | I18: =+G18/H15 -> 0.24367816091954023 | J18: 1007454.25 | L18: =+J18/K15 -> 8.2416198653449249E-2 | M18: ---- | N18: ---- | P18: ---- | Q18: ---- | R18: =8731/12 -> 727.58333333333337 | S18: =(R18*10000)/2113836 -> 3.4420046462134879
C19: Junín | D19: 61101 | E19: 526046 | F19: =+E19/D19 -> 8.6094499271697682 | G19: 25 | I19: =+G19/H15 -> 5.7471264367816091E-2 | J19: =729642.35 -> 729642.35 | L19: =+J19/K15 -> 5.9689409085891043E-2 | M19: =642/12 -> 53.5 | N19: =(M19*10000)/526046 -> 1.0170213251312623 | P19: =32/12 -> 2.6666666666666665 | Q19: =+P19/M19 -> 4.9844236760124609E-2 | R19: =1929/12 -> 160.75 | S19: =(R19*10000)/526046 -> 3.0558164114925312
B20: MAR DEL PLATA | C20: Mar del Plata Nros. 1 y 3 | D20: 22587 | E20: 773462 | F20: =+E20/D20 -> 34.243679992916277 | H20: 190 | J20: =572265.18+537750.77 -> 1110015.95 | K20: 5912975.0099999998 | L20: =+J20/$K$20 -> 0.1877254593707475 | M20: =(1071+902)/12 -> 164.41666666666666 | N20: =(M20*10000)/773462 -> 2.1257239097288121 | P20: =(80+41)/12 -> 10.083333333333334 | Q20: =+P20/M20 -> 6.1327927014698434E-2 | R20: ---- | S20: ---- | T20: Comp. Penal: Estupefacientes (50,31%) Delitos c/la fé pública (24,39%). [**Tenencia simple y Falsificación de moneda] Comp. Civil: Ejecuciones Fiscales (65,8%) y Ejecutivos (13,7%)
C21: Mar del Plata Nº 2 | D21: 22587 | E21: 773462 | F21: 34.2 | G21: 80 | I21: =+G21/$H$20 -> 0.42105263157894735 | J21: 883286.86 | L21: =+J21/$K$20 -> 0.1493811251537828 | M21: ---- | N21: ---- | P21: ---- | Q21: ---- | R21: =6345/12 -> 528.75 | S21: =(R21*10000)/773462 -> 6.8361470893204839
C22: Azul | D22: 62202 | E22: 478733 | F22: 7.7 | G22: 31 | I22: =+G22/$H$20 -> 0.16315789473684211 | J22: 1043357.72 | L22: =+J22/$K$20 -> 0.17645224582134672 | M22: =645/12 -> 53.75 | N22: =(M22*10000)/478733 -> 1.122755272772088 | P22: =34/12 -> 2.8333333333333335 | Q22: =+P22/M22 -> 5.271317829457365E-2 | R22: =2068/12 -> 172.33333333333334 | S22: =(R22*10000)/478733 -> 3.599779696267718
C23: Dolores | D23: 32950 | E23: 249505 | F23: 7.6 | G23: 22 | I23: =+G23/$H$20 -> 0.11578947368421053 | J23: 493860.5 | L23: =+J23/$K$20 -> 8.3521492846627132E-2 | M23: =876/12 -> 73 | N23: =(M23*10000)/249505 -> 2.9257930702791528 | P23: =36/12 -> 3 | Q23: =+P23/M23 -> 4.1095890410958902E-2 | R23: =1131/12 -> 94.25 | S23: =(R23*10000)/249505 -> 3.7774794092302759
B24: BAHIA BLANCA | C24: Bahía Blanca N° 1 | D24: 84134 | E24: 642235 | F24: =+E24/D24 -> 7.6334775477214922 | H24: 147 | J24: =925870.7 -> 925870.7 | K24: 5771058.3200000003 | L24: =+J24/$K$24 -> 0.16043343329096696 | M24: =537/12 -> 44.75 | N24: =(M24*10000)/642235 -> 0.69678544458025493 | P24: =61/12 -> 5.083333333333333 | Q24: =+P24/M24 -> 0.11359404096834264 | R24: =1709/12 -> 142.41666666666666 | S24: =(R24*10000)/642235 -> 2.2175164334965651 | T24: Comp. Penal:Delitos c/la fe pública (30,42%)-Falsificación de moneda-, Infracción Ley 23737(28,83%)-Tenencia Simple- y Comp. Civil: Ejecuciones Fiscales (68,9%) Ejecutivos (10,4%)
C25: Bahía Blanca N° 2 | D25: 84134 | E25: 642235 | F25: 7.6 | G25: 55 | I25: =+G25/H24 -> 0.37414965986394561 | J25: 825849.02 | L25: =+J25/$K$24 -> 0.14310183231695361 | M25: =370/12 -> 30.833333333333332 | N25: =(M25*10000)/642235 -> 0.48009425418006385 | P25: =25/12 -> 2.0833333333333335 | Q25: =+P25/M25 -> 6.7567567567567571E-2 | R25: =2125/12 -> 177.08333333333334 | S25: =(R25*10000)/642235 -> 2.7572980814395565
C26: Santa Rosa (La Pampa) | D26: 143440 | E26: 298460 | F26: 2.1 | G26: 25 | I26: =+G26/$H24 -> 0.17006802721088435 | J26: 838409.17 | L26: =+J26/$K$24 -> 0.14527823555246969 | M26: =536/12 -> 44.666666666666664 | N26: =(M26*10000)/298460 -> 1.4965712881681519 | P26: =57/12 -> 4.75 | Q26: =+P26/M26 -> 0.10634328358208955 | R26: =1094/12 -> 91.166666666666671 | S26: =(R26*10000)/298460 -> 3.0545690098058929
B27: MENDOZA | C27: Mendoza Nros. 1 y 3 | D27: 61827 | E27: 1336358 | F27: 21.6 | H27: 326 | J27: =774768.3+577931.9 -> 1352700.2 | K27: 11150052.640000001 | L27: =+J27/$K$27 -> 0.12131783083671613 | M27: =(971+1084)/12 -> 171.25 | N27: =(M27*10000)/1336358 -> 1.2814679898649912 | P27: =(104+108)/12 -> 17.666666666666668 | Q27: =+P27/M27 -> 0.10316301703163018 | R27: ---- | S27: ---- | T27: Comp. Penal:Estupefacientes (30,17%) y Delitos c/fe publica (23,83%)-Falsificación de moneda- Comp. Civil: Ejecuciones Fiscales (58,9%) Ejecutivos (10,3%).
C28: Mendoza Nº 2 | D28: 61827 | E28: 1336358 | F28: 21.6 | G28: 88 | I28: 00.27 | J28: 1069383.63 | L28: =+J28/$K$27 -> 9.5908392949075785E-2 | M28: ---- | N28: ---- | P28: ---- | Q28: ---- | R28: =6612/12 -> 551 | S28: =(R28*10000)/1336358 -> 4.123146641842979
C29: San Rafael | D29: 87000 | E29: 240227 | F29: 2.8 | G29: 32 | I29: 00.1 | J29: 876444.6 | L29: =+J29/$K$27 -> 7.8604525763028135E-2 | M29: =620/12 -> 51.666666666666664 | N29: =(M29*10000)/240227 -> 2.1507435328529541 | P29: =27/12 -> 2.25 | Q29: =+P29/M29 -> 4.3548387096774194E-2 | R29: =1186/12 -> 98.833333333333329 | S29: =(R29*10000)/240227 -> 4.1141642418767805
C30: San Juan Nros. 1 y 2 | D30: 89651 | E30: 622094 | F30: 6.9 | G30: 47 | I30: 00.14 | J30: =734768.87+809883.18 -> 1544652.05 | L30: =+J30/$K$27 -> 0.13853316211787858 | M30: =719/12 -> 59.916666666666664 | N30: =(M30*10000)/622094 -> 0.96314490521796803 | P30: =46/12 -> 3.8333333333333335 | Q30: =+P30/M30 -> 6.397774687065369E-2 | R30: =(345+2095)/12 -> 203.33333333333334 | S30: =(R30*10000)/622094 -> 3.2685306936465124
C31: San Luis | D31: 76749 | E31: 366900 | F31: 4.8 | G31: 30 | I31: 00.09 | J31: 937594.88 | L31: =+J31/$K$27 -> 8.4088829916053195E-2 | M31: =554/12 -> 46.166666666666664 | N31: =(M31*10000)/366900 -> 1.2582901789770145 | P31: =33/12 -> 2.75 | Q31: =+P31/M31 -> 5.9566787003610108E-2 | R31: =1433/12 -> 119.41666666666667 | S31: =(R31*10000)/366900 -> 3.2547469791950578
B32: ROSARIO | C32: Rosario Nros. 1 y 2 | D32: 27559 | E32: 1712639 | F32: 62.1 | H32: 284 | J32: =712102.97+762245.3 -> 1474348.27 | K32: 9932688.5199999996 | L32: =+J32/$K$32 -> 0.14843395793911396 | M32: ---- | N32: ---- | P32: ---- | Q32: ---- | R32: =(7131+5271)/12 -> 1033.5 | S32: =(R32*10000)/1712639 -> 6.0345466849698042 | T32: Comp. Penal: Estupefacientes (48,47%)-Tenencia para consumo personal-. Comp. Civil: Ejecuciones Fiscales (66,5%)
C33: Rosario Nros. 3 y 4 | D33: 27559 | E33: 1712639 | F33: 62.1 | G33: 84 | I33: 00.31 | J33: =518043.64+502951.1 -> 1020994.74 | L33: =+J33/$K$32 -> 0.10279137797829585 | M33: =(669+809)/12 -> 123.16666666666667 | N33: =(M33*10000)/1712639 -> 0.71916303825071526 | P33: =(73+62)/12 -> 11.25 | Q33: =+P33/M33 -> 9.1339648173207028E-2 | R33: ---- | S33: ----
C34: Santa Fe Nros. 1 y 2 | D34: 34775 | E34: 944635 | F34: 27.2 | G34: 64 | I34: 00.23 | J34: =957314.5+1027497.2 -> 1984811.7 | L34: =+J34/$K$32 -> 0.1998262299279269 | M34: =(817+608)/12 -> 118.75 | N34: =(M34*10000)/944635 -> 1.257099302905355 | P34: =(50+29)/12 -> 6.583333333333333 | Q34: =+P34/M34 -> 5.5438596491228065E-2 | R34: =(2695+2705)/12 -> 450 | S34: =(R34*10000)/944635 -> 4.7637447267992403
C35: San Nicolás Nros. 1 y 2 | D35: 8814 | E35: 383823 | F35: 43.5 | G35: 43 | I35: 00.15 | J35: =824953.52+652572.01 -> 1477525.53 | L35: =+J35/$K$32 -> 0.14875383709304116 | M35: =538/12 -> 44.833333333333336 | N35: =(M35*10000)/383823 -> 1.1680731309310108 | P35: =32/12 -> 2.6666666666666665 | Q35: =+P35/M35 -> 5.9479553903345715E-2 | R35: =2981/12 -> 248.41666666666666 | S35: =(R35*10000)/383823 -> 6.4721672923891127
B36: GENERAL ROCA | C36: General Roca | D36: 72887 | E36: 332030 | F36: 4.6 | G36: 30 | H36: 213 | I36: 00.14 | J36: 919342.18 | K36: 7868620.0599999996 | L36: =+J36/$K$36 -> 0.11683651936296439 | M36: =565/12 -> 47.083333333333336 | N36: =(M36*10000)/332030 -> 1.4180445542069493 | P36: =17/12 -> 1.4166666666666667 | Q36: =+P36/M36 -> 3.0088495575221239E-2 | R36: =1964/12 -> 163.66666666666666 | S36: =(R36*10000)/332030 -> 4.9292734592255716 | T36: Comp. Penal: Delitos c/la fe pública (22,24%)-Falsificación de moneda- y Estupefacientes (18,72%)-Tenencia p/consumo personal-. Comp. Civil:Ejecuciones Fiscales (67,4%) Amparos (9,8%)
C37: Viedma | D37: 78647 | E37: 89241 | F37: 1.1 | G37: 28 | I37: 00.13 | J37: 978888.89 | L37: =+J37/$K$36 -> 0.12440413726114005 | M37: =292/12 -> 24.333333333333332 | N37: =(M37*10000)/89241 -> 2.7266988641244865 | P37: =2/12 -> 0.16666666666666666 | Q37: =+P37/M37 -> 6.8493150684931503E-3 | R37: =557/12 -> 46.416666666666664 | S37: =(R37*10000)/89241 -> 5.2012714634155444
C38: Neuquén Nros. 1 y 2 | D38: 27727 | E38: 335707 | F38: 12.1 | G38: =35+11+5 -> 51 | I38: 00.24 | J38: =1258826.09+327006.68 -> 1585832.77 | L38: =+J38/$K$36 -> 0.20153886677812222 | M38: =776/12 -> 64.666666666666671 | N38: =(M38*10000)/335707 -> 1.926282939190028 | P38: =35/12 -> 2.9166666666666665 | Q38: =+P38/M38 -> 4.5103092783505147E-2 | R38: =3148/12 -> 262.33333333333331 | S38: =(R38*10000)/335707 -> 7.814353985270885
C39: Bariloche | D39: 77164 | E39: 186069 | F39: 2.4 | G39: 26 | I39: 00.12 | J39: 864831.96 | L39: =+J39/$K$36 -> 0.1099089743062267 | M39: =309/12 -> 25.75 | N39: =(M39*10000)/186069 -> 1.3838952216650813 | P39: =5/12 -> 0.41666666666666669 | Q39: =+P39/M39 -> 1.6181229773462785E-2 | R39: =1474/12 -> 122.83333333333333 | S39: =(R39*10000)/186069 -> 6.601493711114335
C40: Zapala | D40: 66351 | E40: 137608 | F40: 2.1 | G40: 24 | I40: 00.11 | J40: 790943.91 | L40: =+J40/$K$36 -> 0.10051875728766603 | M40: =243/12 -> 20.25 | N40: =(M40*10000)/137608 -> 1.4715714202662635 | P40: =6/12 -> 0.5 | Q40: =+P40/M40 -> 2.4691358024691357E-2 | R40: =423/12 -> 35.25 | S40: =(R40*10000)/137608 -> 2.5616243241671994
B41: PARANA | C41: Paraná | D41: 35193 | E41: 563890 | F41: 16 | G41: 30 | H41: 131 | I41: 00.23 | J41: 1000458.78 | K41: 4454394.29 | L41: =+J41/$K$41 -> 0.2246004091389045 | M41: =378/12 -> 31.5 | N41: =(M41*10000)/563890 -> 0.55861958892691832 | P41: =35/12 -> 2.9166666666666665 | Q41: =+P41/M41 -> 9.2592592592592587E-2 | R41: =2866/12 -> 238.83333333333334 | S41: =(R41*10000)/563890 -> 4.2354596345622966 | T41: Comp. Penal: Delitos c/fe pública (34,89%)-Falsificación o uso documento público- Estupefacientes(16,49%)-Tenencia Simple- Comp. Civil:Ejecuciones Fiscales (55,4%) Amparos (9,4%)
C42: Concepción del Uruguay | D42: 43588 | E42: 592909 | F42: 13.6 | G42: 41 | I42: 00.31 | J42: 1204429.34 | L42: =+J42/$K$41 -> 0.27039127243493305 | M42: =932/12 -> 77.666666666666671 | N42: =(M42*10000)/592909 -> 1.3099255816097695 | P42: =157/12 -> 13.083333333333334 | Q42: =+P42/M42 -> 0.16845493562231759 | R42: =2415/12 -> 201.25 | S42: =(R42*10000)/592909 -> 3.3942814158665158
B43: POSADAS | C43: Posadas | D43: 15143 | E43: 696737 | F43: =+E43/D43 -> 46.010499900944332 | G43: =33+27 -> 60 | H43: 129 | I43: =+G43/$H43 -> 0.46511627906976744 | J43: =614380.42+1709377.69 -> 2323758.11 | K43: 4503025.53 | L43: =+J43/$K$43 -> 0.51604373426681405 | M43: =1104/12 -> 92 | N43: =(M43*10000)/696737 -> 1.3204408550141589 | P43: =66/12 -> 5.5 | Q43: =+P43/M43 -> 5.9782608695652176E-2 | R43: =3258/12 -> 271.5 | S43: =(R43*10000)/696737 -> 3.8967357840906969 | T43: Comp. Penal: Delitos c/la fe pública (21,99%)-Falsificación de moneda-, Delitos c/la administración pública (17,81%)-Atentado y resistencia a la autoridad-. Comp. Civil: Ejecuciones Fiscales /74%) Ordinarios (13,3%)
C44: El Dorado | D44: 14658 | E44: 267132 | F44: =+E44/D44 -> 18.224314367580842 | G44: 22 | I44: =+G44/$H43 -> 0.17054263565891473 | J44: 708685.58 | L44: =+J44/$K$43 -> 0.1573798716615315 | M44: =738/12 -> 61.5 | N44: =(M44*10000)/267132 -> 2.3022326041058352 | P44: =19/12 -> 1.5833333333333333 | Q44: =+P44/M44 -> 2.5745257452574524E-2 | R44: =1048/12 -> 87.333333333333329 | S44: =(R44*10000)/267132 -> 3.2692950800852509
B45: RESISTENCIA | C45: Resistencia | D45: 99633 | E45: 983087 | F45: 9.9 | G45: 43 | H45: 163 | I45: =+G45/$H$45 -> 0.26380368098159507 | J45: 1237194.27 | K45: 5733600.9900000002 | L45: =+J45/$K$45 -> 0.21577962473457715 | M45: =1257/12 -> 104.75 | N45: =(M45*10000)/983087 -> 1.0655211593683978 | P45: =8/12 -> 0.66666666666666663 | Q45: =+P45/M45 -> 6.3643595863166263E-3 | R45: =2772/12 -> 231 | S45: =(R45*10000)/983087 -> 2.3497411724496406 | T45: Comp. Penal: Estupefacientes (27,15%)-Tenencia simple- Delitos c/ fe pública (21,83%)-Falsificación o uso de documentos destinados a acreditar la identidad- . Comp. Civil: Ejecuciones Fiscales (74,3%) Ejecutivos (7,1)
C46: Formosa | D46: 72066 | E46: 485700 | F46: 6.7 | G46: 50 | I46: =+G46/$H$45 -> 0.30674846625766872 | J46: 1314743.04 | L46: =+J46/$K$45 -> 0.22930494157041087 | M46: =751/12 -> 62.583333333333336 | N46: =(M46*10000)/485700 -> 1.2885182897536203 | P46: =102/12 -> 8.5 | Q46: =+P46/M46 -> 0.13581890812250333 | R46: =1822/12 -> 151.83333333333334 | S46: =(R46*10000)/485700 -> 3.1260723354608473
C47: Reconquista | D47: 70673 | E47: 340102 | F47: 4.8 | G47: 12 | I47: =+G47/$H$45 -> 7.3619631901840496E-2 | J47: 415533.69 | L47: =+J47/$K$45 -> 7.247342302415781E-2 | M47: =191/12 -> 15.916666666666666 | N47: =(M47*10000)/340102 -> 0.46799685584520717 | P47: =14/12 -> 1.1666666666666667 | Q47: =+P47/M47 -> 7.3298429319371736E-2 | R47: =967/12 -> 80.583333333333329 | S47: =(R47*10000)/340102 -> 2.3693872230487716
B48: CORDOBA | C48: Córdoba Nº 1 | D48: 69502 | E48: 2055280 | F48: 29.6 | H48: 409 | J48: 943521.49 | K48: 11750386.84 | L48: =+J48/$K$48 -> 8.0297057692442747E-2 | M48: =621/12 -> 51.75 | N48: =(M48*10000)/2055280 -> 0.2517905102954342 | P48: =51/12 -> 4.25 | Q48: =+P48/M48 -> 8.2125603864734303E-2 | R48: =3686/12 -> 307.16666666666669 | S48: =(R48*10000)/2055280 -> 1.4945246714154115 | T48: Comp. Penal: Estupefacientes (36,35%)-Tenencia para consumo personal- y Delitos c/ la fe pública (26,74%)-Falsificación o uso de documento público- Comp. Civil: Ejecuciones Fiscales (66,9%) y Ejecutivos (10,5%)
C49: Córdoba Nº 2 | D49: 69502 | E49: 2055280 | F49: 29.6 | G49: 128 | I49: =+G49/$H48 -> 0.31295843520782396 | J49: 989709.51 | L49: =+J49/$K$48 -> 8.4227823600741977E-2 | M49: =594/12 -> 49.5 | N49: =(M49*10000)/2055280 -> 0.24084309680432836 | P49: =53/12 -> 4.416666666666667 | Q49: =+P49/M49 -> 8.9225589225589236E-2 | R49: =3586/12 -> 298.83333333333331 | S49: =(R49*10000)/2055280 -> 1.4539786955224265
C50: Córdoba Nº 3 | D50: 69502 | E50: 2055280 | F50: 29.6 | J50: 1124690.83 | L50: =+J50/$K$48 -> 9.5715217321304807E-2 | M50: =598/12 -> 49.833333333333336 | N50: =(M50*10000)/2055280 -> 0.24246493584004777 | P50: =80/12 -> 6.666666666666667 | Q50: =+P50/M50 -> 0.13377926421404682 | R50: =3691/12 -> 307.58333333333331 | S50: =(R50*10000)/2055280 -> 1.4965519702100605
C51: Bell Ville | D51: 36614 | E51: 518650 | F51: 14.2 | G51: 27 | I51: =+G51/$H$48 -> 6.6014669926650366E-2 | J51: 715419.95 | L51: =+J51/$K$48 -> 6.0884799772260093E-2 | M51: =368/12 -> 30.666666666666668 | N51: =(M51*10000)/518650 -> 0.59127864005912789 | P51: =6/12 -> 0.5 | Q51: =+P51/M51 -> 1.6304347826086956E-2 | R51: =2016/12 -> 168 | S51: =(R51*10000)/518650 -> 3.239178636845657
C52: Río Cuarto | D52: 59205 | E52: 487681 | F52: 8.2 | G52: 45 | I52: =+G52/$H$48 -> 0.1100244498777506 | J52: 965735.8 | L52: =+J52/$K$48 -> 8.2187575026253359E-2 | M52: =244/12 -> 20.333333333333332 | N52: =(M52*10000)/487681 -> 0.41693921504699449 | P52: =39/12 -> 3.25 | Q52: =+P52/M52 -> 0.1598360655737705 | R52: =2106/12 -> 175.5 | S52: =(R52*10000)/487681 -> 3.5986638806925018
C53: La Rioja | D53: 89680 | E53: 289820 | F53: 3.2 | G53: 28 | I53: =+G53/$H$48 -> 6.8459657701711488E-2 | J53: 780099.74 | L53: =+J53/$K$48 -> 6.6389281529390054E-2 | M53: =305/12 -> 25.416666666666668 | N53: =(M53*10000)/289820 -> 0.87698111471488061 | P53: =3/12 -> 0.25 | Q53: =+P53/M53 -> 9.8360655737704909E-3 | R53: =1055/12 -> 87.916666666666671 | S53: =(R53*10000)/289820 -> 3.0334920525383575
B54: SAN MARTIN | C54: San Martín Nros. 1 y 2 Penal | D54: 298 | E54: 1514123 | F54: 5080.9 | G54: 83 | H54: 639 | I54: =+G54/$H$54 -> 0.12989045383411579 | J54: =+2129280.11+2282436.36 -> 4411716.47 | K54: 19409130.879999999 | L54: =+J54/$K$54 -> 0.22730108304571336 | M54: =(987+1133)/12 -> 176.66666666666666 | N54: =(M54*10000)/1514123 -> 1.1667920417737967 | P54: =(49+62)/12 -> 9.25 | Q54: =+P54/M54 -> 5.2358490566037738E-2 | R54: ---- | S54: ---- | T54: Comp. Penal: Estupefacientes (42,16%)-Tenencia simple-, Delitos c/fe pública (14,26)-Falsificación o uso de documento público-. Comp. Civil: Ejecutivos (91,6%)
C55: San Martín Nros. 1 y 2 Civil | D55: 2943 | E55: 5321295 | F55: 1808.1 | G55: 75 | I55: =+G55/$H$54 -> 0.11737089201877934 | M55: ---- | N55: ---- | P55: ---- | Q55: ---- | R55: =(13636+10732)/12 -> 2030.6666666666667 | S55: =(R55*10000)/5321295 -> 3.8161136841063441
C56: San Isidro Nros. 1 y 2 Penal | D56: 1371 | E56: 1018040 | F56: 742.6 | G56: 92 | I56: =+G56/$H$54 -> 0.14397496087636932 | J56: =1118532.62+900289.32 -> 2018821.94 | L56: =+J56/$K$54 -> 0.10401403094665515 | M56: =(1228+613)/12 -> 153.41666666666666 | N56: =(M56*10000)/1018040 -> 1.506980734221314 | P56: =(43+36)/12 -> 6.583333333333333 | Q56: =+P56/M56 -> 4.2911461162411735E-2 | R56: ---- | S56: ----
C57: Morón Nros. 1, 2 y 3 Penal | D57: 1274 | E57: 2789130 | F57: 2189.3 | G57: 138 | I57: =+G57/$H$54 -> 0.215962441314554 | J57: =1168482.83+1329219.83+961154.39 -> 3458857.05 | L57: =+J57/$K$54 -> 0.17820772456968462 | M57: =(651+1079+1394)/12 -> 260.33333333333331 | N57: =(M57*10000)/2789130 -> 0.93338544038224569 | P57: =(67+106+119)/12 -> 24.333333333333332 | Q57: =+P57/M57 -> 9.3469910371318826E-2 | R57: ---- | S57: ----
C58: Mercedes | D58: 13292 | E58: 413360 | F58: 31.1 | G58: 46 | I58: =+G58/$H$54 -> 7.1987480438184662E-2 | J58: 1408191.87 | L58: =+J58/$K$54 -> 7.2553061685573017E-2 | M58: =417/12 -> 34.75 | N58: =(M58*10000)/413360 -> 0.84067156957615641 | P58: =36/12 -> 3 | Q58: =+P58/M58 -> 8.6330935251798566E-2 | R58: =1859/12 -> 154.91666666666666 | S58: =(R58*10000)/413360 -> 3.747742081156054
C59: Campana | D59: 4989 | E59: 652864 | F59: 130.9 | G59: 22 | I59: =+G59/$H$54 -> 3.4428794992175271E-2 | J59: 863464.51 | L59: =+J59/$K$54 -> 4.4487541216477182E-2 | M59: =902/12 -> 75.166666666666671 | N59: =(M59*10000)/652864 -> 1.1513372871940661 | P59: =29/12 -> 2.4166666666666665 | Q59: =+P59/M59 -> 3.215077605321507E-2 | R59: =1159/12 -> 96.583333333333329 | S59: =(R59*10000)/652864 -> 1.4793790641440381
B60: TUCUMAN | C60: Tucumán Nros. 1 y 2 | D60: 22524 | E60: 1336664 | F60: 59.3 | G60: 74 | H60: 258 | I60: =+G60/$H$60 -> 0.2868217054263566 | J60: =1025094.47+934330.33 -> 1959424.8 | K60: 8015161.6699999999 | L60: =+J60/$K$60 -> 0.24446478819434717 | M60: =(1165+643)/12 -> 150.66666666666666 | N60: =(M60*10000)/1336664 -> 1.1271842936345009 | P60: =(16+97)/12 -> 9.4166666666666661 | Q60: =+P60/M60 -> 6.25E-2 | R60: =(2703+2622)/12 -> 443.75 | S60: =(R60*10000)/1336664 -> 3.3198320595153308 | T60: Comp. Penal: Estupefacientes (19,54%) -Tenencia simple- y Delitos c/fe pública (14,61%)-Falsificación de moneda-. Comp. Civil: Ejecuciones Fiscales (61,2%)
C61: Catamarca | D61: 102602 | E61: 333661 | F61: 3.3 | G61: 29 | I61: =+G61/$H$60 -> 0.1124031007751938 | J61: 854084.17 | L61: =+J61/$K$60 -> 0.10655857051477291 | M61: =450/12 -> 37.5 | N61: =(M61*10000)/333661 -> 1.1238952110075795 | P61: =2/12 -> 0.16666666666666666 | Q61: =+P61/M61 -> 4.4444444444444444E-3 | R61: =1905/12 -> 158.75 | S61: =(R61*10000)/333661 -> 4.757823059932087
C62: Santiago del Estero | D62: 136351 | E62: 806347 | F62: 5.9 | G62: 48 | I62: =+G62/$H$60 -> 0.18604651162790697 | J62: 1251150.03 | L62: =+J62/$K$60 -> 0.1560979156144707 | M62: =419/12 -> 34.916666666666664 | N62: =(M62*10000)/806347 -> 0.43302283838926248 | P62: =8/12 -> 0.66666666666666663 | Q62: =+P62/M62 -> 1.9093078758949882E-2 | R62: =1638/12 -> 136.5 | S62: =(R62*10000)/806347 -> 1.6928195925575467
B63: SALTA | C63: Salta Nros. 1 y 2 | D63: 155488 | E63: 1079422 | F63: 6.9 | G63: 46 | H63: 169 | I63: =+G63/$H$63 -> 0.27218934911242604 | J63: =617157.12+639249.94 -> 1256407.06 | K63: 5522076.6100000003 | L63: =+J63/$K$63 -> 0.22752438054277555 | M63: =(1209+1046)/12 -> 187.91666666666666 | N63: =(M63*10000)/1079422 -> 1.7409008401409889 | P63: =(119+125)/12 -> 20.333333333333332 | Q63: =+P63/M63 -> 0.1082039911308204 | R63: =(1430+2045)/12 -> 289.58333333333331 | S63: =(R63*10000)/1079422 -> 2.6827629354722555 | T63: Comp.Penal:Delitos c/fe pública (35,58%)-Falsificación o uso de documentos destinados a acrediar la identidad-, Estupefacientes (14,63%)-Transporte de Estupefacientes simple- Comp. Civil: Ejecuciones Fiscales (71,4%) Ejecutivos (9,9%).
C64: Jujuy Nros. 1 y 2 | D64: 53219 | E64: 611484 | F64: 11.5 | G64: 47 | I64: =+G64/$H$63 -> 0.27810650887573962 | J64: =828162.66+593272.79 -> 1421435.45 | L64: =+J64/$K$63 -> 0.25740958526832175 | M64: =(1203+1230)/12 -> 202.75 | N64: =(M64*10000)/611484 -> 3.3157040903768538 | P64: =(3+40)/12 -> 3.5833333333333335 | Q64: =+P64/M64 -> 1.7673653925195234E-2 | R64: =(614+689)/12 -> 108.58333333333333 | S64: =(R64*10000)/611484 -> 1.7757346608142375
B65: COMODORO RIVADAVIA | C65: Comodoro Rivadavia | D65: 97110 | E65: 198373 | F65: 2 | G65: 34 | H65: 246 | I65: =+G65/$H$65 -> 0.13821138211382114 | J65: 1282047.91 | K65: 10036828.74 | L65: =+J65/$K$65 -> 0.12773436144134107 | M65: =318/12 -> 26.5 | N65: =(M65*10000)/198373 -> 1.3358672803254474 | P65: =29/12 -> 2.4166666666666665 | Q65: =+P65/M65 -> 9.1194968553459113E-2 | R65: =3055/12 -> 254.58333333333334 | S65: =(R65*10000)/198373 -> 12.833567740233466 | T65: Comp. Penal: Delitos c/ la fe pública(14,37%,)- Falsificación de moneda-, Estupefacientes (12,61%)-Tenencia Simple-. Comp. Civil: Ejecuciones Fiscales (60,9%), Ejecutivos (11,5%)
C66: Rawson | D66: 148088 | E66: 199886 | F66: 1.3 | G66: 30 | I66: =+G66/$H$65 -> 0.12195121951219512 | J66: 1204778.41 | L66: =+J66/$K$65 -> 0.12003576440420562 | M66: =1425/12 -> 118.75 | N66: =(M66*10000)/199886 -> 5.9408863051939607 | P66: =21/12 -> 1.75 | Q66: =+P66/M66 -> 1.4736842105263158E-2 | R66: =1780/12 -> 148.33333333333334 | S66: =(R66*10000)/199886 -> 7.4208965777159657
C67: Río Gallegos | D67: 197747 | E67: 157510 | F67: 00.8 | G67: 30 | I67: =+G67/$H$65 -> 0.12195121951219512 | J67: 1260089.47 | L67: =+J67/$K$65 -> 0.12554657478393916 | M67: =369/12 -> 30.75 | N67: =(M67*10000)/157510 -> 1.9522569995555838 | P67: =16/12 -> 1.3333333333333333 | Q67: =+P67/M67 -> 4.3360433604336043E-2 | R67: =1940/12 -> 161.66666666666666 | S67: =(R67*10000)/157510 -> 10.263898588449409
C68: Ushuaia | D68: 9390 | E68: 45598 | F68: 4.9 | G68: 55 | I68: =+G68/$H$65 -> 0.22357723577235772 | J68: 1694616.79 | L68: =+J68/$K$65 -> 0.16883986305817947 | M68: =168/12 -> 14 | N68: =(M68*10000)/45598 -> 3.0703101013202332 | P68: =4/12 -> 0.33333333333333331 | Q68: =+P68/M68 -> 2.3809523809523808E-2 | R68: =739/12 -> 61.583333333333336 | S68: =(R68*10000)/45598 -> 13.505709314736027
C69: Río Grande | D69: 12181 | E69: 55201 | F69: 4.5 | G69: 34 | I69: =+G69/$H$65 -> 0.13821138211382114 | J69: 1102738.82 | L69: =+J69/$K$65 -> 0.10986924740533134 | M69: =163/12 -> 13.583333333333334 | N69: =(M69*10000)/55201 -> 2.4607042142956348 | P69: =11/12 -> 0.91666666666666663 | Q69: =+P69/M69 -> 6.7484662576687116E-2 | R69: =528/12 -> 44 | S69: =(R69*10000)/55201 -> 7.9708700929330991
B70: CORRIENTES | C70: Corrientes | D70: 45255 | E70: 685003 | F70: 15.1 | G70: 48 | H70: 119 | I70: =+G70/$H$70 -> 0.40336134453781514 | J70: 1323853.42 | K70: 3886181.19 | L70: =+J70/$K$70 -> 0.34065663829740267 | M70: =826/12 -> 68.833333333333329 | N70: =(M70*10000)/685003 -> 1.0048617791941543 | P70: =28/12 -> 2.3333333333333335 | Q70: =+P70/M70 -> 3.389830508474577E-2 | R70: =3114/12 -> 259.5 | S70: =(R70*10000)/685003 -> 3.7883045767682768 | T70: Comp. Penal: Ley Estupefacientes (10,26%)-Tenencia simple- y Delitos c/la fé pública(7,42%)-Falsificación o uso de documento público. Comp. Civil: Ejecuciones Fiscales (59,9%) y Amparos (10%)
C71: Paso de Los Libres | D71: 42944 | E71: 244233 | F71: 5.7 | G71: 38 | I71: =+G71/$H$70 -> 0.31932773109243695 | J71: 1061500.48 | L71: =+J71/$K$70 -> 0.2731474494116421 | M71: =723/12 -> 60.25 | N71: =(M71*10000)/244233 -> 2.4669066014830099 | P71: =13/12 -> 1.0833333333333333 | Q71: =+P71/M71 -> 1.7980636237897647E-2 | R71: =1454/12 -> 121.16666666666667 | S71: =(R71*10000)/244233 -> 4.9611095415716413
B72: FUENTE: Oficina de Estadísticas del Poder Judicial de la Nación.
B74: Ver Gráfico: | C74: D.1
C75: D.2
C76: D.3
C77: D.4