C4: I - DATOS GENERALES - AÑO 2004
C6: Poder Judicial de la Nación
C9: Población de la República Argentina (1) | D9: 38226051
C10: Producto Bruto Interno (2) | D10: 279020
C11: Abogados Matriculados (3) | D11: 99819
C12: Personal del Poder Judicial de la Nación (4)
C13: Magistrados | D13: 843
C14: Funcionarios | D14: 4389
C15: Empleados | D15: 13868
C16: Total | D16: =SUM(D13:D15) -> 19100
C17: Causas Ingresadas en Juzgados
C18: Capital Federal
C19: Penal (5) | D19: 215707
C20: Civil (6) | D20: 307392
C21: Total | D21: =+D19+D20 -> 523099
C22: Interior del País (7)
C23: Penal | D23: 51025
C24: Civil | D24: 184620
C25: Total | D25: =+D23+D24 -> 235645
C26: Total General | D26: =+D21+D25 -> 758744
C27: Presupuesto del Poder Judicial (8) | D27: =638975482+82487423 -> 721462905
C28: Indicadores calculados
C29: Causas Ingresadas cada 10.000 habitantes | D29: =+(D26*10000)/$D$9 -> 198.48872173586543
C30: Causas civiles sobre 10.000 habitantes | D30: =+((D20+D24)*10000)/$D$9 -> 128.711176574321
C31: Causas penales sobre 10.000 habitantes | D31: =+((D19+D23)*10000)/$D$9 -> 69.77754516154441
C32: Causas Ingresadas por magistrado | D32: =+D26/D13 -> 900.05219454329779
C33: Empleados por juez | D33: =+D15/D13 -> 16.450771055753261
C34: Presupuesto por juez (9) | D34: =+D27/D13 -> 855827.88256227761
C35: Presupuesto por causa (9) | D35: =+D27/D26 -> 950.86472512467969
C36: Presupuesto del P.J.N. por habitante (9) | D36: =+D27/D9 -> 18.873592383372273
C37: Presupuesto del P.J.N. Sobre P.B.I. | D37: =+D27/(D10*1000000) -> 2.5857031933194754E-3
C38: Magistrados cada 100.000 habitantes | D38: =+(D13*100000)/D9 -> 2.2053023473442233
C39: Abogados Matriculados cada 100.000 habitantes | D39: =+(D11*100000)/D9 -> 261.1282028583073
C40: INDICADORES\INDI2004\DATOS-GRALES-04\HOJA A
C41: OFICINA DE ESTADISTICAS
C43: Referencias