B6: PODER JUDICIAL DE LA NACION
B7: JURISDICCION FEDERAL CORDOBA
B9: COMPETENCIA PENAL
B10: CUADRO VII
B11: CAUSAS INGRESADAS Y ELEVADAS A JUICIO EN LOS JUZGADOS DE 1RA. INSTANCIA -AÑO 2001-
C13: TOTAL DE CAUSAS INGRESADAS | D13: TOTAL DE CAUSAS ELEVADAS A JUICIO (*) | E13: PORCENTAJE DE CAUSAS ELEVADAS A JUICIO
B15: Juzgado Federal de Primera Instancia de Córdoba Nº 1 | C15: 621 | D15: 51 | E15: =+D15/C15 -> 8.2125603864734303E-2
B16: Juzgado Federal de Primera Instancia de Córdoba Nº 2 | C16: 594 | D16: 53 | E16: =+D16/C16 -> 8.9225589225589222E-2
B17: Juzgado Federal de Primera Instancia de Córdoba Nº 3 | C17: 598 | D17: 80 | E17: =+D17/C17 -> 0.13377926421404682
B18: Juzgado Federal de Primera Instancia de Bell Ville | C18: 368 | D18: 6 | E18: =+D18/C18 -> 1.6304347826086956E-2
B19: Juzgado Federal de Primera Instancia de Rio Cuarto | C19: 244 | D19: 39 | E19: =+D19/C19 -> 0.1598360655737705
B20: Juzgado Federal de Primera Instancia de La Rioja | C20: 305 | D20: 3 | E20: =+D20/C20 -> 9.8360655737704927E-3
B21: Total | C21: =SUM(C15:C20) -> 2730 | D21: =SUM(D15:D20) -> 232 | E21: =+D21/C21 -> 8.4981684981684985E-2
B22: REFERENCIAS: (*): En estas cifras se incluyen causas de años anteriores y las elevaciones a juicio en causas correccionales que se resuelven en la misma instancia.
B23: FUENTE: Oficina de Estadísticas del Poder Judicial de la Nación.