B6: PODER JUDICIAL DE LA NACION
B7: JURISDICCION FEDERAL CORDOBA
B9: CUADRO III
B10: DISTRIBUCION DE LOS CARGOS PERMANENTES Y CONTRATADOS -AÑO 2001-
C12: Cámara Federal de Apelaciones de Córdoba | E12: Tribunales Orales en lo Criminal Federal de Córdoba Nros 1 y 2 | G12: Juzgados Federales de Primera Instancia de Córdoba Nros 1 a 3 | I12: Juzgado Federal de Primera Instancia de Bell Ville | K12: Juzgado Federal de Primera Instancia de Rio Cuarto | M12: Tribunal Oral en lo Criminal Federal de La Rioja | O12: Juzgado Federal de Primera Instancia de La Rioja
C13: P | D13: C | E13: P | F13: C | G13: P | H13: C | I13: P | J13: C | K13: P | L13: C | M13: P | N13: C | O13: P | P13: C
B14: Juez (1ª o 2ª
B15: instancia) | C15: 6 | E15: 6 | G15: 3 | I15: 1 | K15: 1 | M15: 3 | O15: 1
B16: Secretario (1ª o 2ª instancia)
C17: 7 | D17: 4 | E17: 2 | G17: 12 | I17: 3 | K17: 4 | M17: 1 | O17: 3
B18: Prosecretario Administrativo
B19: Jefe | D19: 1
B20: Prosecretario
B21: de Cámara | D21: 1
B22: Prosecretario Administrativo
C23: 13 | D23: 5 | E23: 3 | F23: 1 | G23: 12 | H23: 6 | I23: 3 | K23: 5 | L23: 1 | M23: 2 | O23: 3
B24: Oficial Mayor
C25: 17 | D25: 5 | E25: 6 | F25: 2 | G25: 15 | H25: 3 | I25: 3 | K25: 6 | M25: 3 | N25: 1 | O25: 3
B26: Oficial Mayor Relator
B28: Oficial
C29: 1 | I29: 1 | K29: 1 | O29: 1
B30: Escribiente
C31: 7 | D31: 1 | E31: 2 | G31: 27 | H31: 1 | I31: 6 | K31: 7 | M31: 1 | O31: 3
B32: Escribiente Auxiliar
C33: 6 | E33: 2 | G33: 12 | I33: 2 | K33: 5 | M33: 1 | O33: 2
B34: Auxiliar
C35: 10 | D35: 9 | F35: 6 | G35: 22 | H35: 4 | I35: 5 | K35: 8 | L35: 2 | O35: 4 | P35: 2
B36: Auxiliar Administrativo
B38: Jefe de Sección /
B39: Encargado de Sección | C39: 11
B40: Oficial
B41: de Servicio / Medio Oficial | C41: 5
B42: Ayudante
C43: 24 | D43: 1 | E43: 2 | F43: 2 | G43: 11 | I43: 3 | K43: 5 | M43: 1 | O43: 5 | P43: 1
B44: Auxiliar de Servicio
B46: Total
C47: =SUM(C15:C45) -> 107 | D47: =SUM(D15:D45) -> 27 | E47: =SUM(E15:E45) -> 23 | F47: =SUM(F15:F45) -> 11 | G47: =SUM(G15:G45) -> 114 | H47: =SUM(H15:H45) -> 14 | I47: =SUM(I15:I45) -> 27 | J47: =SUM(J15:J45) -> 0 | K47: =SUM(K15:K45) -> 42 | L47: =SUM(L15:L45) -> 3 | M47: =SUM(M15:M45) -> 12 | N47: =SUM(N15:N45) -> 1 | O47: =SUM(O15:O45) -> 25 | P47: =SUM(P15:P45) -> 3
B48: Fuente: División Programación Presupuestaria. Consejo de la Magistratura.
B49: Oficina de Estadísticas del Poder Judicial de la Nación.