B6: PODER JUDICIAL DE LA NACION
B7: JURISDICCION FEDERAL CORDOBA
B8: CUADRO V
B9: DISTRIBUCION ANUAL DEL GASTO EN CONCEPTO DE LIQUIDACION DE HABERES -AÑO 2001-
C11: Gasto (Haberes) | D11: %
B12: Cámara Federal de Apelaciones de Córdoba | C12: 3743051.0420460263 | D12: =+C12/C$22 -> 0.31854704811114348 | F12: =+$C$26*D12 -> 0
B13: Tribunal Oral en lo Criminal Federal de Córdoba Nº 1 | C13: 1435073.5349219353 | D13: =+C13/C$22 -> 0.12212989703766515 | F13: =+$C$26*D13 -> 0
B14: Tribunal Oral en lo Criminal Federal de Córdoba Nº 2 | C14: 606929.79327965318 | D14: =+C14/C$22 -> 5.1651898915666107E-2 | F14: =+$C$26*D14 -> 0
B15: Juzgado Federal de Primera Instancia de Córdoba Nº 1 | C15: 943521.48571984633 | D15: =+C15/C$22 -> 8.0297057328186358E-2 | F15: =+$C$26*D15 -> 0
B16: Juzgado Federal de Primera Instancia de Córdoba Nº 2 | C16: 989709.50826804072 | D16: =+C16/C$22 -> 8.4227823453346062E-2 | F16: =+$C$26*D16 -> 0
B17: Juzgado Federal de Primera Instancia de Córdoba Nº 3 | C17: 1124690.8320665911 | D17: =+C17/C$22 -> 9.5715217497179123E-2 | F17: =+$C$26*D17 -> 0
B18: Juzgado Federal de Primera Instancia de Bell Ville | C18: 715419.94924453902 | D18: =+C18/C$22 -> 6.0884799707967667E-2 | F18: =+$C$26*D18 -> 0
B19: Juzgado Federal de Primera Instancia de Rio Cuarto | C19: 965735.80255942477 | D19: =+C19/C$22 -> 8.2187575244069583E-2 | F19: =+$C$26*D19 -> 0
B20: Tribunal Oral en lo Criminal Federal de La Rioja | C20: 446155.15263124165 | D20: =+C20/C$22 -> 3.7969401238133339E-2 | F20: =+$C$26*D20 -> 0
B21: Juzgado Federal de Primera Instancia de La Rioja | C21: 780099.73926269985 | D21: =+C21/C$22 -> 6.6389281466643191E-2 | F21: =+$C$26*D21 -> 0
B22: TOTAL | C22: =SUM(C12:C21) -> 11750386.839999998 | D22: =SUM(D12:D21) -> 1 | F22: =SUM(F12:F21) -> 0
B23: NOTA: Los datos consignados correponden a la ejecución presupuestaria del año 2001.
B24: FUENTE: Departamento de Contaduría y Oficina de Estadísticas del Poder Judicial de la Nación.
C26: =+C22-11750386.84 -> 0