B6: PODER JUDICIAL DE LA NACION
B7: JURISDICCIÓN FEDERAL CÓRDOBA
B8: CUADRO XII
B9: INDICE DE LITIGIOSIDAD EN LOS JUZGADOS FEDERALES DE PRIMERA INSTANCIA -AÑO 2001-
B12: 1- COMPETENCIA PENAL
B14: Dependencias | C14: Causas ingresadas | D14: Cantidad de habitantes en la jurisdicción | E14: Causas ingresadas
E15: c/10.000 hab.
B16: Juzgado Federal de Primera Instancia de Córdoba Nº 1 | C16: 621 | E16: =+(C16/$D$17)*10000 -> 3.0214861235452104
B17: Juzgado Federal de Primera Instancia de Córdoba Nº 2 | C17: 594 | D17: 2055280 | E17: =+(C17/$D$17)*10000 -> 2.8901171616519403
B18: Juzgado Federal de Primera Instancia de Córdoba Nº 3 | C18: 598 | E18: =+(C18/$D$17)*10000 -> 2.9095792300805732
B19: Juzgado Federal de Primera Instancia de Bell Ville | C19: 368 | D19: 518650 | E19: =+(C19/D19)*10000 -> 7.0953436807095347
B20: Juzgado Federal de Primera Instancia de Rio Cuarto | C20: 244 | D20: 487681 | E20: =+(C20/D20)*10000 -> 5.0032705805639344
B21: Juzgado Federal de Primera Instancia de La Rioja | C21: 305 | D21: 289820 | E21: =+(C21/D21)*10000 -> 10.523773376578564
B22: TOTAL | C22: =SUM(C16:C21) -> 2730 | D22: 3351431 | E22: =+(C22/D22)*10000 -> 8.1457741484160042
B24: FUENTE: INDEC (Censo Nacional de Población, Hogares y Viviendas 2001 e Instituto Geografico Militar). Oficina de Estadísticas del Poder Judicial de la Nación.
B27: 2- COMPETENCIA CIVIL
B29: Dependencias | C29: Causas ingresadas | D29: Cantidad de habitantes en la jurisdicción | E29: Causas ingresadas
E30: c/10.000 hab.
B31: Juzgado Federal de Primera Instancia de Córdoba Nº 1 | C31: 3686 | E31: =+(C31/$D$32)*10000 -> 17.934296056984934
B32: Juzgado Federal de Primera Instancia de Córdoba Nº 2 | C32: 3586 | D32: 2055280 | E32: =+(C32/$D$32)*10000 -> 17.447744346269122
B33: Juzgado Federal de Primera Instancia de Córdoba Nº 3 | C33: 3691 | E33: =+(C33/$D$32)*10000 -> 17.958623642520728
B34: Juzgado Federal de Primera Instancia de Bell Ville | C34: 2016 | D34: 518650 | E34: =+(C34/D34)*10000 -> 38.87014364214788
B35: Juzgado Federal de Primera Instancia de Rio Cuarto | C35: 2106 | D35: 487681 | E35: =+(C35/D35)*10000 -> 43.183966568310026
B36: Juzgado Federal de Primera Instancia de La Rioja | C36: 1055 | D36: 289820 | E36: =+(C36/D36)*10000 -> 36.401904630460287
B37: TOTAL | C37: =SUM(C31:C36) -> 16140 | D37: 3351431 | E37: =+(C37/D37)*10000 -> 48.158532877448472
B39: FUENTE: INDEC (Censo Nacional de Población, Hogares y Viviendas 2001 e Instituto Geografico Militar). Oficina de Estadísticas del Poder Judicial de la Nación.