B6: PODER JUDICIAL DE LA NACION
B7: JURISDICCION FEDERAL CORDOBA
B8: COMPETENCIA CIVIL
B9: CUADRO XI
B10: DISTRIBUCION PORCENTUAL, SEGÚN EL OBJETO DE LITIGIO, DE LOS EXPEDIENTES INGRESADOS, RESUELTOS O SALIDOS Y SENTENCIAS DICTADAS EN LOS JUZGADOS FEDERALES DE PRIMERA INSTANCIA -AÑO 2001-
B11: OBJETO | C11: INGRESADOS | D11: % | E11: RESUELTOS O SALIDOS | F11: % | G11: SENTENCIAS DEFINITIVAS | H11: % | I11: SENTENCIAS INTERLOCUTORIAS | J11: %
B12: ORDINARIOS | C12: 558 | D12: =+C12/C$25 -> 3.4572490706319702E-2 | E12: 1050 | F12: =+E12/E$25 -> 8.0441277867156977E-2 | G12: 424 | H12: =+G12/G$25 -> 3.962246519016914E-2 | I12: 595 | J12: =+I12/I$25 -> 7.1121204876882615E-2
B13: SUMARIOS | C13: 405 | D13: =+C13/C$25 -> 2.5092936802973979E-2 | E13: 473 | F13: =+E13/E$25 -> 3.6236880410633568E-2 | G13: 120 | H13: =+G13/G$25 -> 1.1213905242500702E-2 | I13: 426 | J13: =+I13/I$25 -> 5.09203920631126E-2
B14: SUMARISIMOS | C14: 25 | D14: =+C14/C$25 -> 1.5489467162329617E-3 | E14: 30 | F14: =+E14/E$25 -> 2.2983222247759134E-3 | G14: 14 | H14: =+G14/G$25 -> 1.308288944958415E-3 | I14: 12 | J14: =+I14/I$25 -> 1.4343772412144394E-3
B15: EJECUTIVOS | C15: 1693 | D15: =+C15/C$25 -> 0.10489467162329616 | E15: 1218 | F15: =+E15/E$25 -> 9.3311882325902096E-2 | G15: 821 | H15: =+G15/G$25 -> 7.6721801700775624E-2 | I15: 1113 | J15: =+I15/I$25 -> 0.13303848912263924
B16: EJECUCIONES FISCALES | C16: 10793 | D16: =+C16/C$25 -> 0.66871127633209415 | E16: 5899 | F16: =+E16/E$25 -> 0.45192676013177047 | G16: 7418 | H16: =+G16/G$25 -> 0.6932062424072517 | I16: 4336 | J16: =+I16/I$25 -> 0.51828830982548413
B17: LABORALES | C17: 92 | D17: =+C17/C$25 -> 5.700123915737299E-3 | E17: 1520 | F17: =+E17/E$25 -> 0.11644832605531295 | G17: 130 | H17: =+G17/G$25 -> 1.2148397346042426E-2 | I17: 1094 | J17: =+I17/I$25 -> 0.13076739182404973
B18: CIUDADANIA | C18: 372 | D18: =+C18/C$25 -> 2.3048327137546468E-2 | E18: 447 | F18: =+E18/E$25 -> 3.4245001149161111E-2 | G18: 326 | H18: =+G18/G$25 -> 3.0464442575460236E-2 | I18: 10 | J18: =+I18/I$25 -> 1.1953143676786994E-3
B19: AMPAROS (LEY 16.986) | C19: 465 | D19: =+C19/C$25 -> 2.8810408921933085E-2 | E19: 297 | F19: =+E19/E$25 -> 2.2753390025281546E-2 | G19: 104 | H19: =+G19/G$25 -> 9.7187178768339405E-3 | I19: 226 | J19: =+I19/I$25 -> 2.7014104709538609E-2
B20: AMPAROS POR MORA | C20: 170 | D20: =+C20/C$25 -> 1.0532837670384139E-2 | E20: 176 | F20: =+E20/E$25 -> 1.3483490385352027E-2 | G20: 115 | H20: =+G20/G$25 -> 1.0746659190729839E-2 | I20: 21 | J20: =+I20/I$25 -> 2.5101601721252689E-3
B21: EXPROPIACIONES | C21: 11 | D21: =+C21/C$25 -> 6.8153655514250309E-4 | E21: 53 | F21: =+E21/E$25 -> 4.0603692637707807E-3 | G21: 13 | H21: =+G21/G$25 -> 1.2148397346042426E-3 | I21: 10 | J21: =+I21/I$25 -> 1.1953143676786994E-3
B22: LEY 24.463 (ART. 15 SEG. SOC.) | C22: 1085 | D22: =+C22/C$25 -> 6.7224287484510536E-2 | E22: 1293 | F22: =+E22/E$25 -> 9.9057687887841875E-2 | G22: 1137 | H22: =+G22/G$25 -> 0.10625175217269414 | I22: 198 | J22: =+I22/I$25 -> 2.3667224480038249E-2
B23: LEYES ESPECIALES | C23: 84 | D23: =+C23/C$25 -> 5.2044609665427505E-3 | E23: 278 | F23: =+E23/E$25 -> 2.1297785949590132E-2 | G23: 8 | H23: =+G23/G$25 -> 7.4759368283338007E-4 | J23: =+I23/I$25 -> 0
B24: CAUTELARES | C24: 387 | D24: =+C24/C$25 -> 2.3977695167286244E-2 | E24: 319 | F24: =+E24/E$25 -> 2.4438826323450548E-2 | G24: 71 | H24: =+G24/G$25 -> 6.634893935146248E-3 | I24: 325 | J24: =+I24/I$25 -> 3.8847716949557735E-2
B25: TOTAL | C25: =SUM(C12:C24) -> 16140 | D25: =SUM(D12:D24) -> 1 | E25: =SUM(E12:E24) -> 13053 | F25: =SUM(F12:F24) -> 1 | G25: =SUM(G12:G24) -> 10701 | H25: =SUM(H12:H24) -> 1 | I25: =SUM(I12:I24) -> 8366 | J25: =SUM(J12:J24) -> 1
B26: FUENTE: Oficina de Estadísticas del Poder Judicial de la Nación.