B6: PODER JUDICIAL DE LA NACION
B7: JURISDICCION FEDERAL CORDOBA
B8: COMPETENCIA PENAL
B9: CUADRO IX
B10: DISTRIBUCION PORCENTUAL, SEGÚN EL TIPO DE DELITO, DE LAS CAUSAS INGRESADAS, ELEVADAS A JUICIO Y PERSONAS CONDENADAS EN LOS JUZGADOS FEDERALES -AÑO 2001-
C11: CAUSAS | D11: % | E11: CAUSAS | F11: % | G11: PERSONAS | H11: %
B12: DELITOS | C12: INGRESADAS | E12: ELEVADAS | G12: CONDENADAS(*)
B13: DELITOS CONTRA LAS PERSONAS | C13: 46 | D13: =+(C13/C$29) -> 1.6849816849816849E-2 | E13: 1 | F13: =+E13/E$29 -> 4.3103448275862068E-3 | H13: =+G13/G$29 -> 0
B14: HOMICIDIOS | C14: 1 | D14: =+(C14/C$29) -> 3.663003663003663E-4 | F14: =+E14/E$29 -> 0 | H14: =+G14/G$29 -> 0
B15: DELITOS CONTRA+B27 EL HONOR | C15: 4 | D15: =+(C15/C$29) -> 1.4652014652014652E-3 | F15: =+E15/E$29 -> 0 | H15: =+G15/G$29 -> 0
B16: DELITOS CONTRA LA INTEGRIDAD SEXUAL | C16: 3 | D16: =+(C16/C$29) -> 1.0989010989010989E-3 | F16: =+E16/E$29 -> 0 | H16: =+G16/G$29 -> 0
B17: DELITOS CONTRA EL ESTADO CIVIL | C17: 1 | D17: =+(C17/C$29) -> 3.663003663003663E-4 | F17: =+E17/E$29 -> 0 | H17: =+G17/G$29 -> 0
B18: DELITOS CONTRA LA LIBERTAD | C18: 28 | D18: =+(C18/C$29) -> 1.0256410256410256E-2 | E18: 1 | F18: =+E18/E$29 -> 4.3103448275862068E-3 | H18: =+G18/G$29 -> 0
B19: DELITOS CONTRA LA PROPIEDAD | C19: 251 | D19: =+(C19/C$29) -> 9.1941391941391948E-2 | E19: 10 | F19: =+E19/E$29 -> 4.3103448275862072E-2 | G19: 12 | H19: =+G19/G$29 -> 6.1538461538461542E-2
B20: DELITOS CONTRA LA SEGURIDAD PUBLICA | C20: 26 | D20: =+(C20/C$29) -> 9.5238095238095247E-3 | E20: 2 | F20: =+E20/E$29 -> 8.6206896551724137E-3 | G20: 2 | H20: =+G20/G$29 -> 1.0256410256410256E-2
B21: DELITOS CONTRA EL ORDEN PUBLICO | C21: 30 | D21: =+(C21/C$29) -> 1.098901098901099E-2 | F21: =+E21/E$29 -> 0 | H21: =+G21/G$29 -> 0
B22: DELITOS CONTRA LA SEG. DE LA NACION | D22: =+(C22/C$29) -> 0 | F22: =+E22/E$29 -> 0 | H22: =+G22/G$29 -> 0
B23: DELITOS CONTRA LOS POD. PUB. Y ORD. CONTITUC. | D23: =+(C23/C$29) -> 0 | F23: =+E23/E$29 -> 0 | H23: =+G23/G$29 -> 0
B24: DELITOS CONTRA LA ADMINISTRACION PUBLICA | C24: 151 | D24: =+(C24/C$29) -> 5.5311355311355309E-2 | E24: 10 | F24: =+E24/E$29 -> 4.3103448275862072E-2 | G24: 5 | H24: =+G24/G$29 -> 2.564102564102564E-2
B25: DELITOS CONTRA LA FE PUBLICA | C25: 730 | D25: =+(C25/C$29) -> 0.26739926739926739 | E25: 83 | F25: =+E25/E$29 -> 0.35775862068965519 | G25: 35 | H25: =+G25/G$29 -> 0.17948717948717949
B26: INFRACCION LEY 23.737 (ESTUPEFACIENTES) | C26: 965 | D26: =+(C26/C$29) -> 0.3534798534798535 | E26: 109 | F26: =+E26/E$29 -> 0.46982758620689657 | G26: 138 | H26: =+G26/G$29 -> 0.70769230769230773
B27: INFRACCION LEYES ESPECIALES Y DEC. LEYES | C27: =211+206+37 -> 454 | D27: =+(C27/C$29) -> 0.16630036630036629 | E27: =9+7 -> 16 | F27: =+E27/E$29 -> 6.8965517241379309E-2 | G27: 3 | H27: =+G27/G$29 -> 1.5384615384615385E-2
B28: D.G.I. | C28: 40 | D28: =+(C28/C$29) -> 1.4652014652014652E-2 | F28: =+E28/E$29 -> 0 | H28: =+G28/G$29 -> 0
B29: TOTAL | C29: =SUM(C13:C28) -> 2730 | D29: =SUM(D13:D28) -> 1 | E29: =SUM(E13:E28) -> 232 | F29: =SUM(F13:F28) -> 1 | G29: =SUM(G13:G28) -> 195 | H29: =SUM(H13:H28) -> 1
B30: REFERENCIAS: (*) En causas tramitadas en los Juzgados de 1ra. Instancia y en los Tribunales Orales en lo Criminal Federal.
B31: FUENTE: Oficina de Estadísticas del Poder Judicial de la Nación.