B6: PODER JUDICIAL DE LA NACION
B7: JURISDICCION FEDERAL CORDOBA
B9: CUADRO II
B10: DENSIDAD DE POBLACION POR COMPETENCIA TERRITORIAL -AÑO 2001-
C12: POBLACION TOTAL (2001) | D12: SUPERFICIE (Km2) | E12: DENSIDAD DE
E13: POBLACION (hab/km2)
B14: Cámara Federal de Apelaciones | C14: 3351431 | D14: 255001 | E14: =+C14/D14 -> 13.142815126215192
B15: de Córdoba
B16: Tribunal Oral en lo Criminal Federal | C16: 3061611 | D16: 165321 | E16: =+C16/D16 -> 18.519189939572104
B17: de Córdoba Nº 1
B19: Tribunal Oral en lo Criminal Federal
B20: de Córdoba Nº 2
C21: 3061611 | D21: 165321 | E21: =+C21/D21 -> 18.519189939572104
B22: Juzgado Federal de Primera Instancia | C22: 2055280 | D22: 69502 | E22: =+C22/D22 -> 29.571523121636787
B23: de Córdoba Nº 1
B24: Juzgado Federal de Primera Instancia
B25: de Córdoba Nº 2 | C25: 2055280 | D25: 69502 | E25: =+C25/D25 -> 29.571523121636787
B26: Juzgado Federal de Primera Instancia
B27: de Córdoba Nº 3 | C27: 2055280 | D27: 69502 | E27: =+C27/D27 -> 29.571523121636787
B28: Juzgado Federal de Primera Instancia
B29: de Bell Ville | C29: 518650 | D29: 36614 | E29: =+C29/D29 -> 14.165346588736549
B30: Juzgado Federal de Primera Instancia
B31: de Rio Cuarto | C31: 487681 | D31: 59205 | E31: =+C31/D31 -> 8.2371590237311043
B32: Tribunal Oral en lo Criminal Federal
B33: de La Rioja
C34: 289820 | D34: 89680 | E34: =+C34/D34 -> 3.2317127564674397
B35: Juzgado Federal de Primera Instancia
B36: de La Rioja | C36: 289820 | D36: 89680 | E36: =+C36/D36 -> 3.2317127564674397
B37: FUENTE: INDEC (Censo Nacional de Población, Hogares y Viviendas 2001) E Instituto Geográfico Militar.
B38: Oficina de Estadísticas del Poder Judicial de la Nación.