B6: PODER JUDICIAL DE LA NACION
B7: JURISDICCION FEDERAL CORDOBA
B9: CUADRO VI
B10: DISTRIBUCION ANUAL DEL GASTO POR TODO CONCEPTO -AÑO 2001-
C12: Cámara, Tribunal Oral y Juzgados | D12: %
B13: HABERES | C13: =+Hoja5!C22 -> 11750386.839999998 | D13: =+C13/C$17 -> 0.93453534184522147
B14: BIENES DE CONSUMO | C14: 114580.1 | D14: =+C14/C$17 -> 9.1128193803498379E-3
B15: SERVICIOS NO PERSONALES | C15: 708540.25 | D15: =+C15/C$17 -> 5.635183877442871E-2
B16: BIENES DE USO | D16: =+C16/C$17 -> 0
B17: Total | C17: =SUM(C13:C16) -> 12573507.189999998 | D17: =SUM(D13:D16) -> 1
B18: NOTA: Los datos consignados corresponden a la ejecución presupuestaria del año 2001.
B19: FUENTE: Departamento de Contaduría y Oficina de Estadísticas del Poder Judicial de la Nación.