B6: PODER JUDICIAL DE LA NACION
B7: JURISDICCION FEDERAL CORDOBA
B9: CUADRO IV
B10: DISTRIBUCION DE LOS CARGOS POR DEPENDENCIA - AÑO 2001-
C12: Distribución de los cargos actuales | D12: Distribución
D13: Porcentual
B14: Cámara Federal de Apelaciones de Córdoba | C14: =107+27 -> 134 | D14: =+C14/C$21 -> 0.32762836185819072
B15: Tribunales Orales en lo Criminal Federal de Córdoba Nros 1 y 2 | C15: =23+11 -> 34 | D15: =+C15/C$21 -> 8.3129584352078234E-2
B16: Juzgados Federales de Primera Instancia de Córdoba Nros 1 a 3 | C16: =114+14 -> 128 | D16: =+C16/C$21 -> 0.31295843520782396
B17: Juzgado Federal de Primera Instancia de Bell Ville | C17: 27 | D17: =+C17/C$21 -> 6.6014669926650366E-2
B18: Juzgado Federal de Primera Instancia de Rio Cuarto | C18: 45 | D18: =+C18/C$21 -> 0.1100244498777506
B19: Tribunal Oral en lo Criminal Federal de La Rioja | C19: 13 | D19: =+C19/C$21 -> 3.1784841075794622E-2
B20: Juzgado Federal de Primera Instancia de La Rioja | C20: 28 | D20: =+C20/C$21 -> 6.8459657701711488E-2
B21: TOTAL | C21: =SUM(C14:C20) -> 409 | D21: =SUM(D14:D20) -> 1
B22: FUENTE: Oficina de Estadísticas del Poder Judicial de la Nación.