B6: PODER JUDICIAL DE LA NACION
B7: JURISDICCION FEDERAL MENDOZA
B8: CUADRO VI
B10: DISTRIBUCION DEL GASTO POR TODO CONCEPTO
B11: -AÑO 2001-
C13: Cámara, Tribunal Oral y Juzgados | D13: %
B14: HABERES | C14: 11150052.640000001 | D14: =+C14/C$18 -> 0.9258506758261601
B15: BIENES DE CONSUMO | C15: 108400.15 | D15: =+C15/C$18 -> 9.0010653202761137E-3
B16: SERVICIOS NO PERSONALES | C16: 784582.8 | D16: =+C16/C$18 -> 6.5148258853563679E-2
B17: BIENES DE USO | D17: =+C17/C$18 -> 0
B18: Total | C18: =SUM(C14:C17) -> 12043035.590000002 | D18: =SUM(D14:D17) -> 1
B19: Nota: Los datos registrados corresponde a la ejecución presupuestaria del año 2001.
B20: Fuente: Departamento de Contaduría y Oficina de Estadísticas del Poder Judicial de la Nación.