B6: PODER JUDICIAL DE LA NACION
B7: JURISDICCION FEDERAL MENDOZA
B8: CUADRO V
B10: DISTRIBUCION ANUAL DEL GASTO EN CONCEPTO DE LIQUIDACION DE HABERES
B11: - AÑO 2001 -
C13: Gasto (Haberes) | D13: %
B14: Cámara Federal de Apelaciones de Mendoza | C14: 2821371.7642723243 | D14: =+C14/C$26 -> 0.25303663178690822
B15: Tribunal Oral en lo Criminal Federal de Mendoza Nº 1 | C15: 633957.62367242982 | D15: =+C15/C$26 -> 5.685691755374795E-2
B16: Tribunal Oral en lo Criminal Federal de Mendoza Nº 2 | C16: 535086.87783494173 | D16: =+C16/C$26 -> 4.7989627951652576E-2
B17: Tribunal Oral en lo Criminal Federal de San Juan | C17: 689771.68127425865 | D17: =+C17/C$26 -> 6.1862638997752614E-2
B18: Tribunal Oral en lo Criminal Federal de San Luis | C18: 689089.33905195154 | D18: =+C18/C$26 -> 6.1801442674799013E-2
B19: Juzgado Federal de Primera Instancia de Mendoza Nº 1 | C19: 774768.30314700934 | D19: =+C19/C$26 -> 6.9485618423682088E-2
B20: Juzgado Federal de Primera Instancia de Mendoza Nº 2 | C20: 1069383.6288116111 | D20: =+C20/C$26 -> 9.5908392842494319E-2
B21: Juzgado Federal de Primera Instancia de Mendoza Nº 3 | C21: 577931.90021422575 | D21: =+C21/C$26 -> 5.1832212714488637E-2
B22: Juzgado Federal de Primera Instancia de San Rafael | C22: 876444.59743536031 | D22: =+C22/C$26 -> 7.8604525533016681E-2
B23: Juzgado Federal de Primera Instancia de San Juan N° 1 | C23: 734768.87070718245 | D23: =+C23/C$26 -> 6.5898242316027519E-2
B24: Juzgado Federal de Primera Instancia de San Juan N° 2 | C24: 809883.17764482857 | D24: =+C24/C$26 -> 7.2634919654050029E-2
B25: Juzgado Federal de Primera Instancia de San Luis | C25: 937594.87593387743 | D25: =+C25/C$26 -> 8.4088829551380237E-2
B26: TOTAL | C26: =SUM(C14:C25) -> 11150052.640000002 | D26: =SUM(D14:D25) -> 1
B27: Nota: Los datos registrados corresponde a la ejecución presupuestaria del año 2001.
B28: Fuente: Departamento de Contaduría y Oficina de Estadísticas del Poder Judicial de la Nación.