B6: PODER JUDICIAL DE LA NACION
B7: JURISDICCION FEDERAL MENDOZA
B9: COMPETENCIA PENAL
B10: CUADRO VII
B11: CAUSAS INGRESADAS Y ELEVADAS A JUICIO EN LOS JUZGADOS DE 1RA. INSTANCIA
B12: AÑO 2001
C14: TOTAL DE CAUSAS INGRESADAS | D14: TOTAL DE CAUSAS ELEVADAS A JUICIO (*) | E14: PORCENTAJE DE CAUSAS ELEVADAS A JUICIO
B16: Juzgado Federal de Primera Instancia de Mendoza N° 1 | C16: 971 | D16: 104 | E16: =+D16/C16 -> 0.10710607621009269
B17: Juzgado Federal de Primera Instancia de Mendoza N° 3 | C17: 1084 | D17: 108 | E17: =+D17/C17 -> 9.9630996309963096E-2
B18: Juzgado Federal de Primera Instancia de San Rafael | C18: 620 | D18: 27 | E18: =+D18/C18 -> 4.3548387096774194E-2
B19: Juzgado Federal de Primera Instancia de San Juan N° 2 | C19: 719 | D19: 46 | E19: =+D19/C19 -> 6.397774687065369E-2
B20: Juzgado Federal de Primera Instancia de San Luis | C20: 554 | D20: 33 | E20: =+D20/C20 -> 5.9566787003610108E-2
B21: Total | C21: =SUM(C16:C20) -> 3948 | D21: =SUM(D16:D20) -> 318 | E21: =+D21/C21 -> 8.0547112462006076E-2
B22: (*): En estas cifras se incluyen causas de años anteriores y las elevaciones a juicio en causas correccionales que se resuelven en la misma instancia.
B23: FUENTE: Oficina de Estadísticas del Poder Judicial de la Nación.