B6: PODER JUDICIAL DE LA NACION
B7: JURISDICCION FEDERAL MENDOZA
B9: CUADRO III
B10: DISTRIBUCION DE LOS CARGOS PERMANENTES Y CONTRATADOS -AÑO 2001-
C12: Cámara Federal de Apelaciones de Mendoza | E12: Tribunales Orales en lo Criminal Federal de Mendoza Nros 1 y 2 | G12: Tribunal Oral en lo Criminal Federal de San Juan | I12: Tribunal Oral en lo Criminal Federal de San Luis | K12: Juzgados Federales de Primera Instancia de Mendoza Nros 1 al 3 | M12: Juzgados Federales de Primera Instancia de San Juan Nros 1 y 2 | O12: Juzgado Federal de Primera Instancia de San Luis | Q12: Juzgado Federal de Primera Instancia de San Rafael
C13: P | D13: C | E13: P | F13: C | G13: P | H13: C | I13: P | J13: C | K13: P | L13: C | M13: P | N13: C | O13: P | P13: C | Q13: P | R13: C
B14: Juez y Fiscal (1ª o 2ª
B15: instancia) | C15: 6 | E15: 6 | G15: 3 | I15: 3 | K15: 3 | M15: 2 | O15: 1 | Q15: 1
B16: Secretario (1ª o 2ª instancia)
C17: 3 | E17: 2 | G17: 1 | I17: 1 | K17: 10 | M17: 5 | N17: 1 | O17: 3 | Q17: 4
B18: Prosecretario
B19: Jefe
B20: Prosecretario
B21: de Cámara
B22: Prosecretario Administrativo
C23: 12 | E23: 3 | G23: 2 | I23: 2 | K23: 9 | M23: 5 | O23: 4 | Q23: 3
B24: Oficial Mayor | L24: 6
C25: 10 | D25: 4 | E25: 6 | G25: 3 | I25: 3 | K25: 10 | M25: 5 | O25: 5 | Q25: 3
B26: Oficial Mayor Relator
B28: Oficial
C29: 6 | M29: 2 | O29: 1 | Q29: 1
B30: Escribiente | L30: 1
C31: 6 | D31: 4 | E31: 2 | G31: 1 | I31: 1 | K31: 5 | M31: 7 | O31: 4 | Q31: 4
B32: Escribiente Auxiliar
C33: 7 | E33: 2 | G33: 1 | I33: 1 | K33: 15 | M33: 5 | O33: 3 | P33: 1 | Q33: 5
B34: Auxiliar
C35: 7 | K35: 17 | L35: 2 | M35: 6 | N35: 3 | O35: 4 | Q35: 7
B36: Auxiliar Administrativo
B38: Jefe de Sección /
B39: Encargado de Sección
B40: Oficial
B41: de Servicio / Medio Oficial | C41: 3 | G41: 1 | O41: 1
B42: Ayudante
C43: 13 | E43: 2 | G43: 1 | I43: 1 | K43: 10 | M43: 6 | O43: 3 | Q43: 4
B44: Auxiliar de Servicio
B46: Total
C47: =SUM(C15:C45) -> 73 | D47: =SUM(D15:D45) -> 8 | E47: =SUM(E15:E45) -> 23 | F47: =SUM(F15:F45) -> 0 | G47: =SUM(G15:G45) -> 13 | H47: =SUM(H15:H45) -> 0 | I47: =SUM(I15:I45) -> 12 | J47: =SUM(J15:J45) -> 0 | K47: =SUM(K15:K45) -> 79 | L47: =SUM(L15:L45) -> 9 | M47: =SUM(M15:M45) -> 43 | N47: =SUM(N15:N45) -> 4 | O47: =SUM(O15:O45) -> 29 | P47: =SUM(P15:P45) -> 1 | Q47: =SUM(Q15:Q45) -> 32 | R47: =SUM(R15:R45) -> 0
B48: FUENTE: División Programación Presupuestaria.Consejo de la Magistratura. Oficina de Estadísticas del Poder Judicial de la Nación.