B6: PODER JUDICIAL DE LA NACION
B7: JURISDICCION FEDERAL MENDOZA
B9: COMPETENCIA PENAL
B10: CUADRO IX
B11: DISTRIBUCION PORCENTUAL,SEGÚN ELTIPO DE DELITO, DE LAS CAUSAS INGRESADAS, ELEVADAS A JUICIO Y PERSONAS CONDENADAS EN LOS JUZGADOS FEDERALES -AÑO 2001-
C13: CAUSAS | D13: % | E13: CAUSAS | F13: % | G13: PERSONAS | H13: %
B14: BIEN PROTEGIDO | C14: INGRESADAS | E14: ELEVADAS | G14: CONDENADAS (*)
B15: DELITOS CONTRA LAS PERSONAS | C15: 20 | D15: =+(C15/C$31) -> 5.065856129685917E-3 | F15: =+E15/E$31 -> 0 | H15: =+G15/G$31 -> 0
B16: HOMICIDIOS | D16: =+(C16/C$31) -> 0 | E16: 1 | F16: =+E16/E$31 -> 3.1446540880503146E-3 | H16: =+G16/G$31 -> 0
B17: DELITOS CONTRA EL HONOR | C17: 1 | D17: =+(C17/C$31) -> 2.5329280648429586E-4 | F17: =+E17/E$31 -> 0 | H17: =+G17/G$31 -> 0
B18: DELITOS CONTRA LA INTEGRIDAD SEXUAL | C18: 1 | D18: =+(C18/C$31) -> 2.5329280648429586E-4 | F18: =+E18/E$31 -> 0 | H18: =+G18/G$31 -> 0
B19: DELITOS CONTRA EL ESTADO CIVIL | C19: 1 | D19: =+(C19/C$31) -> 2.5329280648429586E-4 | F19: =+E19/E$31 -> 0 | H19: =+G19/G$31 -> 0
B20: DELITOS CONTRA LA LIBERTAD | C20: 60 | D20: =+(C20/C$31) -> 1.5197568389057751E-2 | E20: 2 | F20: =+E20/E$31 -> 6.2893081761006293E-3 | G20: 2 | H20: =+G20/G$31 -> 5.8139534883720929E-3
B21: DELITOS CONTRA LA PROPIEDAD | C21: 316 | D21: =+(C21/C$31) -> 8.0040526849037494E-2 | E21: 16 | F21: =+E21/E$31 -> 5.0314465408805034E-2 | G21: 7 | H21: =+G21/G$31 -> 2.0348837209302327E-2
B22: DELITOS CONTRA LA SEGURIDAD PUBLICA | C22: 153 | D22: =+(C22/C$31) -> 3.8753799392097263E-2 | E22: 4 | F22: =+E22/E$31 -> 1.2578616352201259E-2 | G22: 2 | H22: =+G22/G$31 -> 5.8139534883720929E-3
B23: DELITOS CONTRA EL ORDEN PUBLICO | C23: 4 | D23: =+(C23/C$31) -> 1.0131712259371835E-3 | F23: =+E23/E$31 -> 0 | G23: 1 | H23: =+G23/G$31 -> 2.9069767441860465E-3
B24: DELITOS CONTRA LA SEG. DE LA NACION | C24: 3 | D24: =+(C24/C$31) -> 7.5987841945288754E-4 | F24: =+E24/E$31 -> 0 | H24: =+G24/G$31 -> 0
B25: DELITOS CONTRA LOS POD. PUB. Y ORD. CONTITUC. | C25: 2 | D25: =+(C25/C$31) -> 5.0658561296859173E-4 | F25: =+E25/E$31 -> 0 | H25: =+G25/G$31 -> 0
B26: DELITOS CONTRA LA ADMINISTRACION PUBLICA | C26: 194 | D26: =+(C26/C$31) -> 4.9138804457953392E-2 | E26: 9 | F26: =+E26/E$31 -> 2.8301886792452831E-2 | G26: 10 | H26: =+G26/G$31 -> 2.9069767441860465E-2
B27: DELITOS CONTRA LA FE PUBLICA | C27: 941 | D27: =+(C27/C$31) -> 0.23834853090172239 | E27: 60 | F27: =+E27/E$31 -> 0.18867924528301888 | G27: 41 | H27: =+G27/G$31 -> 0.11918604651162791
B28: INFRACCION LEY 23.737 (ESTUPEFACIENTES) | C28: 1191 | D28: =+(C28/C$31) -> 0.30167173252279633 | E28: 195 | F28: =+E28/E$31 -> 0.6132075471698113 | G28: =80+162 -> 242 | H28: =+G28/G$31 -> 0.70348837209302328
B29: INFRACCION LEYES ESPECIALES Y DEC. LEYES | C29: =669+61+110+180 -> 1020 | D29: =+(C29/C$31) -> 0.25835866261398177 | E29: =18+13 -> 31 | F29: =+E29/E$31 -> 9.7484276729559755E-2 | G29: =1+1+23+14 -> 39 | H29: =+G29/G$31 -> 0.11337209302325581
B30: D.G.I. | C30: 41 | D30: =+(C30/C$31) -> 1.0385005065856131E-2 | F30: =+E30/E$31 -> 0 | H30: =+G30/G$31 -> 0
B31: TOTAL | C31: =SUM(C15:C30) -> 3948 | D31: =SUM(D15:D30) -> 1 | E31: =SUM(E15:E30) -> 318 | F31: =SUM(F15:F30) -> 1 | G31: =SUM(G15:G30) -> 344 | H31: =SUM(H15:H30) -> 1
B32: REFERENCIA (*): En causas tramitadas en los Juzgados de Primera Instancia y en el Tribunal Oral en lo Criminal Federal.
B33: FUENTE: Oficina de Estadísticas del Poder Judicial de la Nación.