B6: PODER JUDICIAL DE LA NACION
B7: JURISDICCION FEDERAL MENDOZA
B9: CUADRO II
B11: DENSIDAD DE POBLACION POR COMPETENCIA TERRITORIAL -AÑO 2001-
C13: POBLACION TOTAL (2001) | D13: SUPERFICIE (Km2) | E13: DENSIDAD DE
E14: POBLACION (hab/km2)
B15: Cámara Federal de Apelaciones y | C15: 2565579 | D15: 315226 | E15: =+C15/D15 -> 8.1388559319345486
B16: de Mendoza
B17: Tribunales Orales en lo Criminal Federal | C17: 1576585 | D17: 148827 | E17: =+C17/D17 -> 10.59340711026897
B18: de Mendoza Nros 1 y 2
B19: Tribunal Oral en lo Criminal Federal
B20: de San Juan | C20: 622034 | D20: 89651 | E20: =+C20/D20 -> 6.9383944406643536
B21: Tribunal Oral en lo Criminal Federal
B22: de San Luis | C22: 366900 | D22: 76749 | E22: =+C22/D22 -> 4.7805183129421884
B23: Juzgados Federales de Primera Instancia | C23: 1336358 | D23: 61827 | E23: =+C23/D23 -> 21.614472641402624
B24: de Mendoza Nros 1, 2 y 3
B25: Juzgado Federal de Primera Instancia
B26: de San Rafael | C26: 240227 | D26: 87000 | E26: =+C26/D26 -> 2.7612298850574715
B27: Juzgados Federales de Primera Instancia
B28: de San Juan Nros 1 y 2 | C28: 622094 | D28: 89651 | E28: =+C28/D28 -> 6.9390637025800048
B29: Juzgado Federal de Primera Instancia
B30: de San Luis | C30: 366900 | D30: 76749 | E30: =+C30/D30 -> 4.7805183129421884
B31: FUENTE: INDEC (Censo Nacional de Población, Hogares y Viviendas 2001) E INSTITUTO GEOGRAFICO MILITAR .
B32: Oficina de Estadísticas del Poder Judicial de la Nación.