B6: PODER JUDICIAL DE LA NACION
B7: JURISDICCIÓN FEDERAL MENDOZA
B9: CUADRO XII
B10: INDICE DE LITIGIOSIDAD EN LOS JUZGADOS FEDERALES DE PRIMERA INSTANCIA -AÑO 2001-
B14: 1- COMPETENCIA PENAL
B16: Dependencias | C16: Causas ingresadas | D16: Cantidad de habitantes en la jurisdicción | E16: Causas ingresadas
E17: c/10.000 hab.
B18: Juzgado Federal de Primera Instancia de Mendoza N° 1 | C18: 971 | D18: 1336358 | E18: =+(C18/D18)*10000 -> 7.2660170403439794
B19: Juzgado Federal de Primera Instancia de Mendoza N° 3 | C19: 1084 | D19: 1336358 | E19: =+(C19/D19)*10000 -> 8.1115988380359152
B20: Juzgado Federal de Primera Instancia de San Rafael | C20: 620 | D20: 240227 | E20: =+(C20/D20)*10000 -> 25.808922394235452
B21: Juzgado Federal de Primera Instancia de San Juan N° 2 | C21: 719 | D21: 622094 | E21: =+(C21/D21)*10000 -> 11.557738862615617
B22: Juzgado Federal de Primera Instancia de San Luis | C22: 554 | D22: 366900 | E22: =+(C22/D22)*10000 -> 15.099482147724176
B23: TOTAL | C23: =SUM(C18:C22) -> 3948 | D23: 2565579 | E23: =+(C23/D23)*10000 -> 15.388339240381995
B25: FUENTE: INDEC (Censo Nacional de Población, Hogares y Viviendas 2001 e Instituto Geografico Militar). Oficinas de Estadísticas
B26: del Poder Judicial de la Nación.
B28: 2- COMPETENCIA CIVIL
B30: Dependencias | C30: Causas ingresadas | D30: Cantidad de habitantes en | E30: Causas ingresadas
D31: la jurisdicción | E31: c/10.000 hab.
B32: Juzgado Federal de Primera Instancia de Mendoza Nº 2 | C32: 6612 | D32: 1336358 | E32: =+(C32/D32)*10000 -> 49.477759702115748
B33: Juzgado Federal de Primera Instancia de San Rafael | C33: 1186 | D33: 240227 | E33: =+(C33/D33)*10000 -> 49.369970902521366
B34: Juzgado Federal de Primera Instancia de San Juan N° 1 | C34: 345 | D34: 622094 | E34: =+(C34/D34)*10000 -> 5.5457856851215412
B35: Juzgado Federal de Primera Instancia de San Juan N° 2 | C35: 2095 | D35: 622094 | E35: =+(C35/D35)*10000 -> 33.676582638636603
B36: Juzgado Federal de Primera Instancia de San Luis | C36: 1433 | D36: 366900 | E36: =+(C36/D36)*10000 -> 39.056963750340692
B37: TOTAL | C37: =SUM(C32:C36) -> 11671 | D37: 2565579 | E37: =+(C37/D37)*10000 -> 45.490705996580111
B39: FUENTE: INDEC (Censo Nacional de Población, Hogares y Viviendas 2001 e Instituto Geografico Militar). Oficinas de Estadísticas
B40: del Poder Judicial de la Nación.