B6: PODER JUDICIAL DE LA NACION
B7: JURISDICCION FEDERAL MENDOZA
B8: CUADRO IV
B10: DISTRIBUCION DE LOS CARGOS POR DEPENDENCIA -AÑO 2001-
C12: Distribución de los cargos actuales | D12: Distribución
D13: Porcentual
B14: Cámara Federal de Apelaciones de Mendoza | C14: =73+8 -> 81 | D14: =+C14/C$22 -> 0.24846625766871167
B15: Tribunal Oral en lo Criminal Federal de Mendoza Nros 1 y 2 | C15: 23 | D15: =+C15/C$22 -> 7.0552147239263799E-2
B16: Tribunal Oral en lo Criminal Federal de San Juan | C16: 13 | D16: =+C16/C$22 -> 3.9877300613496931E-2
B17: Tribunal Oral en lo Criminal Federal de San Luis | C17: 12 | D17: =+C17/C$22 -> 3.6809815950920248E-2
B18: Juzgados Federales de Primera Instancia de Mendoza Nros 1 al 3 | C18: =79+9 -> 88 | D18: =+C18/C$22 -> 0.26993865030674846
B19: Juzgados Federales de Primera Instancia de San Juan Nros 1 y 2 | C19: =43+4 -> 47 | D19: =+C19/C$22 -> 0.14417177914110429
B20: Juzgado Federal de Primera Instancia de San Luis | C20: 30 | D20: =+C20/C$22 -> 9.202453987730061E-2
B21: Juzgado Federal de Primera Instancia de San Rafael | C21: 32 | D21: =+C21/C$22 -> 9.815950920245399E-2
B22: TOTAL | C22: =SUM(C14:C21) -> 326 | D22: =SUM(D14:D21) -> 1
B23: Fuente:Oficina de Estadísticas del Poder Judicial de la Nación.