B6: PODER JUDICIAL DE LA NACION
B7: JURISDICCION FEDERAL MENDOZA
B9: COMPETENCIA CIVIL
B10: CUADRO XI
B11: DISTRIBUCION PORCENTUAL,SEGÚN EL OBJETO DE LITIGIO,DE LOS EXPEDIENTES INGRESADOS,RESUELTOS O SALIDOS Y SENTENCIAS DICTADAS EN LOS JUZGADOS FEDERALES DE PRIMERA INSTANCIA -AÑO 2001-
B13: OBJETO | C13: INGRESADOS | D13: % | E13: RESUELTOS O SALIDOS | F13: % | G13: SENTENCIAS DEFINITIVAS | H13: % | I13: SENTENCIAS INTERLOCUTORIAS | J13: %
B14: ORDINARIOS | C14: 380 | D14: =+C14/C$27 -> 3.2559335104104192E-2 | E14: 357 | F14: =+E14/E$27 -> 4.4574853290048698E-2 | G14: 328 | H14: =+G14/G$27 -> 0.10729473339875695 | I14: 191 | J14: =+I14/I$27 -> 2.1559995484817698E-2
B15: SUMARIOS | C15: 376 | D15: =+C15/C$27 -> 3.2216605260903093E-2 | E15: 454 | F15: =+E15/E$27 -> 5.6686227993507303E-2 | G15: 254 | H15: =+G15/G$27 -> 8.3087994766110562E-2 | I15: 185 | J15: =+I15/I$27 -> 2.0882718139744891E-2
B16: SUMARISIMOS | C16: 27 | D16: =+C16/C$27 -> 2.3134264416074029E-3 | E16: 33 | F16: =+E16/E$27 -> 4.1203645898364337E-3 | G16: 116 | H16: =+G16/G$27 -> 3.7945698397121363E-2 | I16: 14 | J16: =+I16/I$27 -> 1.5803138051698837E-3
B17: EJECUTIVOS | C17: 1202 | D17: =+C17/C$27 -> 0.10299031788192957 | E17: 1139 | F17: =+E17/E$27 -> 0.14221500811586965 | G17: 318 | H17: =+G17/G$27 -> 0.10402355250245339 | I17: 429 | J17: =+I17/I$27 -> 4.842533017270572E-2
B18: EJECUCIONES FISCALES | C18: 6872 | D18: =+C18/C$27 -> 0.5888098706194842 | E18: 4107 | F18: =+E18/E$27 -> 0.51279810213509802 | G18: 1408 | H18: =+G18/G$27 -> 0.46058227019954201 | I18: 7291 | J18: =+I18/I$27 -> 0.82300485382097299
B19: LABORALES | C19: 41 | D19: =+C19/C$27 -> 3.5129808928112414E-3 | E19: 139 | F19: =+E19/E$27 -> 1.7355475090523161E-2 | G19: 55 | H19: =+G19/G$27 -> 1.7991494929669612E-2 | I19: 210 | J19: =+I19/I$27 -> 2.3704707077548254E-2
B20: CIUDADANIA | C20: 232 | D20: =+C20/C$27 -> 1.987833090566361E-2 | E20: 178 | F20: =+E20/E$27 -> 2.2224996878511673E-2 | G20: 77 | H20: =+G20/G$27 -> 2.5188092901537455E-2 | I20: 3 | J20: =+I20/I$27 -> 3.3863867253640368E-4
B21: AMPAROS (LEY 16.986) | C21: 901 | D21: =+C21/C$27 -> 7.7199897181047042E-2 | E21: 101 | F21: =+E21/E$27 -> 1.2610812835559995E-2 | G21: 99 | H21: =+G21/G$27 -> 3.23846908734053E-2 | I21: 338 | J21: =+I21/I$27 -> 3.8153290439101477E-2
B22: AMPAROS POR MORA | C22: 90 | D22: =+C22/C$27 -> 7.7114214720246767E-3 | E22: 63 | F22: =+E22/E$27 -> 7.8661505805968281E-3 | G22: 25 | H22: =+G22/G$27 -> 8.1779522407589133E-3 | I22: 26 | J22: =+I22/I$27 -> 2.9348684953154985E-3
B23: EXPROPIACIONES | C23: 16 | D23: =+C23/C$27 -> 1.3709193728043869E-3 | E23: 2 | F23: =+E23/E$27 -> 2.4971906605069299E-4 | G23: 1 | H23: =+G23/G$27 -> 3.2711808963035657E-4 | I23: 5 | J23: =+I23/I$27 -> 5.6439778756067272E-4
B24: LEY 24.463 (ART. 15 SEG. SOC.) | C24: 415 | D24: =+C24/C$27 -> 3.5558221232113787E-2 | E24: 409 | F24: =+E24/E$27 -> 5.1067549007366715E-2 | G24: 296 | H24: =+G24/G$27 -> 9.6826954530585541E-2 | I24: 79 | J24: =+I24/I$27 -> 8.9174850434586301E-3
B25: LEYES ESPECIALES | C25: 266 | D25: =+C25/C$27 -> 2.2791534572872932E-2 | E25: 118 | F25: =+E25/E$27 -> 1.4733424896990885E-2 | G25: 61 | H25: =+G25/G$27 -> 1.9954203467451751E-2 | I25: 30 | J25: =+I25/I$27 -> 3.3863867253640365E-3
B26: CAUTELARES | C26: 853 | D26: =+C26/C$27 -> 7.308713906263388E-2 | E26: 909 | F26: =+E26/E$27 -> 0.11349731552003996 | G26: 19 | H26: =+G26/G$27 -> 6.2152437029767745E-3 | I26: 58 | J26: =+I26/I$27 -> 6.5470143357038045E-3
B27: TOTAL | C27: =SUM(C14:C26) -> 11671 | D27: =SUM(D14:D26) -> 1 | E27: =SUM(E14:E26) -> 8009 | F27: =SUM(F14:F26) -> 1 | G27: =SUM(G14:G26) -> 3057 | H27: =SUM(H14:H26) -> 1 | I27: =SUM(I14:I26) -> 8859 | J27: =SUM(J14:J26) -> 1
B28: FUENTE: Oficina de Estadísticas del Poder Judicial de la Nación.