B3: CUADRO A
B6: CUADRO COMPARATIVO DE LOS EXPEDIENTES TRAMITADOS EN LA
B7: CORTE SUPREMA DE JUSTICIA DE LA NACION EN EL PERIODO 2000/2011
C10: AÑOS
C11: 2000 (*) | E11: 2001 | G11: 2002 (#) | I11: 2003 | K11: 2004 | M11: 2005 | O11: 2006 (+) | Q11: 2007 (+) | S11: =2008 -> 2008 | U11: =2009 -> 2009 | W11: 2010 | Y11: 2011
C12: INGRESADOS | D12: RESUELTOS | E12: INGRESADOS | F12: RESUELTOS | G12: INGRESADOS | H12: RESUELTOS | I12: INGRESADOS | J12: RESUELTOS | K12: INGRESADOS | L12: RESUELTOS | M12: INGRESADOS | N12: RESUELTOS | O12: INGRESADOS | P12: RESUELTOS | Q12: INGRESADOS | R12: RESUELTOS | S12: INGRESADOS | T12: RESUELTOS | U12: INGRESADOS | V12: RESUELTOS | W12: INGRESADOS | X12: RESUELTOS | Y12: INGRESADOS | Z12: RESUELTOS
B13: TOTAL C.S.J.N. | C13: =SUM(C14:C15) -> 17290 | D13: =SUM(D14:D15) -> 15454 | E13: =SUM(E14:E15) -> 14262 | F13: =SUM(F14:F15) -> 15263 | G13: =SUM(G14:G15) -> 41860 | H13: =SUM(H14:H15) -> 36526 | I13: =SUM(I14:I15) -> 31290 | J13: =SUM(J14:J15) -> 18980 | K13: =SUM(K14:K15) -> 37881 | L13: =SUM(L14:L15) -> 20963 | M13: =SUM(M14:M15) -> 36460 | N13: =SUM(N14:N15) -> 20485 | O13: =SUM(O14:O15) -> 30544 | P13: =SUM(P14:P15) -> 14668 | Q13: =SUM(Q14:Q15) -> 20041 | R13: =SUM(R14:R15) -> 59644 | S13: =SUM(S14:S15) -> 16463 | T13: =SUM(T14:T15) -> 39646 | U13: =SUM(U14:U15) -> 13177 | V13: =SUM(V14:V15) -> 27449 | W13: =SUM(W14:W15) -> 13388 | X13: =SUM(X14:X15) -> 14907 | Y13: =SUM(Y14:Y15) -> 15397 | Z13: =SUM(Z14:Z15) -> 16293
B14: SECRETARIAS JUDICIALES | C14: 7003 | D14: =6167+372+39 -> 6578 | E14: 7273 | F14: 6788 | G14: 30170 | H14: 28644 | I14: 14146 | J14: 7554 | K14: 25627 | L14: 7891 | M14: 31492 | N14: 9455 | O14: 25901 | P14: 10874 | Q14: 17285 | R14: 56996 | S14: 12722 | T14: 34363 | U14: 9631 | V14: 18596 | W14: 9131 | X14: 11727 | Y14: 9418 | Z14: 9946
B15: PREVISIONALES | C15: 10287 | D15: =8271+569+36 -> 8876 | E15: 6989 | F15: 8475 | G15: 11690 | H15: 7882 | I15: 17144 | J15: 11426 | K15: 12254 | L15: 13072 | M15: 4968 | N15: 11030 | O15: 4643 | P15: 3794 | Q15: 2756 | R15: 2648 | S15: 3741 | T15: 5283 | U15: 3546 | V15: 8853 | W15: 4257 | X15: 3180 | Y15: 5979 | Z15: 6347
B16: APEN0111/EVOL2011/EVOLUCION
B18: Referidas: (#): Las cifras de ingresados y resueltos del año 2002 resultan influídas por la gran cantidad de amparos tramitados, estos resultan ser aproximadamente 22.000.
B19: (*): Las cifras consignadas en la columna de ingresados del año 1999 responden a la utilización errónea de los códigos previstos en en el sistema para el registro de las causas previsionales. Por ello se corrige y soluciona, como podrá observarse,
B20: al extraer los datos del año 2000.
B21: (+): Datos provisorios.
B24: VER GRAFICOS
B27: OFICINA DE ESTADISTICAS, PODER JUDICIAL DE LA NACION