B6: PODER JUDICIAL DE LA NACION
B7: JURISDICCION FEDERAL RESISTENCIA
B9: CUADRO IV
B10: DISTRIBUCION DE LOS CARGOS POR DEPENDENCIA -AÑO 2001-
C11: Distribución de los cargos actuales | D11: Distribución
D12: Porcentual
B13: Cámara Federal de Apelaciones de Resistencia | C13: 36 | D13: =+C13/C$19 -> 0.22085889570552147
B14: Tribunal Oral en lo Criminal Federal de Resistencia | C14: 10 | D14: =+C14/C$19 -> 6.1349693251533742E-2
B15: Tribunal Oral en lo Criminal Federal de Formosa | C15: 12 | D15: =+C15/C$19 -> 7.3619631901840496E-2
B16: Juzgado Federal de Primera Instancia de Resistencia | C16: 43 | D16: =+C16/C$19 -> 0.26380368098159507
B17: Juzgado Federal de Primera Instancia de Formosa N° 1 | C17: 50 | D17: =+C17/C$19 -> 0.30674846625766872
B18: Juzgado Federal de Primera Instancia de Reconquista | C18: 12 | D18: =+C18/C$19 -> 7.3619631901840496E-2
B19: TOTAL | C19: =SUM(C13:C18) -> 163 | D19: =SUM(D13:D18) -> 1
B20: FUENTE: Oficina de Estadísticas del Poder Judicial de la Nación.