B6: PODER JUDICIAL DE LA NACION
B7: JURISDICCION FEDERAL RESISTENCIA
B9: CUADRO VI
B10: DISTRIBUCION ANUAL DEL GASTO POR TODO CONCEPTO -AÑO 2001-
C13: Cámara, Tribunal Oral y Juzgados | D13: %
B14: HABERES | C14: 4974478.44 | D14: =+C14/C$18 -> 0.88121139231766066
B15: BIENES DE CONSUMO | C15: 66593.1 | D15: =+C15/C$18 -> 1.1796733884276159E-2
B16: SERVICIOS NO PERSONALES | C16: 603974 | D16: =+C16/C$18 -> 0.10699187379806328
B17: BIENES DE USO
B18: Total | C18: =SUM(C14:C17) -> 5645045.54 | D18: =SUM(D14:D17) -> 1
B19: NOTA: Los datos consignados corresponden a la ejecución presupuestaria del año 2001.
B20: FUENTE: Departamento de Contaduría y Oficina de Estadísticas del Poder Judicial de la Nación.