B6: PODER JUDICIAL DE LA NACION
B7: JURISDICCION FEDERAL RESISTENCIA
B9: COMPETENCIA PENAL
B10: CUADRO VII
B12: CAUSAS INGRESADAS Y ELEVADAS A JUICIO EN LOS JUZGADOS DE 1RA. INSTANCIA -AÑO 2001-
C14: TOTAL DE CAUSAS INGRESADAS | D14: TOTAL DE CAUSAS ELEVADAS A JUICIO (*) | E14: PORCENTAJE DE CAUSAS ELEVADAS A JUICIO
B16: Juzgado Federal de Primera Instancia de Resistencia | C16: 1257 | D16: 8 | E16: =+D16/C16 -> 6.3643595863166272E-3
B17: Juzgado Federal de Primera Instancia de Formosa N° 1 | C17: 751 | D17: 102 | E17: =+D17/C17 -> 0.13581890812250333
B18: Juzgado Federal de Primera Instancia de Reconquista | C18: 191 | D18: 14 | E18: =+D18/C18 -> 7.3298429319371722E-2
B19: Total | C19: =SUM(C16:C18) -> 2199 | D19: =SUM(D16:D18) -> 124 | E19: =+D19/C19 -> 5.6389267849022283E-2
B20: REFERENCIAS: (*) En estas cifras se incluyen causas de años anteriores y las elevaciones a juicio en causas correccionales que se resuelven
B21: en la misma instancia.
B22: FUENTE: Oficina de Estadísticas del Poder Judicial de la Nación.