B6: PODER JUDICIAL DE LA NACION
B7: JURISDICCIÓN FEDERAL RESISTENCIA
B8: CUADRO XII
B9: INDICE DE LITIGIOSIDAD EN LOS JUZGADOS FEDERALES DE PRIMERA INSTANCIA -AÑO 2001-
B12: 1- COMPETENCIA PENAL
B14: Dependencias | C14: Causas ingresadas | D14: Cantidad de habitantes en la | E14: Causas ingresadas
D15: jurisdicción | E15: c/10.000 hab.
B16: Juzgado Federal de Primera Instancia de Resistencia | C16: 1257 | D16: 983087 | E16: =+(C16/$D$16)*10000 -> 12.786253912420772
B17: Juzgado Federal de Primera Instancia de Formosa N° 1 | C17: 751 | D17: 485700 | E17: =+(C17/$D$17)*10000 -> 15.462219477043442
B18: Juzgado Federal de Primera Instancia de Reconquista | C18: 191 | D18: 340102 | E18: =+(C18/$D$18)*10000 -> 5.6159622701424867
B19: TOTAL | C19: =SUM(C16:C18) -> 2199 | D19: 1808889 | E19: =+(C19/D19)*10000 -> 12.156633159911967
B21: FUENTE: INDEC (Censo Nacional de Población, Hogares y Viviendas 2001 e Instituto Geografico Militar). Oficina de Estadísticas del Poder Judicial de la Nación.
B24: 2- COMPETENCIA CIVIL
B26: Dependencias | C26: Causas ingresadas | D26: Cantidad de habitantes en la jurisdicción | E26: Causas ingresadas
E27: c/10.000 hab.
B28: Juzgado Federal de Primera Instancia de Resistencia | C28: 2772 | D28: 983087 | E28: =+(C28/$D$28)*10000 -> 28.19689406939569
B29: Juzgado Federal de Primera Instancia de Formosa N° 1 | C29: 1822 | D29: 485700 | E29: =+(C29/$D$29)*10000 -> 37.51286802553016
B30: Juzgado Federal de Primera Instancia de Reconquista | C30: 967 | D30: 340102 | E30: =+(C30/$D$30)*10000 -> 28.432646676585261
B31: TOTAL | C31: =SUM(C28:C30) -> 5561 | D31: 1808889 | E31: =+(C31/D31)*10000 -> 30.742627104261231
B33: FUENTE: INDEC (Censo Nacional de Población, Hogares y Viviendas 2001 e Instituto Geografico Militar). Oficina de Estadísticas del Poder Judicial de la Nación.