B6: PODER JUDICIAL DE LA NACION
B7: JURISDICCIÓN FEDERAL RESISTENCIA
B8: COMPETENCIA CIVIL
B9: CUADRO XI
B10: DISTRIBUCION PORCENTUAL, SEGÚN EL OBJETO DE LITIGIO, DE LOS EXPEDIENTES INGRESADOS, RESUELTOS O SALIDOS Y SENTENCIAS DICTADAS EN LOS JUZGADOS FEDERALES DE PRIMERA INSTANCIA -AÑO 2001-
B13: OBJETO | C13: INGRESADOS | D13: % | E13: RESUELTOS O SALIDOS | F13: % | G13: SENTENCIAS DEFINITIVAS | H13: % | I13: SENTENCIAS INTERLOCUTORIAS | J13: %
B14: ORDINARIOS | C14: 144 | D14: =+C14/C$27 -> 2.5894623269196188E-2 | E14: 30 | F14: =+E14/E$27 -> 1.358695652173913E-2 | G14: 44 | H14: =+G14/G$27 -> 2.1526418786692758E-2 | I14: 51 | J14: =+I14/I$27 -> 1.5384615384615385E-2
B15: SUMARIOS | C15: 70 | D15: =+C15/C$27 -> 1.2587664089192591E-2 | E15: 10 | F15: =+E15/E$27 -> 4.528985507246377E-3 | G15: 42 | H15: =+G15/G$27 -> 2.0547945205479451E-2 | I15: 31 | J15: =+I15/I$27 -> 9.3514328808446453E-3
B16: SUMARISIMOS | C16: 25 | D16: =+C16/C$27 -> 4.4955943175687824E-3 | E16: 16 | F16: =+E16/E$27 -> 7.246376811594203E-3 | G16: 6 | H16: =+G16/G$27 -> 2.9354207436399216E-3 | I16: 1 | J16: =+I16/I$27 -> 3.0165912518853697E-4
B17: EJECUTIVOS | C17: 395 | D17: =+C17/C$27 -> 7.1030390217586767E-2 | E17: 65 | F17: =+E17/E$27 -> 2.9438405797101448E-2 | G17: 121 | H17: =+G17/G$27 -> 5.9197651663405085E-2 | I17: 285 | J17: =+I17/I$27 -> 8.5972850678733032E-2
B18: EJECUCIONES FISCALES | C18: 4130 | D18: =+C18/C$27 -> 0.7426721812623629 | E18: 1596 | F18: =+E18/E$27 -> 0.72282608695652173 | G18: 1653 | H18: =+G18/G$27 -> 0.80870841487279843 | I18: 2252 | J18: =+I18/I$27 -> 0.67933634992458525
B19: LABORALES | C19: 52 | D19: =+C19/C$27 -> 9.3508361805430679E-3 | E19: 135 | F19: =+E19/E$27 -> 6.1141304347826088E-2 | G19: 22 | H19: =+G19/G$27 -> 1.0763209393346379E-2 | I19: 207 | J19: =+I19/I$27 -> 6.244343891402715E-2
B20: CIUDADANIA | C20: 42 | D20: =+C20/C$27 -> 7.5525984535155547E-3 | E20: 97 | F20: =+E20/E$27 -> 4.3931159420289856E-2 | G20: 20 | H20: =+G20/G$27 -> 9.7847358121330719E-3 | I20: 60 | J20: =+I20/I$27 -> 1.8099547511312219E-2
B21: AMPAROS (LEY 16.986) | C21: 240 | D21: =+C21/C$27 -> 4.3157705448660315E-2 | E21: 28 | F21: =+E21/E$27 -> 1.2681159420289856E-2 | G21: 21 | H21: =+G21/G$27 -> 1.0273972602739725E-2 | I21: 152 | J21: =+I21/I$27 -> 4.5852187028657614E-2
B22: AMPAROS POR MORA | C22: 2 | D22: =+C22/C$27 -> 3.596475454055026E-4 | E22: 3 | F22: =+E22/E$27 -> 1.358695652173913E-3 | G22: 1 | H22: =+G22/G$27 -> 4.8923679060665359E-4 | I22: 1 | J22: =+I22/I$27 -> 3.0165912518853697E-4
B23: EXPROPIACIONES | D23: =+C23/C$27 -> 0 | F23: =+E23/E$27 -> 0 | H23: =+G23/G$27 -> 0 | J23: =+I23/I$27 -> 0
B24: LEY 24.463 (ART. 15 SEG. SOC.) | C24: 74 | D24: =+C24/C$27 -> 1.3306959180003597E-2 | E24: 56 | F24: =+E24/E$27 -> 2.5362318840579712E-2 | G24: 87 | H24: =+G24/G$27 -> 4.2563600782778863E-2 | I24: 23 | J24: =+I24/I$27 -> 6.9381598793363496E-3
B25: LEYES ESPECIALES | C25: 39 | D25: =+C25/C$27 -> 7.0131271354073009E-3 | E25: 18 | F25: =+E25/E$27 -> 8.152173913043478E-3 | G25: 16 | H25: =+G25/G$27 -> 7.8277886497064575E-3 | I25: 2 | J25: =+I25/I$27 -> 6.0331825037707393E-4
B26: CAUTELARES | C26: 348 | D26: =+C26/C$27 -> 6.257867290055745E-2 | E26: 154 | F26: =+E26/E$27 -> 6.9746376811594207E-2 | G26: 11 | H26: =+G26/G$27 -> 5.3816046966731895E-3 | I26: 250 | J26: =+I26/I$27 -> 7.5414781297134234E-2
B27: TOTAL | C27: =SUM(C14:C26) -> 5561 | D27: =SUM(D14:D26) -> 1 | E27: =SUM(E14:E26) -> 2208 | F27: =SUM(F14:F26) -> 1 | G27: =SUM(G14:G26) -> 2044 | H27: =SUM(H14:H26) -> 1 | I27: =SUM(I14:I26) -> 3315 | J27: =SUM(J14:J26) -> 1
B28: FUENTE:Oficina de Estadísticas del Poder Judicial de la Nación.