B6: PODER JUDICIAL DE LA NACION
B7: JURISDICCION FEDERAL RESISTENCIA
B9: CUADRO III
B10: DISTRIBUCION DE LOS CARGOS PERMANENTES Y CONTRATADOS -AÑO 2001-
C13: Cámara Federal de Apelaciones de Resistencia | E13: Tribunal Oral en lo Criminal Federal de Resistencia | G13: Tribunal Oral en lo Criminal Federal de Formosa | I13: Juzgado Federal de Primera Instancia de Resistencia | K13: Juzgado Federal de Primera Instancia de Presidencia Roque Sáenz Peña (sin habilitar) | M13: Juzgado Federal de Primera Instancia de Formosa N° 1 | O13: Juzgado Federal de Primera Instancia de Formosa N° 2 sin habilitar) | Q13: Juzgado Federal de Primera Instancia de Reconquista
C14: P | D14: C | E14: P | F14: C | G14: P | H14: C | I14: P | J14: C | K14: P | L14: C | M14: P | N14: C | O14: P | P14: C | Q14: P | R14: C
B15: Juez (1ª o 2ª
B16: instancia) | C16: 3 | E16: 3 | G16: 3 | I16: 1 | M16: 1 | Q16: 1
B17: Secretario (1ª o 2ª instancia)
C18: 2 | E18: 1 | G18: 1 | I18: 5 | M18: 4 | Q18: 2
B19: Prosecretario Administrativo
B20: Jefe
B21: Prosecretario
B22: de Cámara | C22: 1
B23: Prosecretario Administrativo | J23: 1
C24: 6 | E24: 2 | G24: 2 | I24: 5 | M24: 4 | N24: 1 | Q24: 2
B25: Oficial Mayor | J25: 1
C26: 8 | D26: 1 | E26: 3 | G26: 3 | I26: 5 | M26: 4 | Q26: 1
B27: Oficial Mayor Relator
B29: Oficial
Q30: 1
B31: Escribiente
C32: 3 | G32: 1 | I32: 6 | M32: 8
B33: Escribiente Auxiliar
C34: 2 | G34: 1 | I34: 6 | M34: 5 | Q34: 2
B35: Auxiliar
C36: 4 | I36: 8 | J36: 1 | M36: 13 | Q36: 2
B37: Auxiliar Administrativo
B39: Jefe de Sección /
B40: Encargado de Sección | M40: 1
B41: Oficial
B42: de Servicio / Medio Oficial | C42: 1 | M42: 3
B43: Ayudante
C44: 5 | E44: 1 | G44: 1 | I44: 4 | M44: 6 | Q44: 1
B45: Auxiliar de Servicio
B47: Total | C47: =SUM(C15:C46) -> 35 | D47: =SUM(D15:D46) -> 1 | E47: =SUM(E15:E46) -> 10 | F47: =SUM(F15:F46) -> 0 | G47: =SUM(G15:G46) -> 12 | H47: =SUM(H15:H46) -> 0 | I47: =SUM(I15:I46) -> 40 | J47: =SUM(J15:J46) -> 3 | K47: =SUM(K15:K46) -> 0 | L47: =SUM(L15:L46) -> 0 | M47: =SUM(M15:M46) -> 49 | N47: =SUM(N15:N46) -> 1 | O47: =SUM(O15:O46) -> 0 | P47: =SUM(P15:P46) -> 0 | Q47: =SUM(Q15:Q46) -> 12 | R47: =SUM(R15:R46) -> 0
B48: FUENTE: División Programación Presupuestaria. Consejo de la Magistratura.
B49: Oficina de Estadísticas del Poder Judicial de la Nación.