B6: PODER JUDICIAL DE LA NACION
B7: JURISDICCION FEDERAL RESISTENCIA
B9: CUADRO II
B10: DENSIDAD DE POBLACION POR COMPETENCIA TERRITORIAL -AÑO 2001-
C13: POBLACION TOTAL (2001) | D13: SUPERFICIE (Km2) | E13: DENSIDAD DE
E14: POBLACION (hab/km2)
B15: Cámara Federal de Apelaciones | C15: 1808889 | D15: 242372 | E15: =+C15/D15 -> 7.4632754608618157
B16: de Resistencia
C17: 983087 | D17: 99633 | E17: =+C17/D17 -> 9.8670821916433304
B18: Tribunal Oral en lo Criminal Federal
B19: de Resistencia
B21: Tribunal Oral en lo Criminal Federal y
B22: de Formosa | C22: 485700 | D22: 72066 | E22: =+C22/D22 -> 6.7396553159603698
B23: Juzgado Federal de Primera Instancia | C23: 983087 | D23: 99633 | E23: =+C23/D23 -> 9.8670821916433304
B24: de Resistencia
B25: Juzgado Federal de Primera Instancia
B26: de Presidencia Roque Sáenz Peña (sin habilitar) | C26: ----- | D26: ---- | E26: ----
B27: Juzgado Federal de Primera Instancia
B28: de Formosa N° 1 | C28: 485700 | D28: 72066 | E28: =+C28/D28 -> 6.7396553159603698
B29: Juzgado Federal de Primera Instancia
B30: de Formosa N° 2 (sin habilitar) | C30: ----- | D30: ---- | E30: ----
B31: Juzgado Federal de Primera Instancia
B32: de Reconquista | C32: 340102 | D32: 70673 | E32: =+C32/D32 -> 4.8123328569609329
B33: FUENTE: INDEC (Censo Nacional de Población, Hogares y Viviendas 2001) e Instituto Geográfico Militar
B34: Oficina de Estadísticas del Poder Judicial de la Nación.