B6: PODER JUDICIAL DE LA NACION
B7: JURISDICCION FEDERAL RESISTENCIA
B9: CUADRO V
B10: DISTRIBUCION ANUAL DEL GASTO EN CONCEPTO DE LIQUIDACION DE HABERES -AÑO 2001-
C12: Gasto (Haberes) | D12: %
B13: Cámara Federal de Apelaciones de Resistencia | C13: 1214822.5700234608 | D13: =+C13/C$19 -> 0.24421104336386684
B14: Tribunal Oral en lo Criminal Federal de Resistencia | C14: 578847.23713757086 | D14: =+C14/C$19 -> 0.11636340253945715
B15: Tribunal Oral en lo Criminal Federal de Formosa | C15: 606227.57347138238 | D15: =+C15/C$19 -> 0.12186756476753015
B16: Juzgado Federal de Primera Instancia de Resistencia | C16: 1073391.0910334447 | D16: =+C16/C$19 -> 0.21577962473457712
B17: Juzgado Federal de Primera Instancia de Formosa N° 1 | C17: 1140672.4880274688 | D17: =+C17/C$19 -> 0.2293049415704109
B18: Juzgado Federal de Primera Instancia de Reconquista | C18: 360517.48030667263 | D18: =+C18/C$19 -> 7.247342302415781E-2
B19: TOTAL | C19: =SUM(C13:C18) -> 4974478.44 | D19: =SUM(D13:D18) -> 1
B20: NOTA: Los datos registrados corresponden a la ejecución presupuestaria del año 2001.
B21: FUENTE: Departamento de Contaduría y Oficina de Estadísticas del Poder Judicial de la Nación.