B6: PODER JUDICIAL DE LA NACION
B7: JURISDICCION FEDERAL RESISTENCIA
B9: COMPETENCIA PENAL
B10: CUADRO IX
B11: DISTRIBUCION PORDENTUAL SEGÚN EL TIPO DE DELITO DE LAS CAUSAS INGRESADAS, ELEVADAS A JUICIO Y PERSONAS CONDENADAS EN LOS JUZGADOS FEDERALES -AÑO 2001-
C13: CAUSAS | D13: % | E13: CAUSAS | F13: % | G13: PERSONAS | H13: %
B14: DELITOS | C14: INGRESADAS | E14: ELEVADAS | G14: CONDENADAS
B15: DELITOS CONTRA LAS PERSONAS | C15: 21 | D15: =+(C15/C$31) -> 9.5497953615279671E-3 | F15: =+E15/E$31 -> 0 | H15: =+G15/G$31 -> 0
B16: HOMICIDIOS | C16: 2 | D16: =+(C16/C$31) -> 9.0950432014552066E-4 | F16: =+E16/E$31 -> 0 | H16: =+G16/G$31 -> 0
B17: DELITOS CONTRA EL HONOR | C17: 3 | D17: =+(C17/C$31) -> 1.364256480218281E-3 | F17: =+E17/E$31 -> 0 | H17: =+G17/G$31 -> 0
B18: DELITOS CONTRA LA INTEGRIDAD SEXUAL | D18: =+(C18/C$31) -> 0 | F18: =+E18/E$31 -> 0 | H18: =+G18/G$31 -> 0
B19: DELITOS CONTRA EL ESTADO CIVIL | C19: 1 | D19: =+(C19/C$31) -> 4.5475216007276033E-4 | F19: =+E19/E$31 -> 0 | H19: =+G19/G$31 -> 0
B20: DELITOS CONTRA LA LIBERTAD | C20: 94 | D20: =+(C20/C$31) -> 4.2746703046839474E-2 | F20: =+E20/E$31 -> 0 | H20: =+G20/G$31 -> 0
B21: DELITOS CONTRA LA PROPIEDAD | C21: 106 | D21: =+(C21/C$31) -> 4.8203728967712599E-2 | E21: 5 | F21: =+E21/E$31 -> 4.0322580645161289E-2 | H21: =+G21/G$31 -> 0
B22: DELITOS CONTRA LA SEGURIDAD PUBLICA | C22: 266 | D22: =+(C22/C$31) -> 0.12096407457935425 | E22: 2 | F22: =+E22/E$31 -> 1.6129032258064516E-2 | H22: =+G22/G$31 -> 0
B23: DELITOS CONTRA EL ORDEN PUBLICO | D23: =+(C23/C$31) -> 0 | F23: =+E23/E$31 -> 0 | H23: =+G23/G$31 -> 0
B24: DELITOS CONTRA LA SEG. DE LA NACION | C24: 2 | D24: =+(C24/C$31) -> 9.0950432014552066E-4 | F24: =+E24/E$31 -> 0 | H24: =+G24/G$31 -> 0
B25: DELITOS CONTRA LOS POD. PUB. Y ORD. CONTITUC. | C25: 4 | D25: =+(C25/C$31) -> 1.8190086402910413E-3 | F25: =+E25/E$31 -> 0 | H25: =+G25/G$31 -> 0
B26: DELITOS CONTRA LA ADMINISTRACION PUBLICA | C26: 88 | D26: =+(C26/C$31) -> 4.0018190086402908E-2 | F26: =+E26/E$31 -> 0 | H26: =+G26/G$31 -> 0
B27: DELITOS CONTRA LA FE PUBLICA | C27: 480 | D27: =+(C27/C$31) -> 0.21828103683492497 | E27: 50 | F27: =+E27/E$31 -> 0.40322580645161288 | G27: 7 | H27: =+G27/G$31 -> 0.1111111111111111
B28: INFRACCION LEY 23.737 (ESTUPEFACIENTES) | C28: 597 | D28: =+(C28/C$31) -> 0.27148703956343795 | E28: 39 | F28: =+E28/E$31 -> 0.31451612903225806 | G28: 51 | H28: =+G28/G$31 -> 0.80952380952380953
B29: INFRACCION LEYES ESPECIALES Y DEC. LEYES | C29: =483+2+28+1 -> 514 | D29: =+(C29/C$31) -> 0.23374261027739882 | E29: 28 | F29: =+E29/E$31 -> 0.22580645161290322 | G29: 5 | H29: =+G29/G$31 -> 7.9365079365079361E-2
B30: D.G.I. | C30: 21 | D30: =+(C30/C$31) -> 9.5497953615279671E-3 | F30: =+E30/E$31 -> 0 | H30: =+G30/G$31 -> 0
B31: TOTAL | C31: =SUM(C15:C30) -> 2199 | D31: =SUM(D15:D30) -> 1 | E31: =SUM(E15:E30) -> 124 | F31: =SUM(F15:F30) -> 1 | G31: =SUM(G15:G30) -> 63 | H31: =SUM(H15:H30) -> 1
B32: REFERENCIAS: (*) En causa tramitadas en los Juzgados de 1ra. Instancia y en los Tribunales Orales en lo Criminal Federal.
B33: FUENTE: Oficina de Estadísticas del Poder Judicial de la Nación.