B6: PODER JUDICIAL DE LA NACION
B7: JURISDICCION FEDERAL ROSARIO
B8: CUADRO V
B9: DISTRIBUCION ANUAL DEL GASTO EN CONCEPTO DE LIQUIDACION DE HABERES -AÑO 2001-
C11: Gasto (Haberes) | D11: %
B12: Cámara Federal de Apelaciones de Rosario | C12: 2648341.3797119432 | D12: =+C12/C$23 -> 0.26662885626377653
B13: Tribunal Oral en lo Criminal Federal de Rosario N° 1 | C13: 748165.94231701037 | D13: =+C13/C$23 -> 7.5323608589007718E-2
B14: Tribunal Oral en lo Criminal Federal de Santa Fe | C14: 578500.96107804473 | D14: =+C14/C$23 -> 5.8242132521643272E-2
B15: Juzgado Federal de Primera Instancia de Rosario Nº 1 | C15: 712102.96734770469 | D15: =+C15/C$23 -> 7.1692872067199861E-2
B16: Juzgado Federal de Primera Instancia de Rosario Nº 2 | C16: 762245.30120450736 | D16: =+C16/C$23 -> 7.6741085726154165E-2
B17: Juzgado Federal de Primera Instancia de Rosario Nº 3 | C17: 518043.63509618246 | D17: =+C17/C$23 -> 5.2155429424075257E-2
B18: Juzgado Federal de Primera Instancia de Rosario N° 4 | C18: 502951.1032922389 | D18: =+C18/C$23 -> 5.0635948391970609E-2
B19: Juzgado Federal de Primera Instancia de Santa Fé N° 1 | C19: 957314.49837679742 | D19: =+C19/C$23 -> 9.6380199222918697E-2
B20: Juzgado Federal de Primera Instancia de Santa Fé N° 2 | C20: 1027497.1993339626 | D20: =+C20/C$23 -> 0.10344603047453287
B21: Juzgado Federal de Primera Instancia de San Nicolás N° 1 | C21: 824953.51976592676 | D21: =+C21/C$23 -> 8.3054403458322365E-2
B22: Juzgado Federal de Primera Instancia de San Nicolás N° 2 | C22: 652572.01247568196 | D22: =+C22/C$23 -> 6.5699433860398754E-2
B23: TOTAL | C23: =SUM(C12:C22) -> 9932688.5199999996 | D23: =SUM(D12:D22) -> 1
B24: NOTA: Los datos consignados correponden a la ejecución presupuestaria del año 2001.
B25: FUENTE: Departamento de Contaduría y Oficina de Estadísticas del Poder Judicial de la Nación.