B6: PODER JUDICIAL DE LA NACION
B7: JURISDICCION FEDERAL ROSARIO
B9: CUADRO II
B10: DENSIDAD DE POBLACION POR COMPETENCIA TERRITORIAL -AÑO 2001-
C12: POBLACION TOTAL (2001) | D12: SUPERFICIE (Km2) | E12: DENSIDAD DE
E13: POBLACION (hab/km2)
B14: Cámara Federal de Apelaciones | C14: 3041097 | D14: 71148 | E14: =+C14/D14 -> 42.743253499747006
B15: de Rosario
B16: Tribunal Oral en lo Criminal Federal | C16: 3041097 | D16: 71148 | E16: =+C16/D16 -> 42.743253499747006
B17: de Rosario N° 1
B18: Tribunal Oral en lo Criminal Federal
B19: de Rosario N° 2 (sin habilitar) | C19: 3041097 | D19: 71148 | E19: =+C19/D19 -> 42.743253499747006
B20: Tribunal Oral en lo Criminal Federal
B21: de Santa Fé | C21: 944635 | D21: 34775 | E21: =+C21/D21 -> 27.164198418404027
B22: Juzgados Federales de Primera Instancia | C22: 1712639 | D22: 27559 | E22: =+C22/D22 -> 62.144453717478861
B23: de Rosario Nros 1, 2, 3 y 4
B24: Juzgados Federales de Primera Instancia
B25: de Santa Fé Nros 1 y 2 | C25: 944635 | D25: 34775 | E25: =+C25/D25 -> 27.164198418404027
B26: Juzgados Federales de Primera Instancia de
B27: San Nicolás Nros 1 y 2 | C27: 383823 | D27: 8814 | E27: =+C27/D27 -> 43.546970728386654
B28: FUENTE: INDEC (Censo Nacional de Población, Hogares y Viviendas 2001) e Instituto Geográfico Militar.
B29: Oficina de Estadísticas del Poder Judicial de la Nación.