B6: PODER JUDICIAL DE LA NACION
B7: JURISDICCION FEDERAL ROSARIO
B9: CUADRO III
B10: DISTRIBUCION DE LOS CARGOS PERMANENTES Y CONTRATADOS -AÑO 2001-
C12: Cámara Federal de Apelaciones de Rosario | E12: Tribunales Orales en lo Criminal Federal de Rosario Nros 1 y 2 (*) | G12: Tribunal Oral en lo Criminal Federal de Santa Fé | I12: Juzgados Federales de Primera Instancia de Rosario Nros 1 al 4 | K12: Juzgados Federales de Primera Instancia de Santa Fé Nros 1 y 2 | M12: Juzgados Federales de Primera Instancia de San Nicolás Nros 1 y 2
C13: P | D13: C | E13: P | F13: C | G13: P | H13: C | I13: P | J13: C | K13: P | L13: C | M13: P | N13: C
B14: Juez y Fiscal (1ª o 2ª
B15: instancia) | C15: 6 | E15: 3 | G15: 3 | I15: 4 | K15: 2 | M15: 2
B16: Secretario (1ª o 2ª instancia)
C17: 3 | E17: 1 | G17: 1 | I17: 13 | K17: 8 | M17: 5 | N17: 1
B18: Prosecretario Administrativo
B19: Jefe | C19: 1 | D19: 1
B20: Prosecretario
B21: de Cámara | C21: 1
B22: Prosecretario Administrativo
C23: 15 | D23: 1 | E23: 2 | G23: 2 | I23: 13 | K23: 8 | M23: 5 | N23: 1
B24: Oficial Mayor
C25: 18 | D25: 1 | E25: 3 | G25: 3 | I25: 10 | K25: 7 | M25: 5
B26: Oficial Mayor Relator
B28: Oficial
C29: 1 | I29: 4 | K29: 2 | M29: 1
B30: Escribiente
C31: 2 | D31: 1 | E31: 1 | G31: 1 | I31: 13 | K31: 10 | M31: 5
B32: Escribiente Auxiliar
C33: 3 | E33: 1 | G33: 1 | I33: 9 | K33: 6 | M33: 4
B34: Auxiliar
C35: 2 | D35: 1 | I35: 15 | K35: 15 | M35: 10
B36: Auxiliar Administrativo
B38: Jefe de Sección /
B39: Encargado de Sección
B40: Oficial
B41: de Servicio / Medio Oficial | C41: 2
B42: Ayudante
C43: 6 | E43: 1 | G43: 1 | I43: 7 | K43: 6 | M43: 4
B44: Auxiliar de Servicio
B46: Total | C46: =SUM(C14:C45) -> 60 | D46: =SUM(D14:D45) -> 5 | E46: =SUM(E14:E45) -> 12 | F46: =SUM(F14:F45) -> 0 | G46: =SUM(G14:G45) -> 12 | H46: =SUM(H14:H45) -> 0 | I46: =SUM(I14:I45) -> 88 | J46: =SUM(J14:J45) -> 0 | K46: =SUM(K14:K45) -> 64 | L46: =SUM(L14:L45) -> 0 | M46: =SUM(M14:M45) -> 41 | N46: =SUM(N14:N45) -> 2
B47: Fuente: División Programación Presupuestaria. Consejo de la Magistratura.
B48: Oficina de Estadísticas del Poder Judicial de la Nación.
B49: REF: (*) Sin habilitar