B6: PODER JUDICIAL DE LA NACION
B7: JURISDICCION FEDERAL ROSARIO
B9: CUADRO IV
B10: DISTRIBUCION DE LOS CARGOS POR DEPENDENCIA - AÑO 2001-
C12: Distribución de los cargos actuales | D12: Distribución
D13: Porcentual
B14: Cámara Federal de Apelaciones de Rosario | C14: 65 | D14: =+C14/C$20 -> 0.22887323943661972
B15: Tribunales Orales en lo Criminal Federal de Rosario Nros 1 y 2 (*) | C15: 12 | D15: =+C15/C$20 -> 4.2253521126760563E-2
B16: Tribunal Oral en lo Criminal Federal de Santa Fe | C16: 12 | D16: =+C16/C$20 -> 4.2253521126760563E-2
B17: Juzgados Federales de Primera Instancia de Rosario Nros 1 al 4 | C17: 88 | D17: =+C17/C$20 -> 0.30985915492957744
B18: Juzgados Federales de Primera Instancia de Santa Fé Nros 1 y 2 | C18: 64 | D18: =+C18/C$20 -> 0.22535211267605634
B19: Juzgados Federales de Primera Instancia de San Nicolás Nros 1 y 2 | C19: 43 | D19: =+C19/C$20 -> 0.15140845070422534
B20: TOTAL | C20: =SUM(C14:C19) -> 284 | D20: =SUM(D14:D19) -> 1
B21: FUENTE: Oficina de Estadísticas del Poder Judicial de la Nación.
B22: REF: (*) Sin habilitar