B6: PODER JUDICIAL DE LA NACION
B7: JURISDICCION FEDERAL ROSARIO
B9: CUADRO VI
B10: DISTRIBUCION ANUAL DEL GASTO POR TODO CONCEPTO -AÑO 2001-
C12: Cámara, Tribunal Oral y Juzgados | D12: %
B13: HABERES | C13: 9932688.5199999996 | D13: =+C13/C$17 -> 0.95384908324430828
B14: BIENES DE CONSUMO | C14: 112720.98 | D14: =+C14/C$17 -> 1.0824743292705207E-2
B15: SERVICIOS NO PERSONALES | C15: 367861 | D15: =+C15/C$17 -> 3.5326173462986485E-2
B16: BIENES DE USO
B17: Total | C17: =SUM(C13:C15) -> 10413270.5 | D17: =SUM(D13:D15) -> 1
B18: NOTA: Los datos consignados corresponden a la ejecución presupuestaria del año 2001.
B19: FUENTE: Departamento de Contaduría y Oficina de Estadísticas del Poder Judicial de la Nación.