B6: PODER JUDICIAL DE LA NACION
B7: JURISDICCION FEDERAL ROSARIO
B8: COMPETENCIA CIVIL
B9: CUADRO XI
B10: DISTRIBUCION PORCENTUAL, SEGÚN EL OBJETO DE LITIGIO, DE LOS EXPEDIENTES INGRESADOS, RESUELTOS O SALIDOS Y SENTENCIAS DICTADAS EN LOS JUZGADOS FEDERALES DE PRIMERA INSTANCIA -AÑO 2001-
B11: OBJETO | C11: INGRESADOS | D11: % | E11: RESUELTOS O SALIDOS | F11: % | G11: SENTENCIAS DEFINITIVAS | H11: % | I11: SENTENCIAS INTERLOCUTORIAS | J11: %
B12: ORDINARIOS | C12: 632 | D12: =+C12/C$25 -> 3.0409469277775103E-2 | E12: 357 | F12: =+E12/E$25 -> 4.897791192207436E-2 | G12: 320 | H12: =+G12/G$25 -> 6.5520065520065521E-2 | I12: 486 | J12: =+I12/I$25 -> 8.1447963800904979E-2
B13: SUMARIOS | C13: 200 | D13: =+C13/C$25 -> 9.6232497714478175E-3 | E13: 181 | F13: =+E13/E$25 -> 2.4831938537522295E-2 | G13: 94 | H13: =+G13/G$25 -> 1.9246519246519246E-2 | I13: 160 | J13: =+I13/I$25 -> 2.6814144461203285E-2
B14: SUMARISIMOS | C14: 68 | D14: =+C14/C$25 -> 3.2719049222922581E-3 | E14: 12 | F14: =+E14/E$25 -> 1.6463163671285499E-3 | G14: 12 | H14: =+G14/G$25 -> 2.4570024570024569E-3 | I14: 175 | J14: =+I14/I$25 -> 2.9327970504441091E-2
B15: EJECUTIVOS | C15: 2573 | D15: =+C15/C$25 -> 0.12380310830967618 | E15: 266 | F15: =+E15/E$25 -> 3.6493346138016192E-2 | G15: 271 | H15: =+G15/G$25 -> 5.5487305487305488E-2 | I15: 1228 | J15: =+I15/I$25 -> 0.20579855873973521
B16: EJECUCIONES FISCALES | C16: 13821 | D16: =+C16/C$25 -> 0.66501467545590143 | E16: 3187 | F16: =+E16/E$25 -> 0.43723418850322404 | G16: 1437 | H16: =+G16/G$25 -> 0.2942260442260442 | I16: 2447 | J16: =+I16/I$25 -> 0.41008882185352774
B17: LABORALES | C17: 123 | D17: =+C17/C$25 -> 5.9182986094404076E-3 | E17: 337 | F17: =+E17/E$25 -> 4.6234051310193446E-2 | G17: 182 | H17: =+G17/G$25 -> 3.7264537264537267E-2 | I17: 457 | J17: =+I17/I$25 -> 7.6587900117311883E-2
B18: CIUDADANIA | C18: 408 | D18: =+C18/C$25 -> 1.9631429533753547E-2 | E18: 96 | F18: =+E18/E$25 -> 1.3170530937028399E-2 | G18: 157 | H18: =+G18/G$25 -> 3.2145782145782148E-2 | I18: 4 | J18: =+I18/I$25 -> 6.7035361153008216E-4
B19: AMPAROS (LEY 16.986) | C19: 603 | D19: =+C19/C$25 -> 2.9014098060915171E-2 | E19: 128 | F19: =+E19/E$25 -> 1.7560707916037865E-2 | G19: 180 | H19: =+G19/G$25 -> 3.6855036855036855E-2 | I19: 339 | J19: =+I19/I$25 -> 5.6812468577174459E-2
B20: AMPAROS POR MORA | C20: 84 | D20: =+C20/C$25 -> 4.0417649040080834E-3 | E20: 103 | F20: =+E20/E$25 -> 1.413088215118672E-2 | G20: 60 | H20: =+G20/G$25 -> 1.2285012285012284E-2 | I20: 11 | J20: =+I20/I$25 -> 1.8434724317077259E-3
B21: EXPROPIACIONES | D21: =+C21/C$25 -> 0 | E21: 9 | F21: =+E21/E$25 -> 1.2347372753464124E-3 | G21: 2 | H21: =+G21/G$25 -> 4.0950040950040953E-4 | I21: 5 | J21: =+I21/I$25 -> 8.3794201441260267E-4
B22: LEY 24.463 (ART. 15 SEG. SOC.) | C22: 1228 | D22: =+C22/C$25 -> 5.9086753596689599E-2 | E22: 2115 | F22: =+E22/E$25 -> 0.29016325970640694 | G22: 1973 | H22: =+G22/G$25 -> 0.40397215397215397 | I22: 500 | J22: =+I22/I$25 -> 8.3794201441260263E-2
B23: LEYES ESPECIALES | C23: 374 | D23: =+C23/C$25 -> 1.7995477072607419E-2 | E23: 86 | F23: =+E23/E$25 -> 1.179860063108794E-2 | G23: 66 | H23: =+G23/G$25 -> 1.3513513513513514E-2 | I23: 67 | J23: =+I23/I$25 -> 1.1228422993128876E-2
B24: CAUTELARES | C24: 669 | D24: =+C24/C$25 -> 3.2189770485492951E-2 | E24: 412 | F24: =+E24/E$25 -> 5.6523528604746881E-2 | G24: 130 | H24: =+G24/G$25 -> 2.6617526617526619E-2 | I24: 88 | J24: =+I24/I$25 -> 1.4747779453661807E-2
B25: TOTAL | C25: =SUM(C12:C24) -> 20783 | D25: =SUM(D12:D24) -> 1 | E25: =SUM(E12:E24) -> 7289 | F25: =SUM(F12:F24) -> 1 | G25: =SUM(G12:G24) -> 4884 | H25: =SUM(H12:H24) -> 1 | I25: =SUM(I12:I24) -> 5967 | J25: =SUM(J12:J24) -> 1
B26: FUENTE: Oficina de Estadísticas del Poder Judicial de la Nación.