B6: PODER JUDICIAL DE LA NACION
B7: JURISDICCIÓN FEDERAL ROSARIO
B8: CUADRO XII
B9: INDICE DE LITIGIOSIDAD EN LOS JUZGADOS FEDERALES DE PRIMERA INSTANCIA -AÑO 2001-
B12: 1- COMPETENCIA PENAL
B14: Dependencias | C14: Causas ingresadas | D14: Cantidad de habitantes en la | E14: Causas ingresadas
D15: jurisdicción | E15: c/10.000 hab.
B16: Juzgado Federal de Primera Instancia de Rosario N° 3 | C16: 669 | E16: =+(C16/$D$17)*10000 -> 3.906252280836767
B17: Juzgado Federal de Primera Instancia de Rosario N° 4 | C17: 809 | D17: 1712639 | E17: =+(C17/$D$17)*10000 -> 4.7237041781718156
B18: Juzgado Federal de Primera Instancia de Santa Fe N° 1 | C18: 817 | E18: =+(C18/$D$19)*10000 -> 4.7704157151623896
B19: Juzgado Federal de Primera Instancia de Santa Fe N° 2 | C19: 608 | D19: 1712639 | E19: =+(C19/$D$19)*10000 -> 3.5500768112836392
B20: Juzgado Federal de Primera Instancia de San Nicolás N° 2 | C20: 538 | D20: 383823 | E20: =+(C20/D20)*10000 -> 14.016877571172129
B21: TOTAL | C21: =SUM(C16:C20) -> 3441 | D21: 3041097 | E21: =+(C21/D21)*10000 -> 11.31499587155556
B23: FUENTE: INDEC (Censo Nacional de Población, Hogares y Viviendas 2001 e Instituto Geografico Militar). Oficina de Estadísticas del Poder Judicial de la Nación.
B26: 2- COMPETENCIA CIVIL
B28: Dependencias | C28: Causas ingresadas | D28: Cantidad de habitantes en la jurisdicción | E28: Causas ingresadas
E29: c/10.000 hab.
B30: Juzgado Federal de Primera Instancia de Rosario N° 1 | C30: 7131 | E30: =+(C30/$D$31)*10000 -> 41.637496284973075
B31: Juzgado Federal de Primera Instancia de Rosario N° 2 | C31: 5271 | D31: 1712639 | E31: =+(C31/$D$31)*10000 -> 30.777063934664572
B32: Juzgado Federal de Primera Instancia de Santa Fe N° 1 | C32: 2695 | E32: =+(C32/$D$33)*10000 -> 28.529537863831003
B33: Juzgado Federal de Primera Instancia de Santa Fe N° 2 | C33: 2705 | D33: 944635 | E33: =+(C33/$D$33)*10000 -> 28.635398857759878
B34: Juzgado Federal de Primera Instancia de San Nicolás N° 1 | C34: 2981 | D34: 383823 | E34: =+(C34/D34)*10000 -> 77.666007508669352
B35: TOTAL | C35: =SUM(C30:C34) -> 20783 | D35: 3041097 | E35: =+(C35/D35)*10000 -> 68.34047056045894
B37: FUENTE: INDEC (Censo Nacional de Población, Hogares y Viviendas 2001 e Instituto Geografico Militar). Oficina de Estadísticas del Poder Judicial de la Nación.