B6: PODER JUDICIAL DE LA NACION
B7: JURISDICCION FEDERAL ROSARIO
B8: COMPETENCIA PENAL
B9: CUADRO IX
B10: DISTRIBUCION PORCENTUAL, SEGÚN EL TIPO DE DELITO, DE LAS CAUSAS INGRESADAS, ELEVADAS A JUICIO Y PERSONAS CONDENADAS EN LOS JUZGADOS FEDERALES -AÑO 2001-
C11: CAUSAS | D11: % | E11: CAUSAS | F11: % | G11: PERSONAS | H11: %
B12: DELITOS | C12: INGRESADAS | E12: ELEVADAS | G12: CONDENADAS (*)
B13: DELITOS CONTRA LAS PERSONAS | C13: 39 | D13: =+(C13/C$29) -> 1.1333914559721011E-2 | E13: 1 | F13: =+E13/E$29 -> 4.0650406504065045E-3 | H13: =+G13/G$29 -> 0
B14: HOMICIDIOS | C14: 19 | D14: =+(C14/C$29) -> 5.5216506829410053E-3 | E14: 1 | F14: =+E14/E$29 -> 4.0650406504065045E-3 | H14: =+G14/G$29 -> 0
B15: DELITOS CONTRA EL HONOR | C15: 5 | D15: =+(C15/C$29) -> 1.4530659691950015E-3 | F15: =+E15/E$29 -> 0 | H15: =+G15/G$29 -> 0
B16: DELITOS CONTRA LA INTEGRIDAD SEXUAL | D16: =+(C16/C$29) -> 0 | F16: =+E16/E$29 -> 0 | G16: 1 | H16: =+G16/G$29 -> 5.1020408163265302E-3
B17: DELITOS CONTRA EL ESTADO CIVIL | D17: =+(C17/C$29) -> 0 | F17: =+E17/E$29 -> 0 | H17: =+G17/G$29 -> 0
B18: DELITOS CONTRA LA LIBERTAD | C18: 24 | D18: =+(C18/C$29) -> 6.9747166521360072E-3 | F18: =+E18/E$29 -> 0 | H18: =+G18/G$29 -> 0
B19: DELITOS CONTRA LA PROPIEDAD | C19: 157 | D19: =+(C19/C$29) -> 4.5626271432723048E-2 | E19: 12 | F19: =+E19/E$29 -> 4.878048780487805E-2 | G19: =7+7 -> 14 | H19: =+G19/G$29 -> 7.1428571428571425E-2
B20: DELITOS CONTRA LA SEGURIDAD PUBLICA | C20: 61 | D20: =+(C20/C$29) -> 1.7727404824179019E-2 | E20: 1 | F20: =+E20/E$29 -> 4.0650406504065045E-3 | G20: 1 | H20: =+G20/G$29 -> 5.1020408163265302E-3
B21: DELITOS CONTRA EL ORDEN PUBLICO | C21: 41 | D21: =+(C21/C$29) -> 1.1915140947399011E-2 | F21: =+E21/E$29 -> 0 | H21: =+G21/G$29 -> 0
B22: DELITOS CONTRA LA SEG. DE LA NACION | C22: 1 | D22: =+(C22/C$29) -> 2.906131938390003E-4 | F22: =+E22/E$29 -> 0 | H22: =+G22/G$29 -> 0
B23: DELITOS CONTRA LOS POD. PUB. Y ORD. CONTITUC. | D23: =+(C23/C$29) -> 0 | F23: =+E23/E$29 -> 0 | H23: =+G23/G$29 -> 0
B24: DELITOS CONTRA LA ADMINISTRACION PUBLICA | C24: 78 | D24: =+(C24/C$29) -> 2.2667829119442023E-2 | E24: 4 | F24: =+E24/E$29 -> 1.6260162601626018E-2 | G24: 1 | H24: =+G24/G$29 -> 5.1020408163265302E-3
B25: DELITOS CONTRA LA FE PUBLICA | C25: 355 | D25: =+(C25/C$29) -> 0.10316768381284511 | E25: 29 | F25: =+E25/E$29 -> 0.11788617886178862 | G25: 13 | H25: =+G25/G$29 -> 6.6326530612244902E-2
B26: INFRACCION LEY 23.737 (ESTUPEFACIENTES) | C26: 1668 | D26: =+(C26/C$29) -> 0.48474280732345248 | E26: 161 | F26: =+E26/E$29 -> 0.65447154471544711 | G26: =19+131 -> 150 | H26: =+G26/G$29 -> 0.76530612244897955
B27: INFRACCION LEYES ESPECIALES Y DEC. LEYES | C27: =271+41+449+37 -> 798 | D27: =+(C27/C$29) -> 0.23190932868352224 | E27: =23+2+9+3 -> 37 | F27: =+E27/E$29 -> 0.15040650406504066 | G27: =3+13 -> 16 | H27: =+G27/G$29 -> 8.1632653061224483E-2
B28: D.G.I. | C28: 195 | D28: =+(C28/C$29) -> 5.6669572798605058E-2 | F28: =+E28/E$29 -> 0 | H28: =+G28/G$29 -> 0
B29: TOTAL | C29: =SUM(C13:C28) -> 3441 | D29: =SUM(D13:D28) -> 1 | E29: =SUM(E13:E28) -> 246 | F29: =SUM(F13:F28) -> 1 | G29: =SUM(G13:G28) -> 196 | H29: =SUM(H13:H28) -> 1
B30: REFERENCIAS: (*) En causas tramitadas en los Juzgados de 1ra. Instancia y en los Tribunales Orales en lo Criminal Federal.
B31: FUENTE: Oficina de Estadísticas del Poder Judicial de la Nación.