B6: PODER JUDICIAL DE LA NACION
B7: JURISDICCION FEDERAL ROSARIO
B9: COMPETENCIA PENAL
B10: CUADRO VII
B11: CAUSAS INGRESADAS Y ELEVADAS A JUICIO EN LOS JUZGADOS DE 1RA. INSTANCIA -AÑO 2001-
C13: TOTAL DE CAUSAS INGRESADAS | D13: TOTAL DE CAUSAS ELEVADAS A JUICIO (*) | E13: PORCENTAJE DE CAUSAS ELEVADAS A JUICIO
B15: Juzgado Federal de Primera Instancia de Rosario Nº 3 | C15: 669 | D15: 73 | E15: =+D15/C15 -> 0.10911808669656203
B16: Juzgado Federal de Primera Instancia de Rosario N° 4 | C16: 809 | D16: 62 | E16: =+D16/C16 -> 7.6637824474660068E-2
B17: Juzgado Federal de Primera Instancia de Santa Fé N° 1 | C17: 817 | D17: 50 | E17: =+D17/C17 -> 6.1199510403916767E-2
B18: Juzgado Federal de Primera Instancia de Santa Fé N° 2 | C18: 608 | D18: 29 | E18: =+D18/C18 -> 4.7697368421052634E-2
B19: Juzgado Federal de Primera Instancia de San Nicolás N° 2 | C19: 538 | D19: 32 | E19: =+D19/C19 -> 5.9479553903345722E-2
B20: Total | C20: =SUM(C15:C19) -> 3441 | D20: =SUM(D15:D19) -> 246 | E20: =+D20/C20 -> 7.1490845684394067E-2
B21: REFERENCIAS: (*): En estas cifras se incluyen causas de años anteriores y las elevaciones a juicio en causas correccionales que se resuelven en la misma instancia.
B22: FUENTE: Oficina de Estadísticas del Poder Judicial de la Nación.