B6: PODER JUDICIAL DE LA NACION
B7: JURISDICCIÓN FEDERAL PARANA
B8: CUADRO XII
B9: INDICE DE LITIGIOSIDAD EN LOS JUZGADOS FEDERALES DE PRIMERA INSTANCIA -AÑO 2001-
B13: 1- COMPETENCIA PENAL
B15: Dependencias | C15: Causas ingresadas | D15: Cantidad de habitantes en la jurisdicción | E15: Causas ingresadas
E16: c/10.000 hab.
B17: Juzgado Federal de Primera Instancia de Paraná | C17: 378 | D17: 576782 | E17: =+(C17/D17)*10000 -> 6.5536025742828317
B18: Juzgado Federal de Primera Instancia de Concepción del Uruguay | C18: 932 | D18: 580017 | E18: =+(C18/D18)*10000 -> 16.068494544125429
B19: TOTAL | C19: =SUM(C17:C18) -> 1310 | D19: 1156799 | E19: =+(C19/D19)*10000 -> 11.324352804592673
B21: FUENTE: INDEC (Censo Nacional de Población, Hogares y Viviendas 2001 e Instituto Geografico Militar). Oficina de Estadísticas del
B22: Poder Judicial de la Nación.
B24: 2- COMPETENCIA CIVIL
B26: Dependencias | C26: Causas ingresadas | D26: Cantidad de habitantes en la jurisdicción | E26: Causas ingresadas
E27: c/10.000 hab.
B28: Juzgado Federal de Primera Instancia de Paraná | C28: 2866 | D28: 576782 | E28: =+(C28/D28)*10000 -> 49.689484068504221
B29: Juzgado Federal de Primera Instancia de Concepción del Uruguay | C29: 2415 | D29: 580017 | E29: =+(C29/D29)*10000 -> 41.63671064813618
B30: TOTAL | C30: =SUM(C28:C29) -> 5281 | D30: =SUM(D28:D29) -> 1156799 | E30: =+(C30/D30)*10000 -> 45.651837527522062
B32: FUENTE: INDEC (Censo Nacional de Población, Hogares y Viviendas 2001 e Instituto Geografico Militar). Oficina de Estadísticas del
B33: Poder Judicial de la Nación.