B6: PODER JUDICIAL DE LA NACION
B7: JURISDICCION FEDERAL PARANA
B9: CUADRO III
B10: DISTRIBUCION DE LOS CARGOS PERMANENTES Y CONTRATADOS -AÑO 2001-
C13: Cámara Federal de Apelaciones de Paraná | E13: Tribunal Oral en lo Criminal Federal de Paraná | G13: Juzgado Federal de Primera Instancia de Paraná | I13: Juzgado Federal de Primera Instancia de Concepción del Uruguay
C14: P | D14: C | E14: P | F14: C | G14: P | H14: C | I14: P | J14: C
B15: Juez (1ª o 2ª
B16: instancia) | C16: 3 | E16: 3 | G16: 1 | I16: 1
B17: Secretario (1ª o 2ª instancia)
C18: 2 | E18: 1 | G18: 5 | I18: 5
B19: Prosecretario
B20: de Cámara | C20: 1
B21: Prosecretario Administrativo
C22: 5 | D22: 1 | E22: 2 | G22: 5 | I22: 5
B23: Oficial Mayor
C24: 11 | D24: 3 | E24: 4 | G24: 4 | I24: 5
B25: Oficial Mayor Relator
B27: Oficial
G28: 1 | I28: 1
B29: Escribiente
C30: 3 | E30: 1 | G30: 1 | I30: 8
B31: Escribiente Auxiliar
C32: 2 | E32: 1 | G32: 4 | I32: 5
B33: Auxiliar
C34: 6 | D34: 1 | G34: 6 | I34: 7
B35: Auxiliar Administrativo
B37: Oficial
B38: de Servicio | C38: 1 | E38: 1
B39: Ayudante
C40: 7 | E40: 1 | G40: 3 | I40: 4
B41: Auxiliar de Servicio
B43: Total
C44: =SUM(C16:C42) -> 41 | D44: =SUM(D16:D42) -> 5 | E44: =SUM(E16:E42) -> 14 | F44: =SUM(F16:F42) -> 0 | G44: =SUM(G16:G42) -> 30 | H44: =SUM(H16:H42) -> 0 | I44: =SUM(I16:I42) -> 41 | J44: =SUM(J16:J42) -> 0
B45: FUENTE: División Programación Presupuestaria. Consejo de la Magistratura.
B46: Oficina de Estadísticas del Poder Judicial de la Nación.