B6: PODER JUDICIAL DE LA NACION
B7: JURISDICCION FEDERAL PARANA
B9: CUADRO IV
B11: DISTRIBUCION DE LOS CARGOS POR DEPENDENCIA -AÑO 2001-
C13: Distribución de los cargos actuales | D13: Distribución
D14: Porcentual
B15: Cámara Federal de Apelaciones de Paraná | C15: 46 | D15: =+C15/C$19 -> 0.35114503816793891
B16: Tribunal Oral en lo Criminal Federal de Paraná | C16: 14 | D16: =+C16/C$19 -> 0.10687022900763359
B17: Juzgado Federal de Primera Instancia de Paraná | C17: 30 | D17: =+C17/C$19 -> 0.22900763358778625
B18: Juzgado Federal de Primera Instancia de Concepción del Uruguay | C18: 41 | D18: =+C18/C$19 -> 0.31297709923664124
B19: TOTAL | C19: =SUM(C15:C18) -> 131 | D19: =SUM(D15:D18) -> 1
B20: FUENTE: Oficina de Estadísticas del Poder Judicial de la Nación.