B6: PODER JUDICIAL DE LA NACION
B7: JURISDICCIÓN FEDERAL PARANA
B9: CUADRO II
B10: DENSIDAD DE POBLACION POR COMPETENCIA TERRITORIAL -AÑO 2001-
C13: POBLACION TOTAL (2001) | D13: SUPERFICIE (Km2) | E13: DENSIDAD DE
E14: POBLACION (hab/km2)
B15: Cámara Federal de Apelaciones | C15: 1156799 | D15: 78781 | E15: =+C15/D15 -> 14.683730848808723
B16: y Tribunal Oral en lo Criminal Federal
B17: de Paraná
B19: Juzgado Federal de | C19: =52577+156952+60169+24937+14508+101149+93799+48362+11437 -> 563890 | D19: 35193 | E19: =+C19/D19 -> 16.022788622737476
B20: Primera Instancia
B21: de Paraná
B22: Juzgado Federal de | C22: =+C15-C19 -> 592909 | D22: =+D15-D19 -> 43588 | E22: =+C22/D22 -> 13.602574102964118
B23: Primera Instancia de
B24: Concepcion del Uruguay
B25: FUENTE: INDEC (Censo Nacional de Población, Hogares y Viviendas 2001) e Instituto Geográfico Militar.
B26: Oficina de Estadísticas del Poder Judicial de la Nación.