B6: PODER JUDICIAL DE LA NACION
B7: JURISDICCION FEDERAL PARANA
B9: COMPETENCIA CIVIL
B10: CUADRO XI
B11: DISTRIBUCION PORCENTUAL, SEGÚN EL OBJETO DE LITIGIO, DE LOS EXPEDIENTES INGRESADOS, RESUELTOS O SALIDOS Y SENTENCIAS DICTADAS EN LOS JUZGADOS FEDERALES DE PRIMERA INSTANCIA -AÑO 2001-
B13: OBJETO | C13: INGRESADOS | D13: % | E13: RESUELTOS O SALIDOS | F13: % | G13: SENTENCIAS DEFINITIVAS | H13: % | I13: SENTENCIAS INTERLOCUTORIAS | J13: %
B14: ORDINARIOS | C14: 93 | D14: =+C14/C$27 -> 1.7610301079341036E-2 | E14: 381 | F14: =+E14/E$27 -> 6.3744353354525676E-2 | G14: 231 | H14: =+G14/G$27 -> 9.3182734973779754E-2 | I14: 17 | J14: =+I14/I$27 -> 1.7561983471074381E-2
B15: SUMARIOS | C15: 232 | D15: =+C15/C$27 -> 4.3931073660291614E-2 | E15: 723 | F15: =+E15/E$27 -> 0.12096369416095031 | G15: 268 | H15: =+G15/G$27 -> 0.10810810810810811 | I15: 265 | J15: =+I15/I$27 -> 0.2737603305785124
B16: SUMARISIMOS | C16: 2 | D16: =+C16/C$27 -> 3.7871615224389319E-4 | E16: 2 | F16: =+E16/E$27 -> 3.3461602810774636E-4 | G16: 1 | H16: =+G16/G$27 -> 4.0338846308995562E-4 | I16: 1 | J16: =+I16/I$27 -> 1.0330578512396695E-3
B17: EJECUTIVOS | C17: 368 | D17: =+C17/C$27 -> 6.9683772012876344E-2 | E17: 307 | F17: =+E17/E$27 -> 5.1363560314539064E-2 | G17: 176 | H17: =+G17/G$27 -> 7.0996369503832188E-2 | I17: 120 | J17: =+I17/I$27 -> 0.12396694214876033
B18: EJECUCIONES FISCALES | C18: 2925 | D18: =+C18/C$27 -> 0.55387237265669376 | E18: 1860 | F18: =+E18/E$27 -> 0.31119290614020412 | G18: 504 | H18: =+G18/G$27 -> 0.20330778539733763 | I18: 134 | J18: =+I18/I$27 -> 0.13842975206611571
B19: LABORALES | C19: 129 | D19: =+C19/C$27 -> 2.442719181973111E-2 | E19: 414 | F19: =+E19/E$27 -> 6.9265517818303493E-2 | G19: 21 | H19: =+G19/G$27 -> 8.4711577248890689E-3 | I19: 26 | J19: =+I19/I$27 -> 2.6859504132231406E-2
B20: CIUDADANIA | C20: 146 | D20: =+C20/C$27 -> 2.7646279113804205E-2 | E20: 225 | F20: =+E20/E$27 -> 3.7644303162121466E-2 | G20: 122 | H20: =+G20/G$27 -> 4.9213392496974588E-2 | I20: 0 | J20: =+I20/I$27 -> 0
B21: AMPAROS (LEY 16.986) | C21: 498 | D21: =+C21/C$27 -> 9.4300321908729404E-2 | E21: 421 | F21: =+E21/E$27 -> 7.0436673916680612E-2 | G21: 408 | H21: =+G21/G$27 -> 0.1645824929407019 | I21: 142 | J21: =+I21/I$27 -> 0.14669421487603307
B22: AMPAROS POR MORA | C22: 16 | D22: =+C22/C$27 -> 3.0297292179511455E-3 | E22: 12 | F22: =+E22/E$27 -> 2.0076961686464781E-3 | G22: 14 | H22: =+G22/G$27 -> 5.647438483259379E-3 | I22: 3 | J22: =+I22/I$27 -> 3.0991735537190084E-3
B23: EXPROPIACIONES | D23: =+C23/C$27 -> 0 | E23: 190 | F23: =+E23/E$27 -> 3.1788522670235901E-2 | G23: 0 | H23: =+G23/G$27 -> 0 | I23: 4 | J23: =+I23/I$27 -> 4.1322314049586778E-3
B24: LEY 24.463 (ART. 15 SEG. SOC.) | C24: 334 | D24: =+C24/C$27 -> 6.3245597424730168E-2 | E24: 1020 | F24: =+E24/E$27 -> 0.17065417433495064 | G24: 575 | H24: =+G24/G$27 -> 0.23194836627672449 | I24: 122 | J24: =+I24/I$27 -> 0.12603305785123967
B25: LEYES ESPECIALES | C25: 45 | D25: =+C25/C$27 -> 8.5211134254875968E-3 | E25: 52 | F25: =+E25/E$27 -> 8.7000167308014052E-3 | G25: 2 | H25: =+G25/G$27 -> 8.0677692617991124E-4 | I25: 1 | J25: =+I25/I$27 -> 1.0330578512396695E-3
B26: CAUTELARES | C26: 493 | D26: =+C26/C$27 -> 9.3353531528119676E-2 | E26: 370 | F26: =+E26/E$27 -> 6.1903965199933075E-2 | G26: 157 | H26: =+G26/G$27 -> 6.3331988705123035E-2 | I26: 133 | J26: =+I26/I$27 -> 0.13739669421487602
B27: TOTAL | C27: =SUM(C14:C26) -> 5281 | D27: =SUM(D14:D26) -> 1 | E27: =SUM(E14:E26) -> 5977 | F27: =SUM(F14:F26) -> 1 | G27: =SUM(G14:G26) -> 2479 | H27: =SUM(H14:H26) -> 1 | I27: =SUM(I14:I26) -> 968 | J27: =SUM(J14:J26) -> 1
B28: FUENTE: Oficina de Estadísticas del Poder Judicial de la Nación.