B6: PODER JUDICIAL DE LA NACION
B7: JURISDICCION FEDERAL PARANA
B9: CUADRO V
B10: DISTRIBUCION ANUAL DEL GASTO EN CONCEPTO DE LIQUIDACION DE HABERES -AÑO 2001-
C12: Gasto (Haberes) | D12: %
B13: Cámara Federal de Apelaciones de Paraná | C13: 1684620.4965777504 | D13: =+C13/C$17 -> 0.37819294541564941
B14: Tribunal Oral en lo Criminal Federal de Paraná | C14: 564885.67011048901 | D14: =+C14/C$17 -> 0.12681537226703141
B15: Juzgado Federal de Primera Instancia de Paraná | C15: 1000458.7787411079 | D15: =+C15/C$17 -> 0.22460040885628646
B16: Juzgado Federal de Primera Instancia de Concepción del Uruguay | C16: 1204429.344570653 | D16: =+C16/C$17 -> 0.27039127346103281
B17: TOTAL | C17: =SUM(C13:C16) -> 4454394.29 | D17: =SUM(D13:D16) -> 1
B18: NOTA: Los datos registrados corresponden a la ejecución presupuestaria del año 2001.
B19: FUENTE: Departamento de Contaduría y Oficina de Estadísticas del Poder Judicial de la Nación.