B6: PODER JUDICIAL DE LA NACION
B7: JURISDICCION FEDERAL PARANA
B9: COMPETENCIA PENAL
B10: CUADRO IX
B11: DISTRIBUCION PORCENTUAL, SEGÚN EL TIPO DE DELITO, DE LAS CAUSAS INGRESADAS, ELEVADAS A JUICIO Y PERSONAS CONDENADAS EN LOS JUZGADOS FEDERALES -AÑO 2001-
C13: CAUSAS | D13: % | E13: CAUSAS | F13: % | G13: PERSONAS | H13: %
B14: DELITOS | C14: INGRESADAS | E14: ELEVADAS | G14: CONDENADAS (*)
B15: DELITOS CONTRA LAS PERSONAS | C15: 8 | D15: =+(C15/C$31) -> 6.1068702290076335E-3 | F15: =+E15/E$31 -> 0 | H15: =+G15/G$31 -> 0
B16: HOMICIDIOS | C16: 1 | D16: =+(C16/C$31) -> 7.6335877862595419E-4 | F16: =+E16/E$31 -> 0 | H16: =+G16/G$31 -> 0
B17: DELITOS CONTRA EL HONOR | C17: 1 | D17: =+(C17/C$31) -> 7.6335877862595419E-4 | F17: =+E17/E$31 -> 0 | H17: =+G17/G$31 -> 0
B18: DELITOS CONTRA LA INTEGRIDAD SEXUAL | D18: =+(C18/C$31) -> 0 | F18: =+E18/E$31 -> 0 | H18: =+G18/G$31 -> 0
B19: DELITOS CONTRA EL ESTADO CIVIL | D19: =+(C19/C$31) -> 0 | F19: =+E19/E$31 -> 0 | H19: =+G19/G$31 -> 0
B20: DELITOS CONTRA LA LIBERTAD | C20: 26 | D20: =+(C20/C$31) -> 1.984732824427481E-2 | F20: =+E20/E$31 -> 0 | H20: =+G20/G$31 -> 0
B21: DELITOS CONTRA LA PROPIEDAD | C21: 71 | D21: =+(C21/C$31) -> 5.4198473282442747E-2 | E21: 3 | F21: =+E21/E$31 -> 1.5625E-2 | H21: =+G21/G$31 -> 0
B22: DELITOS CONTRA LA SEGURIDAD PUBLICA | C22: 39 | D22: =+(C22/C$31) -> 2.9770992366412213E-2 | F22: =+E22/E$31 -> 0 | G22: 2 | H22: =+G22/G$31 -> 4.6511627906976744E-2
B23: DELITOS CONTRA EL ORDEN PUBLICO | C23: 0 | D23: =+(C23/C$31) -> 0 | F23: =+E23/E$31 -> 0 | H23: =+G23/G$31 -> 0
B24: DELITOS CONTRA LA SEG. DE LA NACION | C24: 1 | D24: =+(C24/C$31) -> 7.6335877862595419E-4 | F24: =+E24/E$31 -> 0 | H24: =+G24/G$31 -> 0
B25: DELITOS CONTRA LOS POD .PUB. Y ORD. CONTITUC. | D25: =+(C25/C$31) -> 0 | F25: =+E25/E$31 -> 0 | H25: =+G25/G$31 -> 0
B26: DELITOS CONTRA LA ADMINISTRACION PUBLICA | C26: 28 | D26: =+(C26/C$31) -> 2.1374045801526718E-2 | E26: 6 | F26: =+E26/E$31 -> 3.125E-2 | G26: 1 | H26: =+G26/G$31 -> 2.3255813953488372E-2
B27: DELITOS CONTRA LA FE PUBLICA | C27: 457 | D27: =+(C27/C$31) -> 0.34885496183206105 | E27: 100 | F27: =+E27/E$31 -> 0.52083333333333337 | G27: 12 | H27: =+G27/G$31 -> 0.27906976744186046
B28: INFRACCION LEY 23.737 (ESTUPEFACIENTES) | C28: 216 | D28: =+(C28/C$31) -> 0.16488549618320611 | E28: 43 | F28: =+E28/E$31 -> 0.22395833333333334 | G28: 18 | H28: =+G28/G$31 -> 0.41860465116279072
B29: INFRACCION LEYES ESPECIALES Y DEC. LEYES | C29: =325+39+3 -> 367 | D29: =+(C29/C$31) -> 0.28015267175572517 | E29: =21+1+18 -> 40 | F29: =+E29/E$31 -> 0.20833333333333334 | G29: 10 | H29: =+G29/G$31 -> 0.23255813953488372
B30: D.G.I. | C30: 95 | D30: =+(C30/C$31) -> 7.2519083969465645E-2 | E30: 0 | F30: =+E30/E$31 -> 0 | H30: =+G30/G$31 -> 0
B31: TOTAL | C31: =SUM(C15:C30) -> 1310 | D31: =SUM(D15:D30) -> 1 | E31: =SUM(E15:E30) -> 192 | F31: =SUM(F15:F30) -> 1 | G31: =SUM(G15:G30) -> 43 | H31: =SUM(H15:H30) -> 1
B32: REFERENCIAS: (*) En causas tramitadas en los Juzgados de 1ra. Instancia y en los Tribunales Orales en lo Criminal Federal de la Jurisdicción.
B33: FUENTE: Oficina de Estadísticas del Poder Judicial de la Nación.