B6: PODER JUDICIAL DE LA NACION
B7: JURISDICCIONES FEDERALES DEL INTERIOR
B9: CUADRO B
B11: CAMARAS FEDERALES DE APELACION -AÑO 2001-
B13: FUERO | C13: Superficie en Km2 | D13: Población | E13: Densidad de población (habitantes x km2) | F13: Recursos Humanos | G13: Total de RRHH en la Jurisdicción | H13: Porcentaje de RRHH respecto de toda la jurisdicción (1º inst .+ TOC + Cam) | I13: Gasto anual en haberes (en $) | J13: Total anual en haberes en la Jurisdicción | K13: Porcentaje de gasto en haberes respecto de toda la jurisdicción (1° inst + TOC + Cam) | L13: Promedio mensual de causas penales ingresadas | M13: Promedio mensual de causas civiles ingresadas
B14: LA PLATA | C14: 75660 | D14: 4903402 | E14: =+D14/C14 -> 64.808379592915671 | F14: 150 | G14: 435 | H14: =+F14/G14 -> 0.34482758620689657 | I14: 4418736.17 | J14: 12223983.470000001 | K14: =+I14/J14 -> 0.36148086921455891 | L14: 110.91666666666667 | M14: 70.25
B15: MAR DEL PLATA | C15: 117739 | D15: 1501700 | E15: =+D15/C15 -> 12.754482372026262 | F15: 44 | G15: 190 | H15: =+F15/G15 -> 0.23157894736842105 | I15: 1764811.63 | J15: 5912975.0099999998 | K15: =+I15/J15 -> 0.2984642463422148 | L15: 33.833333333333336 | M15: 65.416666666666671
B16: BAHIA BLANCA | C16: 227564 | D16: 940695 | E16: =+D16/C16 -> 4.1337601729623312 | F16: 41 | G16: 147 | H16: =+F16/G16 -> 0.27891156462585032 | I16: 1639648.34 | J16: 5771058.3200000003 | K16: =+I16/J16 -> 0.28411571137960706 | L16: 15.083333333333334 | M16: 17.25
B17: MENDOZA | C17: 315226 | D17: 2565579 | E17: =+D17/C17 -> 8.1388559319345486 | F17: 81 | G17: 326 | H17: =+F17/G17 -> 0.24846625766871167 | I17: 2821371.76 | J17: 11150052.640000001 | K17: =+I17/J17 -> 0.25303663140374194 | L17: 44.666666666666664 | M17: 71
B18: ROSARIO | C18: 71148 | D18: 3041097 | E18: =+D18/C18 -> 42.743253499747006 | F18: 65 | G18: 284 | H18: =+F18/G18 -> 0.22887323943661972 | I18: 2648341.38 | J18: 9932688.5199999996 | K18: =+I18/J18 -> 0.26662885629277744 | L18: 39.25 | M18: 61.416666666666664
B19: GENERAL ROCA | C19: 322776 | D19: 1080655 | E19: =+D19/C19 -> 3.3480029494138348 | F19: 26 | G19: 213 | H19: =+F19/G19 -> 0.12206572769953052 | I19: 1141298.83 | J19: 7868620.0599999996 | K19: =+I19/J19 -> 0.14504434339151459 | L19: 24.75 | M19: 15.083333333333334
B20: PARANA | C20: 78781 | D20: 1156799 | E20: =+D20/C20 -> 14.683730848808723 | F20: 46 | G20: 131 | H20: =+F20/G20 -> 0.35114503816793891 | I20: 1684620.5 | J20: 4454394.29 | K20: =+I20/J20 -> 0.37819294618393556 | L20: 19.416666666666668 | M20: 85.75
B21: POSADAS | C21: 29801 | D21: 963869 | E21: =+D21/C21 -> 32.343511962685817 | F21: 35 | G21: 129 | H21: =+F21/G21 -> 0.27131782945736432 | I21: 1470581.84 | J21: 4503025.53 | K21: =+I21/J21 -> 0.32657639407165429 | L21: 7.416666666666667 | M21: 20.75
B22: RESISTENCIA | C22: 242372 | D22: 1808889 | E22: =+D22/C22 -> 7.4632754608618157 | F22: 36 | G22: 163 | H22: =+F22/G22 -> 0.22085889570552147 | I22: 1400208.68 | J22: 5733600.9900000002 | K22: =+I22/J22 -> 0.24421104336386684 | L22: 12.25 | M22: 17.333333333333332
B23: CORDOBA | C23: 255001 | D23: 3351431 | E23: =+D23/C23 -> 13.142815126215192 | F23: 134 | G23: 409 | H23: =+F23/G23 -> 0.32762836185819072 | I23: 3743051.04 | J23: 11750386.84 | K23: =+I23/J23 -> 0.31854704793701927 | L23: 20 | M23: 71.083333333333329
B24: SAN MARTIN | C24: 21224 | D24: 6387519 | E24: =+D24/C24 -> 300.95735959291369 | F24: 124 | G24: 639 | H24: =+F24/G24 -> 0.19405320813771518 | I24: 3962698.3 | J24: 19409130.879999999 | K24: =+I24/J24 -> 0.2041667050678366 | L24: 97.416666666666671 | M24: 43.416666666666664
B25: TUCUMAN | C25: 261477 | D25: 2476672 | E25: =+D25/C25 -> 9.4718541210125551 | F25: 72 | G25: 258 | H25: =+F25/G25 -> 0.27906976744186046 | I25: 2245417.68 | J25: 8015161.6699999999 | K25: =+I25/J25 -> 0.28014627432961065 | L25: 14.666666666666666 | M25: 49.166666666666664
B26: SALTA | C26: 208707 | D26: 1690906 | E26: =+D26/C26 -> 8.1018173803466098 | F26: 51 | G26: 169 | H26: =+F26/G26 -> 0.30177514792899407 | I26: 1517079.97 | J26: 5522076.6100000003 | K26: =+I26/J26 -> 0.27472997517866743 | L26: 30 | M26: 23.916666666666668
B27: COMODORO RIVADAVIA | C27: 464515 | D27: 656567 | E27: =+D27/C27 -> 1.4134462826819372 | F27: 38 | G27: 246 | H27: =+F27/G27 -> 0.15447154471544716 | I27: 1768683.96 | J27: 10036828.74 | K27: =+I27/J27 -> 0.17621940214554263 | L27: 34.25 | M27: 20.666666666666668
B28: CORRIENTES | C28: 88199 | D28: 929236 | E28: =+D28/C28 -> 10.535675007653149 | F28: 25 | G28: 119 | H28: =+F28/G28 -> 0.21008403361344538 | I28: 941001.67 | J28: 3886181.19 | K28: =+I28/J28 -> 0.24214045202560411 | L28: 10.583333333333334 | M28: 23.333333333333332
B29: FUENTE: Oficina de Estadísticas del Poder Judicial de la Nación.
B33: Ver Gráfico B.1
B35: Ver Gráfico B.2