B6: PODER JUDICIAL DE LA NACION
B7: JURISDICCION CAPITAL FEDERAL
B9: CUADRO A
B11: CAMARAS NACIONALES DE APELACION -AÑO 2001-
B13: FUERO | C13: Superficie en Km2 | D13: Población | E13: Densidad de población (habitantes x km2) | F13: Recursos Humanos | G13: Total de RRHH en la Jurisdicción | H13: Porcentaje de RRHH respecto de toda la jurisdicción (1º inst .+ TOC + Cam) | I13: Gasto anual en haberes (en $) | J13: Total anual en haberes en la Jurisdicción | K13: Porcentaje de gasto en haberes respecto de toda la jurisdicción (1° inst + TOC + Cam) | L13: Promedio mensual de causas penales ingresadas | M13: Promedio mensual de causas civiles ingresadas
B14: CRIMINAL Y CORRECCIONAL | C14: 200 | E14: 13844 | F14: 432 | G14: 13867 | H14: =+F14/$G$14 -> 3.1153097281315354E-2 | I14: =4302054.9+4596011.58 -> 8898066.4800000004 | J14: 416308044.56999999 | K14: =+I14/$J$14 -> 2.1373755794680153E-2 | L14: 1068.25
B15: CRIMINAL Y CORRECCIONAL FEDERAL | F15: 122 | H15: =+F15/$G$14 -> 8.7978654359270204E-3 | I15: =2750874.92+630607.79 -> 3381482.71 | K15: =+I15/$J$14 -> 8.1225495257789132E-3 | L15: 181.66666666666666
B16: PENAL ECONOMICO | F16: 119 | H16: =+F16/$G$14 -> 8.581524482584554E-3 | I16: =1805145.68+198105.44+1264146.43 -> 3267397.55 | K16: =+I16/$J$14 -> 7.848509277246514E-3 | L16: 207
B17: CIVIL | F17: 474 | H17: =+F17/$G$14 -> 3.4181870628109901E-2 | I17: =13777682.36+4212348.98 -> 17990031.34 | K17: =+I17/$J$14 -> 4.3213268575152577E-2 | M17: 2107.5
B18: COMERCIAL | D18: 2768772 | F18: 228 | H18: =+F18/$G$14 -> 1.6441912454027548E-2 | I18: 7782140.9900000002 | K18: =+I18/$J$14 -> 1.8693227506660574E-2 | M18: 1379.5833333333333
B19: TRABAJO | F19: 485 | H19: =+F19/$G$14 -> 3.4975120790365619E-2 | I19: =1336708.33+10050336.14 -> 11387044.470000001 | K19: =+I19/$J$14 -> 2.7352448790081762E-2 | M19: 1703.1666666666667
B20: SEGURIDAD SOCIAL | F20: 217 | H20: =+F20/$G$14 -> 1.5648662291771833E-2 | I20: =5490913.18+657438.39 -> 6148351.5699999994 | K20: =+I20/$J$14 -> 1.4768755132633971E-2 | M20: 2075.4166666666665
B21: CIVIL Y COMERCIAL FEDERAL | F21: 104 | H21: =+F21/$G$14 -> 7.4998197158722144E-3 | I21: =3193380.19+541583.36 -> 3734963.55 | K21: =+I21/$J$14 -> 8.9716343431648134E-3 | M21: 196.08333333333334
B22: CONTENCIOSO ADMINISTRATIVO FEDERAL | F22: 174 | H22: =+F22/$G$14 -> 1.2547775293863129E-2 | I22: =6407019.82+302299.81 -> 6709319.6299999999 | K22: =+I22/$J$14 -> 1.6116238245960351E-2 | M22: 519.58333333333337
B23: FUENTE: Oficina de Estadísticas del Poder Judicial de la Nación.
B27: Ver Gráfico A.1
B29: Ver Gráfico A.2