B6: PODER JUDICIAL DE LA NACION
B7: JURISDICCION FEDERAL SAN MARTIN
B10: CUADRO IV
B11: DISTRIBUCION DE LOS CARGOS POR DEPENDENCIA -AÑO 2001-
C12: Distribución de los cargos actuales | D12: Distribución
D13: Porcentual
B14: Cámara Federal de Apelaciones de San Martín | C14: =120+4 -> 124 | D14: =+C14/C$22 -> 0.19405320813771518
B15: Tribunales Orales en lo Criminal Federal de San Martín Nros. 1 al 5 | C15: =42+17 -> 59 | D15: =+C15/C$22 -> 9.2331768388106417E-2
B16: Juzgados Federales de Primera Instancia en lo Civil, Comercial y Cont. Adm. de San Martín Nros 1 y 2 | C16: =73+10 -> 83 | D16: =+C16/C$22 -> 0.12989045383411579
B17: Juzgados Federales de Primera Instancia en lo Criminal y Correccional de San Martín Nros 1 y 2 | C17: 75 | D17: =+C17/C$22 -> 0.11737089201877934
B18: Juzgados Federales de Primera Instancia en lo Criminal y Correccional de San Isidro Nros 1 y 2 | C18: =88+4 -> 92 | D18: =+C18/C$22 -> 0.14397496087636932
B19: Juzgados Federales de Primera Instancia en lo Criminal y Correccional de Morón Nros 1 a 3 | C19: =136+2 -> 138 | D19: =+C19/C$22 -> 0.215962441314554
B20: Juzgado Federal de Primera Instancia de Mercedes | C20: 46 | D20: =+C20/C$22 -> 7.1987480438184662E-2
B21: Juzgado Federal de Primera Instancia de Campana | C21: 22 | D21: =+C21/C$22 -> 3.4428794992175271E-2
B22: TOTAL | C22: =SUM(C14:C21) -> 639 | D22: =SUM(D14:D21) -> 1
B23: Fuente: Oficina de Estadísticas del Poder Judicial de la Nación.