B6: PODER JUDICIAL DE LA NACION
B7: JURISDICCION FEDERAL SAN MARTIN
B9: CUADRO II
B10: DENSIDAD DE POBLACION POR COMPETENCIA TERRITORIAL -AÑO 2001-
C13: POBLACION TOTAL (2001) | D13: SUPERFICIE (Km2) | E13: DENSIDAD DE
E14: POBLACION (hab/km2)
B15: Cámara Federal de Apelaciones | C15: 6387519 | D15: 21224 | E15: =+C15/D15 -> 300.95735959291369
B16: de San Martín
B17: Tribunales Orales en lo Criminal Federal | C17: 6387519 | D17: 21224 | E17: =+C17/D17 -> 300.95735959291369
B18: de San Martín Nros. 1, 2, 3, 4 y 5
B19: Juzgados Federales de Primera Instancia
B20: en lo Civil, Comercial y Cont. Adm. de
B21: San Martín Nros. 1 y 2 | C21: 5321295 | D21: 2943 | E21: =+C21/D21 -> 1808.119266055046
B22: Juzgados Federales de Primera Instancia
B23: en lo Criminal y Correccional de San Martín
B24: Nros. 1 y 2
C25: 1514123 | D25: 298 | E25: =+C25/D25 -> 5080.9496644295305
B26: Juzgados Federales de Primera Instancia
B27: en lo Criminal y Correccional de San Isidro
B28: Nros 1 y 2 | C28: 1018040 | D28: 1371 | E28: =+C28/D28 -> 742.5528811086798
B29: Juzgados Federales de Primera Instancia
B30: en lo Criminal y Correccional de Morón
B31: Nros 1, 2 y 3 | C31: 2789130 | D31: 1274 | E31: =+C31/D31 -> 2189.270015698587
B32: Juzgado Federal de Primera Instancia
B33: de Mercedes
C34: 413360 | D34: 13292 | E34: =+C34/D34 -> 31.098405055672586
B35: Juzgado Federal de Primera Instancia
B36: de Campana
C37: 652864 | D37: 4989 | E37: =+C37/D37 -> 130.86069352575666
B38: FUENTE: INDEC (Censo Nacional de Población, Hogares y Viviendas 2001) E INSTITUTO GEOGRAFICO MILITAR .
B39: Oficina de Estadísticas del Poder Judicial de la Nación.