B6: PODER JUDICIAL DE LA NACION
B7: JURISDICCION FEDERAL SAN MARTIN
B8: CUADRO V
B9: DISTRIBUCION ANUAL DEL GASTO EN CONCEPTO DE LIQUIDACION DE HABERES -AÑO 2001-
C11: Gasto (Haberes) | D11: %
B12: Cámara Federal de Apelaciones de San Martín | C12: 3962698.3015545085 | D12: =+C12/C$27 -> 0.20416670514792823
B13: Tribunal Oral en lo Criminal Federal de San Martín N° 1 | C13: 701273.39860144525 | D13: =+C13/C$27 -> 3.6131107721266771E-2
B14: Tribunal Oral en lo Criminal Federal de San Martín N° 2 | C14: 603707.59879573132 | D14: =+C14/C$27 -> 3.1104308715740464E-2
B15: Tribunal Oral en lo Criminal Federal de San Martín N° 3 | C15: 725016.42277672002 | D15: =+C15/C$27 -> 3.7354399187642558E-2
B16: Tribunal Oral en lo Criminal Federal de San Martín N° 4 | C16: 619501.06661208882 | D16: =+C16/C$27 -> 3.1918022009447586E-2
B17: Tribunal Oral en lo Criminal Federal de San Martín N° 5 | C17: 635882.25570345065 | D17: =+C17/C$27 -> 3.2762015962223792E-2
B18: Juzgados Federales de Primera Instancia de San Martín N° 1 | C18: 2129280.1085409187 | D18: =+C18/C$27 -> 0.10970507240666919
B19: Juzgados Federales de Primera Instancia de San Martín N° 2 | C19: 2282436.3572077234 | D19: =+C19/C$27 -> 0.11759601042000514
B20: Juzgado Federal de Primera Instancia en lo Criminal y Correccional de San Isidro N° 1 | C20: 1118532.6204821197 | D20: =+C20/C$27 -> 5.7629196659944405E-2
B21: Juzgado Federal de Primera Instancia en lo Criminal y Correccional de San Isidro N° 2 | C21: 900289.32350737264 | D21: =+C21/C$27 -> 4.6384834492257943E-2
B22: Juzgado Federal de Primera Instancia en lo Criminal y Correccional de Morón N° 1 | C22: 1168482.8266248831 | D22: =+C22/C$27 -> 6.0202738280720126E-2
B23: Juzgado Federal de Primera Instancia en lo Criminal y Correccional de Morón N° 2 | C23: 1329219.8279692752 | D23: =+C23/C$27 -> 6.8484252911033758E-2
B24: Juzgado Federal de Primera Instancia en lo Criminal y Correccional de Morón N° 3 | C24: 961154.38965159433 | D24: =+C24/C$27 -> 4.9520733081459566E-2
B25: Juzgado Federal de Primera Instancia de Mercedes | C25: 1408191.8708553407 | D25: =+C25/C$27 -> 7.2553061729642002E-2
B26: Juzgado Federal de Primera Instancia de Campana | C26: 863464.51111682924 | D26: =+C26/C$27 -> 4.4487541274018619E-2
B27: TOTAL | C27: =SUM(C12:C26) -> 19409130.879999999 | D27: =SUM(D12:D26) -> 1
B28: NOTA: Los datos consignados corresponden a la ejecución presupuestaria del año 2001.
B29: FUENTE: Departamento de Contaduría y Oficina de Estadísticas del Poder Judicial de la Nación.