B6: PODER JUDICIAL DE LA NACION
B7: JURISDICCION FEDERAL SAN MARTIN
B9: COMPETENCIA CIVIL
B10: CUADRO XI
B11: DISTRIBUCION PORCENTUAL, SEGÚN EL OBJETO DE LITIGIO, DE LOS EXPEDIENTES INGRESADOS, RESUELTOS O SALIDOS Y SENTENCIAS DICTADAS EN LOS JUZGADOS FEDERALES DE PRIMERA INSTANCIA -AÑO 2001-
B12: OBJETO | C12: INGRESADOS | D12: % | E12: RESUELTOS O SALIDOS | F12: % | G12: SENTENCIAS DEFINITIVAS | H12: % | I12: SENTENCIAS INTERLOCUTORIAS | J12: %
B13: ORDINARIOS | C13: 98 | D13: =+C13/C$26 -> 3.5784707514788577E-3 | E13: 52 | F13: =+E13/E$26 -> 6.1926878647135886E-3 | G13: 42 | H13: =+G13/G$26 -> 4.1111981205951449E-3 | I13: 72 | J13: =+I13/I$26 -> 8.1697492340860097E-3
B14: SUMARIOS | C14: 401 | D14: =+C14/C$26 -> 1.4642518074928796E-2 | E14: 142 | F14: =+E14/E$26 -> 1.6910801476717877E-2 | G14: 280 | H14: =+G14/G$26 -> 2.7407987470634301E-2 | I14: 188 | J14: =+I14/I$26 -> 2.133212300011347E-2
B15: SUMARISIMOS | C15: 5 | D15: =+C15/C$26 -> 1.8257503834075806E-4 | E15: 6 | F15: =+E15/E$26 -> 7.1454090746695244E-4 | H15: =+G15/G$26 -> 0 | I15: 3 | J15: =+I15/I$26 -> 3.4040621808691704E-4
B16: EJECUTIVOS | C16: 25074 | D16: =+C16/C$26 -> 0.91557730227123346 | E16: 7319 | F16: =+E16/E$26 -> 0.87162081695843752 | G16: 9268 | H16: =+G16/G$26 -> 0.9072043852779953 | I16: 8322 | J16: =+I16/I$26 -> 0.94428684897310788
B17: EJECUCIONES FISCALES | D17: =+C17/C$26 -> 0 | F17: =+E17/E$26 -> 0 | H17: =+G17/G$26 -> 0 | J17: =+I17/I$26 -> 0
B18: LABORALES | C18: 10 | D18: =+C18/C$26 -> 3.6515007668151613E-4 | E18: 4 | F18: =+E18/E$26 -> 4.7636060497796833E-4 | G18: 7 | H18: =+G18/G$26 -> 6.8519968676585745E-4 | I18: 5 | J18: =+I18/I$26 -> 5.6734369681152839E-4
B19: CIUDADANIA | C19: 1055 | D19: =+C19/C$26 -> 3.8523333089899948E-2 | E19: 568 | F19: =+E19/E$26 -> 6.7643205906871506E-2 | G19: 558 | H19: =+G19/G$26 -> 5.4620203602192642E-2 | I19: 3 | J19: =+I19/I$26 -> 3.4040621808691704E-4
B20: AMPAROS (LEY 16.986) | C20: 226 | D20: =+C20/C$26 -> 8.2523917330022643E-3 | E20: 94 | F20: =+E20/E$26 -> 1.1194474216982256E-2 | G20: 49 | H20: =+G20/G$26 -> 4.7963978073610027E-3 | I20: 136 | J20: =+I20/I$26 -> 1.5431748553273573E-2
B21: AMPAROS POR MORA | D21: =+C21/C$26 -> 0 | F21: =+E21/E$26 -> 0 | H21: =+G21/G$26 -> 0 | J21: =+I21/I$26 -> 0
B22: EXPROPIACIONES | D22: =+C22/C$26 -> 0 | F22: =+E22/E$26 -> 0 | H22: =+G22/G$26 -> 0 | J22: =+I22/I$26 -> 0
B23: LEY 24.463 (ART. 15 SEG. SOC.) | D23: =+C23/C$26 -> 0 | F23: =+E23/E$26 -> 0 | H23: =+G23/G$26 -> 0 | J23: =+I23/I$26 -> 0
B24: LEYES ESPECIALES | C24: 82 | D24: =+C24/C$26 -> 2.994230628788432E-3 | E24: 35 | F24: =+E24/E$26 -> 4.1681552935572226E-3 | G24: 4 | H24: =+G24/G$26 -> 3.9154267815191856E-4 | I24: 9 | J24: =+I24/I$26 -> 1.0212186542607512E-3
B25: CAUTELARES | C25: 435 | D25: =+C25/C$26 -> 1.588402833564595E-2 | E25: 177 | F25: =+E25/E$26 -> 2.1078956770275097E-2 | G25: 8 | H25: =+G25/G$26 -> 7.8308535630383712E-4 | I25: 75 | J25: =+I25/I$26 -> 8.510155452172926E-3
B26: TOTAL | C26: =SUM(C13:C25) -> 27386 | D26: =SUM(D13:D25) -> 1 | E26: =SUM(E13:E25) -> 8397 | F26: =SUM(F13:F25) -> 1 | G26: =SUM(G13:G25) -> 10216 | H26: =SUM(H13:H25) -> 1 | I26: =SUM(I13:I25) -> 8813 | J26: =SUM(J13:J25) -> 1
B27: FUENTE: Oficina de Estadísticas del Poder Judicial de la Nación.