B6: PODER JUDICIAL DE LA NACION
B7: JURISDICCION FEDERAL SAN MARTIN
B9: COMPETENCIA CIVIL
B11: CUADRO X
B12: CAUSAS INGRESADAS, RESUELTAS O SALIDAS Y SENTENCIAS DICTADAS EN LOS JUZGADOS FEDERALES DE PRIMERA INSTANCIA -AÑO 2001-
C13: CAUSAS INGRESADAS | D13: CAUSAS RESUELTAS O SALIDAS | E13: SENTENCIAS DICTADAS
E14: DEFINITIVAS | F14: INTERLOCUTORIAS
B15: Juzgado Federal de Primera Instancia de San Martín N° 1 | C15: 13636 | D15: 5127 | E15: 8569 | F15: 992
B16: Juzgado Federal de Primera Instancia de San Martín N° 2 | C16: 10732 | D16: =2093+308 -> 2401 | E16: 418 | F16: 6688
B17: Juzgado Federal de Primera Instancia de Mercedes | C17: 1859 | D17: =456+91 -> 547 | E17: =40+147+850 -> 1037 | F17: =269+117 -> 386
B18: Juzgado Federal de Primera Instancia de Campana | C18: 1159 | D18: =271+51 -> 322 | E18: 192 | F18: =151+596 -> 747
B19: Total | C19: =SUM(C15:C18) -> 27386 | D19: =SUM(D15:D18) -> 8397 | E19: =SUM(E15:E18) -> 10216 | F19: =SUM(F15:F18) -> 8813
B20: FUENTE: Oficina de Estadísticas del Poder Judicial de la Nación.