B6: PODER JUDICIAL DE LA NACION
B7: JURISDICCION FEDERAL SAN MARTIN
B9: CUADRO III
B10: DISTRIBUCION DE LOS CARGOS PERMANENTES Y CONTRATADOS -AÑO 2001-
C14: Cámara Federal de Apelaciones de San Martín | E14: Tribunales Orales en lo Criminal Federal de San Martín Nros. 1 a 5 | G14: Juzgados Federales de Primera Instancia Civil, Comercial y Cont. Adm. de San Martín Nros 1 y 2 | I14: Juzgados Federales de Primera Instancia en lo Criminal y Correccional de San Martín Nros. 1 y 2 | K14: Juzgados Federales de Primera Instancia en lo Criminal y Correccional de San Isidro Nros 1 y 2 | M14: Juzgados Federales de Primera Instancia en lo Criminal y Correccional de Morón Nros 1 a 3 | O14: Juzgado Federal de Primera Instancia de Mercedes | Q14: Juzgado Federal de Primera Instancia de Campana
C15: P | D15: C | E15: P | F15: C | G15: P | H15: C | I15: P | J15: C | K15: P | L15: C | M15: P | N15: C | O15: P | P15: C | Q15: P | R15: C
B16: Juez (1ª o 2ª
B17: instancia) | C17: 6 | E17: 15 | G17: 2 | I17: 2 | K17: 2 | M17: 3 | O17: 1 | Q17: 1
B18: Secretario Letrado
B19: C.S.J.N. | C19: 1
B20: Secretario (1ª o 2ª instancia)
C21: 6 | E21: 5 | F21: 1 | G21: 8 | H21: 2 | I21: 6 | K21: 7 | M21: 11 | N21: 1 | O21: 5 | P21: 1 | Q21: 3
B22: Prosecretario
B23: de Cámara | C23: 7
B24: Prosecretario
B25: Jefe | C25: 7 | L25: 1 | O25: 1
B26: Prosecretario Administrativo
C27: 23 | E27: 7 | G27: 8 | H27: 4 | I27: 8 | K27: 9 | L27: 1 | M27: 16 | N27: 1 | O27: 5 | Q27: 2 | R27: 1
B28: Oficial Mayor
C29: 26 | D29: 3 | E29: 15 | F29: 1 | G29: 15 | I29: 16 | K29: 18 | M29: 25 | O29: 6 | Q29: 2 | R29: 1
B30: Oficial Mayor Relator
B32: Oficial
C33: 2 | K33: 1 | L33: 2 | M33: 3 | O33: 1 | Q33: 1
B34: Escribiente
C35: 8 | F35: 5 | G35: 12 | I35: 14 | K35: 20 | M35: 33 | O35: 10 | Q35: 2
B36: Escribiente Auxiliar
C37: 3 | F37: 5 | G37: 6 | I37: 8 | K37: 8 | M37: 11 | O37: 4 | Q37: 2
B38: Auxiliar
C39: 14 | G39: 14 | H39: 4 | I39: 14 | K39: 14 | M39: 11 | O39: 6 | Q39: 5
B40: Auxiliar Administrativo
B42: Oficial
B43: de Servicio/Medio Oficial | C43: 2 | I43: 1 | K43: 2 | M43: 4 | O43: 1
B44: Ayudante
C45: 15 | D45: 1 | F45: 5 | G45: 8 | I45: 6 | K45: 7 | M45: 19 | O45: 5 | Q45: 2
B46: Auxiliar de Servicio
B48: Total
C49: =SUM(C17:C47) -> 120 | D49: =SUM(D17:D47) -> 4 | E49: =SUM(E17:E47) -> 42 | F49: =SUM(F17:F47) -> 17 | G49: =SUM(G17:G47) -> 73 | H49: =SUM(H17:H47) -> 10 | I49: =SUM(I17:I47) -> 75 | J49: =SUM(J17:J47) -> 0 | K49: =SUM(K17:K47) -> 88 | L49: =SUM(L17:L47) -> 4 | M49: =SUM(M17:M47) -> 136 | N49: =SUM(N17:N47) -> 2 | O49: =SUM(O17:O47) -> 45 | P49: =SUM(P17:P47) -> 1 | Q49: =SUM(Q17:Q47) -> 20 | R49: =SUM(R17:R47) -> 2
B50: Fuente: División Programación Presupuestaria. Consejo de la Magistratura.
B51: Oficina de Estadísticas del Poder Judicial de la Nación.