B6: PODER JUDICIAL DE LA NACION
B7: JURISDICCION FEDERAL SAN MARTIN
B9: CUADRO VI
B10: DISTRIBUCION ANUAL DEL GASTO POR TODO CONCEPTO -AÑO 2001-
C14: Cámara, Tribunal Oral y Juzgados | D14: %
B15: HABERES | C15: =+Hoja5!C27 -> 19409130.879999999 | D15: =+C15/C$19 -> 0.92369471386938351
B16: BIENES DE CONSUMO | C16: 131068.61 | D16: =+C16/C$19 -> 6.2376508747210751E-3
B17: SERVICIOS NO PERSONALES | C17: 1472295.86 | D17: =+C17/C$19 -> 7.0067635255895502E-2
B18: BIENES DE USO | D18: =+C18/C$19 -> 0
B19: Total | C19: =SUM(C15:C18) -> 21012495.349999998 | D19: =SUM(D15:D18) -> 1
B20: NOTA: Los datos consignados correponden a la ejecución presupuestaria del año 2001.
B21: FUENTE: Departamento de Contaduría y Oficina de Estadísticas del Poder Judicial de la Nación.