B6: PODER JUDICIAL DE LA NACION
B7: JURISDICCION FEDERAL SAN MARTIN
B9: COMPETENCIA PENAL
B11: CUADRO VII
B12: CAUSAS INGRESADAS Y ELEVADAS A JUICIO EN LOS JUZGADOS DE 1RA. INSTANCIA -AÑO 2001-
C13: TOTAL DE CAUSAS INGRESADAS | D13: TOTAL DE CAUSAS ELEVADAS A JUICIO (*) | E13: PORCENTAJE DE CAUSAS ELEVADAS A JUICIO
B15: Juzgado Federal de Primera Instancia de San Martín N° 1 | C15: 987 | D15: 49 | E15: =+D15/C15 -> 4.9645390070921988E-2
B16: Juzgado Federal de Primera Instancia de San Martín N° 2 | C16: 1133 | D16: 62 | E16: =+D16/C16 -> 5.4721977052074142E-2
B17: Juzgado Federal de Primera Instancia de San Isidro N° 1 | C17: 1228 | D17: 43 | E17: =+D17/C17 -> 3.5016286644951142E-2
B18: Juzgado Federal de Primera Instancia de San Isidro N° 2 | C18: 613 | D18: 36 | E18: =+D18/C18 -> 5.872756933115824E-2
B19: Juzgado Federal de Primera Instancia de Morón N° 1 | C19: 651 | D19: 67 | E19: =+D19/C19 -> 0.10291858678955453
B20: Juzgado Federal de Primera Instancia de Morón N° 2 | C20: 1079 | D20: 106 | E20: =+D20/C20 -> 9.8239110287303061E-2
B21: Juzgado Federal de Primera Instancia de Morón N° 3 | C21: 1394 | D21: 119 | E21: =+D21/C21 -> 8.5365853658536592E-2
B22: Juzgado Federal de Primera Instancia de Mercedes | C22: 417 | D22: 36 | E22: =+D22/C22 -> 8.6330935251798566E-2
B23: Juzgado Federal de Primera Instancia de Campana | C23: 902 | D23: 29 | E23: =+D23/C23 -> 3.2150776053215077E-2
B24: Total | C24: =SUM(C15:C23) -> 8404 | D24: =SUM(D15:D23) -> 547 | E24: =+D24/C24 -> 6.508805330794859E-2
B25: REFERENCIAS: (*) En estas cifras se incluyen causas de años anteriores y las elevaciones a juicio en causas correccionales que se resuelven en la misma instancia.
B26: FUENTE: Oficina de Estadísticas del Poder Judicial de la Nación.