B6: PODER JUDICIAL DE LA NACION
B7: JURISDICCIÓN FEDERAL SAN MARTIN
B8: CUADRO XII
B9: INDICE DE LITIGIOSIDAD EN LOS JUZGADOS FEDERALES DE PRIMERA INSTANCIA -AÑO 2001-
B13: 1- COMPETENCIA PENAL
B15: Dependencias | C15: Causas ingresadas | D15: Cantidad de habitantes en la jurisdicción | E15: Causas ingresadas
E16: c/10.000 hab.
B17: Juzgado Federal de Primera Instancia de San Martín N° 1 | C17: 987 | D17: 1514123 | E17: =+(C17/D17)*10000 -> 6.5186249730041741
B18: Juzgado Federal de Primera Instancia de San Martín N° 2 | C18: 1133 | D18: 1514123 | E18: =+(C18/D18)*10000 -> 7.482879528281388
B19: Juzgado Federal de Primera Instancia de San Isidro N° 1 | C19: 1228 | E19: =+(C19/D20)*10000 -> 12.062394404934974
B20: Juzgado Federal de Primera Instancia de San Isidro N° 2 | C20: 613 | D20: 1018040 | E20: =+(C20/D20)*10000 -> 6.0213744057207963
B21: Juzgado Federal de Primera Instancia de Morón N° 1 | C21: 651 | E21: =+(C21/D22)*10000 -> 2.3340611588559876
B22: Juzgado Federal de Primera Instancia de Morón N° 2 | C22: 1079 | D22: 2789130 | E22: =+(C22/D22)*10000 -> 3.8685898470132263
B23: Juzgado Federal de Primera Instancia de Morón N° 3 | C23: 1394 | E23: =+(C23/D22)*10000 -> 4.997974278717737
B24: Juzgado Federal de Primera Instancia de Mercedes | C24: 417 | D24: 413360 | E24: =+(C24/D24)*10000 -> 10.088058834913877
B25: Juzgado Federal de Primera Instancia de Campana | C25: 902 | D25: 652864 | E25: =+(C25/D25)*10000 -> 13.81604744632879
B26: TOTAL | C26: =SUM(C17:C25) -> 8404 | D26: 6387519 | E26: =+(C26/D26)*10000 -> 13.156908026418394
B28: FUENTE: INDEC (Censo Nacional de Población, Hogares y Viviendas 2001 e Instituto Geografico Militar).
B29: Oficina de Estadísticas del Poder Judicial de la Nación
B31: 2- COMPETENCIA CIVIL
B33: Dependencias | C33: Causas ingresadas | D33: Cantidad de habitantes en la jurisdicción | E33: Causas ingresadas
E34: c/10.000 hab.
B35: Juzgado Federal de Primera Instancia de San Martín N° 1 | C35: 13636 | E35: =+(C35/D36)*10000 -> 25.625341199839511
B36: Juzgado Federal de Primera Instancia de San Martín N° 2 | C36: 10732 | D36: 5321295 | E36: =+(C36/D36)*10000 -> 20.168023009436613
B37: Juzgado Federal de Primera Instancia de Mercedes | C37: 1859 | D37: 413360 | E37: =+(C37/D37)*10000 -> 44.972904973872652
B38: Juzgado Federal de Primera Instancia de Campana | C38: 1159 | D38: 652864 | E38: =+(C38/D38)*10000 -> 17.75254876972846
B39: TOTAL | C39: =SUM(C35:C38) -> 27386 | D39: 6387519 | E39: =+(C39/D39)*10000 -> 42.874236460196833
B41: FUENTE: INDEC (Censo Nacional de Población, Hogares y Viviendas 2001 e Instituto Geografico Militar).
B42: Oficina de Estadísticas del Poder Judicial de la Nación.