B6: PODER JUDICIAL DE LA NACION
B7: JURISDICCION FEDERAL SAN MARTIN
B9: COMPETENCIA PENAL
B11: CUADRO IX
B12: DISTRIBUCION PORCENTUAL,SEGÚN EL TIPO DE DELITO, DE LAS CAUSAS INGRESADAS, ELEVADAS A JUICIO Y PERSONAS CONDENADAS EN LOS JUZGADOS FEDERALES -AÑO 2001-
C13: CAUSAS | D13: % | E13: CAUSAS | F13: % | G13: PERSONAS | H13: %
B14: DELITOS | C14: INGRESADAS | E14: ELEVADAS | G14: CONDENADAS(*)
B15: DELITOS CONTRA LAS PERSONAS | C15: 78 | D15: =+(C15/C$31) -> 9.2812946216087582E-3 | E15: 2 | F15: =+E15/E$31 -> 3.6563071297989031E-3 | H15: =+G15/G$31 -> 0
B16: HOMICIDIOS | C16: 5 | D16: =+(C16/C$31) -> 5.949547834364588E-4 | E16: 3 | F16: =+E16/E$31 -> 5.4844606946983544E-3 | H16: =+G16/G$31 -> 0
B17: DELITOS CONTRA EL HONOR | C17: 1 | D17: =+(C17/C$31) -> 1.1899095668729176E-4 | F17: =+E17/E$31 -> 0 | H17: =+G17/G$31 -> 0
B18: DELITOS CONTRA LA INTEGRIDAD SEXUAL | D18: =+(C18/C$31) -> 0 | F18: =+E18/E$31 -> 0 | H18: =+G18/G$31 -> 0
B19: DELITOS CONTRA EL ESTADO CIVIL | C19: 5 | D19: =+(C19/C$31) -> 5.949547834364588E-4 | F19: =+E19/E$31 -> 0 | H19: =+G19/G$31 -> 0
B20: DELITOS CONTRA LA LIBERTAD | C20: 182 | D20: =+(C20/C$31) -> 2.1656354117087103E-2 | E20: 3 | F20: =+E20/E$31 -> 5.4844606946983544E-3 | G20: 3 | H20: =+G20/G$31 -> 6.4516129032258064E-3
B21: DELITOS CONTRA LA PROPIEDAD | C21: 165 | D21: =+(C21/C$31) -> 1.9633507853403141E-2 | E21: 18 | F21: =+E21/E$31 -> 3.2906764168190127E-2 | G21: 6 | H21: =+G21/G$31 -> 1.2903225806451613E-2
B22: DELITOS CONTRA LA SEGURIDAD PUBLICA | C22: 1111 | D22: =+(C22/C$31) -> 0.13219895287958114 | E22: 11 | F22: =+E22/E$31 -> 2.0109689213893969E-2 | G22: 6 | H22: =+G22/G$31 -> 1.2903225806451613E-2
B23: DELITOS CONTRA EL ORDEN PUBLICO | C23: 205 | D23: =+(C23/C$31) -> 2.4393146120894812E-2 | F23: =+E23/E$31 -> 0 | H23: =+G23/G$31 -> 0
B24: DELITOS CONTRA LA SEG. DE LA NACION | C24: 580 | D24: =+(C24/C$31) -> 6.9014754878629223E-2 | F24: =+E24/E$31 -> 0 | G24: 1 | H24: =+G24/G$31 -> 2.1505376344086021E-3
B25: DELITOS CONTRA LOS POD. PUB. Y ORD. CONTITUC. | D25: =+(C25/C$31) -> 0 | F25: =+E25/E$31 -> 0 | H25: =+G25/G$31 -> 0
B26: DELITOS CONTRA LA ADMINISTRACION PUBLICA | C26: 444 | D26: =+(C26/C$31) -> 5.2831984769157542E-2 | E26: 12 | F26: =+E26/E$31 -> 2.1937842778793418E-2 | G26: 11 | H26: =+G26/G$31 -> 2.3655913978494623E-2
B27: DELITOS CONTRA LA FE PUBLICA | C27: 1198 | D27: =+(C27/C$31) -> 0.14255116611137553 | E27: 108 | F27: =+E27/E$31 -> 0.19744058500914077 | G27: 39 | H27: =+G27/G$31 -> 8.387096774193549E-2
B28: INFRACCION LEY 23.737 (ESTUPEFACIENTES) | C28: 3543 | D28: =+(C28/C$31) -> 0.42158495954307473 | E28: 354 | F28: =+E28/E$31 -> 0.6471663619744058 | G28: =145+252 -> 397 | H28: =+G28/G$31 -> 0.85376344086021505
B29: INFRACCION LEYES ESPECIALES Y DEC. LEYES | C29: =559+1+103+14 -> 677 | D29: =+(C29/C$31) -> 8.0556877677296523E-2 | E29: =+22+14 -> 36 | F29: =+E29/E$31 -> 6.5813528336380253E-2 | G29: 2 | H29: =+G29/G$31 -> 4.3010752688172043E-3
B30: D.G.I. | C30: 210 | D30: =+(C30/C$31) -> 2.4988100904331272E-2 | F30: =+E30/E$31 -> 0 | H30: =+G30/G$31 -> 0
B31: TOTAL | C31: =SUM(C15:C30) -> 8404 | D31: =SUM(D15:D30) -> 1 | E31: =SUM(E15:E30) -> 547 | F31: =SUM(F15:F30) -> 1 | G31: =SUM(G15:G30) -> 465 | H31: =SUM(H15:H30) -> 1
B32: REFERENCIAS: (*) En causas tramitadas en los Juzgados de 1ra. Instancia y en los Tribunales Orales en lo Criminal Federal.
B33: FUENTE: Oficina de Estadísticas del Poder Judicial de la Nación.