C4: II - INDICADORES DE GESTION - AÑO 2004
C6: Cuadro A.I.b)
C8: Capital Federal
C10: Competencia Penal - Juzgados
C12: Indices
D14: Indice de | E14: Indice de | F14: Indice de | G14: Indice de | H14: Promedio
C15: Juzgados | D15: congestión | E15: descongestión | F15: cumplimiento | G15: duración | H15: de resolución
D16: (a/b) | E16: (b/c) | F16: ( b / (a+c) ) | G16: ( (a+c-1) / b ) | H16: (b/e)
C17: Correccionales | D17: =+'C'!D15/'C'!E15 -> 0.20001945004984076 | E17: =+'C'!E15/'C'!F15 -> 1.0039174528014059 | F17: =+'C'!E15/('C'!D15+'C'!F15) -> 0.8360384165862087 | G17: =+('C'!D15+'C'!F15-1)/'C'!E15 -> 1.1961051275193892 | H17: =+'C'!E15/'C'!H15 -> 5875.8571428571431
C18: Instrucción | D18: =+'C'!D16/'C'!E16 -> 0.15256752205219704 | E18: =+'C'!E16/'C'!F16 -> 1.0115936423743486 | F18: =+'C'!E16/('C'!D16+'C'!F16) -> 0.87634219889273579 | G18: =+('C'!D16+'C'!F16-1)/'C'!E16 -> 1.1410976486759579 | H18: =+'C'!E16/'C'!H16 -> 2241.8979591836733
C19: Menores | D19: =+'C'!D17/'C'!E17 -> 0.23449484987946526 | E19: =+'C'!E17/'C'!F17 -> 1.0307205782697086 | F19: =+'C'!E17/('C'!D17+'C'!F17) -> 0.83008913953065311 | G19: =+('C'!D17+'C'!F17-1)/'C'!E17 -> 1.2044707429322814 | H19: =+'C'!E17/'C'!H17 -> 651.85714285714289
C20: Penal Económico | D20: =+'C'!D18/'C'!E18 -> 1.1483375959079285 | E20: =+'C'!E18/'C'!F18 -> 1.5543286219081272 | F20: =+'C'!E18/('C'!D18+'C'!F18) -> 0.55812846946867567 | G20: =+('C'!D18+'C'!F18-1)/'C'!E18 -> 1.7914180164819551 | H20: =+'C'!E18/'C'!H18 -> 439.875
C21: Penal Tributario | D21: =+'C'!D19/'C'!E19 -> 0.49122807017543857 | E21: =+'C'!E19/'C'!F19 -> 0.556640625 | F21: =+'C'!E19/('C'!D19+'C'!F19) -> 0.43711656441717789 | G21: =+('C'!D19+'C'!F19-1)/'C'!E19 -> 2.2842105263157895 | H21: =+'C'!E19/'C'!H19 -> 95
C22: Criminal y Correccional Federal | D22: =+'C'!D20/'C'!E20 -> 0.40271793172025189 | E22: =+'C'!E20/'C'!F20 -> 1.0074016361511493 | F22: =+'C'!E20/('C'!D20+'C'!F20) -> 0.71665544954273719 | G22: =+('C'!D20+'C'!F20-1)/'C'!E20 -> 1.3953154347585901 | H22: =+'C'!E20/'C'!H20 -> 1508.5
C23: INDICADORES\INDI2004\CAPPENAL04\HOJA D
C24: OFICINA DE ESTADISTICAS