C4: II - INDICADORES DE GESTION - AÑO 2004
C6: Cuadro A.I.b)
C8: Capital Federal
C10: Competencia Penal - Juzgados
D12: Casos Existentes | E12: Total de resueltos | F12: Casos iniciados | G12: Sentencias Definitivas | H12: Cantidad de jueces
C13: Juzgados | D13: al comienzo del año | E13: en el año | F13: en el año | G13: dictadas en el año | H13: de 1ra. Instancia
D14: (a) | E14: (b) | F14: ( c ) | G14: (d) | H14: (e)
C15: Correccionales | D15: 16454 | E15: 82262 | F15: 81941 | G15: 572 | H15: 14
C16: Instrucción | D16: 16760 | E16: 109853 | F16: 108594 | H16: 49
C17: Menores | D17: 1070 | E17: 4563 | F17: 4427 | G17: 11 | H17: 7
C18: Penal Económico | D18: 4041 | E18: 3519 | F18: 2264 | G18: 77 | H18: 8
C19: Penal Tributario | D19: 140 | E19: 285 | F19: 512 | H19: 3
C20: Criminal y Correccional Federal | D20: 7290 | E20: 18102 | F20: 17969 | G20: 4 | H20: 12
C21: Total | D21: =SUM(D15:D20) -> 45755 | E21: =SUM(E15:E20) -> 218584 | F21: =SUM(F15:F20) -> 215707 | G21: =SUM(G15:G20) -> 664 | H21: =SUM(H15:H20) -> 93
C22: INDICADORES\INDI2004\CAPPENAL04\HOJA C
C23: OFICINA DE ESTADISTICAS