C4: II - INDICADORES DE GESTION - AÑO 2004
C6: Cuadro A.I.c)
C8: Capital Federal
C10: Competencia Penal - Tribunales Orales
C12: Indices
C14: Tribunales | D14: Indice de | E14: Indice de | F14: Promedio
C15: Orales | D15: cumplimiento | E15: sentencias | F15: de resolución
D16: ( b / (a+c) ) | E16: ( (d + e) / b) | F16: (b/f)
C17: Criminales | D17: =+E!E15/(E!D15+E!F15) -> 0.5783178424500991 | E17: =+(E!G15+E!H15)/E!E15 -> 0.54446054538269006 | F17: =+E!E15/E!I15 -> 84.344444444444449
C18: Penal Económico | D18: =+E!E16/(E!D16+E!F16) -> 0.3658310120705664 | E18: =+(E!G16+E!H16)/E!E16 -> 0.60659898477157359 | F18: =+E!E16/E!I16 -> 43.777777777777779
C19: Menores | D19: =+E!E17/(E!D17+E!F17) -> 0.17664813343923749 | E19: =+(E!G17+E!H17)/E!E17 -> 0.42535971223021585 | F19: =+E!E17/E!I17 -> 123.55555555555556
C20: Criminal Federal | D20: =+E!E18/(E!D18+E!F18) -> 0.41241111829347121 | E20: =+(E!G18+E!H18)/E!E18 -> 0.46394984326018807 | F20: =+E!E18/E!I18 -> 35.444444444444443
C21: INDICADORES\INDI2004\CAPPENAL04\HOJA F
C22: OFICINA DE ESTADISTICAS