C4: II - INDICADORES DE GESTION - AÑO 2004
C6: Cuadro A.I.c)
C8: Capital Federal
C10: Competencia Penal - Tribunales Orales
C12: Tribunales | D12: Casos existentes | E12: Total de resueltos | F12: Casos ingresados | G12: Sentencias: Juicio | H12: Sentencias: Juicio | I12: Cantidad de Jueces
C13: Orales | D13: al comienzo del año | E13: en el año | F13: en el año | G13: Abreviado | H13: Oral o Debate | I13: de Trib. Orales
D14: (a) | E14: (b) | F14: ( c ) | G14: (d) | H14: (e) | I14: (f)
C15: Criminales | D15: 5369 | E15: 7591 | F15: 7757 | G15: 2890 | H15: 1243 | I15: 90
C16: Penal Económico | D16: 573 | E16: 394 | F16: 504 | G16: 152 | H16: 87 | I16: 9
C17: Menores | D17: 4821 | E17: 1112 | F17: 1474 | G17: 301 | H17: 172 | I17: 9
C18: Criminal Federal | D18: 827 | E18: 638 | F18: 720 | G18: 172 | H18: 124 | I18: 18
C19: Total | D19: =SUM(D15:D18) -> 11590 | E19: =SUM(E15:E18) -> 9735 | F19: =SUM(F15:F18) -> 10455 | G19: =SUM(G15:G18) -> 3515 | H19: =SUM(H15:H18) -> 1626 | I19: =SUM(I15:I18) -> 126
C20: INDICADORES\INDI2004\CAPPENAL04\HOJA E
C21: OFICINA DE ESTADISTICAS