C4: II - INDICADORES DE GESTION - AÑO 2004
C6: Cuadro A.I.a)
C8: Capital Federal
C10: Competencia Penal - Cámaras de Apelación
C12: Indices
C14: Cámaras de | D14: Indice de | E14: Promedio de
C15: Apelación | D15: apelación | E15: resolución
D16: ( a/b) | E16: (c/d)
C17: Criminal y Correccional | D17: =+A!D15/A!E15 -> 6.5289457895646691E-2 | E17: =+A!F15/A!G15 -> 922.13333333333333
C18: Penal Económico | D18: =+A!D16/A!E16 -> 0.48764458464773924 | E18: =+A!F16/A!G16 -> 309.5
C19: Criminal y Correccional Federal | D19: =+A!D17/A!E17 -> 0.1386587117445586 | E19: =+A!F17/A!G17 -> 394.16666666666669
C20: INDICADORES\INDI2004\CAPPENAL04\HOJA B
C21: OFICINA DE ESTADISTICAS