B6: PODER JUDICIAL DE LA NACION
B7: JURISDICCION CAPITAL FEDERAL
B8: COMPETENCIA CIVIL
B9: CUADRO XII
B10: DISTRIBUCION PORCENTUAL SEGÚN EL PROCESO DE LOS EXPEDIENTES INGRESADOS Y SENTENCIAS DICTADAS - AÑO 2001-
B13: II - COMERCIAL
C15: CAUSAS | D15: %
B16: PROCESO | C16: INGRESADAS
B17: CONOCIMIENTO | C17: 9160 | D17: =+(C17/C$24) -> 5.575337046166956E-2
B18: EJECUTIVO | C18: 110100 | D18: =+(C18/C$24) -> 0.67013603578928149
B19: CONCURSOS PREVENTIVOS | C19: 1654 | D19: =+(C19/C$24) -> 1.0067257068078761E-2
B20: PEDIDOS DE QUIEBRA | C20: 9819 | D20: =+(C20/C$24) -> 5.9764448096411939E-2
B21: PEDIDOS DE PROPIA QUIEBRA | C21: 281 | D21: =+(C21/C$24) -> 1.7103381113241424E-3
B22: INCIDENTES | C22: 18142 | D22: =+(C22/C$24) -> 0.11042332389908396
B23: OTROS PROCESOS VINC. CON LOS CONCURSOS | C23: 15139 | D23: =+(C23/C$24) -> 9.2145226574150155E-2
B24: TOTAL | C24: =SUM(C17:C23) -> 164295 | D24: =SUM(D17:D23) -> 1
D26: %
B27: SENTENCIAS | C27: SALIDAS
B28: DEFINITIVAS | C28: 3545 | D28: =+(C28/C$32) -> 3.228244636287473E-2
B29: INTERLOCUTORIAS | C29: 38160 | D29: =+(C29/C$32) -> 0.3475030051360507
B30: DE REMATE | C30: 64063 | D30: =+(C30/C$32) -> 0.58338797217061888
B31: EN CAUSAS CONCURSALES | C31: =1459+2568+17 -> 4044 | D31: =+(C31/C$32) -> 3.682657633045569E-2
B32: TOTAL | C32: =SUM(C28:C31) -> 109812 | D32: =SUM(D28:D31) -> 1
B33: FUENTE: Oficina de Estadísticas del Poder Judicial de la Nación.-