B6: PODER JUDICIAL DE LA NACION
B7: JURISDICCIÓN CAPITAL FEDERAL
B8: COMPETENCIA CIVIL
B9: CUADRO XII
B10: DISTRIBUCION PORCENTUAL SEGÚN EL OBJETO DE LITIGIO DE LOS EXPEDIENTES INGRESADOS -AÑO 2001-
B13: I.a - CIVIL - Juzgados Patrimoniales
C16: CAUSAS | D16: %
B17: OBJETO | C17: INGRESADAS
B18: SUCESION AB-INTESTATO | C18: 13358 | D18: =+(C18/C$25) -> 0.15715294117647058
B19: EJECUCION DEEXPENSAS | C19: 8207 | D19: =+(C19/C$25) -> 9.6552941176470591E-2
B20: EJECUCION HIPOTECARIA | C20: 7548 | D20: =+(C20/C$25) -> 8.8800000000000004E-2
B21: EJECUCION DE ALQUILERES | C21: 4961 | D21: =+(C21/C$25) -> 5.8364705882352944E-2
B22: DAÑOS Y PERJUICIOS (ACC. TRANSITO C/LESIONES) | C22: 4600 | D22: =+(C22/C$25) -> 5.4117647058823527E-2
B23: DAÑOS Y PERJUICIOS (ACC. TRANSITO S/LESIONES) | C23: 2818 | D23: =+(C23/C$25) -> 3.3152941176470586E-2
B24: OTROS (181 objetos restantes) | C24: 43508 | D24: =+(C24/C$25) -> 0.51185882352941181
B25: TOTAL | C25: =SUM(C18:C24) -> 85000 | D25: =SUM(D18:D24) -> 1
B26: FUENTE: Oficina de Estadísticas del Poder Judicial de la Nación.-