B6: PODER JUDICIAL DE LA NACION
B7: JURISDICCION CAPITAL FEDERAL
B8: COMPETENCIA CIVIL
B9: CUADRO XII
B10: DISTRIBUCION PORCENTUAL SEGÚN EL PROCESO DE LOS EXPEDIENTES INGRESADOS Y RESUELTOS -AÑO 2001-
B12: I.b - CIVIL - Juzgados de Familia
C14: CAUSAS
B15: PROCESO | C15: INGRESADAS | D15: % | E15: RESUELTOS | F15: %
B16: EJECUTIVO | C16: 278 | D16: =+C16/C$21 -> 9.8802288801222594E-3 | E16: 75 | F16: =+E16/E$21 -> 3.8580246913580245E-3
B17: ORDINARIO | C17: 1438 | D17: =+C17/C$21 -> 5.1107083200056865E-2 | E17: 1272 | F17: =+E17/E$21 -> 6.5432098765432101E-2
B18: PROCESOS ESPECIALES | C18: 25584 | D18: =+C18/C$21 -> 0.90926538010448876 | E18: 17816 | F18: =+E18/E$21 -> 0.91646090534979419
B19: SUMARISIMO | C19: 7 | D19: =+C19/C$21 -> 2.4878274158581225E-4 | E19: 7 | F19: =+E19/E$21 -> 3.6008230452674899E-4
B20: SUMARIO | C20: 830 | D20: =+C20/C$21 -> 2.9498525073746312E-2 | E20: 270 | F20: =+E20/E$21 -> 1.3888888888888888E-2
B21: TOTAL | C21: =SUM(C16:C20) -> 28137 | D21: =+C21/C$21 -> 1 | E21: =SUM(E16:E20) -> 19440 | F21: =+E21/E$21 -> 1
B22: FUENTE: Oficina de Estadísticas del Poder Judicial de la Nación.-