B6: PODER JUDICIAL DE LA NACION
B7: JURISDICCION CAPITAL FEDERAL
B10: COMPETENCIA PENAL
B11: CUADRO VIII
B12: MOVIMIENTO DE CAUSAS EN LOS TRIBUNALES ORALES -AÑO 2001-
B13: FUERO | C13: TOTAL DE CAUSAS INGRESADAS | D13: TOTAL DE JUICIOS ABREVIADOS | E13: TOTAL DE DEBATES | F13: TOTAL DE SUSPENSIONES DEL PROCESO A PRUEBA | G13: APLICACIÓN DEL ARTICULO 4º LEY 22278
B14: ORDINARIO | C14: 6421 | D14: 2437 | E14: 1391 | F14: 996
B15: CORRECCIONAL | C15: 1658 | D15: 129 | E15: 502 | F15: 712
B16: FEDERAL | C16: 554 | D16: 138 | E16: 149 | F16: 123
B17: PENAL ECONOMICO | C17: 364 | D17: 83 | E17: 162 | F17: 25
B18: MENORES | C18: 1165 | D18: 412 | E18: 165 | G18: 159
B19: TOTAL | C19: =SUM(C14:C18) -> 10162 | D19: =SUM(D14:D18) -> 3199 | E19: =SUM(E14:E18) -> 2369 | F19: =SUM(F14:F18) -> 1856 | G19: =SUM(G14:G18) -> 159
B20: Fuente: Oficina de Estadísticas del Poder Judicial de la Nación.