B6: PODER JUDICIAL DE LA NACION
B7: JURISDICCION CAPITAL FEDERAL
B8: COMPETENCIA CIVIL
B9: CUADRO XII
B10: DISTRIBUCION PORCENTUAL SEGÚN EL OBJETO DE LITIGIO DE LOS EXPEDIENTES INGRESADOS, RESUELTOS Y SENTENCIAS DICTADAS -AÑO 2001-
B13: V - CIVIL Y COMERCIAL FEDERAL
C15: CAUSAS | D15: %
B16: OBJETO | C16: INGRESADAS
B17: PROPIEDAD INDUSTRIAL | C17: 1309 | D17: =+(C17/C$35) -> 0.11407407407407408
B18: TRANSPORTE (MARITIMO - AERONAUTICO Y OTROS) | C18: 185 | D18: =+(C18/C$35) -> 1.6122004357298474E-2
B19: DEMANDAS C/LA NACION Y ORGANISMOS DEL ESTADO | C19: 4 | D19: =+(C19/C$35) -> 3.4858387799564268E-4
B20: DAÑOS Y PERJUICIOS VARIOS | C20: 891 | D20: =+(C20/C$35) -> 7.7647058823529416E-2
B21: INCUMPL. DE SERV. DE TELECOMUNICAC. | C21: 22 | D21: =+(C21/C$35) -> 1.9172113289760348E-3
B22: INCUMPL. DE PRESTAC. DE OBRA SOCIAL | C22: 146 | D22: =+(C22/C$35) -> 1.2723311546840959E-2
B23: SEGUROS VARIOS | C23: 505 | D23: =+(C23/C$35) -> 4.400871459694989E-2
B24: CONTRATOS | C24: 240 | D24: =+(C24/C$35) -> 2.0915032679738561E-2
B25: COBRO DE PESOS | C25: 378 | D25: =+(C25/C$35) -> 3.2941176470588238E-2
B26: EJECUTIVOS | C26: 1272 | D26: =+(C26/C$35) -> 0.11084967320261438
B27: DESALOJO | C27: 6 | D27: =+(C27/C$35) -> 5.228758169934641E-4
B28: CIUDADANIA | C28: 2759 | D28: =+(C28/C$35) -> 0.24043572984749456
B29: MEDIDAS PRELIMINARES Y DE PRUEBA ANTICIPADA
B30: EMBARGO.MEDIDAS CAUTELARES.AMPARO.SUMARISIMOS | C30: 849 | D30: =+(C30/C$35) -> 7.3986928104575161E-2
B31: EXHORTOS | C31: 126 | D31: =+(C31/C$35) -> 1.0980392156862745E-2
B32: BENEFICIO DE LITIGAR SIN GASTOS | C32: 1365 | D32: =+(C32/C$35) -> 0.11895424836601307
B33: MEDIACION | C33: 103 | D33: =+(C33/C$35) -> 8.9760348583877991E-3
B34: OTROS. VARIOS. | C34: 1315 | D34: =+(C34/C$35) -> 0.11459694989106754
B35: TOTAL | C35: =SUM(C17:C34) -> 11475 | D35: =SUM(D17:D34) -> 1
C38: CAUSAS | D38: % | E38: SENTENCIAS | F38: %
B39: OBJETO | C39: RESUELTAS | E39: DICTADAS (*)
B40: PROPIEDAD INDUSTRIAL | C40: 593 | D40: =+(C40/C$59) -> 6.1700135261679327E-2 | E40: 369 | F40: =+(E40/E$59) -> 8.0514946541566657E-2
B41: TRANSPORTE (MARITIMO - AERONAUTICO Y OTROS) | C41: 232 | D41: =+(C41/C$59) -> 2.4139007387368641E-2 | E41: 165 | F41: =+(E41/E$59) -> 3.6002618372245256E-2
B42: DEMANDAS C/LA NACION Y ORGANISMOS DEL ESTADO | C42: 11 | D42: =+(C42/C$59) -> 1.1445219019873061E-3 | E42: 76 | F42: =+(E42/E$59) -> 1.658302421994327E-2
B43: DAÑOS Y PERJUICIOS VARIOS | C43: 502 | D43: =+(C43/C$59) -> 5.223181770887525E-2 | E43: 426 | F43: =+(E43/E$59) -> 9.2952214706524108E-2
B44: INCUMPL. DE SERV. DE TELECOMUNICAC. | C44: 18 | D44: =+(C44/C$59) -> 1.8728540214337738E-3 | E44: 65 | F44: =+(E44/E$59) -> 1.4182849661793584E-2
B45: INCUMPL. DE PRESTAC. DE OBRA SOCIAL | C45: 154 | D45: =+(C45/C$59) -> 1.6023306627822288E-2 | E45: 99 | F45: =+(E45/E$59) -> 2.1601571023347154E-2
B46: SEGUROS VARIOS | C46: 70 | D46: =+(C46/C$59) -> 7.2833211944646759E-3 | E46: 47 | F46: =+(E46/E$59) -> 1.0255291293912285E-2
B47: CONTRATOS | C47: 380 | D47: =+(C47/C$59) -> 3.953802934137967E-2 | E47: 199 | F47: =+(E47/E$59) -> 4.3421339733798824E-2
B48: COBRO DE PESOS | C48: 255 | D48: =+(C48/C$59) -> 2.6532098636978464E-2 | E48: 316 | F48: =+(E48/E$59) -> 6.8950469125027281E-2
B49: EJECUTIVOS | C49: 674 | D49: =+(C49/C$59) -> 7.012797835813131E-2 | E49: 553 | F49: =+(E49/E$59) -> 0.12066332096879773
B50: DESALOJO | C50: 6 | D50: =+(C50/C$59) -> 6.2428467381125789E-4 | E50: 8 | F50: =+(E50/E$59) -> 1.7455814968361336E-3
B51: CIUDADANIA | C51: 725 | D51: =+(C51/C$59) -> 7.5434398085527002E-2 | E51: 924 | F51: =+(E51/E$59) -> 0.20161466288457341
B52: MEDIDAS PRELIMINARES Y DE PRUEBA ANTICIPADA
B53: EMBARGO.MEDIDAS CAUTELARES.AMPARO.SUMARISIMOS | C53: 554 | D53: =+(C53/C$59) -> 5.7642284881906147E-2 | E53: 491 | F53: =+(E53/E$59) -> 0.1071350643683177
B54: EXHORTOS | C54: 72 | D54: =+(C54/C$59) -> 7.4914160857350951E-3 | E54: 11 | F54: =+(E54/E$59) -> 2.4001745581496837E-3
B55: BENEFICIO DE LITIGAR SIN GASTOS | C55: 308 | D55: =+(C55/C$59) -> 3.2046613255644577E-2 | E55: 111 | F55: =+(E55/E$59) -> 2.4219943268601354E-2
B56: MEDIACION | C56: 29 | D56: =+(C56/C$59) -> 3.0173759234210801E-3 | E56: 21 | F56: =+(E56/E$59) -> 4.5821514291948503E-3
B57: OTROS. VARIOS. | C57: 433 | D57: =+(C57/C$59) -> 4.5052543960045779E-2 | E57: 196 | F57: =+(E57/E$59) -> 4.276674667248527E-2
B58: RESUELTOS SIN DISCRIMINAR OBJETO | C58: 4595 | D58: =+(C58/C$59) -> 0.47809801269378838 | E58: 506 | F58: =+(E58/E$59) -> 0.11040802967488544
B59: TOTAL | C59: =SUM(C40:C58) -> 9611 | D59: =SUM(D40:D58) -> 1 | E59: =SUM(E40:E58) -> 4583 | F59: =SUM(F40:F58) -> 1
B60: REFERENCIAS: (*) Con Sentencias Definitivas, Interlocutorias y Para mejor proveer.
B61: FUENTE: Oficina de Estadísticas del Poder Judicial de la Nación.-