B6: PODER JUDICIAL DE LA NACION
B7: JURISDICCION CAPITAL FEDERAL
B9: CUADRO II
B11: DISTRIBUCION DE LOS CARGOS PERMANENTES Y CONTRATADOS -AÑO 2001-
C16: Juez de | E16: Secretario de | G16: Juez de | I16: Juez de | K16: Prosecretario | M16: Prosecretario de | O16: Prosecretario | Q16: Oficial | S16: Oficial | U16: Escribiente | W16: Escribiente | Y16: Auxiliar / | AA16: Personal de | AC16: Subtotal | AE16: Total
C17: Cámara de | E17: la C.S.J.N./ | G17: Cámara | I17: Primera | K17: Letrado de la | M17: de Cámara/ | O17: Administrativo | Q17: Mayor | W17: Auxiliar | Y17: Auxiliar | AA17: Maestranza
C18: Casación | E18: Secretario Letra- | I18: Instancia / | K18: C.S.J.N./ | M18: Secretario de | Y18: Administrativo
B19: JUSTICIA ORDINARIA | E19: do de C.S.J.N./ | I19: Secretario Cámara | K19: Secret. Cámara/ | M19: Juzgado/
E20: Director Gral | I20: Nacional Electoral | K20: Prosec. Jefe/ | M20: Subsecretario Adm./
K21: Secretario Electoral/ | M21: Prosec. Electoral/
K22: Prosec. Jefe de 2da./ | M22: Jefe Depto./
K23: Subdirector gral. | M23: 2do. Jefe Depto.
C24: P | D24: C | E24: P | F24: C | G24: P | H24: C | I24: P | J24: C | K24: P | L24: C | M24: P | N24: C | O24: P | P24: C | Q24: P | R24: C | S24: P | T24: C | U24: P | V24: C | W24: P | X24: C | Y24: P | Z24: C | AA24: P | AB24: C | AC24: P | AD24: C | AH24: JUECES | AI24: FUNCIONARIOS | AJ24: EMPLEADOS | AK24: TOTAL
B25: CAMARA DE CASACION PENAL | AG25: CAMARA DE CASACION PENAL
B26: CAMARA DE CASACION PENAL | C26: 13 | E26: =1+1 -> 2 | K26: =1+5+4+2 -> 12 | L26: 1 | M26: 17 | O26: 12 | P26: 3 | Q26: 33 | R26: 4 | S26: 1 | T26: 4 | U26: 5 | W26: 6 | Y26: 1 | AA26: =2+3+10+7+32 -> 54 | AB26: =1+5+3 -> 9 | AC26: =+C26+E26+G26+I26+K26+M26+O26+Q26+S26+U26+W26+Y26+AA26 -> 156 | AD26: =+D26+F26+H26+J26+L26+N26+P26+R26+T26+V26+X26+Z26+AB26 -> 21 | AE26: 181 | AG26: CAMARA DE CASACION PENAL | AH26: =+C26+D26+G26+H26+I26+J26 -> 13 | AI26: =+E26+F26+SUM(K26:P26)+3 -> 50 | AJ26: =SUM(Q26:AB26)+1 -> 118 | AK26: =+AH26+AI26+AJ26 -> 181
B27: JUZGADOS NACIONALES DE EJECUCION PENAL | I27: 3 | M27: 3 | N27: 3 | O27: 3 | Q27: 3 | U27: 3 | Y27: 3 | Z27: 1 | AA27: 3 | AC27: =+C27+E27+G27+I27+K27+M27+O27+Q27+S27+U27+W27+Y27+AA27 -> 21 | AD27: =+D27+F27+H27+J27+L27+N27+P27+R27+T27+V27+X27+Z27+AB27 -> 4 | AE27: =+AC27+AD27 -> 25 | AG27: JUZGADOS NACIONALES DE EJECUCION PENAL | AH27: =+C27+D27+G27+H27+I27+J27 -> 3 | AI27: =+E27+F27+SUM(K27:P27) -> 9 | AJ27: =SUM(Q27:AB27) -> 13 | AK27: =+AH27+AI27+AJ27 -> 25
B28: Total (*) | C28: =SUM(C25:C27) -> 13 | D28: =SUM(D25:D27) -> 0 | E28: =SUM(E25:E27) -> 2 | F28: =SUM(F25:F27) -> 0 | G28: =SUM(G25:G27) -> 0 | H28: =SUM(H25:H27) -> 0 | I28: =SUM(I25:I27) -> 3 | J28: =SUM(J25:J27) -> 0 | K28: =SUM(K25:K27) -> 12 | L28: =SUM(L25:L27) -> 1 | M28: =SUM(M25:M27) -> 20 | N28: =SUM(N25:N27) -> 3 | O28: =SUM(O25:O27) -> 15 | P28: =SUM(P25:P27) -> 3 | Q28: =SUM(Q25:Q27) -> 36 | R28: =SUM(R25:R27) -> 4 | S28: =SUM(S25:S27) -> 1 | T28: =SUM(T25:T27) -> 4 | U28: =SUM(U25:U27) -> 8 | V28: =SUM(V25:V27) -> 0 | W28: =SUM(W25:W27) -> 6 | X28: =SUM(X25:X27) -> 0 | Y28: =SUM(Y25:Y27) -> 4 | Z28: =SUM(Z25:Z27) -> 1 | AA28: =SUM(AA25:AA27) -> 57 | AB28: =SUM(AB25:AB27) -> 9 | AC28: =SUM(AC25:AC27) -> 177 | AD28: =SUM(AD25:AD27) -> 25 | AE28: =SUM(AE25:AE27) -> 206 | AG28: Total (*) | AH28: =+C28+D28+G28+H28+I28+J28 -> 16 | AI28: =+E28+F28+SUM(K28:P28) -> 56 | AJ28: =SUM(Q28:AB28) -> 130 | AK28: =+AK26+AK27 -> 206
B29: CRIMINAL Y CORRECCIONAL | AG29: CRIMINAL Y CORRECCIONAL | AH29: =+C29+D29+G29+H29+I29+J29 -> 0 | AI29: =+E29+F29+SUM(K29:P29) -> 0 | AJ29: =SUM(Q29:AB29) -> 0 | AK29: =+AH29+AI29+AJ29 -> 0
B30: CAMARA NAC. DE APEL. EN LO CRIMINAL Y CORRECCIONAL | E30: 2 | G30: 16 | K30: =8+11 -> 19 | M30: 7 | N30: 1 | O30: 43 | P30: 3 | Q30: 79 | R30: 2 | S30: 44 | U30: 57 | W30: 20 | Y30: 31 | AA30: =3+6+14+13+63 -> 99 | AB30: 9 | AC30: =+C30+E30+G30+I30+K30+M30+O30+Q30+S30+U30+W30+Y30+AA30 -> 417 | AD30: =+D30+F30+H30+J30+L30+N30+P30+R30+T30+V30+X30+Z30+AB30 -> 15 | AE30: =+AC30+AD30 -> 432 | AG30: CAMARA NAC. DE APEL. EN LO CRIMINAL Y CORRECCIONAL | AH30: =+C30+D30+G30+H30+I30+J30 -> 16 | AI30: =+E30+F30+SUM(K30:P30) -> 75 | AJ30: =SUM(Q30:AB30) -> 341 | AK30: =+AH30+AI30+AJ30 -> 432
B31: JUZGADOS NACIONALES EN LO CRIMINAL DE INSTRUCCION | I31: 49 | M31: 65 | N31: 14 | O31: 65 | P31: 7 | Q31: 114 | R31: 1 | T31: 1 | U31: 65 | W31: 73 | Y31: 73 | Z31: 2 | AA31: 65 | AC31: =+C31+E31+G31+I31+K31+M31+O31+Q31+S31+U31+W31+Y31+AA31 -> 569 | AD31: =+D31+F31+H31+J31+L31+N31+P31+R31+T31+V31+X31+Z31+AB31 -> 25 | AE31: =+AC31+AD31 -> 594 | AG31: JUZGADOS NACIONALES EN LO CRIMINAL DE INSTRUCCION | AH31: =+C31+D31+G31+H31+I31+J31 -> 49 | AI31: =+E31+F31+SUM(K31:P31) -> 151 | AJ31: =SUM(Q31:AB31) -> 394 | AK31: =+AH31+AI31+AJ31 -> 594
B32: JUZGADOS CORRECCIONALES DE LA CAPITAL FEDERAL | I32: 14 | M32: 28 | O32: 28 | Q32: 42 | R32: 1 | U32: 28 | W32: 28 | Y32: 28 | AA32: 28 | AC32: =+C32+E32+G32+I32+K32+M32+O32+Q32+S32+U32+W32+Y32+AA32 -> 224 | AD32: =+D32+F32+H32+J32+L32+N32+P32+R32+T32+V32+X32+Z32+AB32 -> 1 | AE32: =+AC32+AD32 -> 225 | AG32: JUZGADOS CORRECCIONALES DE LA CAPITAL FEDERAL | AH32: =+C32+D32+G32+H32+I32+J32 -> 14 | AI32: =+E32+F32+SUM(K32:P32) -> 56 | AJ32: =SUM(Q32:AB32) -> 155 | AK32: =+AH32+AI32+AJ32 -> 225
B33: JUZGADOS NACIONALES DE MENORES | I33: 7 | M33: 21 | O33: 21 | Q33: 28 | U33: 22 | W33: 25 | Y33: 24 | AA33: 17 | AB33: 1 | AC33: =+C33+E33+G33+I33+K33+M33+O33+Q33+S33+U33+W33+Y33+AA33 -> 165 | AD33: =+D33+F33+H33+J33+L33+N33+P33+R33+T33+V33+X33+Z33+AB33 -> 1 | AE33: =+AC33+AD33 -> 166 | AG33: JUZGADOS NACIONALES DE MENORES | AH33: =+C33+D33+G33+H33+I33+J33 -> 7 | AI33: =+E33+F33+SUM(K33:P33) -> 42 | AJ33: =SUM(Q33:AB33) -> 117 | AK33: =+AH33+AI33+AJ33 -> 166
B34: JUZGADO NACIONAL EN LO CRIMINAL DE ROGATORIAS | I34: 1 | M34: 1 | O34: 1 | Q34: 2 | U34: 1 | W34: 1 | Y34: 3 | AA34: 1 | AC34: =+C34+E34+G34+I34+K34+M34+O34+Q34+S34+U34+W34+Y34+AA34 -> 11 | AD34: =+D34+F34+H34+J34+L34+N34+P34+R34+T34+V34+X34+Z34+AB34 -> 0 | AE34: =+AC34+AD34 -> 11 | AG34: JUZGADO NACIONAL EN LO CRIMINAL DE ROGATORIAS | AH34: =+C34+D34+G34+H34+I34+J34 -> 1 | AI34: =+E34+F34+SUM(K34:P34) -> 2 | AJ34: =SUM(Q34:AB34) -> 8 | AK34: =+AH34+AI34+AJ34 -> 11
B35: Total | C35: =SUM(C30:C34) -> 0 | D35: =SUM(D30:D34) -> 0 | E35: =SUM(E30:E34) -> 2 | F35: =SUM(F30:F34) -> 0 | G35: =SUM(G30:G34) -> 16 | H35: =SUM(H30:H34) -> 0 | I35: =SUM(I30:I34) -> 71 | J35: =SUM(J30:J34) -> 0 | K35: =SUM(K30:K34) -> 19 | L35: =SUM(L30:L34) -> 0 | M35: =SUM(M30:M34) -> 122 | N35: =SUM(N30:N34) -> 15 | O35: =SUM(O30:O34) -> 158 | P35: =SUM(P30:P34) -> 10 | Q35: =SUM(Q30:Q34) -> 265 | R35: =SUM(R30:R34) -> 4 | S35: =SUM(S30:S34) -> 44 | T35: =SUM(T30:T34) -> 1 | U35: =SUM(U30:U34) -> 173 | V35: =SUM(V30:V34) -> 0 | W35: =SUM(W30:W34) -> 147 | X35: =SUM(X30:X34) -> 0 | Y35: =SUM(Y30:Y34) -> 159 | Z35: =SUM(Z30:Z34) -> 2 | AA35: =SUM(AA30:AA34) -> 210 | AB35: =SUM(AB30:AB34) -> 10 | AC35: =SUM(AC30:AC34) -> 1386 | AD35: =SUM(AD30:AD34) -> 42 | AE35: =SUM(AE30:AE34) -> 1428 | AG35: Total | AH35: =+C35+D35+G35+H35+I35+J35 -> 87 | AI35: =+E35+F35+SUM(K35:P35) -> 326 | AJ35: =SUM(Q35:AB35) -> 1015 | AK35: =+AH35+AI35+AJ35 -> 1428
B36: CIVIL | AG36: CIVIL | AH36: =+C36+D36+G36+H36+I36+J36 -> 0 | AI36: =+E36+F36+SUM(K36:P36) -> 0 | AJ36: =SUM(Q36:AB36) -> 0 | AK36: =+AH36+AI36+AJ36 -> 0
B37: CAMARA NACIONAL EN LO CIVIL | G37: 39 | K37: =17+3 -> 20 | L37: 1 | M37: 16 | O37: 52 | P37: 1 | Q37: 73 | S37: 47 | U37: 43 | W37: 18 | Y37: 28 | Z37: 3 | AA37: 126 | AB37: 7 | AC37: =+C37+E37+G37+I37+K37+M37+O37+Q37+S37+U37+W37+Y37+AA37 -> 462 | AD37: =+D37+F37+H37+J37+L37+N37+P37+R37+T37+V37+X37+Z37+AB37 -> 12 | AE37: =+AC37+AD37 -> 474 | AG37: CAMARA NACIONAL EN LO CIVIL | AH37: =+C37+D37+G37+H37+I37+J37 -> 39 | AI37: =+E37+F37+SUM(K37:P37) -> 90 | AJ37: =SUM(Q37:AB37) -> 345 | AK37: =+AH37+AI37+AJ37 -> 474
B38: JUZGADOS NACIONALES DE PRIMERA INSTANCIA EN LO CIVIL | I38: 110 | M38: 110 | N38: 3 | O38: 134 | P38: 1 | Q38: 354 | S38: 110 | U38: 220 | W38: 220 | Y38: 220 | Z38: 1 | AA38: 222 | AC38: =+C38+E38+G38+I38+K38+M38+O38+Q38+S38+U38+W38+Y38+AA38 -> 1700 | AD38: =+D38+F38+H38+J38+L38+N38+P38+R38+T38+V38+X38+Z38+AB38 -> 5 | AE38: =+AC38+AD38 -> 1705 | AG38: JUZGADOS NACIONALES DE PRIMERA INSTANCIA EN LO CIVIL | AH38: =+C38+D38+G38+H38+I38+J38 -> 110 | AI38: =+E38+F38+SUM(K38:P38) -> 248 | AJ38: =SUM(Q38:AB38) -> 1347 | AK38: =+AH38+AI38+AJ38 -> 1705
B39: Total | C39: =SUM(C36:C38) -> 0 | D39: =SUM(D36:D38) -> 0 | E39: =SUM(E36:E38) -> 0 | F39: =SUM(F36:F38) -> 0 | G39: =SUM(G36:G38) -> 39 | H39: =SUM(H36:H38) -> 0 | I39: =SUM(I36:I38) -> 110 | J39: =SUM(J36:J38) -> 0 | K39: =SUM(K36:K38) -> 20 | L39: =SUM(L36:L38) -> 1 | M39: =SUM(M36:M38) -> 126 | N39: =SUM(N36:N38) -> 3 | O39: =SUM(O36:O38) -> 186 | P39: =SUM(P36:P38) -> 2 | Q39: =SUM(Q36:Q38) -> 427 | R39: =SUM(R36:R38) -> 0 | S39: =SUM(S36:S38) -> 157 | T39: =SUM(T36:T38) -> 0 | U39: =SUM(U36:U38) -> 263 | V39: =SUM(V36:V38) -> 0 | W39: =SUM(W36:W38) -> 238 | X39: =SUM(X36:X38) -> 0 | Y39: =SUM(Y36:Y38) -> 248 | Z39: =SUM(Z36:Z38) -> 4 | AA39: =SUM(AA36:AA38) -> 348 | AB39: =SUM(AB36:AB38) -> 7 | AC39: =SUM(AC36:AC38) -> 2162 | AD39: =SUM(AD36:AD38) -> 17 | AE39: =SUM(AE36:AE38) -> 2179 | AG39: Total | AH39: =+C39+D39+G39+H39+I39+J39 -> 149 | AI39: =+E39+F39+SUM(K39:P39) -> 338 | AJ39: =SUM(Q39:AB39) -> 1692 | AK39: =+AH39+AI39+AJ39 -> 2179
B40: COMERCIAL | AG40: COMERCIAL | AH40: =+C40+D40+G40+H40+I40+J40 -> 0 | AI40: =+E40+F40+SUM(K40:P40) -> 0 | AJ40: =SUM(Q40:AB40) -> 0 | AK40: =+AH40+AI40+AJ40 -> 0
B41: CAMARA NACIONAL DE APELACIONES EN LO COMERCIAL | E41: 2 | G41: 15 | K41: 10 | M41: 6 | N41: 5 | O41: 21 | P41: 6 | Q41: 27 | S41: 13 | U41: 16 | V41: 1 | W41: 20 | Y41: 15 | Z41: 1 | AA41: 65 | AB41: 5 | AC41: =+C41+E41+G41+I41+K41+M41+O41+Q41+S41+U41+W41+Y41+AA41 -> 210 | AD41: =+D41+F41+H41+J41+L41+N41+P41+R41+T41+V41+X41+Z41+AB41 -> 18 | AE41: =+AC41+AD41 -> 228 | AG41: CAMARA NACIONAL DE APELACIONES EN LO COMERCIAL | AH41: =+C41+D41+G41+H41+I41+J41 -> 15 | AI41: =+E41+F41+SUM(K41:P41) -> 50 | AJ41: =SUM(Q41:AB41) -> 163 | AK41: =+AH41+AI41+AJ41 -> 228
B42: JUZGADOS NACIONALES DE PRIMERA INSTANCIA EN LO COMERCIAL | I42: 26 | M42: 52 | N42: 5 | O42: 52 | P42: 7 | Q42: 78 | R42: 1 | S42: 52 | T42: 1 | U42: 104 | V42: 3 | W42: 130 | Y42: 78 | Z42: 14 | AA42: 52 | AB42: 2 | AC42: =+C42+E42+G42+I42+K42+M42+O42+Q42+S42+U42+W42+Y42+AA42 -> 624 | AD42: =+D42+F42+H42+J42+L42+N42+P42+R42+T42+V42+X42+Z42+AB42 -> 33 | AE42: =+AC42+AD42 -> 657 | AG42: JUZGADOS NACIONALES DE PRIMERA INSTANCIA EN LO COMERCIAL | AH42: =+C42+D42+G42+H42+I42+J42 -> 26 | AI42: =+E42+F42+SUM(K42:P42) -> 116 | AJ42: =SUM(Q42:AB42) -> 515 | AK42: =+AH42+AI42+AJ42 -> 657
B43: Total | C43: =SUM(C41:C42) -> 0 | D43: =SUM(D41:D42) -> 0 | E43: =SUM(E41:E42) -> 2 | F43: =SUM(F41:F42) -> 0 | G43: =SUM(G41:G42) -> 15 | H43: =SUM(H41:H42) -> 0 | I43: =SUM(I41:I42) -> 26 | J43: =SUM(J41:J42) -> 0 | K43: =SUM(K41:K42) -> 10 | L43: =SUM(L41:L42) -> 0 | M43: =SUM(M41:M42) -> 58 | N43: =SUM(N41:N42) -> 10 | O43: =SUM(O41:O42) -> 73 | P43: =SUM(P41:P42) -> 13 | Q43: =SUM(Q41:Q42) -> 105 | R43: =SUM(R41:R42) -> 1 | S43: =SUM(S41:S42) -> 65 | T43: =SUM(T41:T42) -> 1 | U43: =SUM(U41:U42) -> 120 | V43: =SUM(V41:V42) -> 4 | W43: =SUM(W41:W42) -> 150 | X43: =SUM(X41:X42) -> 0 | Y43: =SUM(Y41:Y42) -> 93 | Z43: =SUM(Z41:Z42) -> 15 | AA43: =SUM(AA41:AA42) -> 117 | AB43: =SUM(AB41:AB42) -> 7 | AC43: =SUM(AC41:AC42) -> 834 | AD43: =SUM(AD41:AD42) -> 51 | AE43: =SUM(AE41:AE42) -> 885 | AG43: Total | AH43: =+C43+D43+G43+H43+I43+J43 -> 41 | AI43: =+E43+F43+SUM(K43:P43) -> 166 | AJ43: =SUM(Q43:AB43) -> 678 | AK43: =+AH43+AI43+AJ43 -> 885
B44: TRABAJO | AG44: TRABAJO | AH44: =+C44+D44+G44+H44+I44+J44 -> 0 | AI44: =+E44+F44+SUM(K44:P44) -> 0 | AJ44: =SUM(Q44:AB44) -> 0 | AK44: =+AH44+AI44+AJ44 -> 0
B45: CAMARA NACIONAL DE APELACIONES DEL TRABAJO | G45: 30 | K45: 14 | M45: 11 | O45: 32 | P45: 20 | Q45: 60 | R45: 5 | S45: 26 | U45: 27 | V45: 1 | W45: 29 | Y45: 37 | Z45: 43 | AA45: 118 | AB45: 32 | AC45: =+C45+E45+G45+I45+K45+M45+O45+Q45+S45+U45+W45+Y45+AA45 -> 384 | AD45: =+D45+F45+H45+J45+L45+N45+P45+R45+T45+V45+X45+Z45+AB45 -> 101 | AE45: =+AC45+AD45 -> 485 | AG45: CAMARA NACIONAL DE APELACIONES DEL TRABAJO | AH45: =+C45+D45+G45+H45+I45+J45 -> 30 | AI45: =+E45+F45+SUM(K45:P45) -> 77 | AJ45: =SUM(Q45:AB45) -> 378 | AK45: =+AH45+AI45+AJ45 -> 485
B46: JUZGADOS NACIONALES DE PRIMERA INSTANCIA DEL TRABAJO | I46: 80 | M46: 80 | O46: 160 | Q46: 160 | R46: 1 | S46: 80 | U46: 160 | W46: 160 | Y46: 160 | AA46: 80 | AC46: =+C46+E46+G46+I46+K46+M46+O46+Q46+S46+U46+W46+Y46+AA46 -> 1120 | AD46: =+D46+F46+H46+J46+L46+N46+P46+R46+T46+V46+X46+Z46+AB46 -> 1 | AE46: =+AC46+AD46 -> 1121 | AG46: JUZGADOS NACIONALES DE PRIMERA INSTANCIA DEL TRABAJO | AH46: =+C46+D46+G46+H46+I46+J46 -> 80 | AI46: =+E46+F46+SUM(K46:P46) -> 240 | AJ46: =SUM(Q46:AB46) -> 801 | AK46: =+AH46+AI46+AJ46 -> 1121
B47: Total | C47: =SUM(C45:C46) -> 0 | D47: =SUM(D45:D46) -> 0 | E47: =SUM(E45:E46) -> 0 | F47: =SUM(F45:F46) -> 0 | G47: =SUM(G45:G46) -> 30 | H47: =SUM(H45:H46) -> 0 | I47: =SUM(I45:I46) -> 80 | J47: =SUM(J45:J46) -> 0 | K47: =SUM(K45:K46) -> 14 | L47: =SUM(L45:L46) -> 0 | M47: =SUM(M45:M46) -> 91 | N47: =SUM(N45:N46) -> 0 | O47: =SUM(O45:O46) -> 192 | P47: =SUM(P45:P46) -> 20 | Q47: =SUM(Q45:Q46) -> 220 | R47: =SUM(R45:R46) -> 6 | S47: =SUM(S45:S46) -> 106 | T47: =SUM(T45:T46) -> 0 | U47: =SUM(U45:U46) -> 187 | V47: =SUM(V45:V46) -> 1 | W47: =SUM(W45:W46) -> 189 | X47: =SUM(X45:X46) -> 0 | Y47: =SUM(Y45:Y46) -> 197 | Z47: =SUM(Z45:Z46) -> 43 | AA47: =SUM(AA45:AA46) -> 198 | AB47: =SUM(AB45:AB46) -> 32 | AC47: =SUM(AC45:AC46) -> 1504 | AD47: =SUM(AD45:AD46) -> 102 | AE47: =SUM(AE45:AE46) -> 1606 | AG47: Total | AH47: =+C47+D47+G47+H47+I47+J47 -> 110 | AI47: =+E47+F47+SUM(K47:P47) -> 317 | AJ47: =SUM(Q47:AB47) -> 1179 | AK47: =+AH47+AI47+AJ47 -> 1606
B48: PENAL ECONOMICO | AG48: PENAL ECONOMICO | AH48: =+C48+D48+G48+H48+I48+J48 -> 0 | AI48: =+E48+F48+SUM(K48:P48) -> 0 | AJ48: =SUM(Q48:AB48) -> 0 | AK48: =+AH48+AI48+AJ48 -> 0
B49: CAMARA NAC. DE APELACIONES EN LO PENAL ECONOMICO | G49: 6 | K49: 10 | M49: 2 | N49: 3 | O49: 9 | P49: 1 | Q49: 12 | R49: 1 | S49: 2 | U49: 8 | W49: 12 | X49: 1 | Y49: 8 | Z49: 1 | AA49: 38 | AB49: 5 | AC49: =+C49+E49+G49+I49+K49+M49+O49+Q49+S49+U49+W49+Y49+AA49 -> 107 | AD49: =+D49+F49+H49+J49+L49+N49+P49+R49+T49+V49+X49+Z49+AB49 -> 12 | AE49: =+AC49+AD49 -> 119 | AG49: CAMARA NAC. DE APELACIONES EN LO PENAL ECONOMICO | AH49: =+C49+D49+G49+H49+I49+J49 -> 6 | AI49: =+E49+F49+SUM(K49:P49) -> 25 | AJ49: =SUM(Q49:AB49) -> 88 | AK49: =+AH49+AI49+AJ49 -> 119
B50: JUZGADOS NACIONALES EN LO PENAL ECONOMICO | I50: 8 | M50: 16 | N50: 3 | O50: 16 | P50: 2 | Q50: 24 | R50: 2 | T50: 1 | U50: 16 | V50: 1 | W50: 32 | Y50: 16 | Z50: 1 | AA50: 16 | AC50: =+C50+E50+G50+I50+K50+M50+O50+Q50+S50+U50+W50+Y50+AA50 -> 144 | AD50: =+D50+F50+H50+J50+L50+N50+P50+R50+T50+V50+X50+Z50+AB50 -> 10 | AE50: =+AC50+AD50 -> 154 | AG50: JUZGADOS NACIONALES EN LO PENAL ECONOMICO | AH50: =+C50+D50+G50+H50+I50+J50 -> 8 | AI50: =+E50+F50+SUM(K50:P50) -> 37 | AJ50: =SUM(Q50:AB50) -> 109 | AK50: =+AH50+AI50+AJ50 -> 154
B51: Total | C51: =SUM(C49:C50) -> 0 | D51: =SUM(D49:D50) -> 0 | E51: =SUM(E49:E50) -> 0 | F51: =SUM(F49:F50) -> 0 | G51: =SUM(G49:G50) -> 6 | H51: =SUM(H49:H50) -> 0 | I51: =SUM(I49:I50) -> 8 | J51: =SUM(J49:J50) -> 0 | K51: =SUM(K49:K50) -> 10 | L51: =SUM(L49:L50) -> 0 | M51: =SUM(M49:M50) -> 18 | N51: =SUM(N49:N50) -> 6 | O51: =SUM(O49:O50) -> 25 | P51: =SUM(P49:P50) -> 3 | Q51: =SUM(Q49:Q50) -> 36 | R51: =SUM(R49:R50) -> 3 | S51: =SUM(S49:S50) -> 2 | T51: =SUM(T49:T50) -> 1 | U51: =SUM(U49:U50) -> 24 | V51: =SUM(V49:V50) -> 1 | W51: =SUM(W49:W50) -> 44 | X51: =SUM(X49:X50) -> 1 | Y51: =SUM(Y49:Y50) -> 24 | Z51: =SUM(Z49:Z50) -> 2 | AA51: =SUM(AA49:AA50) -> 54 | AB51: =SUM(AB49:AB50) -> 5 | AC51: =SUM(AC49:AC50) -> 251 | AD51: =SUM(AD49:AD50) -> 22 | AE51: =SUM(AE49:AE50) -> 273 | AG51: Total | AH51: =+C51+D51+G51+H51+I51+J51 -> 14 | AI51: =+E51+F51+SUM(K51:P51) -> 62 | AJ51: =SUM(Q51:AB51) -> 197 | AK51: =+AH51+AI51+AJ51 -> 273
B52: JUSTICIA PENAL ORAL ORDINARIA | AG52: JUSTICIA PENAL ORAL ORDINARIA | AH52: =+C52+D52+G52+H52+I52+J52 -> 0 | AI52: =+E52+F52+SUM(K52:P52) -> 0 | AJ52: =SUM(Q52:AB52) -> 0 | AK52: =+AH52+AI52+AJ52 -> 0
B53: TRIBUNALES ORALES CRIMINALES | G53: 90 | K53: 30 | L53: 1 | O53: 29 | P53: 1 | Q53: 120 | R53: 1 | U53: 33 | W53: 32 | Y53: 31 | Z53: 2 | AA53: 29 | AB53: 1 | AC53: =+C53+E53+G53+I53+K53+M53+O53+Q53+S53+U53+W53+Y53+AA53 -> 394 | AD53: =+D53+F53+H53+J53+L53+N53+P53+R53+T53+V53+X53+Z53+AB53 -> 6 | AE53: =+AC53+AD53 -> 400 | AG53: TRIBUNALES ORALES CRIMINALES | AH53: =+C53+D53+G53+H53+I53+J53 -> 90 | AI53: =+E53+F53+SUM(K53:P53) -> 61 | AJ53: =SUM(Q53:AB53) -> 249 | AK53: =+AH53+AI53+AJ53 -> 400
B54: TRIBUNALES ORALES DE MENORES | G54: 9 | K54: 3 | M54: 3 | O54: 6 | P54: 1 | Q54: 12 | U54: 6 | W54: 3 | Y54: 6 | AA54: 3 | AC54: =+C54+E54+G54+I54+K54+M54+O54+Q54+S54+U54+W54+Y54+AA54 -> 51 | AD54: =+D54+F54+H54+J54+L54+N54+P54+R54+T54+V54+X54+Z54+AB54 -> 1 | AE54: =+AC54+AD54 -> 52 | AG54: TRIBUNALES ORALES DE MENORES | AH54: =+C54+D54+G54+H54+I54+J54 -> 9 | AI54: =+E54+F54+SUM(K54:P54) -> 13 | AJ54: =SUM(Q54:AB54) -> 30 | AK54: =+AH54+AI54+AJ54 -> 52
B55: TRIBUNALES ORALES EN LO PENAL ECONOMICO | G55: 9 | K55: 3 | N55: 3 | O55: 3 | P55: 2 | Q55: 11 | R55: 1 | S55: 1 | U55: 3 | W55: 2 | Y55: 4 | AA55: 3 | AB55: 1 | AC55: =+C55+E55+G55+I55+K55+M55+O55+Q55+S55+U55+W55+Y55+AA55 -> 39 | AD55: =+D55+F55+H55+J55+L55+N55+P55+R55+T55+V55+X55+Z55+AB55 -> 7 | AE55: =+AC55+AD55 -> 46 | AG55: TRIBUNALES ORALES EN LO PENAL ECONOMICO | AH55: =+C55+D55+G55+H55+I55+J55 -> 9 | AI55: =+E55+F55+SUM(K55:P55) -> 11 | AJ55: =SUM(Q55:AB55) -> 26 | AK55: =+AH55+AI55+AJ55 -> 46
B56: Total | C56: =SUM(C53:C55) -> 0 | D56: =SUM(D53:D55) -> 0 | E56: =SUM(E53:E55) -> 0 | F56: =SUM(F53:F55) -> 0 | G56: =SUM(G53:G55) -> 108 | H56: =SUM(H53:H55) -> 0 | I56: =SUM(I53:I55) -> 0 | J56: =SUM(J53:J55) -> 0 | K56: =SUM(K53:K55) -> 36 | L56: =SUM(L53:L55) -> 1 | M56: =SUM(M53:M55) -> 3 | N56: =SUM(N53:N55) -> 3 | O56: =SUM(O53:O55) -> 38 | P56: =SUM(P53:P55) -> 4 | Q56: =SUM(Q53:Q55) -> 143 | R56: =SUM(R53:R55) -> 2 | S56: =SUM(S53:S55) -> 1 | T56: =SUM(T53:T55) -> 0 | U56: =SUM(U53:U55) -> 42 | V56: =SUM(V53:V55) -> 0 | W56: =SUM(W53:W55) -> 37 | X56: =SUM(X53:X55) -> 0 | Y56: =SUM(Y53:Y55) -> 41 | Z56: =SUM(Z53:Z55) -> 2 | AA56: =SUM(AA53:AA55) -> 35 | AB56: =SUM(AB53:AB55) -> 2 | AC56: =SUM(AC53:AC55) -> 484 | AD56: =SUM(AD53:AD55) -> 14 | AE56: =SUM(AE53:AE55) -> 498 | AG56: Total | AH56: =+C56+D56+G56+H56+I56+J56 -> 108 | AI56: =+E56+F56+SUM(K56:P56) -> 85 | AJ56: =SUM(Q56:AB56) -> 305 | AK56: =+AH56+AI56+AJ56 -> 498
C57: Juez de | E57: Secretario de | G57: Juez de | I57: Juez de | K57: Prosecretario | M57: Prosecretario de | O57: Prosecretario | Q57: Oficial | S57: Oficial | U57: Escribiente | W57: Escribiente | Y57: Auxiliar / | AA57: Personal de | AC57: Subtotal | AE57: Total | AH57: =+C57+D57+G57+H57+I57+J57 -> #¡VALOR! | AI57: =+E57+F57+SUM(K57:P57) -> #¡VALOR! | AJ57: =SUM(Q57:AB57) -> 0 | AK57: =+AH57+AI57+AJ57 -> #¡VALOR!
C58: Cámara de | E58: la C.S.J.N./ | G58: Cámara | I58: Primera | K58: Letrado de la | M58: de Cámara/ | O58: Administrativo | Q58: Mayor | W58: Auxiliar | Y58: Auxiliar | AA58: Maestranza | AH58: =+C58+D58+G58+H58+I58+J58 -> #¡VALOR! | AI58: =+E58+F58+SUM(K58:P58) -> #¡VALOR! | AJ58: =SUM(Q58:AB58) -> 0 | AK58: =+AH58+AI58+AJ58 -> #¡VALOR!
C59: Casación | E59: Secretario Letra- | I59: Instancia / | K59: C.S.J.N./ | M59: Secretario de | Y59: Administrativo | AH59: =+C59+D59+G59+H59+I59+J59 -> #¡VALOR! | AI59: =+E59+F59+SUM(K59:P59) -> #¡VALOR! | AJ59: =SUM(Q59:AB59) -> 0 | AK59: =+AH59+AI59+AJ59 -> #¡VALOR!
E60: do de C.S.J.N./ | I60: Secretario Cámara | K60: Secret. Cámara/ | M60: Juzgado/ | AH60: =+C60+D60+G60+H60+I60+J60 -> #¡VALOR! | AI60: =+E60+F60+SUM(K60:P60) -> #¡VALOR! | AJ60: =SUM(Q60:AB60) -> 0 | AK60: =+AH60+AI60+AJ60 -> #¡VALOR!
B61: JUSTICIA FEDERAL | E61: Director Gral | I61: Nacional Electoral | K61: Prosec. Jefe/ | M61: Subsecretario Adm./ | AG61: JUSTICIA FEDERAL | AH61: =+C61+D61+G61+H61+I61+J61 -> #¡VALOR! | AI61: =+E61+F61+SUM(K61:P61) -> #¡VALOR! | AJ61: =SUM(Q61:AB61) -> 0 | AK61: =+AH61+AI61+AJ61 -> #¡VALOR!
K62: Secretario Electoral/ | M62: Prosec. Electoral/ | AH62: =+C62+D62+G62+H62+I62+J62 -> 0 | AI62: =+E62+F62+SUM(K62:P62) -> 0 | AJ62: =SUM(Q62:AB62) -> 0 | AK62: =+AH62+AI62+AJ62 -> 0
K63: Prosec. Jefe de 2da./ | M63: Jefe Depto./ | AH63: =+C63+D63+G63+H63+I63+J63 -> 0 | AI63: =+E63+F63+SUM(K63:P63) -> 0 | AJ63: =SUM(Q63:AB63) -> 0 | AK63: =+AH63+AI63+AJ63 -> 0
K64: Subdirector gral. | M64: 2do. Jefe Depto. | AH64: =+C64+D64+G64+H64+I64+J64 -> 0 | AI64: =+E64+F64+SUM(K64:P64) -> 0 | AJ64: =SUM(Q64:AB64) -> 0 | AK64: =+AH64+AI64+AJ64 -> 0
C65: P | D65: C | E65: P | F65: C | G65: P | H65: C | I65: P | J65: C | K65: P | L65: C | M65: P | N65: C | O65: P | P65: C | Q65: P | R65: C | S65: P | T65: C | U65: P | V65: C | W65: P | X65: C | Y65: P | Z65: C | AA65: P | AB65: C | AC65: P | AD65: C | AH65: =+C65+D65+G65+H65+I65+J65 -> #¡VALOR! | AI65: =+E65+F65+SUM(K65:P65) -> #¡VALOR! | AJ65: =SUM(Q65:AB65) -> 0 | AK65: =+AH65+AI65+AJ65 -> #¡VALOR!
B66: CRIMINAL Y CORRECCIONAL FEDERAL | AG66: CRIMINAL Y CORRECCIONAL FEDERAL | AH66: =+C66+D66+G66+H66+I66+J66 -> 0 | AI66: =+E66+F66+SUM(K66:P66) -> 0 | AJ66: =SUM(Q66:AB66) -> 0 | AK66: =+AH66+AI66+AJ66 -> 0
B67: CAMARA NAC. DE APEL. EN LO CRIM. Y CORREC. FEDERAL | G67: 6 | K67: 20 | M67: 14 | O67: 12 | Q67: 22 | S67: 8 | U67: 7 | V67: 6 | W67: 4 | Y67: 10 | AA67: 13 | AC67: =+C67+E67+G67+I67+K67+M67+O67+Q67+S67+U67+W67+Y67+AA67 -> 116 | AD67: =+D67+F67+H67+J67+L67+N67+P67+R67+T67+V67+X67+Z67+AB67 -> 6 | AE67: =+AC67+AD67 -> 122 | AG67: CAMARA NAC. DE APEL. EN LO CRIM. Y CORREC. FEDERAL | AH67: =+C67+D67+G67+H67+I67+J67 -> 6 | AI67: =+E67+F67+SUM(K67:P67) -> 46 | AJ67: =SUM(Q67:AB67) -> 70 | AK67: =+AH67+AI67+AJ67 -> 122
B68: JUZGADOS NAC. EN LO CRIMINAL Y CORRECCIONAL FEDERAL | I68: 12 | M68: 24 | N68: 15 | O68: 25 | P68: 51 | Q68: 57 | R68: 16 | T68: 1 | U68: 48 | V68: 3 | W68: 47 | Y68: 48 | AA68: 26 | AB68: 2 | AC68: =+C68+E68+G68+I68+K68+M68+O68+Q68+S68+U68+W68+Y68+AA68 -> 287 | AD68: =+D68+F68+H68+J68+L68+N68+P68+R68+T68+V68+X68+Z68+AB68 -> 88 | AE68: =+AC68+AD68 -> 375 | AG68: JUZGADOS NAC. EN LO CRIMINAL Y CORRECCIONAL FEDERAL | AH68: =+C68+D68+G68+H68+I68+J68 -> 12 | AI68: =+E68+F68+SUM(K68:P68) -> 115 | AJ68: =SUM(Q68:AB68) -> 248 | AK68: =+AH68+AI68+AJ68 -> 375
B69: Total | C69: =SUM(C66:C68) -> 0 | D69: =SUM(D66:D68) -> 0 | E69: =SUM(E66:E68) -> 0 | F69: =SUM(F66:F68) -> 0 | G69: =SUM(G66:G68) -> 6 | H69: =SUM(H66:H68) -> 0 | I69: =SUM(I66:I68) -> 12 | J69: =SUM(J66:J68) -> 0 | K69: =SUM(K66:K68) -> 20 | L69: =SUM(L66:L68) -> 0 | M69: =SUM(M66:M68) -> 38 | N69: =SUM(N66:N68) -> 15 | O69: =SUM(O66:O68) -> 37 | P69: =SUM(P66:P68) -> 51 | Q69: =SUM(Q66:Q68) -> 79 | R69: =SUM(R66:R68) -> 16 | S69: =SUM(S66:S68) -> 8 | T69: =SUM(T66:T68) -> 1 | U69: =SUM(U66:U68) -> 55 | V69: =SUM(V66:V68) -> 9 | W69: =SUM(W66:W68) -> 51 | X69: =SUM(X66:X68) -> 0 | Y69: =SUM(Y66:Y68) -> 58 | Z69: =SUM(Z66:Z68) -> 0 | AA69: =SUM(AA66:AA68) -> 39 | AB69: =SUM(AB66:AB68) -> 2 | AC69: =SUM(AC66:AC68) -> 403 | AD69: =SUM(AD66:AD68) -> 94 | AE69: =SUM(AE66:AE68) -> 497 | AG69: Total | AH69: =+C69+D69+G69+H69+I69+J69 -> 18 | AI69: =+E69+F69+SUM(K69:P69) -> 161 | AJ69: =SUM(Q69:AB69) -> 318 | AK69: =+AH69+AI69+AJ69 -> 497
B70: CIVIL Y COMERCIAL FEDERAL | AG70: CIVIL Y COMERCIAL FEDERAL | AH70: =+C70+D70+G70+H70+I70+J70 -> 0 | AI70: =+E70+F70+SUM(K70:P70) -> 0 | AJ70: =SUM(Q70:AB70) -> 0 | AK70: =+AH70+AI70+AJ70 -> 0
B71: CAMARA NAC. DE APELACIONES EN LO CIVIL Y COMERCIAL | G71: 9 | K71: 15 | L71: 2 | M71: 1 | O71: 11 | Q71: 13 | S71: 8 | U71: 14 | W71: 6 | Y71: 5 | AA71: 20 | AC71: =+C71+E71+G71+I71+K71+M71+O71+Q71+S71+U71+W71+Y71+AA71 -> 102 | AD71: =+D71+F71+H71+J71+L71+N71+P71+R71+T71+V71+X71+Z71+AB71 -> 2 | AE71: =+AC71+AD71 -> 104 | AG71: CAMARA NAC. DE APELACIONES EN LO CIVIL Y COMERCIAL | AH71: =+C71+D71+G71+H71+I71+J71 -> 9 | AI71: =+E71+F71+SUM(K71:P71) -> 29 | AJ71: =SUM(Q71:AB71) -> 66 | AK71: =+AH71+AI71+AJ71 -> 104
B72: JUZGADOS NACIONALES EN LO CIVIL Y COMERCIAL FEDERAL | I72: 11 | M72: 22 | O72: 22 | P72: 1 | Q72: 33 | U72: 22 | W72: 33 | Y72: 33 | AA72: 23 | AC72: =+C72+E72+G72+I72+K72+M72+O72+Q72+S72+U72+W72+Y72+AA72 -> 199 | AD72: =+D72+F72+H72+J72+L72+N72+P72+R72+T72+V72+X72+Z72+AB72 -> 1 | AE72: =+AC72+AD72 -> 200 | AG72: JUZGADOS NACIONALES EN LO CIVIL Y COMERCIAL FEDERAL | AH72: =+C72+D72+G72+H72+I72+J72 -> 11 | AI72: =+E72+F72+SUM(K72:P72) -> 45 | AJ72: =SUM(Q72:AB72) -> 144 | AK72: =+AH72+AI72+AJ72 -> 200
B73: Total | C73: =SUM(C71:C72) -> 0 | D73: =SUM(D71:D72) -> 0 | E73: =SUM(E71:E72) -> 0 | F73: =SUM(F71:F72) -> 0 | G73: =SUM(G71:G72) -> 9 | H73: =SUM(H71:H72) -> 0 | I73: =SUM(I71:I72) -> 11 | J73: =SUM(J71:J72) -> 0 | K73: =SUM(K71:K72) -> 15 | L73: =SUM(L71:L72) -> 2 | M73: =SUM(M71:M72) -> 23 | N73: =SUM(N71:N72) -> 0 | O73: =SUM(O71:O72) -> 33 | P73: =SUM(P71:P72) -> 1 | Q73: =SUM(Q71:Q72) -> 46 | R73: =SUM(R71:R72) -> 0 | S73: =SUM(S71:S72) -> 8 | T73: =SUM(T71:T72) -> 0 | U73: =SUM(U71:U72) -> 36 | V73: =SUM(V71:V72) -> 0 | W73: =SUM(W71:W72) -> 39 | X73: =SUM(X71:X72) -> 0 | Y73: =SUM(Y71:Y72) -> 38 | Z73: =SUM(Z71:Z72) -> 0 | AA73: =SUM(AA71:AA72) -> 43 | AB73: =SUM(AB71:AB72) -> 0 | AC73: =SUM(AC71:AC72) -> 301 | AD73: =SUM(AD71:AD72) -> 3 | AE73: =SUM(AE71:AE72) -> 304 | AG73: Total | AH73: =+C73+D73+G73+H73+I73+J73 -> 20 | AI73: =+E73+F73+SUM(K73:P73) -> 74 | AJ73: =SUM(Q73:AB73) -> 210 | AK73: =+AH73+AI73+AJ73 -> 304
B74: CONTENCIOSO ADMINISTRATIVO FEDERAL | AG74: CONTENCIOSO ADMINISTRATIVO FEDERAL | AH74: =+C74+D74+G74+H74+I74+J74 -> 0 | AI74: =+E74+F74+SUM(K74:P74) -> 0 | AJ74: =SUM(Q74:AB74) -> 0 | AK74: =+AH74+AI74+AJ74 -> 0
B75: CAMARA NAC. DE APEL. EN LO CONT. ADMINIST. FEDERAL | E75: 2 | G75: 15 | K75: 13 | M75: 5 | N75: 2 | O75: 14 | P75: 1 | Q75: 38 | R75: 2 | S75: 12 | T75: 1 | U75: 23 | W75: 7 | Y75: 8 | Z75: 1 | AA75: 28 | AB75: 2 | AC75: =+C75+E75+G75+I75+K75+M75+O75+Q75+S75+U75+W75+Y75+AA75 -> 165 | AD75: =+D75+F75+H75+J75+L75+N75+P75+R75+T75+V75+X75+Z75+AB75 -> 9 | AE75: =+AC75+AD75 -> 174 | AG75: CAMARA NAC. DE APEL. EN LO CONT. ADMINIST. FEDERAL | AH75: =+C75+D75+G75+H75+I75+J75 -> 15 | AI75: =+E75+F75+SUM(K75:P75) -> 37 | AJ75: =SUM(Q75:AB75) -> 122 | AK75: =+AH75+AI75+AJ75 -> 174
B76: JUZGADOS NAC. EN LO CONT. ADMINISTRATIVO FEDERAL | I76: 12 | M76: 24 | O76: 24 | P76: 1 | Q76: 36 | U76: 24 | W76: 36 | Y76: 36 | Z76: 1 | AA76: 24 | AB76: 1 | AC76: =+C76+E76+G76+I76+K76+M76+O76+Q76+S76+U76+W76+Y76+AA76 -> 216 | AD76: =+D76+F76+H76+J76+L76+N76+P76+R76+T76+V76+X76+Z76+AB76 -> 3 | AE76: =+AC76+AD76 -> 219 | AG76: JUZGADOS NAC. EN LO CONT. ADMINISTRATIVO FEDERAL | AH76: =+C76+D76+G76+H76+I76+J76 -> 12 | AI76: =+E76+F76+SUM(K76:P76) -> 49 | AJ76: =SUM(Q76:AB76) -> 158 | AK76: =+AH76+AI76+AJ76 -> 219
B77: Total | C77: =SUM(C75:C76) -> 0 | D77: =SUM(D75:D76) -> 0 | E77: =SUM(E75:E76) -> 2 | F77: =SUM(F75:F76) -> 0 | G77: =SUM(G75:G76) -> 15 | H77: =SUM(H75:H76) -> 0 | I77: =SUM(I75:I76) -> 12 | J77: =SUM(J75:J76) -> 0 | K77: =SUM(K75:K76) -> 13 | L77: =SUM(L75:L76) -> 0 | M77: =SUM(M75:M76) -> 29 | N77: =SUM(N75:N76) -> 2 | O77: =SUM(O75:O76) -> 38 | P77: =SUM(P75:P76) -> 2 | Q77: =SUM(Q75:Q76) -> 74 | R77: =SUM(R75:R76) -> 2 | S77: =SUM(S75:S76) -> 12 | T77: =SUM(T75:T76) -> 1 | U77: =SUM(U75:U76) -> 47 | V77: =SUM(V75:V76) -> 0 | W77: =SUM(W75:W76) -> 43 | X77: =SUM(X75:X76) -> 0 | Y77: =SUM(Y75:Y76) -> 44 | Z77: =SUM(Z75:Z76) -> 2 | AA77: =SUM(AA75:AA76) -> 52 | AB77: =SUM(AB75:AB76) -> 3 | AC77: =SUM(AC75:AC76) -> 381 | AD77: =SUM(AD75:AD76) -> 12 | AE77: =SUM(AE75:AE76) -> 393 | AG77: Total | AH77: =+C77+D77+G77+H77+I77+J77 -> 27 | AI77: =+E77+F77+SUM(K77:P77) -> 86 | AJ77: =SUM(Q77:AB77) -> 280 | AK77: =+AH77+AI77+AJ77 -> 393
B78: SEGURIDAD SOCIAL | AG78: SEGURIDAD SOCIAL | AH78: =+C78+D78+G78+H78+I78+J78 -> 0 | AI78: =+E78+F78+SUM(K78:P78) -> 0 | AJ78: =SUM(Q78:AB78) -> 0 | AK78: =+AH78+AI78+AJ78 -> 0
B79: CAMARA FEDERAL DE APELACIONES DE LA SEGURIDAD SOCIAL | E79: 1 | G79: 9 | K79: 10 | L79: 1 | M79: 5 | O79: 16 | P79: 1 | Q79: 36 | R79: 1 | S79: 12 | U79: 16 | W79: 12 | Y79: 42 | AA79: 48 | AB79: 7 | AC79: =+C79+E79+G79+I79+K79+M79+O79+Q79+S79+U79+W79+Y79+AA79 -> 207 | AD79: =+D79+F79+H79+J79+L79+N79+P79+R79+T79+V79+X79+Z79+AB79 -> 10 | AE79: =+AC79+AD79 -> 217 | AG79: CAMARA FEDERAL DE APELACIONES DE LA SEGURIDAD SOCIAL | AH79: =+C79+D79+G79+H79+I79+J79 -> 9 | AI79: =+E79+F79+SUM(K79:P79) -> 34 | AJ79: =SUM(Q79:AB79) -> 174 | AK79: =+AH79+AI79+AJ79 -> 217
B80: JUZGADOS FEDERALES DE LA SEGURIDAD SOCIAL | I80: 10 | M80: 20 | N80: 1 | O80: 10 | Q80: 10 | Y80: 61 | Z80: 11 | AA80: 9 | AB80: 1 | AC80: =+C80+E80+G80+I80+K80+M80+O80+Q80+S80+U80+W80+Y80+AA80 -> 120 | AD80: =+D80+F80+H80+J80+L80+N80+P80+R80+T80+V80+X80+Z80+AB80 -> 13 | AE80: =+AC80+AD80 -> 133 | AG80: JUZGADOS FEDERALES DE LA SEGURIDAD SOCIAL | AH80: =+C80+D80+G80+H80+I80+J80 -> 10 | AI80: =+E80+F80+SUM(K80:P80) -> 31 | AJ80: =SUM(Q80:AB80) -> 92 | AK80: =+AH80+AI80+AJ80 -> 133
B81: Total | C81: =SUM(C79:C80) -> 0 | D81: =SUM(D79:D80) -> 0 | E81: =SUM(E79:E80) -> 1 | F81: =SUM(F79:F80) -> 0 | G81: =SUM(G79:G80) -> 9 | H81: =SUM(H79:H80) -> 0 | I81: =SUM(I79:I80) -> 10 | J81: =SUM(J79:J80) -> 0 | K81: =SUM(K79:K80) -> 10 | L81: =SUM(L79:L80) -> 1 | M81: =SUM(M79:M80) -> 25 | N81: =SUM(N79:N80) -> 1 | O81: =SUM(O79:O80) -> 26 | P81: =SUM(P79:P80) -> 1 | Q81: =SUM(Q79:Q80) -> 46 | R81: =SUM(R79:R80) -> 1 | S81: =SUM(S79:S80) -> 12 | T81: =SUM(T79:T80) -> 0 | U81: =SUM(U79:U80) -> 16 | V81: =SUM(V79:V80) -> 0 | W81: =SUM(W79:W80) -> 12 | X81: =SUM(X79:X80) -> 0 | Y81: =SUM(Y79:Y80) -> 103 | Z81: =SUM(Z79:Z80) -> 11 | AA81: =SUM(AA79:AA80) -> 57 | AB81: =SUM(AB79:AB80) -> 8 | AC81: =SUM(AC79:AC80) -> 327 | AD81: =SUM(AD79:AD80) -> 23 | AE81: =SUM(AE79:AE80) -> 350 | AG81: Total | AH81: =+C81+D81+G81+H81+I81+J81 -> 19 | AI81: =+E81+F81+SUM(K81:P81) -> 65 | AJ81: =SUM(Q81:AB81) -> 266 | AK81: =+AH81+AI81+AJ81 -> 350
B82: ELECTORAL | AG82: ELECTORAL | AH82: =+C82+D82+G82+H82+I82+J82 -> 0 | AI82: =+E82+F82+SUM(K82:P82) -> 0 | AJ82: =SUM(Q82:AB82) -> 0 | AK82: =+AH82+AI82+AJ82 -> 0
B83: CAMARA NACIONAL ELECTORAL | G83: 3 | I83: 2 | K83: 2 | M83: 1 | O83: 29 | Q83: 46 | S83: 30 | T83: 1 | U83: 63 | V83: 1 | W83: 27 | Y83: 14 | AA83: 38 | AC83: =+C83+E83+G83+I83+K83+M83+O83+Q83+S83+U83+W83+Y83+AA83 -> 255 | AD83: =+D83+F83+H83+J83+L83+N83+P83+R83+T83+V83+X83+Z83+AB83 -> 2 | AE83: =+AC83+AD83 -> 257 | AG83: CAMARA NACIONAL ELECTORAL | AH83: 3 | AI83: 34 | AJ83: =SUM(Q83:AB83) -> 220 | AK83: =+AH83+AI83+AJ83 -> 257
B84: SECRETARIAS ELECTORALES | I84: 1 | K84: 23 | M84: 26 | O84: 102 | P84: 1 | Q84: 238 | S84: 185 | U84: 462 | V84: 2 | W84: 166 | Y84: 177 | Z84: 9 | AA84: 105 | AB84: 1 | AC84: =+C84+E84+G84+I84+K84+M84+O84+Q84+S84+U84+W84+Y84+AA84 -> 1485 | AD84: =+D84+F84+H84+J84+L84+N84+P84+R84+T84+V84+X84+Z84+AB84 -> 13 | AE84: =+AC84+AD84 -> 1498 | AG84: SECRETARIAS ELECTORALES | AI84: =+E84+F84+SUM(K84:P84)+1 -> 153 | AJ84: =SUM(Q84:AB84) -> 1345 | AK84: =+AH84+AI84+AJ84 -> 1498
B85: Total | C85: =SUM(C83:C84) -> 0 | D85: =SUM(D83:D84) -> 0 | E85: =SUM(E83:E84) -> 0 | F85: =SUM(F83:F84) -> 0 | G85: =SUM(G83:G84) -> 3 | H85: =SUM(H83:H84) -> 0 | I85: =SUM(I83:I84) -> 3 | J85: =SUM(J83:J84) -> 0 | K85: =SUM(K83:K84) -> 25 | L85: =SUM(L83:L84) -> 0 | M85: =SUM(M83:M84) -> 27 | N85: =SUM(N83:N84) -> 0 | O85: =SUM(O83:O84) -> 131 | P85: =SUM(P83:P84) -> 1 | Q85: =SUM(Q83:Q84) -> 284 | R85: =SUM(R83:R84) -> 0 | S85: =SUM(S83:S84) -> 215 | T85: =SUM(T83:T84) -> 1 | U85: =SUM(U83:U84) -> 525 | V85: =SUM(V83:V84) -> 3 | W85: =SUM(W83:W84) -> 193 | X85: =SUM(X83:X84) -> 0 | Y85: =SUM(Y83:Y84) -> 191 | Z85: =SUM(Z83:Z84) -> 9 | AA85: =SUM(AA83:AA84) -> 143 | AB85: =SUM(AB83:AB84) -> 1 | AC85: =SUM(AC83:AC84) -> 1740 | AD85: =SUM(AD83:AD84) -> 15 | AE85: =SUM(AE83:AE84) -> 1755 | AG85: Total | AH85: =+C85+D85+G85+H85+I85+J85 -> 6 | AI85: =+E85+F85+SUM(K85:P85) -> 184 | AJ85: =SUM(Q85:AB85) -> 1565 | AK85: =+AH85+AI85+AJ85 -> 1755
B86: JUSTICIA PENAL ORAL FEDERAL CAPITAL FEDERAL | AG86: JUSTICIA PENAL ORAL FEDERAL CAPITAL FEDERAL | AH86: =+C86+D86+G86+H86+I86+J86 -> 0 | AI86: =+E86+F86+SUM(K86:P86) -> 0 | AJ86: =SUM(Q86:AB86) -> 0 | AK86: =+AH86+AI86+AJ86 -> 0
B87: TRIBUNALES ORALES (CRIMINAL Y CORRECCIONAL FEDERAL) | G87: 18 | K87: 6 | L87: 1 | N87: 12 | O87: 6 | P87: 5 | Q87: 24 | R87: 6 | S87: 6 | W87: 12 | X87: 2 | AA87: 12 | AC87: =+C87+E87+G87+I87+K87+M87+O87+Q87+S87+U87+W87+Y87+AA87 -> 84 | AD87: =+D87+F87+H87+J87+L87+N87+P87+R87+T87+V87+X87+Z87+AB87 -> 26 | AE87: =+AC87+AD87 -> 110 | AG87: TRIBUNALES ORALES (CRIMINAL Y CORRECCIONAL FEDERAL) | AH87: =+C87+D87+G87+H87+I87+J87 -> 18 | AI87: =+E87+F87+SUM(K87:P87) -> 30 | AJ87: =SUM(Q87:AB87) -> 62
B89: FUENTE: División Programación Presupuestaria -Consejo de la Magistratura-
B90: Oficina de Estadísticas del Poder Judicial de la Nación
B91: REFERENCIAS: (*)Incluye dentro de los permanentes 3 Prosecretarios Administrativos y 1 Escribiente Auxiliar pertenecientes a la repartición transitoria para cargos bolsa.