B6: PODER JUDICIAL DE LA NACION
B7: JURISDICCION CAPITAL FEDERAL
B8: COMPETENCIA CIVIL
B9: CUADRO XII
B10: DISTRIBUCION PORCENTUAL SEGÚN EL OBJETO DE LITIGIO DE LOS EXPEDIENTES INGRESADOS Y RESUELTOS - AÑO 2001-
B13: IV - SEGURIDAD SOCIAL
C15: CAUSAS | D15: %
B16: OBJETO | C16: SORTEADAS
B17: AMPARO POR MORA EN LA ADMINIST. | C17: 1500 | D17: =+(C17/C$33) -> 2.7681916326794249E-2
B18: JUBILACION Y RETIRO POR INVALIDEZ | C18: 78 | D18: =+(C18/C$33) -> 1.4394596489933011E-3
B19: PENSIONES | C19: 168 | D19: =+(C19/C$33) -> 3.1003746286009559E-3
B20: PRESTACIONES VARIAS | C20: 172 | D20: =+(C20/C$33) -> 3.1741930721390739E-3
B21: REAJUSTES VARIOS | C21: 10972 | D21: =+(C21/C$33) -> 0.20248399062505767
B22: OTROS | C22: 1573 | D22: =+(C22/C$33) -> 2.9029102921364902E-2
B23: AMPAROS Y SUMARISIMOS | C23: 7836 | D23: =+(C23/C$33) -> 0.14461033089117317
B24: MEDIDAS CAUTELARES | C24: 1046 | D24: =+(C24/C$33) -> 1.9303522985217855E-2
B25: EJECUCION PREVISIONAL | C25: 3596 | D25: =+(C25/C$33) -> 6.6362780740768082E-2
B26: EJECUCION DE HONORARIOS - ASTREINTES - OTROS | C26: 73 | D26: =+(C26/C$33) -> 1.3471865945706536E-3
B27: EJECUCION FISCAL | C27: 20518 | D27: =+(C27/C$33) -> 0.3786517061287763
B28: PERSONAL MIL. Y CIVIL DE LAS FF.AA. Y DE SEG. | C28: 2774 | D28: =+(C28/C$33) -> 5.1193090593684834E-2
B29: COBRO DE APORTES Y CONTRIBUCIONES | C29: 41 | D29: =+(C29/C$33) -> 7.566390462657095E-4
B30: EJECUCION LEY 23.660 | C30: 3733 | D30: =+(C30/C$33) -> 6.8891062431948619E-2
B31: LEY 24.557 | C31: 5 | D31: =+(C31/C$33) -> 9.2273054422647503E-5
B32: INCIDENTE | C32: 102 | D32: =+(C32/C$33) -> 1.8823703102220091E-3
B33: TOTAL | C33: =SUM(C17:C32) -> 54187 | D33: =SUM(D17:D32) -> 1
C36: CAUSAS | D36: %
B37: OBJETO | C37: RESUELTAS (*)
B38: AMPARO POR MORA EN LA ADMINIST. | C38: 1480 | D38: =+(C38/C$54) -> 2.9086335318279189E-2
B39: JUBILACION Y RETIRO POR INVALIDEZ | C39: 135 | D39: =+(C39/C$54) -> 2.6531454513295206E-3
B40: PENSIONES | C40: 192 | D40: =+(C40/C$54) -> 3.7733624196686515E-3
B41: PRESTACIONES VARIAS | C41: 273 | D41: =+(C41/C$54) -> 5.3652496904663637E-3
B42: REAJUSTES VARIOS | C42: 11073 | D42: =+(C42/C$54) -> 0.21761688579682803
B43: OTROS | C43: 1068 | D43: =+(C43/C$54) -> 2.0989328459406875E-2
B44: AMPAROS Y SUMARISIMOS | C44: =3847+4 -> 3851 | D44: =+(C44/C$54) -> 7.5683430615333211E-2
B45: MEDIDAS CAUTELARES | C45: =749+11 -> 760 | D45: =+(C45/C$54) -> 1.4936226244521745E-2
B46: EJECUCION PREVISIONAL | C46: 1624 | D46: =+(C46/C$54) -> 3.1916357133030676E-2
B47: EJECUCION DE HONORARIOS - ASTREINTES - OTROS | C47: =38+19 -> 57 | D47: =+(C47/C$54) -> 1.1202169683391309E-3
B48: EJECUCION FISCAL | C48: 20074 | D48: =+(C48/C$54) -> 0.39451290214806517
B49: PERSONAL MIL. Y CIVIL DE LAS FF.AA. Y DE SEG. | C49: 6887 | D49: =+(C49/C$54) -> 0.13534972387634378
B50: COBRO DE APORTES Y CONTRIBUCIONES | C50: 150 | D50: =+(C50/C$54) -> 2.9479393903661341E-3
B51: EJECUCION LEY 23.660 | C51: 3235 | D51: =+(C51/C$54) -> 6.3577226185562954E-2
B52: LEY 24.557 | C52: 3 | D52: =+(C52/C$54) -> 5.895878780732268E-5
B53: INCIDENTE | C53: =14+7 -> 21 | D53: =+(C53/C$54) -> 4.127115146512588E-4
B54: TOTAL | C54: =SUM(C38:C53) -> 50883 | D54: =SUM(D38:D53) -> 1
B55: REFERENCIAS: (*) Con Sentencias Definitivas, Interlocutorias y Providencias Simples.
B56: FUENTE: Oficina de Estadísticas del Poder Judicial de la Nación.-