B6: PODER JUDICIAL DE LA NACION
B7: JURISDICCION CAPITAL FEDERAL
B8: COMPETENCIA PENAL
B9: CUADRO X
B10: DISTRIBUCION PORCENTUAL, SEGÚN EL TIPO DE DELITO, DE LAS CAUSAS INGRESADAS, ELEVADAS A JUICIO Y PERSONAS CONDENADAS -AÑO 2001-
B12: VI - PENAL ECONOMICO
C14: CAUSAS | D14: % | E14: CAUSAS | F14: % | G14: PERSONAS | H14: %
B15: BIEN PROTEGIDO | C15: INGRESADAS | E15: ELEVADAS | G15: CONDENADAS (*)
B16: BCO. CENTRAL (LEY 19.359) | C16: 62 | D16: =+(C16/C$29) -> 1.4828988280315715E-2 | E16: 0 | F16: =+E16/E$29 -> 0 | H16: =+G16/G$29 -> 0
B17: CODIGO ADUANERO | C17: 686 | D17: =+(C17/C$29) -> 0.16407558000478353 | E17: 88 | F17: =+E17/E$29 -> 0.25 | G17: =2+43+6+16+11 -> 78 | H17: =+G17/G$29 -> 0.3046875
B18: PENAL TRIBUTARIO (LEY 23.771) | C18: 589 | D18: =+(C18/C$29) -> 0.14087538866299928 | E18: 20 | F18: =+E18/E$29 -> 5.6818181818181816E-2 | G18: 3 | H18: =+G18/G$29 -> 1.171875E-2
B19: SEC. DE COMERCIO (LEY 20.680) | C19: 0 | D19: =+(C19/C$29) -> 0 | E19: 0 | F19: =+E19/E$29 -> 0 | H19: =+G19/G$29 -> 0
B20: D.G.I. (LEY 11.683) | C20: 1189 | D20: =+(C20/C$29) -> 0.28438172685960295 | E20: 0 | F20: =+E20/E$29 -> 0 | G20: =53+23 -> 76 | H20: =+G20/G$29 -> 0.296875
B21: VITIVINICULTURA Y CINEMATOGRAFIA | C21: 0 | D21: =+(C21/C$29) -> 0 | E21: 0 | F21: =+E21/E$29 -> 0 | H21: =+G21/G$29 -> 0
B22: AMPARO (Ley 16.986) | C22: 83 | D22: =+(C22/C$29) -> 1.9851710117196844E-2 | E22: 0 | F22: =+E22/E$29 -> 0 | H22: =+G22/G$29 -> 0
B23: HABEAS CORPUS (Ley 23.098) | C23: 0 | D23: =+(C23/C$29) -> 0 | E23: 0 | F23: =+E23/E$29 -> 0 | H23: =+G23/G$29 -> 0
B24: EJECUCIONES FISCALES | C24: 76 | D24: =+(C24/C$29) -> 1.8177469504903135E-2 | E24: 0 | F24: =+E24/E$29 -> 0 | H24: =+G24/G$29 -> 0
B25: LEY 24.241 (AFJP) | C25: 189 | D25: =+(C25/C$29) -> 4.5204496531930163E-2 | E25: 62 | F25: =+E25/E$29 -> 0.17613636363636365 | G25: 2 | H25: =+G25/G$29 -> 7.8125E-3
B26: ART. 300 DEL COD. PENAL | C26: 7 | D26: =+(C26/C$29) -> 1.6742406122937097E-3 | E26: 0 | F26: =+E26/E$29 -> 0 | H26: =+G26/G$29 -> 0
B27: ART. 302 DEL COD. PENAL | C27: 1233 | D27: =+(C27/C$29) -> 0.29490552499402056 | E27: 182 | F27: =+E27/E$29 -> 0.51704545454545459 | G27: =1+35+61 -> 97 | H27: =+G27/G$29 -> 0.37890625
B28: OTROS | C28: 67 | D28: =+(C28/C$29) -> 1.6024874431954078E-2 | E28: 0 | F28: =+E28/E$29 -> 0 | H28: =+G28/G$29 -> 0
B29: TOTAL | C29: =SUM(C16:C28) -> 4181 | D29: =SUM(D16:D28) -> 1 | E29: =SUM(E16:E28) -> 352 | F29: =SUM(F16:F28) -> 1 | G29: =SUM(G16:G28) -> 256 | H29: =SUM(H16:H28) -> 1
B30: Referencias: (*) En causas tramitadas en los Juzgados y en los Tribunales Orales en lo Criminal Federal.
B31: FUENTE: Oficina de Estadísticas del Poder Judicial de la Nación.