B6: PODER JUDICIAL DE LA NACION
B7: JURISDICCIÓN CAPITAL FEDERAL
B8: CUADRO XIII
B9: INDICE DE LITIGIOSIDAD EN LOS JUZGADOS DE PRIMERA INSTANCIA -AÑO 2001-
B12: 1- COMPETENCIA PENAL
B14: Fueros | C14: Causas ingresadas | D14: Cantidad de habitantes en la jurisdicción | E14: Causas ingresadas
E15: c/10.000 hab.
B16: Instrucción | C16: 118644 | D16: 2768772 | E16: =+(C16/$D$16)*10000 -> 428.50765610169418
B17: Correccional | C17: 82828 | E17: =+(C17/$D$16)*10000 -> 299.15067040550832
B18: Menores | C18: 6529 | E18: =+(C18/$D$16)*10000 -> 23.580851005427679
B19: Penal Económico | C19: 4181 | E19: =+(C19/$D$16)*10000 -> 15.100557214534097
B20: Criminal Federal | C20: 21960 | E20: =+(C20/$D$16)*10000 -> 79.31313954345103
B21: TOTAL | C21: =SUM(C16:C20) -> 234142 | E21: =+(C21/$D$16)*10000 -> 845.65287427061526
B23: FUENTE: INDEC (Censo Nacional de Población, Hogares y Viviendas 2001 e Instituto Geografico Militar).
B24: Oficina de Estadísticas del Poder Judicial de la Nación.-
B26: 2- COMPETENCIA CIVIL
B28: Dependencias | C28: Causas ingresadas | D28: Cantidad de habitantes en la jurisdicción | E28: Causas ingresadas
E29: c/10.000 hab.
B30: Civil | C30: 113137 | D30: 2768772 | E30: =+(C30/$D$30)*10000 -> 408.61797215516486
B31: Comercial | C31: 164295 | E31: =+(C31/$D$30)*10000 -> 593.38580424823715
B32: Civil y Comercial Federal | C32: 11475 | E32: =+(C32/$D$30)*10000 -> 41.444365949959042
B33: Contencioso Administrativo Federal | C33: 30358 | E33: =+(C33/$D$30)*10000 -> 109.64427551275439
B34: Trabajo | C34: 22355 | E34: =+(C34/$D$30)*10000 -> 80.739764776586867
B35: Seguridad Social | C35: 50196 | E35: =+(C35/$D$30)*10000 -> 181.29336760123257
B36: TOTAL | C36: =SUM(C30:C35) -> 391816 | E36: =+(C36/$D$30)*10000 -> 1415.1255502439351
B38: FUENTE: INDEC (Censo Nacional de Población, Hogares y Viviendas 2001 e Instituto Geografico Militar).
B39: Oficina de Estadísticas del Poder Judicial de la Nación.-