B6: PODER JUDICIAL DE LA NACION
B7: JURISDICCION CAPITAL FEDERAL
B9: CUADRO I
B10: DENSIDAD DE POBLACION POR COMPETENCIA TERRITORIAL -AÑO 2001-
B12: DISTRITOS ESCOLARES | C12: COMISARIAS | D12: POBLACION (2001) | E12: SUPERFICIE (Km2) | F12: DENSIDAD DE POBLACION (Hab/Km2)
B13: Distrito I | C13: 1 -2 - 3 - 15 - 17 - 46 | D13: 232609 | E13: 14.5 | F13: =+D13/E13 -> 16042
B14: Distrito II | C14: 5 - 7 - 8 - 19 | D14: 234072 | E14: 7.6 | F14: =+D14/E14 -> 30798.947368421053
B15: Distrito III | C15: 4 - 6 - 16 - 18 - 28 | D15: 121893 | E15: 6 | F15: =+D15/E15 -> 20315.5
B16: Distrito IV | C16: 52 | D16: 84144 | E16: 10.5 | F16: =+D16/E16 -> 8013.7142857142853
B17: Distrito V | C17: 14 - 22 - 24 - 26 - 30 | D17: 97982 | E17: 11.6 | F17: =+D17/E17 -> 8446.7241379310344
B18: Distrito VI | C18: 20 - 32 | D18: 151100 | E18: 4.9 | F18: =+D18/E18 -> 30836.734693877548
B19: Distrito VII | C19: 11 - 25 - 27 - 29 | D19: 158779 | E19: 7.2 | F19: =+D19/E19 -> 22052.638888888887
B20: Distrito VIII | C20: 9 | D20: 135520 | E20: 6.2 | F20: =+D20/E20 -> 21858.06451612903
B21: Distrito IX | C21: 21 - 23 - 53 | D21: 235900 | E21: 17 | F21: =+D21/E21 -> 13876.470588235294
B22: Distrito X | C22: 33 - 35 - 31 - 51 | D22: 215286 | E22: 14.9 | F22: =+D22/E22 -> 14448.724832214764
B23: Distrito XI | C23: 12 - 38 | D23: 103583 | E23: 7.1 | F23: =+D23/E23 -> 14589.154929577466
B24: Distrito XII | C24: 40 - 43 - 50 - 13 | D24: 109435 | E24: 6.2 | F24: =+D24/E24 -> 17650.806451612902
B25: Distrito XIII | C25: 49 | D25: 112038 | E25: 10.7 | F25: =+D25/E25 -> 10470.841121495328
B26: Distrito XIV | C26: 41 | D26: 96177 | E26: 9.1 | F26: =+D26/E26 -> 10568.901098901099
B27: Distrito XV | C27: 37 - 39 | D27: 104097 | E27: 8.2 | F27: =+D27/E27 -> 12694.756097560976
B28: Distrito XVI | C28: 47 | D28: 83987 | E28: 7.7 | F28: =+D28/E28 -> 10907.402597402597
B29: Distrito XVII | C29: 45 | D29: 122294 | E29: 9.3 | F29: =+D29/E29 -> 13149.892473118278
B30: Distrito XVIII | C30: 44 | D30: 99678 | E30: 8.8 | F30: =+D30/E30 -> 11327.045454545454
B31: Distrito XIX | C31: 10 - 34 - 36 | D31: 76978 | E31: 8.2 | F31: =+D31/E31 -> 9387.5609756097565
B32: Distrito XX | C32: 42 | D32: 90082 | E32: 9 | F32: =+D32/E32 -> 10009.111111111111
B33: Distrito XXI | C33: 48 | D33: 103138 | E33: 15.3 | F33: =+D33/E33 -> 6741.0457516339866
B34: TOTAL | D34: =SUM(D13:D33) -> 2768772 | E34: =SUM(E13:E33) -> 200 | F34: =+D34/E34 -> 13843.86
B35: Fuente: INDEC. Censo Nacional de Población, Hogares y Viviendas 2001 e Instituto Geográfico Militar.
B36: Oficina de Estadísticas del Poder Judicial de la Nación.