B6: PODER JUDICIAL DE LA NACION
B7: JURISDICCION CAPITAL FEDERAL
B8: COMPETENCIA PENAL
B9: CUADRO X
B10: DISTRIBUCION PORCENTUAL, SEGÚN EL TIPO DE DELITO, DE LAS CAUSAS INGRESADAS, ELEVADAS A JUICIO Y PERSONAS CONDENADAS -AÑO 2001-
B12: V - CRIMINAL Y CORRECCIONAL FEDERAL
C14: CAUSAS | D14: % | E14: CAUSAS | F14: % | G14: PERSONAS | H14: %
B15: DELITOS | C15: INGRESADAS | E15: ELEVADAS | G15: CONDENADAS (*)
B16: Ley Estupefacientes | C16: 10746 | D16: =+(C16/C$33) -> 0.48934426229508199 | E16: 153 | F16: =+E16/E$33 -> 0.35498839907192575 | G16: =70+36+32+13 -> 151 | H16: =+G16/G$33 -> 0.6088709677419355
B17: C/la fé pública | C17: 2354 | D17: =+(C17/C$33) -> 0.10719489981785063 | E17: 174 | F17: =+E17/E$33 -> 0.40371229698375871 | G17: =2+7+31+4+8 -> 52 | H17: =+G17/G$33 -> 0.20967741935483872
B18: C/las personas | C18: 95 | D18: =+(C18/C$33) -> 4.326047358834244E-3 | E18: 1 | F18: =+E18/E$33 -> 2.3201856148491878E-3 | G18: 2 | H18: =+G18/G$33 -> 8.0645161290322578E-3
B19: Homicidios | C19: 2 | D19: =+(C19/C$33) -> 9.1074681238615665E-5 | E19: 0 | F19: =+E19/E$33 -> 0 | H19: =+G19/G$33 -> 0
B20: C/la honestidad | C20: 1 | D20: =+(C20/C$33) -> 4.5537340619307832E-5 | E20: 0 | F20: =+E20/E$33 -> 0 | H20: =+G20/G$33 -> 0
B21: C/el honor | C21: 50 | D21: =+(C21/C$33) -> 2.2768670309653918E-3 | E21: 2 | F21: =+E21/E$33 -> 4.6403712296983757E-3 | H21: =+G21/G$33 -> 0
B22: C/el est.civil | C22: 22 | D22: =+(C22/C$33) -> 1.0018214936247723E-3 | E22: 2 | F22: =+E22/E$33 -> 4.6403712296983757E-3 | H22: =+G22/G$33 -> 0
B23: C/la libertad | C23: 213 | D23: =+(C23/C$33) -> 9.699453551912568E-3 | E23: 6 | F23: =+E23/E$33 -> 1.3921113689095127E-2 | G23: =1+2 -> 3 | H23: =+G23/G$33 -> 1.2096774193548387E-2
B24: C/la propiedad | C24: 1167 | D24: =+(C24/C$33) -> 5.3142076502732241E-2 | E24: 28 | F24: =+E24/E$33 -> 6.4965197215777259E-2 | G24: =8+10 -> 18 | H24: =+G24/G$33 -> 7.2580645161290328E-2
B25: C/la seg. pública | C25: 647 | D25: =+(C25/C$33) -> 2.9462659380692167E-2 | E25: 9 | F25: =+E25/E$33 -> 2.0881670533642691E-2 | G25: =2+1+1 -> 4 | H25: =+G25/G$33 -> 1.6129032258064516E-2
B26: C/el orden público | C26: 3887 | D26: =+(C26/C$33) -> 0.17700364298724955 | E26: 0 | F26: =+E26/E$33 -> 0 | G26: =1+1 -> 2 | H26: =+G26/G$33 -> 8.0645161290322578E-3
B27: C/la Seg. de la Nación | C27: 31 | D27: =+(C27/C$33) -> 1.4116575591985429E-3 | E27: 0 | F27: =+E27/E$33 -> 0 | H27: =+G27/G$33 -> 0
B28: C/los pod. publ. y el ord. constitucional | C28: 2 | D28: =+(C28/C$33) -> 9.1074681238615665E-5 | E28: 0 | F28: =+E28/E$33 -> 0 | H28: =+G28/G$33 -> 0
B29: C/la adm. pública | C29: 1169 | D29: =+(C29/C$33) -> 5.3233151183970859E-2 | E29: 34 | F29: =+E29/E$33 -> 7.8886310904872387E-2 | G29: =1+7+1+4 -> 13 | H29: =+G29/G$33 -> 5.2419354838709679E-2
B30: Extradiciones | C30: 74 | D30: =+(C30/C$33) -> 3.3697632058287798E-3 | E30: 0 | F30: =+E30/E$33 -> 0 | H30: =+G30/G$33 -> 0
B31: L.esp./Dto.leyes | C31: 870 | D31: =+(C31/C$33) -> 3.9617486338797817E-2 | E31: 16 | F31: =+E31/E$33 -> 3.7122969837587005E-2 | G31: =2+1 -> 3 | H31: =+G31/G$33 -> 1.2096774193548387E-2
B32: Otros | C32: 630 | D32: =+(C32/C$33) -> 2.8688524590163935E-2 | E32: 6 | F32: =+E32/E$33 -> 1.3921113689095127E-2 | H32: =+G32/G$33 -> 0
B33: TOTAL | C33: =SUM(C16:C32) -> 21960 | D33: =SUM(D16:D32) -> 1 | E33: =SUM(E16:E32) -> 431 | F33: =SUM(F16:F32) -> 1 | G33: =SUM(G16:G32) -> 248 | H33: =SUM(H16:H32) -> 1
B34: Referencias: (*) En causas tramitadas en los Juzgados y en los Tribunales Orales en lo Criminal Federal.
B35: FUENTE: Oficina de Estadísticas del Poder Judicial de la Nación.