B7: PODER JUDICIAL DE LA NACION
B8: JURISDICCION CAPITAL FEDERAL
B9: COMPETENCIA CIVIL
B10: CUADRO XII
B11: DISTRIBUCION PORCENTUAL SEGÚN EL PROCESO DE LOS EXPEDIENTES INGRESADOS Y RESUELTOS -AÑO 2001-
B14: I.a - CIVIL - Juzgados Patrimoniales
C17: CAUSAS
B18: PROCESO | C18: INGRESADAS | D18: % | E18: RESUELTOS | F18: %
B19: EJECUTIVO | C19: 25388 | D19: =+C19/C$24 -> 0.29868235294117645 | E19: 14849 | F19: =+E19/E$24 -> 0.25766541151156536
B20: ORDINARIO | C20: 1382 | D20: =+C20/C$24 -> 1.6258823529411763E-2 | E20: 553 | F20: =+E20/E$24 -> 9.5958631938780816E-3
B21: PROCESOS ESPECIALES | C21: 37273 | D21: =+C21/C$24 -> 0.43850588235294119 | E21: 27729 | F21: =+E21/E$24 -> 0.48116399729302956
B22: SUMARISIMO | C22: 512 | D22: =+C22/C$24 -> 6.0235294117647062E-3 | E22: 337 | F22: =+E22/E$24 -> 5.8477502646237141E-3
B23: SUMARIO | C23: 20445 | D23: =+C23/C$24 -> 0.24052941176470588 | E23: 14161 | F23: =+E23/E$24 -> 0.2457269777369033
B24: TOTAL | C24: =SUM(C19:C23) -> 85000 | D24: =+C24/C$24 -> 1 | E24: =SUM(E19:E23) -> 57629 | F24: =+E24/E$24 -> 1
B25: FUENTE: Oficina de Estadísticas del Poder Judicial de la Nación.-