B6: PODER JUDICIAL DE LA NACION
B7: JURISDICCION CAPITAL FEDERAL
B8: COMPETENCIA CIVIL
B9: CUADRO XII
B10: DISTRIBUCION PORCENTUAL SEGÚN EL OBJETO DE LITIGIO DE LOS EXPEDIENTES INGRESADOS - AÑO 2001-
B13: I.b - CIVIL - Juzgados de Familia
C15: CAUSAS | D15: %
B16: OBJETO | C16: INGRESADAS
B17: ART. 482 COD. CIVIL | C17: 6934 | D17: =+(C17/C$23) -> 0.24643707573657461
B18: DIVORCIO ART. 214 INC. 2 COD. CIVIL | C18: 4221 | D18: =+(C18/C$23) -> 0.15001599317624481
B19: DIVORCIO ART. 215 COD. CIVIL | C19: 1904 | D19: =+(C19/C$23) -> 6.7668905711340946E-2
B20: DIVORCIO | C20: 924 | D20: =+(C20/C$23) -> 3.2839321889327221E-2
B21: DENUNCIA POR VIOLENCIA FAMILIAR | C21: 2463 | D21: =+(C21/C$23) -> 8.753598464655081E-2
B22: OTROS (88 objetos restantes) | C22: 11691 | D22: =+(C22/C$23) -> 0.41550271883996159
B23: TOTAL | C23: =SUM(C17:C22) -> 28137 | D23: =SUM(D17:D22) -> 1
B24: FUENTE: Oficina de Estadísticas del Poder Judicial de la Nación.-