B6: PODER JUDICIAL DE LA NACION
B7: JURISDICCION CAPITAL FEDERAL
B8: COMPETENCIA PENAL
B9: CUADRO X
B10: DISTRIBUCION PORCENTUAL, SEGÚN EL TIPO DE DELITO, DE LAS CAUSAS INGRESADAS, ELEVADAS A JUICIO Y PERSONAS CONDENADAS -AÑO 2001-
B12: IV - CORRECCIONAL
C14: CAUSAS | D14: % | E14: CAUSAS | F14: % | G14: PERSONAS | H14: %
B15: DELITOS | C15: INGRESADAS | E15: ELEVADAS | G15: CONDENADAS
B16: CULPOSOS | C16: 11395 | D16: =+(C16/C$22) -> 0.13757425025353745 | E16: 264 | F16: =+D16/D$22 -> 0.13757425025353745 | G16: 153 | H16: =+G16/G$22 -> 0.54063604240282681
B17: DOLOSOS | C17: 24820 | D17: =+(C17/C$22) -> 0.2996571207804124 | E17: 213 | F17: =+D17/D$22 -> 0.2996571207804124 | G17: 123 | H17: =+G17/G$22 -> 0.43462897526501765
B18: ACCION PRIVADA | C18: 521 | D18: =+(C18/C$22) -> 6.2901434297580527E-3 | E18: 16 | F18: =+D18/D$22 -> 6.2901434297580527E-3 | G18: 4 | H18: =+G18/G$22 -> 1.4134275618374558E-2
B19: LEYES ESPECIALES/ DECRETOS LEYES | C19: 2970 | D19: =+(C19/C$22) -> 3.5857439513208092E-2 | E19: 9 | F19: =+D19/D$22 -> 3.5857439513208092E-2 | G19: 3 | H19: =+G19/G$22 -> 1.0600706713780919E-2
B20: FALTAS Y CONTRAVENCIONES POLICIALES | D20: =+(C20/C$22) -> 0 | F20: =+D20/D$22 -> 0 | H20: =+G20/G$22 -> 0
B21: N.N. CUALQUIERA SEA EL DELITO | C21: 43122 | D21: =+(C21/C$22) -> 0.52062104602308401 | F21: =+D21/D$22 -> 0.52062104602308401 | H21: =+G21/G$22 -> 0
B22: TOTAL | C22: =SUM(C16:C21) -> 82828 | D22: =SUM(D16:D21) -> 1 | E22: =SUM(E16:E21) -> 502 | F22: =SUM(F16:F21) -> 1 | G22: =SUM(G16:G21) -> 283 | H22: =SUM(H16:H21) -> 1
B23: FUENTE: Oficina de Estadísticas del Poder Judicial de la Nación.