B6: PODER JUDICIAL DE LA NACION
B7: JURISDICCION CAPITAL FEDERAL
B9: CUADRO IV
B10: DISTRIBUCION ANUAL DEL GASTO POR TODO CONCEPTO -AÑO 2001-
B13: CORTE SUPREMA DE JUSTICIA (*) | C13: HABERES | D13: CONTRATOS | E13: BIENES DE CONSUMO | F13: SERVICIOS NO PERSONALES | G13: LOCACION DE INMUEBLES | H13: BIENES DE USO | I13: TRANSFERENCIAS
D14: (**)
B15: JUSTICIA DE MAXIMA INSTANCIA | C15: 16002788.02 | D15: 947837.45 | E15: 352470.91 | F15: 1580880.41 | H15: 658016.61 | I15: 1920000
B16: ASISTENCIA SOCIAL | C16: 2919641.59 | D16: 100114.76
B17: MANDAMIENTOS Y NOTIFICACIONES | C17: 16753668.560000001 | D17: 60182.15 | E17: 22496.87 | F17: 54655.7 | G17: 265500 | H17: 12752.15
B18: DIRECCION PERICIAL | C18: 19753813.539999999 | D18: 1431027.87 | E18: 290933.81 | F18: 483331.55 | H18: 87346.45
B19: SEC. DE DERECHO COMPARADO Y BIBLIOTECA | C19: 2319937.46 | D19: 58163.62 | E19: 5375.88 | F19: 27749.47 | H19: 299144.95
B20: ARCHIVO | C20: 4262289.84 | D20: 420579.27 | E20: 53660.04 | F20: 40448.85 | H20: 10347.7
B21: ADMINISTRACION GENERAL | C21: 13508067.09 | D21: 1080398.31 | E21: 219835.67 | F21: 485803.21 | H21: 77262.399999999994
B22: Total | C22: =SUM(C15:C21) -> 75520206.100000009 | D22: =SUM(D15:D21) -> 4098303.43 | E22: =SUM(E15:E21) -> 944773.18 | F22: =SUM(F15:F21) -> 2672869.19 | G22: =SUM(G15:G21) -> 265500 | H22: =SUM(H15:H21) -> 1144870.26 | I22: =SUM(I15:I21) -> 1920000
B24: CONSEJO DE LA MAGISTRATURA | C24: 20508395.809999999 | D24: 29749243.030000001 | E24: 3611814.4 | F24: 21785985.350000001 | G24: 1465125 | H24: 1951315.77 | I24: 10418974.73
B25: CAMARA DE CASACION
B26: CAMARA DE CASACION (4) | C26: 6257578.2300000004 | E26: 49928.4 | H26: 423920.55
B27: CRIMINAL Y CORRECCIONAL
B28: CAMARA NACIONAL DE APELACIONES EN LO CRIMINAL Y CORRECCONAL (5) | C28: =330927.3*13 -> 4302054.9
B29: JUZGADOS NACIONALES EN LO CRIMINAL DE INSTRUCCION (49) | C29: =1389661.21*13 -> 18065595.73
B30: JUZGADOS CORRECCIONALES DE LA CAPITAL FEDERAL (14) | C30: =13*589220.95 -> 7659872.3499999996
B31: JUZGADOS NACIONALES DE MENORES (7) | C31: =13*662485.42 -> 8612310.4600000009
B32: JUZGADO NACIONAL DE 1RA. INSTANCIA EN LO CRIMINAL DE ROGATORIAS (1) | C32: =13*25634.87 -> 333253.31
B33: OTROS | C33: =13*459601.09-1378802.59 -> 4596011.58
B34: Total | C34: =SUM(C28:C33) -> 43569098.329999998 | E34: 183850.85
B35: CIVIL
B36: CAMARA NACIONAL EN LO CIVIL (I) (13) | C36: =13*1059821.72 -> 13777682.359999999
B37: JUZGADOS PATRIMONIALES EN LO CIVIL (86) | C37: =13*3179294.98 -> 41330834.740000002
B38: JUZGADOS DE FAMILIA EN LO CIVIL (24) | C38: =13*1041542.58 -> 13540053.539999999
B39: OTROS | C39: =13*369616.88-592670.46 -> 4212348.98
B40: Total | C40: =SUM(C36:C39) -> 72860919.620000005 | E40: 165886.53 | H40: 3264 | I40: 146500
B41: COMERCIAL
B42: CAMARA NACIONAL DE APELACIONES EN LO COMERCIAL (5) | C42: =13*598626.23 -> 7782140.9900000002
B43: JUZGADOS NACIONALES DE 1RA INSTANCIA EN LO COMERCIAL (26) | C43: =13*1537437.83-1521653.61 -> 18465038.18
B44: Total | C44: =SUM(C42:C43) -> 26247179.170000002 | E44: 78554.01 | H44: 1660748.18
B45: TRABAJO
B46: CAMARA NACIONAL DE APELACIONES DEL TRABAJO (II) (10) | C46: =13*773102.78 -> 10050336.140000001
B47: JUZGADOS NACIONALES DE 1RA. INSTANCIA TRABAJO (80) | C47: =13*2584781.08 -> 33602154.039999999
B48: OTROS | C48: =13*240097.62-1784560.73 -> 1336708.33
B49: Total | C49: =SUM(C46:C48) -> 44989198.509999998 | E49: 125698.5
B50: PENAL ECONOMICO
B51: CAMARA NACIONAL DE APELACIONES EN LO PENAL ECONOMICO (2) | C51: =13*138857.36 -> 1805145.68
B52: JUZGADOS EN LO PENAL ECONOMICO (8) | C52: =13*384381.38 -> 4996957.94
B53: UJIERIA | C53: =13*15238.88 -> 198105.44
B54: OTROS | C54: =13*141691.35-577841.12 -> 1264146.43
B55: Total | C55: =SUM(C51:C54) -> 8264355.4900000002 | E55: 52737
B56: JUSTICIA PENAL ORAL ORDINARIA
B57: TRIBUNALES ORALES CRIMINALES (30) | C57: =13*1551057.42-461044.14 -> 19702702.32
B58: TRIBUNALES ORALES DE MENORES (3) | C58: =13*186815.2 -> 2428597.6
B59: TRIBUNALES ORALES EN LO PENAL ECONOMICO (3) | C59: =13*188843.97 -> 2454971.61
B60: JUZGADO NACIONAL DE EJECUCIÓN PENAL DE LA CAPITAL FEDERAL (3) | C60: =13*52697.95 -> 685073.35
B61: Total | C61: =SUM(C57:C60) -> 25271344.880000003 | E61: 30506.31
B62: CRIMINAL Y CORRECCIONAL FEDERAL
B63: CAMARA NACIONAL DE APEL. EN LO CRIMINAL Y CORRECCIONAL FEDERAL (III) (2) | C63: =13*288528.84-1000000 -> 2750874.92
B64: JUZGADOS NAC. DE 1RA. INSTANCIA EN LO CRIMINAL Y CORRECCIONAL FEDERAL (12) | C64: =13*802354.4-2000000 -> 8430607.2000000011
B65: OTROS | C65: =13*77777.93-380505.3 -> 630607.79
B66: Total | C66: =SUM(C63:C65) -> 11812089.91 | E66: 40270.400000000001
B67: CIVIL Y COMERCIAL FEDERAL
B68: CAMARA NAC. DE APELACIONES EN LO CIVIL Y COMERCIAL (IV) (3) | C68: =13*245644.63 -> 3193380.19
B69: JUZGADOS NACIONALES DE 1RA INSTANCIA EN LO CIVIL Y COMERCIAL FEDERAL (11) | C69: =13*489702.24 -> 6366129.1200000001
B70: OTROS | C70: =13*63371.23-282242.63 -> 541583.35999999999
B71: Total | C71: =SUM(C68:C70) -> 10101092.67 | E71: 22850.41
B72: CONTENCIOSO ADMINISTRATIVO FEDERAL
B73: CAMARA NAC. DE APELACIONES EN LO CONTENCIOSO ADMINIS.FEDERAL (V) (5) | C73: =13*504386.14-150000 -> 6407019.8200000003
B74: JUZGADOS NAC. DE 1RA INST. EN LO CONTENCIOSO ADMINISTRATIVO FEDERAL (12) | C74: =13*507048.61-150000 -> 6441631.9299999997
B75: OTROS | C75: =13*30483.07-93980.1 -> 302299.81
B76: Total | C76: =SUM(C73:C75) -> 13150951.560000001 | E76: 39221 | G76: 372000
B77: DE LA SEGURIDAD SOCIAL
B78: CAMARA FEDERAL DE APELACIONES DE LA SEGURIDAD SOCIAL (VI) (3) | C78: =13*445454.86-300000 -> 5490913.1799999997
B79: JUZGADOS FEDERALES DE APELACIONES DE LA SEGURIDAD SOCIAL (10) | C79: =13*354224.79-300000 -> 4304922.27
B80: OTROS | C80: =13*55725.54-66993.63 -> 657438.39
B81: Total | C81: =SUM(C78:C80) -> 10453273.84 | E81: 45287.5
B82: ELECTORAL
B83: CAMARA NACIONAL ELECTORAL (1) | C83: =13*522421.82 -> 6791483.6600000001
B84: SECRETARIAS ELECTORALES (24) | C84: =13*2836910.56+246210-734493.85 -> 36391553.43
B85: Total | C85: =SUM(C83:C84) -> 43183037.090000004 | E85: 82549.46
B86: JUSTICIA PENAL ORAL FEDERAL CAPITAL FEDERAL
B87: TRIBUNALES ORALES (CRIMINAL Y CORRECCIONAL FEDERAL (6) | C87: 4119323.36 | E87: 33000
B88: TOTAL GENERAL | C88: =+C22+C24+C26+C34+C40+C44+C49+C55+C61+C66+C71+C76+C81+C85+C87 -> 416308044.57000005 | D88: =+D22+D24+D26+D34+D40+D44+D49+D55+D61+D66+D71+D76+D81+D85+D87 -> 33847546.460000001 | E88: =+E22+E24+E26+E34+E40+E44+E49+E55+E61+E66+E71+E76+E81+E85+E87 -> 5506927.9500000002 | F88: =+F22+F24+F26+F34+F40+F44+F49+F55+F61+F66+F71+F76+F81+F85+F87 -> 24458854.540000003 | G88: =+G22+G24+G26+G34+G40+G44+G49+G55+G61+G66+G71+G76+G81+G85+G87 -> 2102625 | H88: =+H22+H24+H26+H34+H40+H44+H49+H55+H61+H66+H71+H76+H81+H85+H87 -> 5184118.76 | I88: =+I22+I24+I26+I34+I40+I44+I49+I55+I61+I66+I71+I76+I81+I85+I87 -> 12485474.73
B90: Referencias: (*): En el rubro HABERES incluye lo devengado en los haberes del personal efectivo + horas extras + asignaciones familiares.
B91: (**): El monto correspondiente a los contratos que figura en el Consejo de la Magistratura - $ 29.749.243,03- responde al personal contratado en la totalidad de los fueros siendo imposible disponerlo en forma desagregada.
B92: Nota: Los datos consignados se refieren a la ejecución presupuestaria del año 2001.
B93: Fuente: Departamento de Contaduría CSJN, División Programación Presupuestaria y Oficina de Estadísticas del Poder Judicial de la Nación.-
B99: PODER JUDICIAL DE LA NACION
B100: JURISDICCION CAPITAL FEDERAL
B101: CUADRO V
B102: DISTRIBUCION ANUAL DEL GASTO EN CONCEPTO DE LIQUIDACION DE HABERES -AÑO 2001-
C104: HABERES ($) | D104: %
B105: CORTE SUPREMA DE JUSTICIA | C105: =+C22 -> 75520206.100000009 | D105: =+(C105/C$120) -> 0.18140462833958443
B106: CONSEJO DE LA MAGISTRATURA | C106: =+C24 -> 20508395.809999999 | D106: =+(C106/C$120) -> 4.9262549877418037E-2
B107: CASACION | C107: =+C26 -> 6257578.2300000004 | D107: =+(C107/C$120) -> 1.5031124936495962E-2
B108: CRIMINAL Y CORRECCIONAL CAPITAL FEDERAL | C108: =+C34 -> 43569098.329999998 | D108: =+(C108/C$120) -> 0.10465591260673821
B109: CIVIL | C109: =+C40 -> 72860919.620000005 | D109: =+(C109/C$120) -> 0.17501684286513666
B110: COMERCIAL | C110: =+C44 -> 26247179.170000002 | D110: =+(C110/C$120) -> 6.3047494547241859E-2
B111: TRABAJO | C111: =+C49 -> 44989198.509999998 | D111: =+(C111/C$120) -> 0.10806708901450329
B112: PENAL ORAL ORDINARIO | C112: =+C61 -> 25271344.880000003 | D112: =+(C112/C$120) -> 6.0703474769752512E-2
B113: CRIMINAL Y CORRECCIONAL FEDERAL | C113: =+C66 -> 11812089.91 | D113: =+(C113/C$120) -> 2.8373436603178245E-2
B114: CIVIL Y COMERCIAL FEDERAL | C114: =+C71 -> 10101092.67 | D114: =+(C114/C$120) -> 2.4263505838407005E-2
B115: CONTENCIOSO ADMINISTRATIVO FEDERAL | C115: =+C76 -> 13150951.560000001 | D115: =+(C115/C$120) -> 3.1589472582936685E-2
B116: SEGURIDAD SOCIAL | C116: =+C81 -> 10453273.84 | D116: =+(C116/C$120) -> 2.5109468760799638E-2
B117: ELECTORAL | C117: =+C85 -> 43183037.090000004 | D117: =+(C117/C$120) -> 0.10372856747124183
B118: PENAL ORAL FEDERAL DE CAPITAL FEDERAL | C118: =+C87 -> 4119323.36 | D118: =+(C118/C$120) -> 9.894892529052143E-3
B119: PENAL ECONOMICO | C119: =+C55 -> 8264355.4900000002 | D119: =+(C119/C$120) -> 1.9851539257513415E-2
B120: TOTAL | C120: =SUM(C105:C119) -> 416308044.57000005 | D120: =SUM(D105:D119) -> 1
B121: Los datos consignados se refieren a la ejecución presupuestaria del año 2001,
B122: Fuente: Departamento de Contaduría CSJN, División Programación Presupuestaria y Oficina de Estadísticas del Poder Judicial de la Nación.-
B129: PODER JUDICIAL DE LA NACION
B130: JURISDICCION CAPITAL FEDERAL
B131: CUADRO VI
B133: RESUMEN DEL GASTO POR TODO CONCEPTO - AÑO 2001-
B134: PODER JUDICIAL DE LA NACION | C134: ($) | D134: %
B135: HABERES | C135: =+C88 -> 416308044.57000005 | D135: =+(C135/C$142) -> 0.83279332086671776
B136: CONTRATOS | C136: =+D88 -> 33847546.460000001 | D136: =+(C136/C$142) -> 6.7709502584147749E-2
B137: BIENES DE CONSUMO | C137: =+E88 -> 5506927.9500000002 | D137: =+(C137/C$142) -> 1.1016200323467715E-2
B138: SERVICIOS NO PERSONALES | C138: =+F88 -> 24458854.540000003 | D138: =+(C138/C$142) -> 4.8928121766183233E-2
B139: LOCACION DE INMUEBLES | C139: =+G88 -> 2102625 | D139: =+(C139/C$142) -> 4.2061451348989051E-3
B140: BIENES DE USO | C140: =+H88 -> 5184118.76 | D140: =+(C140/C$142) -> 1.0370444516312773E-2
B141: TRANSFERENCIAS | C141: =+I88 -> 12485474.73 | D141: =+(C141/C$142) -> 2.4976264808271909E-2
B142: Total | C142: =SUM(C135:C141) -> 499893592.01000005 | D142: =SUM(D135:D141) -> 1
B143: Los datos consignados se refieren a la ejecución presupuestaria del año 2001,
B144: Fuente: Departamento de Contaduría CSJN, División Programación Presupuestaria y Oficina de Estadísticas del Poder Judicial de la Nación.-