B6: PODER JUDICIAL DE LA NACION
B9: JURISDICCION CAPITAL FEDERAL
B10: CUADRO III
B11: DISTRIBUCION DE LOS CARGOS POR FUERO -AÑO 2001-
C12: MAGISTRADOS | D12: FUNCIONARIOS | E12: EMPLEADOS | F12: TOTAL | G12: Distribución Porcentual
B13: CORTE SUPREMA DE JUSTICIA | C13: 9 | D13: 752 | E13: 1743 | F13: =SUM(C13:E13) -> 2504 | G13: =+F13/$F$44 -> 0.18057258238984639
B14: CONSEJO DELA MAGISTRATURA | C14: 3 | D14: 200 | E14: 686 | F14: =SUM(C14:E14) -> 889 | G14: =+F14/$F$44 -> 6.4109035840484607E-2
B15: CAMARA DE CASACION PENAL | C15: 13 | D15: 50 | E15: 118 | F15: =SUM(C15:E15) -> 181 | G15: =+F15/$F$44 -> 1.3052570851662219E-2
B16: JUZGADOS NACIONALES DE EJECUCION PENAL | C16: 3 | D16: 9 | E16: 13 | F16: =SUM(C16:E16) -> 25 | G16: =+F16/$F$44 -> 1.8028412778538978E-3
B17: CAMARA NAC. DE APEL. EN LO CRIMINAL Y CORRECCIONAL | C17: 16 | D17: 75 | E17: 341 | F17: =SUM(C17:E17) -> 432 | G17: =+F17/$F$44 -> 3.1153097281315354E-2
B18: JUZGADOS NACIONALES EN LO CRIMINAL DE INSTRUCCION | C18: 49 | D18: 151 | E18: 394 | F18: =SUM(C18:E18) -> 594 | G18: =+F18/$F$44 -> 4.2835508761808611E-2
B19: JUZGADOS CORRECCIONALES DE LA CAPITAL FEDERAL | C19: 14 | D19: 56 | E19: 155 | F19: =SUM(C19:E19) -> 225 | G19: =+F19/$F$44 -> 1.6225571500685081E-2
B20: JUZGADOS NACIONALES DE MENORES | C20: 7 | D20: 42 | E20: 117 | F20: =SUM(C20:E20) -> 166 | G20: =+F20/$F$44 -> 1.1970866084949881E-2
B21: JUZGADO NACIONAL EN LO CRIMINAL DE ROGATORIAS | C21: 1 | D21: 2 | E21: 8 | F21: =SUM(C21:E21) -> 11 | G21: =+F21/$F$44 -> 7.9325016225571506E-4
B22: CAMARA NACIONAL EN LO CIVIL | C22: 39 | D22: 90 | E22: 345 | F22: =SUM(C22:E22) -> 474 | G22: =+F22/$F$44 -> 3.4181870628109901E-2
B23: JUZGADOS NACIONALES DE PRIMERA INSTANCIA EN LO CIVIL | C23: 110 | D23: 248 | E23: 1347 | F23: =SUM(C23:E23) -> 1705 | G23: =+F23/$F$44 -> 0.12295377514963583
B24: CAMARA NACIONAL DE APELACIONES EN LO COMERCIAL | C24: 15 | D24: 50 | E24: 163 | F24: =SUM(C24:E24) -> 228 | G24: =+F24/$F$44 -> 1.6441912454027548E-2
B25: JUZGADOS NACIONALES DE PRIMERA INSTANCIA EN LO COMERCIAL | C25: 26 | D25: 116 | E25: 515 | F25: =SUM(C25:E25) -> 657 | G25: =+F25/$F$44 -> 4.7378668782000435E-2
B26: CAMARA NACIONAL DE APELACIONES DEL TRABAJO | C26: 30 | D26: 77 | E26: 378 | F26: =SUM(C26:E26) -> 485 | G26: =+F26/$F$44 -> 3.4975120790365619E-2
B27: JUZGADOS NACIONALES DE PRIMERA INSTANCIA DEL TRABAJO | C27: 80 | D27: 240 | E27: 801 | F27: =SUM(C27:E27) -> 1121 | G27: =+F27/$F$44 -> 8.0839402898968779E-2
B28: CAMARA NAC. DE APELACIONES EN LO PENAL ECONOMICO | C28: 6 | D28: 25 | E28: 88 | F28: =SUM(C28:E28) -> 119 | G28: =+F28/$F$44 -> 8.581524482584554E-3
B29: JUZGADOS NACIONALES EN LO PENAL ECONOMICO | C29: 8 | D29: 37 | E29: 109 | F29: =SUM(C29:E29) -> 154 | G29: =+F29/$F$44 -> 1.110550227158001E-2
B30: TRIBUNALES ORALES CRIMINALES | C30: 90 | D30: 61 | E30: 249 | F30: =SUM(C30:E30) -> 400 | G30: =+F30/$F$44 -> 2.8845460445662365E-2
B31: TRIBUNALES ORALES DE MENORES | C31: 9 | D31: 13 | E31: 30 | F31: =SUM(C31:E31) -> 52 | G31: =+F31/$F$44 -> 3.7499098579361072E-3
B32: TRIBUNALES ORALES EN LO PENAL ECONOMICO | C32: 9 | D32: 1 | E32: 26 | F32: =SUM(C32:E32) -> 36 | G32: =+F32/$F$44 -> 2.5960914401096128E-3
B33: CAMARA NAC. DE APEL. EN LO CRIM. Y CORREC. FEDERAL | C33: 6 | D33: 46 | E33: 70 | F33: =SUM(C33:E33) -> 122 | G33: =+F33/$F$44 -> 8.7978654359270204E-3
B34: JUZGADOS NAC. EN LO CRIMINAL Y CORRECCIONAL FEDERAL | C34: 12 | D34: 115 | E34: 248 | F34: =SUM(C34:E34) -> 375 | G34: =+F34/$F$44 -> 2.7042619167808465E-2
B35: CAMARA NAC. DE APELACIONES EN LO CIVIL Y COMERCIAL | C35: 9 | D35: 29 | E35: 66 | F35: =SUM(C35:E35) -> 104 | G35: =+F35/$F$44 -> 7.4998197158722144E-3
B36: JUZGADOS NACIONALES EN LO CIVIL Y COMERCIAL FEDERAL | C36: 11 | D36: 45 | E36: 144 | F36: =SUM(C36:E36) -> 200 | G36: =+F36/$F$44 -> 1.4422730222831182E-2
B37: CAMARA NAC. DE APEL. EN LO CONT. ADMINIST. FEDERAL | C37: 15 | D37: 37 | E37: 122 | F37: =SUM(C37:E37) -> 174 | G37: =+F37/$F$44 -> 1.2547775293863129E-2
B38: JUZGADOS NAC. EN LO CONT. ADMINISTRATIVO FEDERAL | C38: 12 | D38: 49 | E38: 158 | F38: =SUM(C38:E38) -> 219 | G38: =+F38/$F$44 -> 1.5792889594000145E-2
B39: CAMARA FEDERAL DE APELACIONES DE LA SEGURIDAD SOCIAL | C39: 9 | D39: 34 | E39: 174 | F39: =SUM(C39:E39) -> 217 | G39: =+F39/$F$44 -> 1.5648662291771833E-2
B40: JUZGADOS FEDERALES DE LA SEGURIDAD SOCIAL | C40: 10 | D40: 31 | E40: 92 | F40: =SUM(C40:E40) -> 133 | G40: =+F40/$F$44 -> 9.5911155981827367E-3
B41: CAMARA NACIONAL ELECTORAL | C41: 3 | D41: 34 | E41: 220 | F41: =SUM(C41:E41) -> 257 | G41: =+F41/$F$44 -> 1.8533208336338067E-2
B42: SECRETARIAS ELECTORALES | D42: 153 | E42: 1345 | F42: =SUM(C42:E42) -> 1498 | G42: =+F42/$F$44 -> 0.10802624936900555
B43: TRIBUNALES ORALES EN LO CRIMINAL Y CORRECCIONAL FEDERAL | C43: 18 | D43: 30 | E43: 62 | F43: =SUM(C43:E43) -> 110 | G43: =+F43/$F$44 -> 7.9325016225571497E-3
B44: TOTAL | C44: =SUM(C13:C43) -> 642 | D44: =SUM(D13:D43) -> 2898 | E44: =SUM(E13:E43) -> 10327 | F44: =SUM(F13:F43) -> 13867 | G44: =SUM(G13:G43) -> 1
B46: FUENTE: OFICINA DE ESTADISTICAS DEL PODER JUDICIAL DE LA NACION.