B6: PODER JUDICIAL DE LA NACION
B7: JURISDICCION CAPITAL FEDERAL
B8: COMPETENCIA CIVIL
B9: CUADRO XII
B10: DISTRIBUCION PORCENTUAL SEGÚN EL OBJETO DE LITIGIO DE LOS EXPEDIENTES INGRESADOS, RESUELTOS Y SENTENCIAS DICTADAS -AÑO 2001-
B13: VI - CONTENCIOSO ADMINISTRATIVO FEDERAL
C16: CAUSAS | D16: %
B17: OBJETO | C17: INGRESADAS
B18: Administración Nacional de Aduanas | C18: 129 | D18: =+(C18/C$43) -> 4.24929178470255E-3
B19: Allanamiento de domicilio | C19: 6 | D19: =+(C19/C$43) -> 1.9764147835825812E-4
B20: Amparo Proceso sumarísimo (art.321 inc.2 C.P.C. y C.) | C20: 27 | D20: =+(C20/C$43) -> 8.8938665261216151E-4
B21: Amparo Ley 16.986 | C21: 2695 | D21: =+(C21/C$43) -> 8.8773964029250932E-2
B22: Amparo por mora | C22: 224 | D22: =+(C22/C$43) -> 7.3786151920416368E-3
B23: Beneficio de litigar sin gastos | C23: 335 | D23: =+(C23/C$43) -> 1.1034982541669411E-2
B24: Contrato Administrativo | C24: 58 | D24: =+(C24/C$43) -> 1.9105342907964951E-3
B25: Contrato de Obra Pública | C25: 18 | D25: =+(C25/C$43) -> 5.9292443507477437E-4
B26: Daños y Perjuicios | C26: 196 | D26: =+(C26/C$43) -> 6.4562882930364321E-3
B27: Diligencia Preliminar | C27: 28 | D27: =+(C27/C$43) -> 9.2232689900520459E-4
B28: Dirección General Impositiva | C28: 103 | D28: =+(C28/C$43) -> 3.392845378483431E-3
B29: Ejecución Fiscal | C29: 1153 | D29: =+(C29/C$43) -> 3.79801040911786E-2
B30: Ejecución Fiscal - D.G.I. | C30: 21560 | D30: =+(C30/C$43) -> 0.71019171223400746
B31: Empleo Público | C31: 451 | D31: =+(C31/C$43) -> 1.4856051123262402E-2
B32: Exhorto | C32: 76 | D32: =+(C32/C$43) -> 2.5034587258712694E-3
B33: Expropiaciones - Servidumbre Administrativa | C33: 5 | D33: =+(C33/C$43) -> 1.6470123196521511E-4
B34: Habeas Data | C34: 54 | D34: =+(C34/C$43) -> 1.778773305224323E-3
B35: Incidente de Impuesto de Sellos | C35: 0 | D35: =+(C35/C$43) -> 0
B36: Inhibitoria | C36: 3 | D36: =+(C36/C$43) -> 9.8820739179129058E-5
B37: Lanzamiento Ley 17.091 | C37: 73 | D37: =+(C37/C$43) -> 2.4046379866921406E-3
B38: Medida cautelar (autónoma) | C38: 462 | D38: =+(C38/C$43) -> 1.5218393833585876E-2
B39: Personal Militar y civil de las FFAA y de Seguridad | C39: 1226 | D39: =+(C39/C$43) -> 4.0384742077870746E-2
B40: Proceso de conocimiento | C40: 577 | D40: =+(C40/C$43) -> 1.9006522168785824E-2
B41: Proceso de Ejecución | C41: 887 | D41: =+(C41/C$43) -> 2.9217998550629159E-2
B42: Varios | C42: 12 | D42: =+(C42/C$43) -> 3.9528295671651623E-4
B43: TOTAL | C43: =SUM(C18:C42) -> 30358 | D43: =SUM(D18:D42) -> 1
B44: FUENTE: Oficina de Estadísticas del Poder Judicial de la Nación.
C48: CAUSAS | D48: % | E48: SENTENCIAS | F48: %
B49: OBJETO | C49: RESUELTAS | E49: DICTADAS (*)
B50: Administración Nacional de Aduanas | C50: 71 | D50: =+(C50/C$75) -> 3.8683665685954015E-3 | E50: 28 | F50: =+(E50/E$75) -> 1.435897435897436E-3
B51: Allanamiento de domicilio | C51: 6 | D51: =+(C51/C$75) -> 3.2690421706440013E-4 | E51: 1 | F51: =+(E51/E$75) -> 5.1282051282051279E-5
B52: Amparo Proceso sumarísimo (art.321 inc.2 C.P.C. y C.) | C52: 28 | D52: =+(C52/C$75) -> 1.5255530129672007E-3 | E52: 3 | F52: =+(E52/E$75) -> 1.5384615384615385E-4
B53: Amparo Ley 16.986 | C53: 518 | D53: =+(C53/C$75) -> 2.8222730739893211E-2 | E53: 242 | F53: =+(E53/E$75) -> 1.241025641025641E-2
B54: Amparo por mora | C54: 114 | D54: =+(C54/C$75) -> 6.2111801242236021E-3 | E54: 138 | F54: =+(E54/E$75) -> 7.076923076923077E-3
B55: Beneficio de litigar sin gastos | C55: 250 | D55: =+(C55/C$75) -> 1.3621009044350006E-2 | E55: 34 | F55: =+(E55/E$75) -> 1.7435897435897436E-3
B56: Contrato Administrativo | C56: 125 | D56: =+(C56/C$75) -> 6.8105045221750031E-3 | E56: 57 | F56: =+(E56/E$75) -> 2.9230769230769232E-3
B57: Contrato de Obra Pública | C57: 76 | D57: =+(C57/C$75) -> 4.140786749482402E-3 | E57: 24 | F57: =+(E57/E$75) -> 1.2307692307692308E-3
B58: Daños y Perjuicios | D58: =+(C58/C$75) -> 0 | F58: =+(E58/E$75) -> 0
B59: Diligencia Preliminar | C59: 36 | D59: =+(C59/C$75) -> 1.9614253023864008E-3 | E59: 6 | F59: =+(E59/E$75) -> 3.076923076923077E-4
B60: Dirección General Impositiva | C60: 115 | D60: =+(C60/C$75) -> 6.2656641604010022E-3 | E60: 45 | F60: =+(E60/E$75) -> 2.3076923076923079E-3
B61: Ejecución Fiscal | C61: 562 | D61: =+(C61/C$75) -> 3.0620028331698811E-2 | E61: 425 | F61: =+(E61/E$75) -> 2.1794871794871794E-2
B62: Ejecución Fiscal - D.G.I. | C62: 12136 | D62: =+(C62/C$75) -> 0.66121826304892661 | E62: 14651 | F62: =+(E62/E$75) -> 0.7513333333333333
B63: Empleo Público | C63: 684 | D63: =+(C63/C$75) -> 3.7267080745341616E-2 | E63: 214 | F63: =+(E63/E$75) -> 1.0974358974358974E-2
B64: Exhorto | C64: 8 | D64: =+(C64/C$75) -> 4.3587228941920016E-4 | E64: 3 | F64: =+(E64/E$75) -> 1.5384615384615385E-4
B65: Expropiaciones - Servidumbre Administrativa | C65: 34 | D65: =+(C65/C$75) -> 1.8524572300316008E-3 | E65: 20 | F65: =+(E65/E$75) -> 1.0256410256410256E-3
B66: Habeas Data | D66: =+(C66/C$75) -> 0 | F66: =+(E66/E$75) -> 0
B67: Incidente de Impuesto de Sellos | C67: 1 | D67: =+(C67/C$75) -> 5.448403617740002E-5 | E67: 1 | F67: =+(E67/E$75) -> 5.1282051282051279E-5
B68: Inhibitoria | D68: =+(C68/C$75) -> 0 | F68: =+(E68/E$75) -> 0
B69: Lanzamiento Ley 17.091 | C69: 77 | D69: =+(C69/C$75) -> 4.195270785659802E-3 | E69: 24 | F69: =+(E69/E$75) -> 1.2307692307692308E-3
B70: Medida cautelar (autónoma) | C70: 200 | D70: =+(C70/C$75) -> 1.0896807235480005E-2 | E70: 170 | F70: =+(E70/E$75) -> 8.7179487179487175E-3
B71: Personal Militar y civil de las FFAA y de Seguridad | C71: 1707 | D71: =+(C71/C$75) -> 9.3004249754821841E-2 | E71: 2380 | F71: =+(E71/E$75) -> 0.12205128205128205
B72: Proceso de conocimiento | C72: 970 | D72: =+(C72/C$75) -> 5.2849515092078019E-2 | E72: 200 | F72: =+(E72/E$75) -> 1.0256410256410256E-2
B73: Proceso de Ejecución | C73: 515 | D73: =+(C73/C$75) -> 2.8059278631361012E-2 | E73: 240 | F73: =+(E73/E$75) -> 1.2307692307692308E-2
B74: Varios | C74: 121 | D74: =+(C74/C$75) -> 6.5925683774654027E-3 | E74: 594 | F74: =+(E74/E$75) -> 3.046153846153846E-2
B75: TOTAL | C75: =SUM(C50:C74) -> 18354 | D75: =+(C75/C$75) -> 1 | E75: =SUM(E50:E74) -> 19500 | F75: =+(E75/E$75) -> 1
B76: REFERENCIAS: (*) Con Sentencias Definitivas y Para mejor proveer.
B77: FUENTE: Oficina de Estadísticas del Poder Judicial de la Nación.-