B6: PODER JUDICIAL DE LA NACION
B7: JURISDICCION CAPITAL FEDERAL
B9: CUADRO II
B11: DISTRIBUCION DE LOS CARGOS PERMANENTES Y CONTRATADOS -AÑO 2001-
B16: PLANTA DE AGENTES PERTENECIENTES A LA CORTE SUPREMA DE JUSTICIA DE LA NACION - AÑO 2001 -
B19: - CORTE SUPREMA DE JUSTICIA DE LA NACION - (*) | C19: Juez de la C.S.J.N. | E19: Secretario de la C.S.J.N. | G19: Secr. Letrado de la C.S.J.N. / Prosecr. de la C.S.J.N. / Director Gral. / Cdor. Auditor | I19: Subdirector Gral. / Subdirector Adjunto / Director Méd. / Peritos | K19: Secr. de Cámara / Prosecr. Letrado | M19: Secr. de Juzgado / Subsecr. Administrativo | O19: Prosecretario Jefe / Jefe de Dpto. | Q19: 2° Jefe de Dpto. | S19: Prosecretario Administrativo | U19: Oficial Mayor | W19: Oficial | Y19: Escribiente | AA19: Escribiente Auxiliar | AC19: Auxiliar / Auxiliar Adminsitrativo | AE19: Personal de Maestranza | AG19: Subtotal | AI19: Total
C20: P | D20: C | E20: P | F20: C | G20: P | H20: C | I20: P | J20: C | K20: P | L20: C | M20: P | N20: C | O20: P | P20: C | Q20: P | R20: C | S20: P | T20: C | U20: P | V20: C | W20: P | X20: C | Y20: P | Z20: C | AA20: P | AB20: C | AC20: P | AD20: C | AE20: P | AF20: C | AG20: P | AH20: C | AI20: Cargos
B22: JUSTICIA DE MAXIMA INSTANCIA | C22: 9 | E22: 9 | G22: 76 | H22: 2 | I22: 3 | K22: 27 | L22: 3 | O22: 23 | P22: 4 | S22: =57+4 -> 61 | T22: 5 | U22: 29 | V22: 2 | W22: 8 | X22: 1 | Y22: 16 | Z22: 3 | AA22: 35 | AC22: 45 | AD22: 3 | AF22: 14 | AG22: =C22+E22+G22+I22+K22+M22+O22+Q22+S22+U22+W22+Y22+AA22+AC22+AE22 -> 341 | AH22: =D22+F22+H22+J22+L22+N22+P22+R22+T22+V22+X22+Z22+AB22+AD22+AF22 -> 37 | AI22: =AG22+AH22 -> 378
B23: ASISTENCIA SOCIAL | G23: 1 | I23: 2 | O23: 7 | S23: 16 | U23: 15 | V23: 1 | W23: 8 | X23: 2 | Y23: 16 | Z23: 1 | AA23: 16 | AC23: 29 | AD23: 2 | AE23: 8 | AF23: 5 | AG23: =C23+E23+G23+I23+K23+M23+O23+Q23+S23+U23+W23+Y23+AA23+AC23+AE23 -> 118 | AH23: =D23+F23+H23+J23+L23+N23+P23+R23+T23+V23+X23+Z23+AB23+AD23+AF23 -> 11 | AI23: =AG23+AH23 -> 129
B24: MANDAMIENTOS Y NOTIFICACIONES | G24: 1 | I24: 4 | S24: 173 | U24: 32 | W24: 69 | Y24: =239+9 -> 248 | AA24: 24 | AC24: =38+4 -> 42 | AD24: 2 | AE24: 18 | AF24: 2 | AG24: =C24+E24+G24+I24+K24+M24+O24+Q24+S24+U24+W24+Y24+AA24+AC24+AE24 -> 611 | AH24: =D24+F24+H24+J24+L24+N24+P24+R24+T24+V24+X24+Z24+AB24+AD24+AF24 -> 4 | AI24: =AG24+AH24 -> 615
B25: DIRECCION PERICIAL | G25: 2 | I25: =104+22 -> 126 | J25: 4 | M25: 17 | N25: 3 | O25: 15 | P25: 1 | Q25: 1 | S25: 40 | T25: 10 | U25: 55 | V25: 16 | W25: 17 | Y25: 54 | Z25: 2 | AA25: 29 | AC25: =49+6 -> 55 | AD25: 3 | AE25: 68 | AG25: =C25+E25+G25+I25+K25+M25+O25+Q25+S25+U25+W25+Y25+AA25+AC25+AE25 -> 479 | AH25: =D25+F25+H25+J25+L25+N25+P25+R25+T25+V25+X25+Z25+AB25+AD25+AF25 -> 39 | AI25: =AG25+AH25 -> 518
B26: SECR.DE DERECHO COMPARADO Y BIBLIOTECA | E26: 2 | G26: 5 | K26: 5 | O26: 5 | Q26: 1 | S26: 11 | U26: 7 | W26: 3 | Y26: 6 | AA26: 3 | AC26: 18 | AD26: 2 | AF26: 1 | AG26: =C26+E26+G26+I26+K26+M26+O26+Q26+S26+U26+W26+Y26+AA26+AC26+AE26 -> 66 | AH26: =D26+F26+H26+J26+L26+N26+P26+R26+T26+V26+X26+Z26+AB26+AD26+AF26 -> 3 | AI26: =AG26+AH26 -> 69
B27: ARCHIVO | G27: 1 | I27: 1 | O27: 5 | S27: 16 | U27: 10 | W27: 9 | Y27: 36 | AA27: 23 | AC27: 16 | AE27: 29 | AF27: 24 | AG27: =C27+E27+G27+I27+K27+M27+O27+Q27+S27+U27+W27+Y27+AA27+AC27+AE27 -> 146 | AH27: =D27+F27+H27+J27+L27+N27+P27+R27+T27+V27+X27+Z27+AB27+AD27+AF27 -> 24 | AI27: =AG27+AH27 -> 170
B28: ADMINISTRACION GENERAL | E28: 1 | G28: 4 | I28: 5 | J28: 1 | K28: 5 | M28: 5 | O28: 10 | Q28: 1 | S28: 29 | T28: 3 | U28: 33 | V28: 2 | W28: 12 | Y28: 19 | Z28: 1 | AA28: 9 | AB28: 1 | AC28: =9+13 -> 22 | AD28: 1 | AE28: =362+54 -> 416 | AF28: 45 | AG28: =C28+E28+G28+I28+K28+M28+O28+Q28+S28+U28+W28+Y28+AA28+AC28+AE28 -> 571 | AH28: =D28+F28+H28+J28+L28+N28+P28+R28+T28+V28+X28+Z28+AB28+AD28+AF28 -> 54 | AI28: =AG28+AH28 -> 625
B30: SUBTOTAL | C30: =SUM(C22:C28) -> 9 | D30: =SUM(D22:D28) -> 0 | E30: =SUM(E22:E28) -> 12 | F30: =SUM(F22:F28) -> 0 | G30: =SUM(G22:G28) -> 90 | H30: =SUM(H22:H28) -> 2 | I30: =SUM(I22:I28) -> 141 | J30: =SUM(J22:J28) -> 5 | K30: =SUM(K22:K28) -> 37 | L30: =SUM(L22:L28) -> 3 | M30: =SUM(M22:M28) -> 22 | N30: =SUM(N22:N28) -> 3 | O30: =SUM(O22:O28) -> 65 | P30: =SUM(P22:P28) -> 5 | Q30: =SUM(Q22:Q28) -> 3 | R30: =SUM(R22:R28) -> 0 | S30: =SUM(S22:S28) -> 346 | T30: =SUM(T22:T28) -> 18 | U30: =SUM(U22:U28) -> 181 | V30: =SUM(V22:V28) -> 21 | W30: =SUM(W22:W28) -> 126 | X30: =SUM(X22:X28) -> 3 | Y30: =SUM(Y22:Y28) -> 395 | Z30: =SUM(Z22:Z28) -> 7 | AA30: =SUM(AA22:AA28) -> 139 | AB30: =SUM(AB22:AB28) -> 1 | AC30: =SUM(AC22:AC28) -> 227 | AD30: =SUM(AD22:AD28) -> 13 | AE30: =SUM(AE22:AE28) -> 539 | AF30: =SUM(AF22:AF28) -> 91 | AG30: =C30+E30+G30+I30+K30+M30+O30+Q30+S30+U30+W30+Y30+AA30+AC30+AE30 -> 2332 | AH30: =SUM(AH22:AH28) -> 172 | AI30: =SUM(AI22:AI28) -> 2504
B31: TOTAL | C31: =C30+D30 -> 9 | E31: =E30+F30 -> 12 | G31: =G30+H30 -> 92 | I31: =I30+J30 -> 146 | K31: =K30+L30 -> 40 | M31: =M30+N30 -> 25 | O31: =O30+P30 -> 70 | Q31: =Q30+R30 -> 3 | S31: =S30+T30 -> 364 | U31: =U30+V30 -> 202 | W31: =W30+X30 -> 129 | Y31: =Y30+Z30 -> 402 | AA31: =AA30+AB30 -> 140 | AC31: =AC30+AD30 -> 240 | AE31: =AE30+AF30 -> 630 | AG31: =AG30+AH30 -> 2504
B34: PLANTA DE AGENTES PERTENECIENTES AL CONSEJO DE LA MAGISTRATURA - AÑO 2001-
B37: - CONSEJO DE LA MAGISTRATURA - (**) | C37: Juez de la C.S.J.N. | E37: Juez de Cámara/Juez Cámara Casación | G37: Secretario de la C.S.J.N. | I37: Secr. Letrado de la C.S.J.N. / Director Gral. / Cdor. Auditor | K37: Subdirector Gral. / Subdirector Adjunto / Director Méd. / Peritos | M37: Secr. de Cámara / Prosecr. Letrado | O37: Secr. de Juzgado / Prosecretario de Cámara/ Subsecr. Administrativo | Q37: Prosecretario Jefe / Prosecretario Jefe de 2da./ Jefe de Dpto. | S37: 2° Jefe de Dpto./ Oficial Superior | U37: Prosecretario Administrativo | W37: Oficial Mayor | Y37: Oficial | AA37: Escribiente | AC37: Escribiente Auxiliar | AE37: Auxiliar / Auxiliar Adminsitrativo | AG37: Personal de Maestranza | AI37: Subtotal | AK37: Total
C38: P | D38: C | E38: P | F38: C | G38: P | H38: C | I38: P | J38: C | K38: P | L38: C | M38: P | N38: C | O38: P | P38: C | Q38: P | R38: C | S38: P | T38: C | U38: P | V38: C | W38: P | X38: C | Y38: P | Z38: C | AA38: P | AB38: C | AC38: P | AD38: C | AE38: P | AF38: C | AG38: P | AH38: C | AI38: P | AJ38: C | AK38: Cargos
B40: Gestión Financiera | G40: 1 | I40: 4 | J40: 4 | K40: 3 | M40: 2 | N40: 1 | O40: 3 | Q40: =14+5 -> 19 | U40: =2+4+29+1 -> 36 | V40: 1 | W40: 31 | X40: =2+2 -> 4 | Y40: 18 | AA40: =2+46+1 -> 49 | AC40: =2+23 -> 25 | AE40: =56+2+1 -> 59 | AF40: =1+1 -> 2 | AG40: =1+5+22+17 -> 45 | AH40: =5+1+1 -> 7 | AI40: =E40+G40+I40+K40+M40+O40+Q40+S40+U40+W40+Y40+AA40+AC40+AE40+AG40 -> 295 | AJ40: =F40+H40+J40+L40+N40+P40+R40+T40+V40+X40+Z40+AB40+AD40+AF40+AH40 -> 19 | AK40: =AI40+AJ40 -> 314
B41: Servicio de Apoyo Tecnológico y Estadístico | I41: 2 | K41: 1 | M41: 1 | O41: 3 | Q41: 4 | U41: 14 | W41: 30 | X41: 2 | Y41: 14 | AA41: 21 | AB41: 1 | AC41: 17 | AE41: 15 | AF41: 8 | AG41: =2+3+6+4 -> 15 | AH41: =2+2+1+1 -> 6 | AI41: =E41+G41+I41+K41+M41+O41+Q41+S41+U41+W41+Y41+AA41+AC41+AE41+AG41 -> 137 | AJ41: =F41+H41+J41+L41+N41+P41+R41+T41+V41+X41+Z41+AB41+AD41+AF41+AH41 -> 17 | AK41: =AI41+AJ41 -> 154
B42: Servicio de Infraestructura Judicial | G42: 1 | K42: 3 | Q42: 8 | S42: 1 | U42: 10 | V42: 3 | W42: 6 | X42: 9 | Y42: 4 | AA42: 4 | AE42: 4 | AF42: 3 | AG42: =15+32+32+39+21 -> 139 | AH42: =2+6+12+9 -> 29 | AI42: =E42+G42+I42+K42+M42+O42+Q42+S42+U42+W42+Y42+AA42+AC42+AE42+AG42 -> 180 | AJ42: =F42+H42+J42+L42+N42+P42+R42+T42+V42+X42+Z42+AB42+AD42+AF42+AH42 -> 44 | AK42: =AI42+AJ42 -> 224
B43: Gestión del Consejo de la Magistratura | E43: 3 | J43: 9 | N43: 13 | P43: 3 | R43: 5 | V43: 15 | W43: 1 | X43: =11+3+4+4+1 -> 23 | Z43: 1 | AB43: 10 | AD43: 8 | AF43: 11 | AH43: 6 | AI43: =E43+G43+I43+K43+M43+O43+Q43+S43+U43+W43+Y43+AA43+AC43+AE43+AG43 -> 4 | AJ43: =F43+H43+J43+L43+N43+P43+R43+T43+V43+X43+Z43+AB43+AD43+AF43+AH43 -> 104 | AK43: =AI43+AJ43 -> 108
B44: Jurado de Enjuiciamiento de Magistrados | G44: 1 | I44: 2 | J44: 1 | M44: 2 | Q44: 1 | U44: 1 | V44: 1 | W44: 1 | AA44: 1 | AD44: 2 | AE44: 3 | AF44: 4 | AG44: 8 | AI44: =E44+G44+I44+K44+M44+O44+Q44+S44+U44+W44+Y44+AA44+AC44+AE44+AG44 -> 20 | AJ44: =F44+H44+J44+L44+N44+P44+R44+T44+V44+X44+Z44+AB44+AD44+AF44+AH44 -> 8 | AK44: =AI44+AJ44 -> 28
B45: Administración de Recursos Humanos | K45: 1 | M45: 1 | P45: 1 | Q45: 2 | U45: 12 | V45: 4 | W45: 10 | Y45: 4 | AA45: 11 | AC45: 4 | AD45: 1 | AE45: 3 | AF45: 1 | AG45: 6 | AI45: =E45+G45+I45+K45+M45+O45+Q45+S45+U45+W45+Y45+AA45+AC45+AE45+AG45 -> 54 | AJ45: =F45+H45+J45+L45+N45+P45+R45+T45+V45+X45+Z45+AB45+AD45+AF45+AH45 -> 7 | AK45: =AI45+AJ45 -> 61
AK46: =AI46+AJ46 -> 0
AK47: =AI47+AJ47 -> 0
B48: SUBTOTAL | C48: =SUM(C40:C45) -> 0 | D48: =SUM(D40:D45) -> 0 | E48: =SUM(E40:E45) -> 3 | F48: =SUM(F40:F45) -> 0 | G48: =SUM(G40:G45) -> 3 | H48: =SUM(H40:H45) -> 0 | I48: =SUM(I40:I45) -> 8 | J48: =SUM(J40:J45) -> 14 | K48: =SUM(K40:K45) -> 8 | L48: =SUM(L40:L45) -> 0 | M48: =SUM(M40:M45) -> 6 | N48: =SUM(N40:N45) -> 14 | O48: =SUM(O40:O45) -> 6 | P48: =SUM(P40:P45) -> 4 | Q48: =SUM(Q40:Q45) -> 34 | R48: =SUM(R40:R45) -> 5 | S48: =SUM(S40:S45) -> 1 | T48: =SUM(T40:T45) -> 0 | U48: =SUM(U40:U45) -> 73 | V48: =SUM(V40:V45) -> 24 | W48: =SUM(W40:W45) -> 79 | X48: =SUM(X40:X45) -> 38 | Y48: =SUM(Y40:Y45) -> 40 | Z48: =SUM(Z40:Z45) -> 1 | AA48: =SUM(AA40:AA45) -> 86 | AB48: =SUM(AB40:AB45) -> 11 | AC48: =SUM(AC40:AC45) -> 46 | AD48: =SUM(AD40:AD45) -> 11 | AE48: =SUM(AE40:AE45) -> 84 | AF48: =SUM(AF40:AF45) -> 29 | AG48: =SUM(AG40:AG45) -> 213 | AH48: =SUM(AH40:AH45) -> 48 | AI48: =SUM(AI40:AI46) -> 690 | AJ48: =SUM(AJ40:AJ46) -> 199 | AK48: =SUM(AK40:AK46) -> 889
B49: TOTAL | C49: =SUM(C48+D48) -> 0 | E49: =SUM(E48+F48) -> 3 | G49: =SUM(G48+H48) -> 3 | I49: =SUM(I48+J48) -> 22 | K49: =SUM(K48+L48) -> 8 | M49: =SUM(M48+N48) -> 20 | O49: =SUM(O48+P48) -> 10 | Q49: =SUM(Q48+R48) -> 39 | S49: =SUM(S48+T48) -> 1 | U49: =SUM(U48+V48) -> 97 | W49: =SUM(W48+X48) -> 117 | Y49: =SUM(Y48+Z48) -> 41 | AA49: =SUM(AA48+AB48) -> 97 | AC49: =SUM(AC48+AD48) -> 57 | AE49: =SUM(AE48+AF48) -> 113 | AG49: =SUM(AG48+AH48) -> 261 | AI49: =AI48+AJ48 -> 889
B51: FUENTE: (*): Departamento de Contabilidad y Presupuesto. Corte Suprema de Justicia de la Nación.
B52: (**): División Programación Presupuestaria. Consejo de la Magistratura.