B6: PODER JUDICIAL DE LA NACION
B7: JURISDICCION CAPITAL FEDERAL
B8: COMPETENCIA CIVIL
B9: CUADRO XII
B10: DISTRIBUCION PORCENTUAL SEGÚN EL OBJETO DE LITIGIO DE LOS EXPEDIENTES INGRESADOS, RESUELTOS Y SENTENCIAS DICTADAS -AÑO 2001-
B13: III - TRABAJO
C15: EXPEDIENTES | D15: %
B16: OBJETO | C16: SORTEADOS
B17: RUBRO A | C17: 19831 | D17: =+(C17/C$22) -> 0.75708177445216462
B18: RUBRO B | C18: 1747 | D18: =+(C18/C$22) -> 6.6694662899900739E-2
B19: RUBRO C | C19: 3705 | D19: =+(C19/C$22) -> 0.14144460563487821
B20: RUBRO D | C20: 388 | D20: =+(C20/C$22) -> 1.4812552492937314E-2
B21: RUBRO E | C21: 523 | D21: =+(C21/C$22) -> 1.9966404520119111E-2
B22: TOTAL | C22: =SUM(C17:C21) -> 26194 | D22: =SUM(D17:D21) -> 1
B24: REFERENCIAS:
B25: RUBRO A: Despidos, indemnización por fallecimiento, indemnización art. 212 LCT, preaviso,
B26: otras indemnizaciones establecidas en estatutos especiales, cobro y diferencias de salarios,
B27: salarios por suspensión, competencia desleal, otros reclamos no codificados, práctica desleal,
B28: homologación.
B29: RUBRO B: Accidentes acción civil, cobro de aportes y contribuciones, consignación, ley 22250.
B30: RUBRO C: Accidentes ley 9688, ejecución de créditos laborales, ejecución fiscal, ejecución
B31: previsional, sumarios Ministerio de Trabajo, apelación por multa ley 12908, acción declarativa,
B32: desalojo, ejecución de aportes.
B33: RUBRO D: amparos y sumarísimos.
B34: RUBRO E: medidas cautelares, diligencia preliminar.
D36: %
B37: PROCESO | C37: RESUELTOS
B38: ORDINARIO
B39: CONCILIACION | C39: 5396 | D39: =+C39/C$45 -> 0.17834479111581175
B40: DEFINITIVAS | C40: 15459 | D40: =+C40/C$45 -> 0.51093997884717079
B41: INTERLOCUTORIAS | C41: 2601 | D41: =+C41/C$45 -> 8.596641988365944E-2
B42: DEVUELTOS RESUELTOS | C42: 1761 | D42: =+C42/C$45 -> 5.8203331570597566E-2
B43: EJECUCIONES FISCALES, OTROS PROCESOS EJECUTIVOS, ETC.
B44: ARCHIVADOS | C44: 5039 | D44: =+C44/C$45 -> 0.16654547858276045
B45: TOTAL | C45: =+C39+C40+C41+C42+C44 -> 30256 | D45: =+D39+D40+D41+D42+D44 -> 1
B46: FUENTE: Oficina de Estadísticas del Poder Judicial de la Nación.-