B6: PODER JUDICIAL DE LA NACION
B7: JURISDICCION CAPITAL FEDERAL
B8: COMPETENCIA PENAL
B9: CUADRO X
B10: DISTRIBUCION PORCENTUAL, SEGÚN EL TIPO DE DELITO, DE LAS CAUSAS INGRESADAS, ELEVADAS A JUICIO Y PERSONAS CONDENADAS - AÑO 2001-
B12: II - JUZGADOS DE MENORES
C14: CAUSAS | D14: % | E14: CAUSAS | F14: %
B15: DELITOS | C15: INGRESADAS | E15: ELEVADAS
B16: CULPOSOS | C16: 418 | D16: =+(C16/C$21) -> 6.402205544493797E-2 | E16: 4 | F16: =+E16/E$21 -> 4.7337278106508876E-3
B17: DOLOSOS | C17: 4911 | D17: =+(C17/C$21) -> 0.75218257007198652 | E17: 833 | F17: =+E17/E$21 -> 0.98579881656804735
B18: ACCION PRIVADA | D18: =+(C18/C$21) -> 0 | F18: =+E18/E$21 -> 0
B19: LEYES ESPECIALES/ DECRETOS LEYES | C19: 540 | D19: =+(C19/C$21) -> 8.2707918517383974E-2 | E19: 8 | F19: =+E19/E$21 -> 9.4674556213017753E-3
B20: FALTAS Y CONTRAVENCIONES POLICIALES | C20: 660 | D20: =+(C20/C$21) -> 0.10108745596569153 | F20: =+E20/E$21 -> 0
B21: TOTAL | C21: =SUM(C16:C20) -> 6529 | D21: =SUM(D16:D20) -> 1 | E21: =SUM(E16:E19) -> 845 | F21: =SUM(F16:F19) -> 1
B22: FUENTE: Oficina de Estadísticas del Poder Judicial de la Nación.
B23: III - TRIBUNALES ORALES DE MENORES
C25: CAUSAS | D25: % | E25: PERSONAS | F25: %
B26: DELITOS | C26: INGRESADAS | E26: CONDENADAS(*)
B27: DELITOS C/LAS PERSONAS | C27: =17+16 -> 33 | D27: =+(C27/C$37) -> 2.8326180257510731E-2 | E27: =6+3+3+1+4+1+11+11 -> 40 | F27: =+E27/E$37 -> 5.2770448548812667E-2
B28: DELITOS C/LA INTEGRID. SEXUAL | C28: 5 | D28: =+(C28/C$37) -> 4.2918454935622317E-3 | E28: 2 | F28: =+E28/E$37 -> 2.6385224274406332E-3
B29: DELITOS C/LA LIBERTAD | C29: 11 | D29: =+(C29/C$37) -> 9.4420600858369091E-3 | E29: 6 | F29: =+E29/E$37 -> 7.9155672823219003E-3
B30: DELITOS C/LA PROPIEDAD | C30: 1032 | D30: =+(C30/C$37) -> 0.88583690987124464 | E30: =320+12+90+91+11+143 -> 667 | F30: =+E30/E$37 -> 0.87994722955145122
B31: DELITOS C/LA SEG. PUBLICA | C31: 69 | D31: =+(C31/C$37) -> 5.9227467811158799E-2 | E31: =21+4+4+11 -> 40 | F31: =+E31/E$37 -> 5.2770448548812667E-2
B32: DELITOS C/EL ORDEN PUBLICO | D32: =+(C32/C$37) -> 0 | F32: =+E32/E$37 -> 0
B33: DELITOS C/LA ADM. PUBLICA | C33: 15 | D33: =+(C33/C$37) -> 1.2875536480686695E-2 | E33: 3 | F33: =+E33/E$37 -> 3.9577836411609502E-3
B34: DELITOS C/LA FE PUBLICA | D34: =+(C34/C$37) -> 0 | F34: =+E34/E$37 -> 0
B35: ESTUPEFACIENTES (LEY 23737) | D35: =+(C35/C$37) -> 0 | F35: =+E35/E$37 -> 0
B36: LEYES ESPECIALES | D36: =+(C36/C$37) -> 0 | F36: =+E36/E$37 -> 0
B37: TOTAL | C37: =SUM(C27:C36) -> 1165 | D37: =SUM(D27:D36) -> 1 | E37: =SUM(E27:E36) -> 758 | F37: =SUM(F27:F36) -> 1
B38: (*) En este rubro se incluyen las Declaraciones de Responsabilidad del menor (462), las imposiciones de pena del art.4º,ley 22.278 (24) y las sentencias condenatorias de mayores (272)
B39: FUENTE: Oficina de Estadísticas del Poder Judicial de la Nación.