B6: PODER JUDICIAL DE LA NACION
B7: JURISDICCIÓN CAPITAL FEDERAL
B8: COMPETENCIA PENAL
B9: CUADRO VII
B10: CAUSAS INGRESADAS Y ELEVADAS A JUICIO EN LOS JUZGADOS DE 1RA. INSTANCIA POR FUERO -AÑO 2001-
B12: FUERO | C12: TOTAL DE CAUSAS INGRESADAS EN LOS JUZGADOS (*) | D12: TOTAL DE CAUSAS ELEVADAS A JUICIO (**) | E12: PORCENTAJE DE CAUSAS ELEVADAS A JUICIO
B15: INSTRUCCIÓN | C15: 118644 | D15: 5327 | E15: =+D15/C15 -> 4.4899025656586086E-2
B16: CORRECCIONAL | C16: 82828 | D16: 1658 | E16: =+D16/C16 -> 2.0017385425218526E-2
B17: FEDERAL | C17: 21960 | D17: 431 | E17: =+D17/C17 -> 1.9626593806921677E-2
B18: MENORES | C18: 6529 | D18: 845 | E18: =+D18/C18 -> 0.12942257619849901
B19: PENAL ECONOMICO | C19: 4181 | D19: 352 | E19: =+D19/C19 -> 8.4190385075340823E-2
B20: TOTAL | C20: =SUM(C15:C19) -> 234142 | D20: =SUM(D15:D19) -> 8613 | E20: =+D20/C20 -> 3.6785369562060632E-2
B22: Referencias: (*): Se incluyen las causas ingresadas por NN
B23: (**): En esta cifra se incluyen las causas de años anteriores.
B24: Fuente: Oficina de Estadísticas del Poder Judicial de la Nación.-