B6: PODER JUDICIAL DE LA NACION
B7: JURISDICCION CAPITAL FEDERAL
B8: COMPETENCIA PENAL
B9: CUADRO X
B10: DISTRIBUCION PORCENTUAL, SEGÚN EL TIPO DE DELITO, DE LAS CAUSAS INGRESADAS,
B11: ELEVADAS A JUICIO Y PERSONAS CONDENADAS -AÑO 2001-
B12: I - INSTRUCCIÓN
C14: CAUSAS | D14: % | E14: CAUSAS | F14: % | G14: PERSONAS | H14: %
B15: DELITOS | C15: INGRESADAS | E15: ELEVADAS | G15: CONDENADAS
B16: DELITOS CONTRA LAS PERSONAS | C16: 4701 | D16: =+(C16/C$28) -> 3.9622736927278246E-2 | E16: 500 | F16: =+E16/E$28 -> 9.3984962406015032E-2 | G16: =8+35+8+21 -> 72 | H16: =+G16/G$28 -> 2.0055710306406686E-2
B17: HOMICIDIOS | C17: 448 | D17: =+(C17/C$28) -> 3.7760021577155187E-3 | E17: 152 | F17: =+E17/E$28 -> 2.8571428571428571E-2 | G17: =12+11+73+6 -> 102 | H17: =+G17/G$28 -> 2.841225626740947E-2
B18: DELITOS CONTRA LA HONESTIDAD | C18: 833 | D18: =+(C18/C$28) -> 7.0210040120022923E-3 | E18: 215 | F18: =+E18/E$28 -> 4.0413533834586464E-2 | G18: =8+19+40+23 -> 90 | H18: =+G18/G$28 -> 2.5069637883008356E-2
B19: DELITOS CONTRA EL ESTADO CIVIL | C19: 47 | D19: =+(C19/C$28) -> 3.9614308351033342E-4 | E19: 2 | F19: =+E19/E$28 -> 3.7593984962406017E-4 | G19: 1 | H19: =+G19/G$28 -> 2.785515320334262E-4
B20: DELITOS CONTRA LA LIBERTAD | C20: 4720 | D20: =+(C20/C$28) -> 3.9782879875931355E-2 | E20: 215 | F20: =+E20/E$28 -> 4.0413533834586464E-2 | G20: =9+24+10+15 -> 58 | H20: =+G20/G$28 -> 1.615598885793872E-2
B21: DELITOS CONTRA LA PROPIEDAD | C21: 25472 | D21: =+(C21/C$28) -> 0.21469269411011091 | E21: =3797+21 -> 3818 | F21: =+E21/E$28 -> 0.71766917293233079 | G21: =1025+1276+393+392 -> 3086 | H21: =+G21/G$28 -> 0.85961002785515317
B22: DELITOS CONTRA LA SEGURIDAD PUBLICA | C22: 619 | D22: =+(C22/C$28) -> 5.2172886955935407E-3 | E22: 98 | F22: =+E22/E$28 -> 1.8421052631578946E-2 | G22: =21+18+9+7 -> 55 | H22: =+G22/G$28 -> 1.532033426183844E-2
B23: DELITOS CONTRA EL ORDEN PUBLICO | C23: 238 | D23: =+(C23/C$28) -> 2.0060011462863692E-3 | E23: 7 | F23: =+E23/E$28 -> 1.3157894736842105E-3 | G23: 1 | H23: =+G23/G$28 -> 2.785515320334262E-4
B24: DELITOS CONTRA LA ADMINISTRACION PUBLICA | C24: 1596 | D24: =+(C24/C$28) -> 1.3452007686861535E-2 | E24: 160 | F24: =+E24/E$28 -> 3.007518796992481E-2 | G24: =19+42+4+20 -> 85 | H24: =+G24/G$28 -> 2.3676880222841225E-2
B25: DELITOS CONTRA LA FE PUBLICA | C25: 1175 | D25: =+(C25/C$28) -> 9.9035770877583355E-3 | E25: 110 | F25: =+E25/E$28 -> 2.0676691729323307E-2 | G25: =1+24+2+4 -> 31 | H25: =+G25/G$28 -> 8.6350974930362121E-3
B26: INFRACCION LEYES ESPECIALES Y DEC. LEYES | C26: 475 | D26: =+(C26/C$28) -> 4.003573716327838E-3 | E26: 43 | F26: =+E26/E$28 -> 8.0827067669172938E-3 | G26: =1+5+1+2 -> 9 | H26: =+G26/G$28 -> 2.5069637883008357E-3
B27: NN CUALQUIERA SEA EL DELITO | C27: 78320 | D27: =+(C27/C$28) -> 0.66012609150062374 | F27: =+E27/E$28 -> 0 | H27: =+G27/G$28 -> 0
B28: TOTAL | C28: =SUM(C16:C27) -> 118644 | D28: =SUM(D16:D27) -> 1 | E28: =SUM(E16:E27) -> 5320 | F28: =SUM(F16:F27) -> 1 | G28: =SUM(G16:G27) -> 3590 | H28: =SUM(H16:H27) -> 1
B29: Referencias: (*) En causas tramitadas en los Tribunales Orales en lo Criminal de la Capital Federal.
B30: Fuente: Oficina de Estadísticas del Poder judicial de la Nación.