C4: II - INDICADORES DE GESTION - AÑO 2004
C6: Cuadro B.IV.b)
C8: Interior del País
C10: Competencia Civil - Juzgados
C12: Indices
D14: Indice de | E14: Indice de | F14: Indice de | G14: Indice de | H14: Promedio | I14: Indice de
C15: Juzgados | D15: congestión | E15: descongestión | F15: cumplimiento | G15: duración | H15: de resolución | I15: sentencias
D16: (a/b) | E16: (b/c) | F16: ( b / (a+c) ) | G16: ( (a+c-1) / b ) | H16: (b/e) | I16: (d/b)
C17: La Plata | D17: =+'C'!D15/'C'!E15 -> 5.5137706911063313 | E17: =+'C'!E15/'C'!F15 -> 1.3078522504892367 | F17: =+'C'!E15/('C'!D15+'C'!F15) -> 0.15927667862023764 | G17: =+('C'!D15+'C'!F15-1)/'C'!E15 -> 6.278359674553446 | H17: =+'C'!E15/'C'!H15 -> 2673.25 | I17: =+'C'!G15/'C'!E15 -> 0.63469091929299537
C18: Mar del Plata | D18: =+'C'!D16/'C'!E16 -> 2.1729303490236562 | E18: =+'C'!E16/'C'!F16 -> 1.9392171061038463 | F18: =+'C'!E16/('C'!D16+'C'!F16) -> 0.37194045946210907 | G18: =+('C'!D16+'C'!F16-1)/'C'!E16 -> 2.6885804028378764 | H18: =+'C'!E16/'C'!H16 -> 4552.7 | I18: =+'C'!G16/'C'!E16 -> 0.17541239264612207
C19: Bahía Blanca | D19: =+'C'!D17/'C'!E17 -> 3.1051065463620655 | E19: =+'C'!E17/'C'!F17 -> 2.1179101443382802 | F19: =+'C'!E17/('C'!D17+'C'!F17) -> 0.27954277127830846 | G19: =+('C'!D17+'C'!F17-1)/'C'!E17 -> 3.5771741217124209 | H19: =+'C'!E17/'C'!H17 -> 1488.2857142857142 | I19: =+'C'!G17/'C'!E17 -> 0.33893261662507201
C20: Mendoza | D20: =+'C'!D18/'C'!E18 -> 10.067024372499091 | E20: =+'C'!E18/'C'!F18 -> 0.86283741368487132 | F20: =+'C'!E18/('C'!D18+'C'!F18) -> 8.9078993203230691E-2 | G20: =+('C'!D18+'C'!F18-1)/'C'!E18 -> 11.225900327391779 | H20: =+'C'!E18/'C'!H18 -> 916.33333333333337 | I20: =+'C'!G18/'C'!E18 -> 1.37531829756275
C21: Rosario | D21: =+'C'!D19/'C'!E19 -> 3.2589650891031261 | E21: =+'C'!E19/'C'!F19 -> 3.4556123414726483 | F21: =+'C'!E19/('C'!D19+'C'!F19) -> 0.28182117569570231 | G21: =+('C'!D19+'C'!F19-1)/'C'!E19 -> 3.5483311422728603 | H21: =+'C'!E19/'C'!H19 -> 3651.2 | I21: =+'C'!G19/'C'!E19 -> 0.27897677475898336
C22: General Roca | D22: =+'C'!D20/'C'!E20 -> 3.3812886142983229 | E22: =+'C'!E20/'C'!F20 -> 2.7270539152759947 | F22: =+'C'!E20/('C'!D20+'C'!F20) -> 0.26681005384868989 | G22: =+('C'!D20+'C'!F20-1)/'C'!E20 -> 3.7479258605472197 | H22: =+'C'!E20/'C'!H20 -> 1699.5 | I22: =+'C'!G20/'C'!E20 -> 0.49102677258017063
C23: Paraná | D23: =+'C'!D21/'C'!E21 -> 4.0602899575671856 | E23: =+'C'!E21/'C'!F21 -> 2.4358311800172263 | F23: =+'C'!E21/('C'!D21+'C'!F21) -> 0.22367224265432831 | G23: =+('C'!D21+'C'!F21-1)/'C'!E21 -> 4.4707390381895333 | H23: =+'C'!E21/'C'!H21 -> 1885.3333333333333 | I23: =+'C'!G21/'C'!E21 -> 0.35590523338048091
C24: Posadas | D24: =+'C'!D22/'C'!E22 -> 5.8864435274338991 | E24: =+'C'!E22/'C'!F22 -> 1.7828337874659401 | F24: =+'C'!E22/('C'!D22+'C'!F22) -> 0.15510252459405002 | G24: =+('C'!D22+'C'!F22-1)/'C'!E22 -> 6.4471954760813084 | H24: =+'C'!E22/'C'!H22 -> 1308.6 | I24: =+'C'!G22/'C'!E22 -> 0.47516429772275715
C25: Resistencia | D25: =+'C'!D23/'C'!E23 -> 6.3219161676646705 | E25: =+'C'!E23/'C'!F23 -> 2.6569792108612642 | F25: =+'C'!E23/('C'!D23+'C'!F23) -> 0.14929198054734433 | G25: =+('C'!D23+'C'!F23-1)/'C'!E23 -> 6.6982035928143713 | H25: =+'C'!E23/'C'!H23 -> 2087.5 | I25: =+'C'!G23/'C'!E23 -> 0.36974051896207583
C26: Córdoba | D26: =+'C'!D24/'C'!E24 -> 3.7509782476607123 | E26: =+'C'!E24/'C'!F24 -> 1.6893861630055431 | F26: =+'C'!E24/('C'!D24+'C'!F24) -> 0.23026039655490824 | G26: =+('C'!D24+'C'!F24-1)/'C'!E24 -> 4.3428849191882364 | H26: =+'C'!E24/'C'!H24 -> 2420.294117647059 | I26: =+'C'!G24/'C'!E24 -> 0.35136711629602624
C27: San Martín | D27: =+'C'!D25/'C'!E25 -> 4.1327039809332291 | E27: =+'C'!E25/'C'!F25 -> 2.0080762759394277 | F27: =+'C'!E25/('C'!D25+'C'!F25) -> 0.21595039727217163 | G27: =+('C'!D25+'C'!F25-1)/'C'!E25 -> 4.6306744125423602 | H27: =+'C'!E25/'C'!H25 -> 4131.2307692307695 | I27: =+'C'!G25/'C'!E25 -> 0.36906490894872079
C28: Tucumán | D28: =+'C'!D26/'C'!E26 -> 2.9961003899610037 | E28: =+'C'!E26/'C'!F26 -> 1.9323736837020578 | F28: =+'C'!E26/('C'!D26+'C'!F26) -> 0.28460848902232533 | G28: =+('C'!D26+'C'!F26-1)/'C'!E26 -> 3.5135486451354865 | H28: =+'C'!E26/'C'!H26 -> 2000.2 | I28: =+'C'!G26/'C'!E26 -> 0.51059894010598939
C29: Salta | D29: =+'C'!D27/'C'!E27 -> 1.9619227937309351 | E29: =+'C'!E27/'C'!F27 -> 4.5477158574503704 | F29: =+'C'!E27/('C'!D27+'C'!F27) -> 0.45833433771242615 | G29: =+('C'!D27+'C'!F27-1)/'C'!E27 -> 2.1817608078258126 | H29: =+'C'!E27/'C'!H27 -> 2376.75 | I29: =+'C'!G27/'C'!E27 -> 0.24976333228147682
C30: Comodoro Rivadavia | D30: =+'C'!D28/'C'!E28 -> 2.2365470852017939 | E30: =+'C'!E28/'C'!F28 -> 3.5594573024740623 | F30: =+'C'!E28/('C'!D28+'C'!F28) -> 0.39722123263270398 | G30: =+('C'!D28+'C'!F28-1)/'C'!E28 -> 2.5174439461883407 | H30: =+'C'!E28/'C'!H28 -> 2230 | I30: =+'C'!G28/'C'!E28 -> 0.27017937219730942
C31: Corrientes | D31: =+'C'!D29/'C'!E29 -> 4.1612446958981613 | E31: =+'C'!E29/'C'!F29 -> 2.8129973474801062 | F31: =+'C'!E29/('C'!D29+'C'!F29) -> 0.22139874739039667 | G31: =+('C'!D29+'C'!F29-1)/'C'!E29 -> 4.5166430928807166 | H31: =+'C'!E29/'C'!H29 -> 1515 | I31: =+'C'!G29/'C'!E29 -> 0.29787835926449791
C32: INDICADORES\INDI2004\INTCIVIL04\HOJA D
C33: OFICINA DE ESTADISTICAS