C4: II - INDICADORES DE GESTION - AÑO 2004
C6: Cuadro B.IV.b)
C8: Interior del País
C10: Competencia Civil - Juzgados
D12: Casos Existentes | E12: Total de resueltos | F12: Casos ingresadas | G12: Sentencias | H12: Cantidad de secretarías
C13: Juzgados | D13: al comienzo del año | E13: en el año | F13: en el año | G13: dictadas en el año | H13: con comp. Civil
D14: (a) | E14: (b) | F14: ( c ) | G14: (d) | H14: (e)
C15: La Plata | D15: 235835 | E15: 42772 | F15: 32704 | G15: 27147 | H15: 16
C16: Mar del Plata | D16: 98927 | E16: 45527 | F16: 23477 | G16: 7986 | H16: 10
C17: Bahía Blanca | D17: 32349 | E17: 10418 | F17: 4919 | G17: 3531 | H17: 7
C18: Mendoza | D18: 110697 | E18: 10996 | F18: 12744 | G18: 15123 | H18: 12
C19: Rosario | D19: 178487 | E19: 54768 | F19: 15849 | G19: 15279 | H19: 15
C20: General Roca | D20: 57465 | E20: 16995 | F20: 6232 | G20: 8345 | H20: 10
C21: Paraná | D21: 45930 | E21: 11312 | F21: 4644 | G21: 4026 | H21: 6
C22: Posadas | D22: 38515 | E22: 6543 | F22: 3670 | G22: 3109 | H22: 5
C23: Resistencia | D23: 79182 | E23: 12525 | F23: 4714 | G23: 4631 | H23: 6
C24: Córdoba | D24: 154334 | E24: 41145 | F24: 24355 | G24: 14457 | H24: 17
C25: San Martín | D25: 221951 | E25: 53706 | F25: 26745 | G25: 19821 | H25: 13
C26: Tucumán | D26: 59928 | E26: 20002 | F26: 10351 | G26: 10213 | H26: 10
C27: Salta | D27: 37304 | E27: 19014 | F27: 4181 | G27: 4749 | H27: 8
C28: Comodoro Rivadavia | D28: 49875 | E28: 22300 | F28: 6265 | G28: 6025 | H28: 10
C29: Corrientes | D29: 44130 | E29: 10605 | F29: 3770 | G29: 3159 | H29: 7
C30: Total | D30: =SUM(D15:D29) -> 1444909 | E30: =SUM(E15:E29) -> 378628 | F30: =SUM(F15:F29) -> 184620 | G30: =SUM(G15:G29) -> 147601 | H30: =SUM(H15:H29) -> 152
C31: INDICADORES\INDI2004\INTCIVIL04\HOJA C
C32: OFICINA DE ESTADISTICAS