C4: II - INDICADORES DE GESTION - AÑO 2004
C6: Cuadro B.IV.a)
C8: Interior del País
C10: Competencia Civil - Cámaras de Apelación
C12: Indices
C14: Cámaras de | D14: Indice de | E14: Promedio de
C15: Apelación | D15: apelación | E15: resolución
D16: (a/b) | E16: (c/d)
C17: La Plata | D17: =+A!D14/A!E14 -> 0.2639577293556532 | E17: =+A!F14/A!G14 -> 690.55555555555554
C18: Mar del Plata | D18: =+A!D15/A!E15 -> 4.8366903156368747E-2 | E18: =+A!F15/A!G15 -> 425
C19: Bahía Blanca | D19: =+A!D16/A!E16 -> 0.1186408139758111 | E19: =+A!F16/A!G16 -> 323.2
C20: Mendoza | D20: =+A!D17/A!E17 -> 0.12368133866860677 | E20: =+A!F17/A!G17 -> 201.16666666666666
C21: Rosario | D21: =+A!D18/A!E18 -> 8.1050978673678054E-2 | E21: =+A!F18/A!G18 -> 1388.5
C22: General Roca | D22: =+A!D19/A!E19 -> 4.9602824360105914E-2 | E22: =+A!F19/A!G19 -> 697
C23: Paraná | D23: =+A!D20/A!E20 -> 0.15806223479490805 | E23: =+A!F20/A!G20 -> 886.33333333333337
C24: Posadas | D24: =+A!D21/A!E21 -> 5.4714962555402723E-2 | E24: =+A!F21/A!G21 -> 149.33333333333334
C25: Resistencia | D25: =+A!D22/A!E22 -> 4.5349301397205589E-2 | E25: =+A!F22/A!G22 -> 148.33333333333334
C26: Córdoba | D26: =+A!D23/A!E23 -> 0.13717341110706038 | E26: =+A!F23/A!G23 -> 560.2
C27: San Martín | D27: =+A!D24/A!E24 -> 6.5244106803709082E-2 | E27: =+A!F24/A!G24 -> 249.33333333333334
C28: Tucumán | D28: =+A!D25/A!E25 -> 6.5593440655934407E-2 | E28: =+A!F25/A!G25 -> 450.33333333333331
C29: Salta | D29: =+A!D26/A!E26 -> 2.2194172714841694E-2 | E29: =+A!F26/A!G26 -> 219
C30: Comodoro Rivadavia | D30: =+A!D27/A!E27 -> 4.9417040358744398E-2 | E30: =+A!F27/A!G27 -> 545.33333333333337
C31: Corrientes | D31: =+A!D28/A!E28 -> 4.4035832154644038E-2 | E31: =+A!F28/A!G28 -> 124
C32: INDICADORES\INDI2004\INTCIVIL04\HOJA B
C33: OFICINA DE ESTADISTICAS