C4: II - INDICADORES DE GESTION - AÑO 2005
C6: Cuadro B.IV.a)
C8: Interior del País
C10: Competencia Civil - Cámaras de Apelación
C12: Indices
C14: Cámaras de | D14: Indice de | E14: Promedio de
C15: Apelación | D15: apelación | E15: resolución
D16: (a/b) | E16: (c/d)
C17: La Plata | D17: =+A!D14/A!E14 -> 0.1328182676624603 | E17: =+A!F14/A!G14 -> 684.33333333333337
C18: Mar del Plata | D18: =+A!D15/A!E15 -> 0.17972039750715849 | E18: =+A!F15/A!G15 -> 451.66666666666669
C19: Bahía Blanca | D19: =+A!D16/A!E16 -> 0.22627093740816925 | E19: =+A!F16/A!G16 -> 334.8
C20: Mendoza | D20: =+A!D17/A!E17 -> 0.19762992223182324 | E20: =+A!F17/A!G17 -> 179.16666666666666
C21: Rosario | D21: =+A!D18/A!E18 -> 6.9018586480407249E-2 | E21: =+A!F18/A!G18 -> 838.16666666666663
C22: General Roca | D22: =+A!D19/A!E19 -> 4.17661961635903E-2 | E22: =+A!F19/A!G19 -> 411.33333333333331
C23: Paraná | D23: =+A!D20/A!E20 -> 0.18652460984393757 | E23: =+A!F20/A!G20 -> 511.33333333333331
C24: Posadas | D24: =+A!D21/A!E21 -> 0.14428509343763582 | E24: =+A!F21/A!G21 -> 156
C25: Resistencia | D25: =+A!D22/A!E22 -> 0.10091472410740632 | E25: =+A!F22/A!G22 -> 108
C26: Córdoba | D26: =+A!D23/A!E23 -> 0.24921935987509758 | E26: =+A!F23/A!G23 -> 804.6
C27: San Martín | D27: =+A!D24/A!E24 -> 0.12102603964244073 | E27: =+A!F24/A!G24 -> 309.16666666666669
C28: Tucumán | D28: =+A!D25/A!E25 -> 4.1270328321571036E-2 | E28: =+A!F25/A!G25 -> 421
C29: Salta | D29: =+A!D26/A!E26 -> 4.7146678555506021E-2 | E29: =+A!F26/A!G26 -> 164.33333333333334
C30: Comodoro Rivadavia | D30: =+A!D27/A!E27 -> 6.1076604554865424E-2 | E30: =+A!F27/A!G27 -> 512.33333333333337
C31: Corrientes | D31: =+A!D28/A!E28 -> 0.16370106761565836 | E31: =+A!F28/A!G28 -> 94.333333333333329
C33: OFICINA DE ESTADISTICAS
C35: Indice de apelación: Ej. La Plata, del total de causas resueltas en Primera Instancia
C36: el indice de apelación es del 0,13.
C37: Promedio de resolución: Ej. La Plata, del total de causas resueltas por la Cámara,
C38: siendo el total de Jueces de Cámara que la integran 9, correspondió resolver a cada uno
C39: un promedio de 684 expedientes en el año.