C3: II - INDICADORES DE GESTION - AÑO 2005
C5: Cuadro B.IV.b)
C7: Interior del País
C9: Competencia Civil - Juzgados
D11: Casos Existentes | E11: Total de resueltos | F11: Casos ingresadas | G11: Sentencias | H11: Cantidad de secretarías
C12: Juzgados | D12: al comienzo del año | E12: en el año | F12: en el año | G12: dictadas en el año | H12: con comp. Civil
D13: (a) | E13: (b) | F13: ( c ) | G13: (d) | H13: (e)
C14: La Plata | D14: 229034 | E14: 58245 | F14: 42479 | G14: 21710 | H14: 16
C15: Mar del Plata | D15: 78597 | E15: 11874 | F15: 10303 | G15: 9121 | H15: 10
C16: Bahía Blanca | D16: 26505 | E16: 3403 | F16: 4536 | G16: 4670 | H16: 7
C17: Mendoza | D17: 112877 | E17: 8101 | F17: 14469 | G17: 15111 | H17: 12
C18: Rosario | D18: 149466 | E18: 33788 | F18: 20678 | G18: 22534 | H18: 15
C19: General Roca | D19: 48272 | E19: 13815 | F19: 10282 | G19: 9684 | H19: 10
C20: Paraná | D20: 42013 | E20: 6664 | F20: 6049 | G20: 5476 | H20: 6
C21: Posadas | D21: 35954 | E21: 2301 | F21: 3942 | G21: 3120 | H21: 5
C22: Resistencia | D22: 71652 | E22: 3389 | F22: 6987 | G22: 6513 | H22: 6
C23: Córdoba | D23: 140806 | E23: 15372 | F23: 21868 | G23: 14566 | H23: 17
C24: San Martín | D24: 197305 | E24: 25730 | F24: 26477 | G24: 22838 | H24: 13
C25: Tucumán | D25: 51765 | E25: 19554 | F25: 10351 | G25: 10064 | H25: 10
C26: Salta (+) | D26: 25805 | E26: 8972 | F26: 5193 | G26: 4402 | H26: 9
C27: Comodoro Rivadavia | D27: 35984 | E27: 11592 | F27: 6415 | G27: 6173 | H27: 10
C28: Corrientes | D28: 37545 | E28: 3372 | F28: 4317 | G28: 3888 | H28: 7
C29: Total | D29: =SUM(D14:D28) -> 1283580 | E29: =SUM(E14:E28) -> 226172 | F29: =SUM(F14:F28) -> 194346 | G29: =SUM(G14:G28) -> 159870 | H29: =SUM(H14:H28) -> 153
C31: OFICINA DE ESTADISTICAS
C33: Referencias: (+) comenzó a funcionar el Juzgado Federal de Orán.