C3: II - INDICADORES DE GESTION - AÑO 2005
C5: Cuadro B.IV.b)
C7: Interior del País
C9: Competencia Civil - Juzgados
C11: Indices
D13: Indice de | E13: Indice de | F13: Indice de | G13: Indice de | H13: Promedio | I13: Indice de
C14: Juzgados | D14: congestión | E14: descongestión | F14: cumplimiento | G14: duración | H14: de resolución | I14: sentencias
D15: (a/b) | E15: (b/c) | F15: ( b / (a+c) ) | G15: ( (a+c-1) / b ) | H15: (b/e) | I15: (d/b)
C16: La Plata | D16: =+'C'!D14/'C'!E14 -> 3.9322516954245001 | E16: =+'C'!E14/'C'!F14 -> 1.3711480967066079 | F16: =+'C'!E14/('C'!D14+'C'!F14) -> 0.21452011505894744 | G16: =+('C'!D14+'C'!F14-1)/'C'!E14 -> 4.6615503476693281 | H16: =+'C'!E14/'C'!H14 -> 3640.3125 | I16: =+'C'!G14/'C'!E14 -> 0.37273585715512059
C17: Mar del Plata | D17: =+'C'!D15/'C'!E15 -> 6.6192521475492674 | E17: =+'C'!E15/'C'!F15 -> 1.1524798602348831 | F17: =+'C'!E15/('C'!D15+'C'!F15) -> 0.13356580427446568 | G17: =+('C'!D15+'C'!F15-1)/'C'!E15 -> 7.4868620515411823 | H17: =+'C'!E15/'C'!H15 -> 1187.4 | I17: =+'C'!G15/'C'!E15 -> 0.76814889674919995
C18: Bahía Blanca | D18: =+'C'!D16/'C'!E16 -> 7.7887158389656186 | E18: =+'C'!E16/'C'!F16 -> 0.75022045855379194 | F18: =+'C'!E16/('C'!D16+'C'!F16) -> 0.10962920009020329 | G18: =+('C'!D16+'C'!F16-1)/'C'!E16 -> 9.1213635027916542 | H18: =+'C'!E16/'C'!H16 -> 486.14285714285717 | I18: =+'C'!G16/'C'!E16 -> 1.372318542462533
C19: Mendoza | D19: =+'C'!D17/'C'!E17 -> 13.933711887421307 | E19: =+'C'!E17/'C'!F17 -> 0.55988665422627681 | F19: =+'C'!E17/('C'!D17+'C'!F17) -> 6.3614090744899723E-2 | G19: =+('C'!D17+'C'!F17-1)/'C'!E17 -> 15.719664238982842 | H19: =+'C'!E17/'C'!H17 -> 675.08333333333337 | I19: =+'C'!G17/'C'!E17 -> 1.8653252684853723
C20: Rosario | D20: =+'C'!D18/'C'!E18 -> 4.4236415295371136 | E20: =+'C'!E18/'C'!F18 -> 1.6340071573653159 | F20: =+'C'!E18/('C'!D18+'C'!F18) -> 0.19858472823020501 | G20: =+('C'!D18+'C'!F18-1)/'C'!E18 -> 5.0356043565762993 | H20: =+'C'!E18/'C'!H18 -> 2252.5333333333333 | I20: =+'C'!G18/'C'!E18 -> 0.66692316798863505
C21: General Roca | D21: =+'C'!D19/'C'!E19 -> 3.4941730003619256 | E21: =+'C'!E19/'C'!F19 -> 1.343610192569539 | F21: =+'C'!E19/('C'!D19+'C'!F19) -> 0.23593605902244083 | G21: =+('C'!D19+'C'!F19-1)/'C'!E19 -> 4.238364096996019 | H21: =+'C'!E19/'C'!H19 -> 1381.5 | I21: =+'C'!G19/'C'!E19 -> 0.70097719869706843
C22: Paraná | D22: =+'C'!D20/'C'!E20 -> 6.3044717887154862 | E22: =+'C'!E20/'C'!F20 -> 1.1016696974706564 | F22: =+'C'!E20/('C'!D20+'C'!F20) -> 0.13865423827556073 | G22: =+('C'!D20+'C'!F20-1)/'C'!E20 -> 7.2120348139255706 | H22: =+'C'!E20/'C'!H20 -> 1110.6666666666667 | I22: =+'C'!G20/'C'!E20 -> 0.82172869147659067
C23: Posadas | D23: =+'C'!D21/'C'!E21 -> 15.625380269448065 | E23: =+'C'!E21/'C'!F21 -> 0.58371385083713856 | F23: =+'C'!E21/('C'!D21+'C'!F21) -> 5.7674954882695008E-2 | G23: =+('C'!D21+'C'!F21-1)/'C'!E21 -> 17.338113863537593 | H23: =+'C'!E21/'C'!H21 -> 460.2 | I23: =+'C'!G21/'C'!E21 -> 1.3559322033898304
C24: Resistencia | D24: =+'C'!D22/'C'!E22 -> 21.142519917379758 | E24: =+'C'!E22/'C'!F22 -> 0.48504365249749537 | F24: =+'C'!E22/('C'!D22+'C'!F22) -> 4.3095665000826559E-2 | G24: =+('C'!D22+'C'!F22-1)/'C'!E22 -> 23.203894954263795 | H24: =+'C'!E22/'C'!H22 -> 564.83333333333337 | I24: =+'C'!G22/'C'!E22 -> 1.9218058424313957
C25: Córdoba | D25: =+'C'!D23/'C'!E23 -> 9.1599011189175119 | E25: =+'C'!E23/'C'!F23 -> 0.70294494238156213 | F25: =+'C'!E23/('C'!D23+'C'!F23) -> 9.4495739946149973E-2 | G25: =+('C'!D23+'C'!F23-1)/'C'!E23 -> 10.582422586520947 | H25: =+'C'!E23/'C'!H23 -> 904.23529411764707 | I25: =+'C'!G23/'C'!E23 -> 0.9475670049440541
C26: San Martín | D26: =+'C'!D24/'C'!E24 -> 7.6682860474154682 | E26: =+'C'!E24/'C'!F24 -> 0.97178683385579934 | F26: =+'C'!E24/('C'!D24+'C'!F24) -> 0.1149779696311589 | G26: =+('C'!D24+'C'!F24-1)/'C'!E24 -> 8.6972794403420135 | H26: =+'C'!E24/'C'!H24 -> 1979.2307692307693 | I26: =+'C'!G24/'C'!E24 -> 0.88760202098717456
C27: Tucumán | D27: =+'C'!D25/'C'!E25 -> 2.6472844430806997 | E27: =+'C'!E25/'C'!F25 -> 1.8890928412713748 | F27: =+'C'!E25/('C'!D25+'C'!F25) -> 0.31479811964711185 | G27: =+('C'!D25+'C'!F25-1)/'C'!E25 -> 3.1765879104019636 | H27: =+'C'!E25/'C'!H25 -> 1955.4 | I27: =+'C'!G25/'C'!E25 -> 0.51467730387644473
C28: Salta | D28: =+'C'!D26/'C'!E26 -> 2.8761703076237182 | E28: =+'C'!E26/'C'!F26 -> 1.7277103793568265 | F28: =+'C'!E26/('C'!D26+'C'!F26) -> 0.28943802825988774 | G28: =+('C'!D26+'C'!F26-1)/'C'!E26 -> 3.454859563085154 | H28: =+'C'!E26/'C'!H26 -> 996.88888888888891 | I28: =+'C'!G26/'C'!E26 -> 0.49063753901025414
C29: Comodoro Rivadavia | D29: =+'C'!D27/'C'!E27 -> 3.104209799861974 | E29: =+'C'!E27/'C'!F27 -> 1.8070148090413094 | F29: =+'C'!E27/('C'!D27+'C'!F27) -> 0.27340267459138184 | G29: =+('C'!D27+'C'!F27-1)/'C'!E27 -> 3.6575224292615598 | H29: =+'C'!E27/'C'!H27 -> 1159.2 | I29: =+'C'!G27/'C'!E27 -> 0.53252242926155968
C30: Corrientes | D30: =+'C'!D28/'C'!E28 -> 11.134341637010676 | E30: =+'C'!E28/'C'!F28 -> 0.7810979847116053 | F30: =+'C'!E28/('C'!D28+'C'!F28) -> 8.0550379819406617E-2 | G30: =+('C'!D28+'C'!F28-1)/'C'!E28 -> 12.41429418742586 | H30: =+'C'!E28/'C'!H28 -> 481.71428571428572 | I30: =+'C'!G28/'C'!E28 -> 1.1530249110320285
C32: OFICINA DE ESTADISTICAS
C34: Indice de congestión: si es mayor que 1 tiende a congestionarse el Juzgado en estudio.
C35: Indice de descongestión: si es 1 o mayor que1 quiere decir que resuelve lo entrado y parte de los existentes.
C36: Indice de cumplimiento: cuanto más se acerca a 1 es mejor el rendimiento y si es 1 el resultado es óptimo.
C37: Indice de duración: se mide la duración probable en años y fracción de año (Ej: 4,66= 4 años y 8 meses, dicho
C38: resultado se obtiene 4= 4años y [0,66x12=7,92 de mes] 8 meses)
C39: Promedio de resolución: del total de causas resueltas en los distintos Juzgados y teniendo en cuenta el total de
C40: Jueces de Primera Instancia de cada especialidad, las cifras obtenidas equivalen al promedio de causas resueltas
C41: por cada uno de ellos en el año que nos ocupa.