B6: PODER JUDICIAL DE LA NACION
B7: JURISDICCION FEDERAL BAHIA BLANCA
B9: CUADRO II
B10: DENSIDAD DE POBLACION POR COMPETENCIA TERRITORIAL -AÑO 2001-
C12: POBLACION TOTAL (2001) | D12: SUPERFICIE (Km2) | E12: DENSIDAD DE
E13: POBLACION (hab/km2)
B14: Cámara Federal de Apelaciones | C14: 940695 | D14: 227574 | E14: =+C14/D14 -> 4.1335785283028814
B15: de Bahía Blanca
B16: Tribunal Oral en lo Criminal Federal | C16: 642235 | D16: 84134 | E16: =+C16/D16 -> 7.6334775477214922
B17: de Bahía Blanca
B19: Juzgados Federales de Primera Instancia | C19: 642235 | D19: 84134 | E19: =+C19/D19 -> 7.6334775477214922
B20: de Bahía Blanca Nros. 1 y 2
B22: Tribunal Oral en lo Criminal Federal | C22: 298460 | D22: 143440 | E22: =+C22/D22 -> 2.0807306190741772
B23: de Santa Rosa
B25: Juzgado Federal de Primera Instancia | C25: 298460 | D25: 143440 | E25: =+C25/D25 -> 2.0807306190741772
B26: de Santa Rosa
B28: FUENTE: INDEC (Censo Nacional de Población, Hogares y Viviendas 2001) E INSTITUTO GEOGRAFICO MILITAR .
B29: Oficina de Estadísticas del Poder Judicial de la Nación.