B6: PODER JUDICIAL DE LA NACION
B7: JURISDICCION FEDERAL BAHIA BLANCA
B9: CUADRO VI
B10: DISTRIBUCION DEL GASTO POR TODO CONCEPTO
B11: AÑO 2001
C13: Cámara, Tribunal Oral y Juzgados | D13: %
B14: HABERES | C14: =+Hoja5!C19 -> 5771058.3200000003 | D14: =+C14/C$18 -> 0.94627444309298858
B15: BIENES DE CONSUMO | C15: 52392 | D15: =+C15/C$18 -> 8.5906618636506608E-3
B16: SERVICIOS NO PERSONALES | C16: 275264.87 | D16: =+C16/C$18 -> 4.5134895043360761E-2
B17: BIENES DE USO
B18: Total | C18: =SUM(C14:C17) -> 6098715.1900000004 | D18: =SUM(D14:D17) -> 1
B19: NOTA: Los datos consignados corresponden a la ejecución presupuestaria del año 2001.
B20: FUENTE: Departamento de Contaduría y Oficina de Estadísticas del Poder Judicial de la Nación.