B6: PODER JUDICIAL DE LA NACION
B7: JURISDICCION FEDERAL BAHIA BLANCA
B9: COMPETENCIA PENAL
B10: CUADRO IX
B11: DISTRIBUCION PORCENTUAL,SEGÚN ELTIPO DE DELITO, DE LAS CAUSAS INGRESADAS, ELEVADAS A JUICIO Y PERSONAS CONDENADAS EN LOS JUZGADOS FEDERALES -AÑO 2001-
C13: CAUSAS | D13: % | E13: CAUSAS | F13: % | G13: PERSONAS | H13: %
B14: DELITOS | C14: INGRESADAS | E14: ELEVADAS | G14: CONDENADAS(*)
B15: DELITOS CONTRA LAS PERSONAS | C15: 5 | D15: =+(C15/C$31) -> 3.4650034650034649E-3 | F15: =+E15/E$31 -> 0 | H15: =+G15/G$31 -> 0
B16: HOMICIDIOS | D16: =+(C16/C$31) -> 0 | F16: =+E16/E$31 -> 0 | H16: =+G16/G$31 -> 0
B17: DELITOS CONTRA EL HONOR | D17: =+(C17/C$31) -> 0 | F17: =+E17/E$31 -> 0 | H17: =+G17/G$31 -> 0
B18: DELITOS CONTRA LA INTEGRIDAD SEXUAL | D18: =+(C18/C$31) -> 0 | F18: =+E18/E$31 -> 0 | H18: =+G18/G$31 -> 0
B19: DELITOS CONTRA EL ESTADO CIVIL | D19: =+(C19/C$31) -> 0 | F19: =+E19/E$31 -> 0 | H19: =+G19/G$31 -> 0
B20: DELITOS CONTRA LA LIBERTAD | C20: 28 | D20: =+(C20/C$31) -> 1.9404019404019403E-2 | E20: 3 | F20: =+E20/E$31 -> 2.097902097902098E-2 | H20: =+G20/G$31 -> 0
B21: DELITOS CONTRA LA PROPIEDAD | C21: 75 | D21: =+(C21/C$31) -> 5.1975051975051978E-2 | E21: 10 | F21: =+E21/E$31 -> 6.9930069930069935E-2 | G21: =1+2 -> 3 | H21: =+G21/G$31 -> 2.4E-2
B22: DELITOS CONTRA LA SEGURIDAD PUBLICA | C22: 21 | D22: =+(C22/C$31) -> 1.4553014553014554E-2 | F22: =+E22/E$31 -> 0 | H22: =+G22/G$31 -> 0
B23: DELITOS CONTRA EL ORDEN PUBLICO | C23: 4 | D23: =+(C23/C$31) -> 2.772002772002772E-3 | F23: =+E23/E$31 -> 0 | G23: 1 | H23: =+G23/G$31 -> 8.0000000000000002E-3
B24: DELITOS CONTRA LA SEG. DE LA NACION | D24: =+(C24/C$31) -> 0 | F24: =+E24/E$31 -> 0 | H24: =+G24/G$31 -> 0
B25: DELITOS CONTRA LOS POD. PUB. Y ORD. CONTITUC. | D25: =+(C25/C$31) -> 0 | F25: =+E25/E$31 -> 0 | H25: =+G25/G$31 -> 0
B26: DELITOS CONTRA LA ADMINISTRACION PUBLICA | C26: 56 | D26: =+(C26/C$31) -> 3.8808038808038806E-2 | E26: 5 | F26: =+E26/E$31 -> 3.4965034965034968E-2 | G26: =3+5 -> 8 | H26: =+G26/G$31 -> 6.4000000000000001E-2
B27: DELITOS CONTRA LA FE PUBLICA | C27: 439 | D27: =+(C27/C$31) -> 0.30422730422730421 | E27: 37 | F27: =+E27/E$31 -> 0.25874125874125875 | G27: 13 | H27: =+G27/G$31 -> 0.104
B28: INFRACCION LEY 23.737 (ESTUPEFACIENTES) | C28: 416 | D28: =+(C28/C$31) -> 0.28828828828828829 | E28: 71 | F28: =+E28/E$31 -> 0.49650349650349651 | G28: =41+55 -> 96 | H28: =+G28/G$31 -> 0.76800000000000002
B29: INFRACCION LEYES ESPECIALES Y DEC. LEYES | C29: =53+322+1 -> 376 | D29: =+(C29/C$31) -> 0.26056826056826055 | E29: =7+10 -> 17 | F29: =+E29/E$31 -> 0.11888111888111888 | G29: =1+3 -> 4 | H29: =+G29/G$31 -> 3.2000000000000001E-2
B30: D.G.I. | C30: 23 | D30: =+(C30/C$31) -> 1.5939015939015939E-2 | F30: =+E30/E$31 -> 0 | H30: =+G30/G$31 -> 0
B31: TOTAL | C31: =SUM(C15:C30) -> 1443 | D31: =SUM(D15:D30) -> 1 | E31: =SUM(E15:E30) -> 143 | F31: =SUM(F15:F30) -> 1 | G31: =SUM(G15:G30) -> 125 | H31: =SUM(H15:H30) -> 1
B32: FUENTE: Oficina de Estadísticas del Poder Judicial de la Nación.