B6: PODER JUDICIAL DE LA NACION
B7: JURISDICCION FEDERAL BAHIA BLANCA
B8: CUADRO IV
B9: DISTRIBUCION DE LOS CARGOS POR DEPENDENCIA -AÑO 2001-
C10: Distribución de los cargos actuales | D10: Distribución
D11: Porcentual
B12: Cámara Federal de Apelaciones de Bahía Blanca | C12: 41 | D12: =+C12/C$17 -> 0.27891156462585032
B13: Tribunal Oral en lo Criminal Federal de Bahía Blanca | C13: 13 | D13: =+C13/C$17 -> 8.8435374149659865E-2
B14: Tribunal Oral en lo Criminal Federal de Santa Rosa | C14: 13 | D14: =+C14/C$17 -> 8.8435374149659865E-2
B15: Juzgados Federales de Primera Instancia de Bahía Blanca Nros 1 y 2 | C15: 55 | D15: =+C15/C$17 -> 0.37414965986394561
B16: Juzgado Federal de Primera Instancia de Santa Rosa | C16: 25 | D16: =+C16/C$17 -> 0.17006802721088435
B17: TOTAL | C17: =SUM(C12:C16) -> 147 | D17: =SUM(D12:D16) -> 1
B18: Fuente: Oficina de Estadísticas del Poder Judicial de la Nación.