B6: PODER JUDICIAL DE LA NACION
B7: JURISDICCION FEDERAL BAHIA BLANCA
B9: CUADRO III
B10: DISTRIBUCION DE LOS CARGOS PERMANENTES Y CONTRATADOS -AÑO 2001-
C13: Cámara Federal de Apelaciones de Bahía Blanca | E13: Tribunal Oral en lo Criminal Federal de Bahía Blanca | G13: Tribunal Oral en lo Criminal Federal de Santa Rosa | I13: Juzgados Federales de Primera Instancia de Bahía Blanca Nros. 1 y 2 | K13: Juzgado Federal de Primera Instancia de Santa Rosa
C14: P | D14: C | E14: P | F14: C | G14: P | H14: C | I14: P | J14: C | K14: P | L14: C
B15: Juez (1ª o 2ª
B16: instancia) | C16: 5 | E16: 3 | G16: 3 | I16: 2 | K16: 1
B17: Secretario (1ª o 2ª instancia)
C18: 2 | E18: 1 | G18: 1 | I18: 8 | K18: 3 | L18: 1
B19: Prosecretario
B20: de Cámara | C20: 2
B21: Prosecretario Administrativo
C22: 6 | E22: 2 | G22: 2 | I22: 8 | K22: 3
B23: Oficial Mayor
C24: 7 | D24: 4 | E24: 3 | G24: 3 | H24: 1 | I24: 8 | K24: 3 | L24: 1
B25: Oficial Mayor Relator
B27: Oficial
K28: 1
B29: Escribiente
C30: 3 | E30: 1 | G30: 1 | I30: 7 | K30: 4
B31: Escribiente Auxiliar
C32: 4 | E32: 1 | G32: 1 | I32: 6 | K32: 2
B33: Auxiliar
C34: 2 | I34: 10 | K34: 3
B35: Auxiliar Administrativo
B37: Oficial
B38: de Servicio/Medio Oficial | C38: 2 | K38: 1
B39: Ayudante
C40: 4 | E40: 1 | F40: 1 | G40: 1 | I40: 6 | K40: 2
B41: Auxiliar de Servicio
B43: Total
C44: =SUM(C16:C42) -> 37 | D44: =SUM(D16:D42) -> 4 | E44: =SUM(E16:E42) -> 12 | F44: =SUM(F16:F42) -> 1 | G44: =SUM(G16:G42) -> 12 | H44: =SUM(H16:H42) -> 1 | I44: =SUM(I16:I42) -> 55 | J44: =SUM(J16:J42) -> 0 | K44: =SUM(K16:K42) -> 23 | L44: =SUM(L16:L42) -> 2
B45: Fuente: División Programación Presupuestaria. Consejo de la Magistratura.
B46: Oficina de Estadísticas del Poder Judicial de la Nación.