B6: PODER JUDICIAL DE LA NACION
B7: JURISDICCION FEDERAL BAHIA BLANCA
B9: COMPETENCIA PENAL
B10: CUADRO VII
B11: CAUSAS INGRESADAS Y ELEVADAS A JUICIO EN LOS JUZGADOS DE 1RA. INSTANCIA
B12: AÑO 2001
C14: TOTAL DE CAUSAS INGRESADAS | D14: TOTAL DE CAUSAS ELEVADAS A JUICIO (*) | E14: PORCENTAJE DE CAUSAS ELEVADAS A JUICIO
B16: Juzgado Federal de Primera Instancia de Bahía Blanca N° 1 | C16: 537 | D16: 61 | E16: =+D16/C16 -> 0.11359404096834265
B17: Juzgado Federal de Primera Instancia de Bahía Blanca N° 2 | C17: 370 | D17: 25 | E17: =+D17/C17 -> 6.7567567567567571E-2
B18: Juzgado Federal de Primera Instancia de Santa Rosa | C18: 536 | D18: 57 | E18: =+D18/C18 -> 0.10634328358208955
B19: Total | C19: =SUM(C16:C18) -> 1443 | D19: =SUM(D16:D18) -> 143 | E19: =+D19/C19 -> 9.90990990990991E-2
B20: (*): En estas cifras se incluyen causas de años anteriores y las elevaciones a juicio en causas correccionales que se resuelven en la misma instancia.
B21: FUENTE: Oficina de Estadísticas del Poder Judicial de la Nación.