B6: PODER JUDICIAL DE LA NACION
B7: JURISDICCION FEDERAL BAHIA BLANCA
B8: CUADRO V
B9: DISTRIBUCION ANUAL DEL GASTO EN CONCEPTO DE LIQUIDACION DE HABERES
B10: AÑO 2001
C12: Gasto (Haberes) | D12: %
B13: Cámara Federal de Apelaciones de Bahía Blanca | C13: 1639648.343949287 | D13: =+C13/C$19 -> 0.28411571206393332
B14: Tribunal Oral en lo Criminal Federal de Bahía Blanca | C14: 716140.94841320137 | D14: =+C14/C$19 -> 0.12409178849074624
B15: Juzgado Federal de Primera Instancia de Bahía Blanca N° 1 | C15: 925870.69572627312 | D15: =+C15/C$19 -> 0.16043343255042225
B16: Juzgado Federal de Primera Instancia de Bahía Blanca N° 2 | C16: 825849.02248305152 | D16: =+C16/C$19 -> 0.14310183274721291
B17: Tribunal Oral en lo Criminal Federal de Santa Rosa | C17: 825140.14376820216 | D17: =+C17/C$19 -> 0.14297899934724662
B18: Juzgado Federal de Primera Instancia de Santa Rosa | C18: 838409.16565998469 | D18: =+C18/C$19 -> 0.14527823480043858
B19: TOTAL | C19: =SUM(C13:C18) -> 5771058.3200000003 | D19: =SUM(D13:D18) -> 1
B20: Nota: Los datos registrados corresponden a la ejecución presupuestaria del año 2001.
B21: Fuente: Departamento de Contaduría y Oficina de Estadísticas del Poder Judicial de la Nación.