B6: PODER JUDICIAL DE LA NACION
B7: JURISDICCION FEDERAL BAHIA BLANCA
B9: COMPETENCIA CIVIL
B10: CUADRO XI
B11: DISTRIBUCION PORCENTUAL,SEGÚN EL OBJETO DE LITIGIO,DE LOS EXPEDIENTES INGRESADOS,RESUELTOS O SALIDOS Y SENTENCIAS DICTADAS EN LOS JUZGADOS FEDERALES DE PRIMERA INSTANCIA -AÑO 2001-
B13: OBJETO | C13: INGRESADOS | D13: % | E13: RESUELTOS O SALIDOS | F13: % | G13: SENTENCIAS DEFINITIVAS | H13: % | I13: SENTENCIAS INTERLOCUTORIAS | J13: %
B14: ORDINARIOS | C14: =+'K:\[BORRCIVIL.xls]Bahía Blanca'!$Q11 -> 98 | D14: =+C14/C$27 -> 1.9886363636363636E-2 | E14: =+'K:\[BORRCIVIL.xls]Bahía Blanca'!$Q38 -> 77 | F14: =+E14/E$27 -> 2.0316622691292877E-2 | G14: =+'K:\[BORRCIVIL.xls]Bahía Blanca'!$Q65 -> 45 | H14: =+G14/G$27 -> 7.1202531645569625E-2 | I14: =+'K:\[BORRCIVIL.xls]Bahía Blanca'!$Q88 -> 49 | J14: =+I14/I$27 -> 2.024793388429752E-2
B15: SUMARIOS | C15: =+'K:\[BORRCIVIL.xls]Bahía Blanca'!$Q12 -> 82 | D15: =+C15/C$27 -> 1.6639610389610388E-2 | E15: =+'K:\[BORRCIVIL.xls]Bahía Blanca'!$Q39 -> 93 | F15: =+E15/E$27 -> 2.453825857519789E-2 | G15: =+'K:\[BORRCIVIL.xls]Bahía Blanca'!$Q66 -> 56 | H15: =+G15/G$27 -> 8.8607594936708861E-2 | I15: =+'K:\[BORRCIVIL.xls]Bahía Blanca'!$Q89 -> 53 | J15: =+I15/I$27 -> 2.1900826446280993E-2
B16: SUMARISIMOS | C16: =+'K:\[BORRCIVIL.xls]Bahía Blanca'!$Q13 -> 104 | D16: =+C16/C$27 -> 2.1103896103896104E-2 | E16: =+'K:\[BORRCIVIL.xls]Bahía Blanca'!$Q40 -> 26 | F16: =+E16/E$27 -> 6.8601583113456462E-3 | G16: =+'K:\[BORRCIVIL.xls]Bahía Blanca'!$Q67 -> 6 | H16: =+G16/G$27 -> 9.4936708860759497E-3 | I16: =+'K:\[BORRCIVIL.xls]Bahía Blanca'!$Q90 -> 78 | J16: =+I16/I$27 -> 3.2231404958677684E-2
B17: EJECUTIVOS | C17: =+'K:\[BORRCIVIL.xls]Bahía Blanca'!$Q14 -> 513 | D17: =+C17/C$27 -> 0.10409902597402597 | E17: =+'K:\[BORRCIVIL.xls]Bahía Blanca'!$Q41 -> 163 | F17: =+E17/E$27 -> 4.3007915567282319E-2 | G17: =+'K:\[BORRCIVIL.xls]Bahía Blanca'!$Q68 -> 69 | H17: =+G17/G$27 -> 0.10917721518987342 | I17: =+'K:\[BORRCIVIL.xls]Bahía Blanca'!$Q91 -> 363 | J17: =+I17/I$27 -> 00.15
B18: EJECUCIONES FISCALES | C18: =+'K:\[BORRCIVIL.xls]Bahía Blanca'!$Q15 -> 3393 | D18: =+C18/C$27 -> 0.68851461038961037 | E18: =+'K:\[BORRCIVIL.xls]Bahía Blanca'!$Q42 -> 2859 | F18: =+E18/E$27 -> 0.75435356200527703 | G18: =+'K:\[BORRCIVIL.xls]Bahía Blanca'!$Q69 -> 18 | H18: =+G18/G$27 -> 2.8481012658227847E-2 | I18: =+'K:\[BORRCIVIL.xls]Bahía Blanca'!$Q92 -> 1674 | J18: =+I18/I$27 -> 0.69173553719008263
B19: LABORALES | C19: =+'K:\[BORRCIVIL.xls]Bahía Blanca'!$Q16 -> 23 | D19: =+C19/C$27 -> 4.667207792207792E-3 | E19: =+'K:\[BORRCIVIL.xls]Bahía Blanca'!$Q43 -> 113 | F19: =+E19/E$27 -> 2.9815303430079154E-2 | G19: =+'K:\[BORRCIVIL.xls]Bahía Blanca'!$Q70 -> 19 | H19: =+G19/G$27 -> 3.0063291139240507E-2 | I19: =+'K:\[BORRCIVIL.xls]Bahía Blanca'!$Q93 -> 68 | J19: =+I19/I$27 -> 2.809917355371901E-2
B20: CIUDADANIA | C20: =+'K:\[BORRCIVIL.xls]Bahía Blanca'!$Q17 -> 139 | D20: =+C20/C$27 -> 2.8206168831168832E-2 | E20: =+'K:\[BORRCIVIL.xls]Bahía Blanca'!$Q44 -> 72 | F20: =+E20/E$27 -> 1.8997361477572559E-2 | G20: =+'K:\[BORRCIVIL.xls]Bahía Blanca'!$Q71 -> 77 | H20: =+G20/G$27 -> 0.12183544303797468 | I20: =+'K:\[BORRCIVIL.xls]Bahía Blanca'!$Q94 -> 1 | J20: =+I20/I$27 -> 4.1322314049586776E-4
B21: AMPAROS (LEY 16.986) | C21: =+'K:\[BORRCIVIL.xls]Bahía Blanca'!$Q18 -> 180 | D21: =+C21/C$27 -> 3.6525974025974024E-2 | E21: =+'K:\[BORRCIVIL.xls]Bahía Blanca'!$Q45 -> 85 | F21: =+E21/E$27 -> 2.2427440633245383E-2 | G21: =+'K:\[BORRCIVIL.xls]Bahía Blanca'!$Q72 -> 73 | H21: =+G21/G$27 -> 0.11550632911392406 | I21: =+'K:\[BORRCIVIL.xls]Bahía Blanca'!$Q95 -> 54 | J21: =+I21/I$27 -> 2.2314049586776859E-2
B22: AMPAROS POR MORA | C22: =+'K:\[BORRCIVIL.xls]Bahía Blanca'!$Q19 -> 16 | D22: =+C22/C$27 -> 3.246753246753247E-3 | E22: =+'K:\[BORRCIVIL.xls]Bahía Blanca'!$Q46 -> 0 | F22: =+E22/E$27 -> 0 | G22: =+'K:\[BORRCIVIL.xls]Bahía Blanca'!$Q73 -> 4 | H22: =+G22/G$27 -> 6.3291139240506328E-3 | I22: =+'K:\[BORRCIVIL.xls]Bahía Blanca'!$Q96 -> 11 | J22: =+I22/I$27 -> 4.5454545454545452E-3
B23: EXPROPIACIONES | C23: =+'K:\[BORRCIVIL.xls]Bahía Blanca'!$Q20 -> 0 | D23: =+C23/C$27 -> 0 | E23: =+'K:\[BORRCIVIL.xls]Bahía Blanca'!$Q47 -> 12 | F23: =+E23/E$27 -> 3.1662269129287598E-3 | G23: =+'K:\[BORRCIVIL.xls]Bahía Blanca'!$Q74 -> 0 | H23: =+G23/G$27 -> 0 | I23: =+'K:\[BORRCIVIL.xls]Bahía Blanca'!$Q97 -> 0 | J23: =+I23/I$27 -> 0
B24: LEY 24.463 (ART. 15 SEG. SOC.) | C24: =+'K:\[BORRCIVIL.xls]Bahía Blanca'!$Q21 -> 130 | D24: =+C24/C$27 -> 2.6379870129870128E-2 | E24: =+'K:\[BORRCIVIL.xls]Bahía Blanca'!$Q48 -> 191 | F24: =+E24/E$27 -> 5.0395778364116094E-2 | G24: =+'K:\[BORRCIVIL.xls]Bahía Blanca'!$Q75 -> 262 | H24: =+G24/G$27 -> 0.41455696202531644 | I24: =+'K:\[BORRCIVIL.xls]Bahía Blanca'!$Q98 -> 48 | J24: =+I24/I$27 -> 1.9834710743801654E-2
B25: LEYES ESPECIALES | C25: =+'K:\[BORRCIVIL.xls]Bahía Blanca'!$Q22 -> 26 | D25: =+C25/C$27 -> 5.275974025974026E-3 | E25: =+'K:\[BORRCIVIL.xls]Bahía Blanca'!$Q49 -> 3 | F25: =+E25/E$27 -> 7.9155672823218995E-4 | G25: =+'K:\[BORRCIVIL.xls]Bahía Blanca'!$Q76 -> 1 | H25: =+G25/G$27 -> 1.5822784810126582E-3 | I25: =+'K:\[BORRCIVIL.xls]Bahía Blanca'!$Q99 -> 7 | J25: =+I25/I$27 -> 2.8925619834710742E-3
B26: CAUTELARES | C26: =+'K:\[BORRCIVIL.xls]Bahía Blanca'!$Q23 -> 224 | D26: =+C26/C$27 -> 4.5454545454545456E-2 | E26: =+'K:\[BORRCIVIL.xls]Bahía Blanca'!$Q50 -> 96 | F26: =+E26/E$27 -> 2.5329815303430078E-2 | G26: =+'K:\[BORRCIVIL.xls]Bahía Blanca'!$Q77 -> 2 | H26: =+G26/G$27 -> 3.1645569620253164E-3 | I26: =+'K:\[BORRCIVIL.xls]Bahía Blanca'!$Q100 -> 14 | J26: =+I26/I$27 -> 5.7851239669421484E-3
B27: TOTAL | C27: =SUM(C14:C26) -> 4928 | D27: =SUM(D14:D26) -> 1 | E27: =SUM(E14:E26) -> 3790 | F27: =SUM(F14:F26) -> 1 | G27: =SUM(G14:G26) -> 632 | H27: =SUM(H14:H26) -> 1 | I27: =SUM(I14:I26) -> 2420 | J27: =SUM(J14:J26) -> 1
B28: FUENTE: Oficina de Estadísticas del Poder Judicial de la Nación.