B6: PODER JUDICIAL DE LA NACION
B7: JURISDICCIÓN FEDERAL BAHIA BLANCA
B8: CUADRO XII
B9: INDICE DE LITIGIOSIDAD EN LOS JUZGADOS FEDERALES DE PRIMERA INSTANCIA -AÑO 2001-
B14: 1- COMPETENCIA PENAL
B16: Dependencias | C16: Causas ingresadas | D16: Cantidad de habitantes en la jurisdicción | E16: Causas ingresadas
E17: c/10.000 hab.
B18: Juzgado Federal de Primera Instancia de Bahía Blanca N° 1 | C18: 537 | D18: 642235 | E18: =+(C18/D18)*10000 -> 8.3614253349630587
B19: Juzgado Federal de Primera Instancia de Bahía Blanca N° 2 | C19: 370
B20: Juzgado Federal de Primera Instancia de Santa Rosa | C20: 536 | D20: 298460 | E20: =+(C20/D20)*10000 -> 17.958855458017826
B21: TOTAL | C21: =SUM(C18:C20) -> 1443 | D21: =642235+298460 -> 940695 | E21: =+(C21/D21)*10000 -> 15.33972222665157
B23: FUENTE: INDEC (Censo Nacional de Población, Hogares y Viviendas 2001 e Instituto Geografico Militar). Oficina de Estadísticas del
B24: Poder Judicial de la Nación.
B26: 2- COMPETENCIA CIVIL
B28: Dependencias | C28: Causas ingresadas | D28: Cantidad de habitantes en la jurisdicción | E28: Causas ingresadas
E29: c/10.000 hab.
B30: Juzgado Federal de Primera Instancia de Bahía Blanca N° 1 | C30: 1709 | D30: 642235 | E30: =+(C30/D30)*10000 -> 26.610197201958783
B31: Juzgado Federal de Primera Instancia de Bahía Blanca N° 2 | C31: 2125
B32: Juzgado Federal de Primera Instancia de Santa Rosa | C32: 1094 | D32: 298460 | E32: =+(C32/D32)*10000 -> 36.654828117670711
B33: TOTAL | C33: =SUM(C30:C32) -> 4928 | D33: =642235+298460 -> 940695 | E33: =+(C33/D33)*10000 -> 52.386799121925812
B35: FUENTE: INDEC (Censo Nacional de Población, Hogares y Viviendas 2001 e Instituto Geografico Militar). Oficina de Estadísticas del
B36: Poder Judicial de la Nación.