B6: PODER JUDICIAL DE LA NACION
B8: JURISDICCION FEDERAL LA PLATA
B9: COMPETENCIA CIVIL
B10: CUADRO X
B11: CAUSAS INGRESADAS, RESUELTAS O SALIDAS Y SENTENCIAS DICTADAS EN LOS JUZGADOS FEDERALES DE PRIMERA INSTANCIA -AÑO 2001-
C13: CAUSAS INGRESADAS | D13: CAUSAS RESUELTAS O SALIDAS | E13: SENTENCIAS DICTADAS
E14: DEFINITIVAS | F14: INTERLOCUTORIAS
B15: Juzgado Federal de Primera Instancia de La Plata N° 1 (*) | C15: 72 | D15: =42+26 -> 68 | E15: 1
B16: Juzgado Federal de Primera Instancia de La Plata N° 2 | C16: 6176 | D16: =354+30 -> 384 | E16: 3550 | F16: 250
B17: Juzgado Federal de Primera Instancia de La Plata N° 4 | C17: 4867 | D17: 520 | E17: 6010 | F17: 955
B18: Juzgado Federal de Primera Instancia de Lomas de Zamora N° 3 | C18: 8731 | D18: =4126+257 -> 4383 | E18: 87 | F18: 6238
B19: Juzgado Federal de Primera Instancia de Junín | C19: 1929 | D19: =24+314 -> 338 | E19: =145+122 -> 267 | F19: =195+980 -> 1175
B20: Total | C20: =SUM(C15:C19) -> 21775 | D20: =SUM(D15:D19) -> 5693 | E20: =SUM(E15:E19) -> 9915 | F20: =SUM(F15:F19) -> 8618
B21: REFERENCIAS: (*) Una Secretaría Civil residual.
B22: FUENTE: Oficina de Estadísticas del Poder Judicial de la Nación.