B6: PODER JUDICIAL DE LA NACION
B7: JURISDICCION FEDERAL LA PLATA
B9: CUADRO II
B10: DENSIDAD DE POBLACION POR COMPETENCIA TERRITORIAL -AÑO 2001-
C12: POBLACION TOTAL (2001) | D12: SUPERFICIE (Km2) | E12: DENSIDAD DE
E14: POBLACION (hab/km2)
B15: Cámara Federal de Apelaciones | C15: 4903402 | D15: 75660 | E15: =+C15/D15 -> 64.808379592915671
B16: de La Plata
B17: Tribunales Orales en lo Criminal Federal | C17: 4903402 | D17: 75660 | E17: =+C17/D17 -> 64.808379592915671
B18: de La Plata Nros. 1 y 2
B19: Juzgados Federales de Primera Instancia
B20: de La Plata Nros. 1, 2, 3 y 4 | C20: 2263520 | D20: =135+1130+101+1240+926+1863+1890+1627+55+188+190+125 -> 9470 | E20: =+C20/D20 -> 239.02006335797253
B21: Juzgados Federales de Primera Instancia
B22: de Lomas de Zamora Nros. 1, 2 y 3 | C22: 2113836 | D22: =1203+760+1740+121+666+122+120+223+45+89 -> 5089 | E22: =+C22/D22 -> 415.37355079583415
B23: Juzgado Federal de Primera Instancia de
B24: Junín | C24: 526046 | D24: =2446+3933+2290+1825+1522+2545+2150+7265+1663+2260+1600+5772+4230+4560+1853+3940+2050+1630+797+5500+1270 -> 61101 | E24: =+C24/D24 -> 8.6094499271697682
B25: FUENTE: INDEC (Censo Nacional de Población, Hogares y Viviendas 2001) E INSTITUTO GEOGRAFICO MILITAR
B26: Oficina de Estadísticas del Poder Judicial de la Nación.