B6: PODER JUDICIAL DE LA NACION
B7: JURISDICCION FEDERAL LA PLATA
B8: COMPETENCIA CIVIL
B9: CUADRO XI
B10: DISTRIBUCION PORCENTUAL, SEGÚN EL OBJETO DE LITIGIO, DE LOS EXPEDIENTES INGRESADOS, RESUELTOS O SALIDOS Y SENTENCIAS DICTADAS EN LOS JUZGADOS FEDERALES DE PRIMERA INSTANCIA AÑO 2001-
B12: OBJETO | C12: INGRESADOS | D12: % | E12: RESUELTOS O SALIDOS | F12: % | G12: SENTENCIAS DEFINITIVAS | H12: % | I12: SENTENCIAS INTERLOCUTORIAS | J12: %
B13: ORDINARIOS | C13: 154 | D13: =+C13/C$26 -> 7.0723306544202063E-3 | E13: 15 | F13: =+E13/E$26 -> 2.6348146847005095E-3 | G13: 89 | H13: =+G13/G$26 -> 8.9762985375693386E-3 | I13: 53 | J13: =+I13/I$26 -> 6.1499187746576929E-3
B14: SUMARIOS | C14: 707 | D14: =+C14/C$26 -> 3.2468427095292768E-2 | E14: 81 | F14: =+E14/E$26 -> 1.422799929738275E-2 | G14: 235 | H14: =+G14/G$26 -> 2.3701462430660614E-2 | I14: 177 | J14: =+I14/I$26 -> 2.0538407983290787E-2
B15: SUMARISIMOS | C15: 13 | D15: =+C15/C$26 -> 5.9701492537313433E-4 | E15: 12 | F15: =+E15/E$26 -> 2.1078517477604074E-3 | G15: 4 | H15: =+G15/G$26 -> 4.0342914775592535E-4 | I15: 11 | J15: =+I15/I$26 -> 1.2763982362497099E-3
B16: EJECUTIVOS | C16: 13443 | D16: =+C16/C$26 -> 0.61735935706084955 | E16: 4354 | F16: =+E16/E$26 -> 0.76479887581240125 | G16: 5180 | H16: =+G16/G$26 -> 0.52244074634392335 | I16: 7671 | J16: =+I16/I$26 -> 0.89011371547922957
B17: EJECUCIONES FISCALES | D17: =+C17/C$26 -> 0 | F17: =+E17/E$26 -> 0 | H17: =+G17/G$26 -> 0 | J17: =+I17/I$26 -> 0
B18: LABORALES | C18: 30 | D18: =+C18/C$26 -> 1.3777267508610792E-3 | E18: 1 | F18: =+E18/E$26 -> 1.756543123133673E-4 | G18: 160 | H18: =+G18/G$26 -> 1.6137165910237016E-2 | I18: 183 | J18: =+I18/I$26 -> 2.1234625203063354E-2
B19: CIUDADANIA | C19: 1814 | D19: =+C19/C$26 -> 8.3306544202066596E-2 | E19: 681 | F19: =+E19/E$26 -> 0.11962058668540312 | G19: 883 | H19: =+G19/G$26 -> 8.905698436712052E-2 | I19: 229 | J19: =+I19/I$26 -> 2.6572290554653051E-2
B20: AMPAROS (LEY 16.986) | C20: 327 | D20: =+C20/C$26 -> 1.5017221584385763E-2 | E20: 47 | F20: =+E20/E$26 -> 8.2557526787282627E-3 | G20: 36 | H20: =+G20/G$26 -> 3.6308623298033282E-3 | I20: 118 | J20: =+I20/I$26 -> 1.3692271988860524E-2
B21: AMPAROS POR MORA | C21: 33 | D21: =+C21/C$26 -> 1.515499425947187E-3 | E21: 10 | F21: =+E21/E$26 -> 1.7565431231336729E-3 | G21: 15 | H21: =+G21/G$26 -> 1.5128593040847202E-3 | I21: 4 | J21: =+I21/I$26 -> 4.6414481318171272E-4
B22: EXPROPIACIONES | D22: =+C22/C$26 -> 0 | F22: =+E22/E$26 -> 0 | H22: =+G22/G$26 -> 0 | J22: =+I22/I$26 -> 0
B23: LEY 24.463 (ART. 15 SEG. SOC.) | D23: =+C23/C$26 -> 0 | F23: =+E23/E$26 -> 0 | H23: =+G23/G$26 -> 0 | J23: =+I23/I$26 -> 0
B24: LEYES ESPECIALES | C24: =29+328 -> 357 | D24: =+C24/C$26 -> 1.6394948335246844E-2 | E24: =46+284 -> 330 | F24: =+E24/E$26 -> 5.7965923063411209E-2 | G24: 50 | H24: =+G24/G$26 -> 5.0428643469490669E-3 | I24: 6 | J24: =+I24/I$26 -> 6.9621721977256902E-4
B25: CAUTELARES | C25: 4897 | D25: =+C25/C$26 -> 0.22489092996555682 | E25: 162 | F25: =+E25/E$26 -> 2.84559985947655E-2 | G25: 3263 | H25: =+G25/G$26 -> 0.32909732728189611 | I25: 166 | J25: =+I25/I$26 -> 1.9262009747041078E-2
B26: TOTAL | C26: =SUM(C13:C25) -> 21775 | D26: =SUM(D13:D25) -> 1 | E26: =SUM(E13:E25) -> 5693 | F26: =SUM(F13:F25) -> 1 | G26: =SUM(G13:G25) -> 9915 | H26: =SUM(H13:H25) -> 1 | I26: =SUM(I13:I25) -> 8618 | J26: =SUM(J13:J25) -> 1
B27: FUENTE: Oficina de Estadísticias del Poder Judicial de la Nación.