B6: PODER JUDICIAL DE LA NACION
B7: JURISDICCION FEDERAL LA PLATA
B9: CUADRO VI
B10: DISTRIBUCION ANUAL DEL GASTO POR TODO CONCEPTO -AÑO 2001-
C12: Cámara, Tribunal Oral y Juzgados | D12: %
B13: HABERES | C13: =+Hoja5!C23 -> 12223983.470000001 | D13: =+C13/C$17 -> 0.93792406406582163
B14: BIENES DE CONSUMO | C14: 108526.52 | D14: =+C14/C$17 -> 8.3270428945794919E-3
B15: SERVICIOS NO PERSONALES | C15: 485742.81 | D15: =+C15/C$17 -> 3.7270164146086839E-2
B16: BIENES DE USO | C16: 214767.61 | D16: =+C16/C$17 -> 1.6478728893512106E-2
B17: Total | C17: =SUM(C13:C16) -> 13033020.41 | D17: =SUM(D13:D16) -> 1
B18: Nota: Los datos consignados corresponden a la ejecución presupuestaria del año 2001.
B19: FUENTE: Departamento de Contaduría y Oficina de Estadísticas del Poder Judicial de la Nación.