B6: PODER JUDICIAL DE LA NACION
B7: JURISDICCION FEDERAL LA PLATA
B9: CUADRO V
B10: DISTRIBUCION ANUAL DEL GASTO EN CONCEPTO DE LIQUIDACION DE HABERES -AÑO 2001-
C12: Gasto (Haberes) | D12: %
B13: Cámara Federal de Apelaciones de La Plata | C13: 4418736.1720495913 | D13: =+C13/C$23 -> 0.36148086938222856
B14: Tribunales Orales en lo Criminal Federal de La Plata Nros. 1 y 2 | C14: 1139718.8041636348 | D14: =+C14/C$23 -> 9.3236284797073174E-2
B15: Juzgado Federal de Primera Instancia de La Plata N° 1 | C15: 831434.27872320963 | D15: =+C15/C$23 -> 6.8016639646454755E-2
B16: Juzgado Federal de Primera Instancia de La Plata N° 2 | C16: 856203.4070681975 | D16: =+C16/C$23 -> 7.0042912702678706E-2
B17: Juzgado Federal de Primera Instancia de La Plata N° 3 | C17: 692567.71927657723 | D17: =+C17/C$23 -> 5.6656467261778552E-2
B18: Juzgado Federal de Primera Instancia de La Plata N° 4 | C18: 834707.76260610216 | D18: =+C18/C$23 -> 6.8284431556589961E-2
B19: Juzgado Federal de Primera Instancia de Lomas de Zamora N° 1 | C19: 1100235.5882585254 | D19: =+C19/C$23 -> 9.0006305306180631E-2
B20: Juzgado Federal de Primera Instancia de Lomas de Zamora N° 2 | C20: 613283.13843445072 | D20: =+C20/C$23 -> 5.0170481655146634E-2
B21: Juzgado Federal de Primera Instancia de Lomas de Zamora N° 3 | C21: 1007454.2532640314 | D21: =+C21/C$23 -> 8.2416198920467892E-2
B22: Juzgado Federal de Primera Instancia de Junín | C22: 729642.34615567944 | D22: =+C22/C$23 -> 5.9689408771401047E-2
B23: TOTAL | C23: =SUM(C13:C22) -> 12223983.470000001 | D23: =SUM(D13:D22) -> 1
B24: Nota: Los datos consignados corresponden a la ejecución presupuestaria del año 2001.
B25: FUENTE: Departamento de Contaduría y Oficina de Estadísticas del Poder Judicial de la Nación.