B6: PODER JUDICIAL DE LA NACION
B7: JURISDICCION FEDERAL LA PLATA
B9: CUADRO III
B10: DISTRIBUCION DE LOS CARGOS PERMANENTES Y CONTRATADOS -AÑO 2001-
C12: Cámara Federal de Apelaciones de La Plata | E12: Tribunales Orales en lo Criminal Federal de La Plata Nros 1 y 2 | G12: Juzgados Federales de Primera Instancia de La Plata Nros 1 al 4 | I12: Juzgados Federales de Primera Instancia de Lomas de Zamora Nros 1 al 3 | K12: Juzgado Federal de Primera Instancia de Junín
C13: P | D13: C | E13: P | F13: C | G13: P | H13: C | I13: P | J13: C | K13: P | L13: C
B14: Juez (1ª o 2ª
B15: instancia) | C15: 9 | E15: 6 | G15: 4 | I15: 3 | K15: 1
B16: Secretario (1ª o 2ª instancia)
C17: 7 | D17: 9 | E17: 2 | F17: 1 | G17: 14 | H17: 3 | I17: 10 | J17: 4 | K17: 3
B18: Prosecretario Administrativo
B19: Jefe | C19: 1
B20: Prosecretario Administrativo
C21: 14 | D21: 3 | E21: 3 | G21: 16 | I21: 11 | J21: 4 | K21: 3
B22: Oficial Mayor
C23: 22 | D23: 10 | E23: 6 | G23: 12 | I23: 17 | J23: 2 | K23: 3
B24: Oficial Mayor Relator
B26: Oficial
C27: 3 | G27: 1 | I27: 3 | K27: 1
B28: Escribiente
C29: 15 | E29: 4 | G29: 21 | I29: 13 | J29: 1 | K29: 4
B30: Escribiente Auxiliar
C31: 10 | E31: 2 | G31: 21 | I31: 9 | J31: 1 | K31: 4
B32: Auxiliar
C33: 8 | G33: 18 | I33: 12 | J33: 1 | K33: 4
B34: Auxiliar Administrativo
B36: Enc. de sección/ Oficial
B37: de Servicio/Medio Oficial | C37: 15 | I37: 4
B38: Ayudante
C39: 22 | D39: 2 | E39: 2 | G39: 18 | I39: 10 | J39: 1 | K39: 2
B40: Auxiliar de Servicio
B42: Total
C43: =SUM(C15:C41) -> 126 | D43: =SUM(D15:D41) -> 24 | E43: =SUM(E15:E41) -> 25 | F43: =SUM(F15:F41) -> 1 | G43: =SUM(G15:G41) -> 125 | H43: =SUM(H15:H41) -> 3 | I43: =SUM(I15:I41) -> 92 | J43: =SUM(J15:J41) -> 14 | K43: =SUM(K15:K41) -> 25 | L43: =SUM(L15:L41) -> 0
B44: Fuente: División Programación Presupuestaria. Consejo de la Magistratura.
B45: Oficina de Estadísticas del Poder Judicial de la Nación.