B6: PODER JUDICIAL DE LA NACION
B7: JURISDICCION FEDERAL LA PLATA
B8: COMPETENCIA PENAL
B9: CUADRO VII
B10: CAUSAS INGRESADAS Y ELEVADAS A JUICIO EN LOS JUZGADOS DE 1RA. INSTANCIA -AÑO 2001-
C12: TOTAL DE CAUSAS INGRESADAS | D12: TOTAL DE CAUSAS ELEVADAS A JUICIO (*) | E12: PORCENTAJE DE CAUSAS ELEVADAS A JUICIO
B14: Juzgado Federal de Primera Instancia de La Plata N° 1 | C14: 1984 | D14: 49 | E14: =+D14/C14 -> 2.4697580645161289E-2
B15: Juzgado Federal de Primera Instancia de La Plata N° 3 | C15: 1827 | D15: 81 | E15: =+D15/C15 -> 4.4334975369458129E-2
B16: Juzgado Federal de Primera Instancia de Lomas de Zamora N° 1 | C16: 1125 | D16: 88 | E16: =+D16/C16 -> 7.8222222222222221E-2
B17: Juzgado Federal de Primera Instancia de Lomas de Zamora N° 2 | C17: 1339 | D17: 66 | E17: =+D17/C17 -> 4.9290515309932788E-2
B18: Juzgado Federal de Primera Instancia de Junín | C18: 642 | D18: 32 | E18: =+D18/C18 -> 4.9844236760124609E-2
B19: Total | C19: =SUM(C14:C18) -> 6917 | D19: =SUM(D14:D18) -> 316 | E19: =+D19/C19 -> 4.5684545323116957E-2
B20: (*): En estas cifras se incluyen causas de años anteriores y las elevaciones a juicio en causas correccionales que se resuelven en la misma instancia.
B21: FUENTE: Oficina de Estadísticas del Poder Judicial de la Nación.