B6: PODER JUDICIAL DE LA NACION
B7: JURISDICCIÓN FEDERAL LA PLATA
B8: CUADRO XII
B9: INDICE DE LITIGIOSIDAD EN LOS JUZGADOS FEDERALES DE PRIMERA INSTANCIA -AÑO 2001-
B13: 1- COMPETENCIA PENAL
B15: Dependencias | C15: Causas ingresadas | D15: Cantidad de habitantes en la jurisdicción | E15: Causas ingresadas
E16: c/10.000 hab.
B17: Juzgado Federal de Primera Instancia de La Plata N° 1 | C17: 1984 | D17: 2263520 | E17: =+(C17/D17)*10000 -> 8.765109210433307
B18: Juzgado Federal de Primera Instancia de La Plata N° 3 | C18: 1827 | D18: 2263520 | E18: =+(C18/D18)*10000 -> 8.0714992577931728
B19: Juzgado Federal de Primera Instancia de Lomas de Zamora N° 1 | C19: 1125 | D19: 2113836 | E19: =+(C19/D19)*10000 -> 5.3220779663133753
B20: Juzgado Federal de Primera Instancia de Lomas de Zamora N° 2 | C20: 1339 | D20: 2113836 | E20: =+(C20/D20)*10000 -> 6.3344554639054307
B21: Juzgado Federal de Primera Instancia de Junín | C21: 642 | D21: 526046 | E21: =+(C21/D21)*10000 -> 12.204255901575147
B22: TOTAL | C22: =SUM(C17:C21) -> 6917 | D22: 4903402 | E22: =+(C22/D22)*10000 -> 14.106532566573167
B24: FUENTE: INDEC (Censo Nacional de Población, Hogares y Viviendas 2001 e Instituto Geografico Militar).
B25: Oficina de Estadísticas del Poder Judicial de la Nación.
B27: 2- COMPETENCIA CIVIL
B29: Dependencias | C29: Causas ingresadas | D29: Cantidad de habitantes en la jurisdicción | E29: Causas ingresadas
E30: c/10.000 hab.
B31: Juzgado Federal de Primera Instancia de La Plata N°1 (*) | C31: 72 | D31: 2263520 | E31: =+(C31/D31)*10000 -> 0.31808864070120874
B32: Juzgado Federal de Primera Instancia de La Plata N°2 | C32: 6176 | D32: 2263520 | E32: =+(C32/D32)*10000 -> 27.284936735703681
B33: Juzgado Federal de Primera Instancia de La Plata N°4 | C33: 4867 | D33: 2263520 | E33: =+(C33/D33)*10000 -> 21.501908531844208
B34: Juzgado Federal de Primera Instancia de Lomas de Zamora N°3 | C34: 8731 | D34: 2113836 | E34: =+(C34/D34)*10000 -> 41.304055754561844
B35: Juzgado Federal de Primera Instancia de Junín | C35: 1929 | D35: 526046 | E35: =+(C35/D35)*10000 -> 36.66979693791037
B36: TOTAL | C36: =SUM(C31:C35) -> 21775 | D36: 4903402 | E36: =+(C36/D36)*10000 -> 44.407943709285924
B37: FUENTE: INDEC (Censo Nacional de Población, Hogares y Viviendas 2001 e Instituto Geografico Militar). Oficina de Estadísticas del Poder
B38: Judicial de la Nación.
B39: REFERENCIAS: (*) Secretaría Civil residual.