B6: PODER JUDICIAL DE LA NACION
B7: JURISDICCION FEDERAL LA PLATA
B8: COMPETENCIA PENAL
B9: CUADRO IX
B10: DISTRIBUCION PORCENTUAL, SEGÚN EL TIPO DE DELITO, DE LAS CAUSAS INGRESADAS, ELEVADAS A JUICIO Y PERSONAS CONDENADAS EN LOS JUZGADOS FEDERALES -AÑO 2001-
C12: CAUSAS | D12: % | E12: CAUSAS | F12: % | G12: PERSONAS | H12: %
B13: DELITOS | C13: INGRESADAS | E13: ELEVADAS | G13: CONDENADAS
B14: DELITOS CONTRA LAS PERSONAS | C14: 201 | D14: =+(C14/C$30) -> 2.9058840537805407E-2 | F14: =+E14/E$30 -> 0 | H14: =+G14/G$30 -> 0
B15: HOMICIDIOS | C15: 9 | D15: =+(C15/C$30) -> 1.3011421136330779E-3 | F15: =+E15/E$30 -> 0 | H15: =+G15/G$30 -> 0
B16: DELITOS CONTRA EL HONOR | C16: 1 | D16: =+(C16/C$30) -> 1.4457134595923088E-4 | F16: =+E16/E$30 -> 0 | H16: =+G16/G$30 -> 0
B17: DELITOS CONTRA LA INTEGRIDAD SEXUAL | D17: =+(C17/C$30) -> 0 | F17: =+E17/E$30 -> 0 | H17: =+G17/G$30 -> 0
B18: DELITOS CONTRA EL ESTADO CIVIL | C18: 3 | D18: =+(C18/C$30) -> 4.3371403787769266E-4 | F18: =+E18/E$30 -> 0 | H18: =+G18/G$30 -> 0
B19: DELITOS CONTRA LA LIBERTAD | C19: 159 | D19: =+(C19/C$30) -> 2.2986844007517711E-2 | E19: 4 | F19: =+E19/E$30 -> 1.2658227848101266E-2 | G19: 1 | H19: =+G19/G$30 -> 5.0000000000000001E-3
B20: DELITOS CONTRA LA PROPIEDAD | C20: 254 | D20: =+(C20/C$30) -> 3.6721121873644645E-2 | E20: 17 | F20: =+E20/E$30 -> 5.3797468354430382E-2 | G20: 2 | H20: =+G20/G$30 -> 00.01
B21: DELITOS CONTRA LA SEGURIDAD PUBLICA | C21: 431 | D21: =+(C21/C$30) -> 6.2310250108428507E-2 | E21: 1 | F21: =+E21/E$30 -> 3.1645569620253164E-3 | G21: 3 | H21: =+G21/G$30 -> 1.4999999999999999E-2
B22: DELITOS CONTRA EL ORDEN PUBLICO | C22: 100 | D22: =+(C22/C$30) -> 1.4457134595923089E-2 | E22: 1 | F22: =+E22/E$30 -> 3.1645569620253164E-3 | H22: =+G22/G$30 -> 0
B23: DELITOS CONTRA LA SEG. DE LA NACION | C23: 1 | D23: =+(C23/C$30) -> 1.4457134595923088E-4 | F23: =+E23/E$30 -> 0 | G23: 1 | H23: =+G23/G$30 -> 5.0000000000000001E-3
B24: DELITOS CONTRA LOS POD. PUB. Y ORD. CONTITUC. | C24: 3 | D24: =+(C24/C$30) -> 4.3371403787769266E-4 | F24: =+E24/E$30 -> 0 | H24: =+G24/G$30 -> 0
B25: DELITOS CONTRA LA ADMINISTRACION PUBLICA | C25: 298 | D25: =+(C25/C$30) -> 4.3082261095850803E-2 | E25: 5 | F25: =+E25/E$30 -> 1.5822784810126583E-2 | G25: 1 | H25: =+G25/G$30 -> 5.0000000000000001E-3
B26: DELITOS CONTRA LA FE PUBLICA | C26: 2564 | D26: =+(C26/C$30) -> 0.37068093103946798 | E26: 62 | F26: =+E26/E$30 -> 0.19620253164556961 | G26: 2 | H26: =+G26/G$30 -> 00.01
B27: INFRACCION LEY 23.737 (ESTUPEFACIENTES) | C27: 1608 | D27: =+(C27/C$30) -> 0.23247072430244325 | E27: 199 | F27: =+E27/E$30 -> 0.629746835443038 | G27: =147+11 -> 158 | H27: =+G27/G$30 -> 00.79
B28: INFRACCION LEYES ESPECIALES Y DEC. LEYES | C28: =175+770+25 -> 970 | D28: =+(C28/C$30) -> 0.14023420558045396 | E28: =11+16 -> 27 | F28: =+E28/E$30 -> 8.5443037974683542E-2 | G28: 9 | H28: =+G28/G$30 -> 4.4999999999999998E-2
B29: D.G.I. | C29: 315 | D29: =+(C29/C$30) -> 4.5539973977157727E-2 | F29: =+E29/E$30 -> 0 | G29: 23 | H29: =+G29/G$30 -> 0.115
B30: TOTAL | C30: =SUM(C14:C29) -> 6917 | D30: =SUM(D14:D29) -> 1 | E30: =SUM(E14:E29) -> 316 | F30: =SUM(F14:F29) -> 1 | G30: =SUM(G14:G29) -> 200 | H30: =SUM(H14:H29) -> 1
B31: REFERENCIAS: (*) En causas tramitadas en los Juzgados de 1ra. Instancia y en los Tribunales Orales en lo Criminal Federal
B32: FUENTE: Oficina de Estadísticas del Poder Judicial de la Nación.