B6: PODER JUDICIAL DE LA NACION
B7: JURISDICCION FEDERAL LA PLATA
B9: CUADRO IV
B10: DISTRIBUCION DE LOS CARGOS POR DEPENDENCIA -AÑO 2001-
C12: Distribución de los cargos actuales | D12: Distribución
D13: Porcentual
B14: Cámara Federal de Apelaciones de La Plata | C14: =126+24 -> 150 | D14: =+C14/C$19 -> 0.34482758620689657
B15: Tribunales Orales en lo Criminal Federal de La Plata Nros 1 y 2 | C15: 26 | D15: =+C15/C$19 -> 5.9770114942528735E-2
B16: Juzgados Federales de Primera Instancia de La Plata Nros 1 al 4 | C16: 128 | D16: =+C16/C$19 -> 0.29425287356321839
B17: Juzgados Federales de Primera Instancia de Lomas de Zamora Nros 1 al 3 | C17: =92+14 -> 106 | D17: =+C17/C$19 -> 0.24367816091954023
B18: Juzgado Federal de Primera Instancia de Junín | C18: 25 | D18: =+C18/C$19 -> 5.7471264367816091E-2
B19: TOTAL | C19: =SUM(C14:C18) -> 435 | D19: =SUM(D14:D18) -> 1
B20: FUENTE: Oficina de Estadísticas del Poder Judicial de la Nación.