B6: PODER JUDICIAL DE LA NACION
B7: JURISDICCION FEDERAL CORRIENTES
B9: COMPETENCIA PENAL
B10: CUADRO VII
B12: CAUSAS INGRESADAS Y ELEVADAS A JUICIO EN LOS JUZGADOS DE 1RA. INSTANCIA -AÑO 2001-
C14: TOTAL DE CAUSAS INGRESADAS | D14: TOTAL DE CAUSAS ELEVADAS A JUICIO (*) | E14: PORCENTAJE DE CAUSAS ELEVADAS A JUICIO
B16: Juzgado Federal de Primera Instancia de Corrientes | C16: 826 | D16: 28 | E16: =+D16/C16 -> 3.3898305084745763E-2
B17: Juzgado Federal de Primera Instancia de Paso de los Libres | C17: 723 | D17: 13 | E17: =+D17/C17 -> 1.7980636237897647E-2
B18: Total | C18: =SUM(C16:C17) -> 1549 | D18: =SUM(D16:D17) -> 41 | E18: =+D18/C18 -> 2.6468689477081989E-2
B19: REFERENCIAS: (*) En estas cifras se incluyen causas de años anteriores y las elevaciones a juicio en causas correccionales que se resuelven
B20: en la misma instancia.
B21: FUENTE: Oficina de Estadísticas del Poder Judicial de la Nación.