C6: PODER JUDICIAL DE LA NACION
C7: JURISDICCION FEDERAL CORRIENTES
C9: CUADRO V
C10: DISTRIBUCION ANUAL DEL GASTO EN CONCEPTO DE LIQUIDACION DE HABERES -AÑO 2001-
D12: Gasto (Haberes) | E12: %
C13: Cámara Federal de Apelaciones de Corrientes | D13: 941001.67269240366 | E13: =+D13/D$17 -> 0.24214045271841883
C14: Tribunal Oral en lo Criminal Federal de Corrientes | D14: 559825.61177080753 | E14: =+D14/D$17 -> 0.14405545814779869
C15: Juzgado Federal de Primera Instancia de Corrientes | D15: 1323853.4237986326 | E15: =+D15/D$17 -> 0.3406566392748745
C16: Juzgado Federal de Primera Instancia de Paso de los Libres | D16: 1061500.4817381562 | E16: =+D16/D$17 -> 0.27314744985890793
C17: TOTAL | D17: =SUM(D13:D16) -> 3886181.19 | E17: =SUM(E13:E16) -> 1
C18: NOTA: Los datos registrados corresponden a la ejecución presupuestaria del año 2001.
C19: FUENTE: Departamento de Contaduría y Oficina de Estadísticas del Poder Judicial de la Nación.