B6: PODER JUDICIAL DE LA NACION
B7: JURISDICCION FEDERAL CORRIENTES
B9: CUADRO VI
B10: DISTRIBUCION ANUAL DEL GASTO POR TODO CONCEPTO -AÑO 2001-
C12: Cámara, Tribunal Oral y Juzgados | D12: %
B13: HABERES | C13: 3886181.19 | D13: =+C13/C$17 -> 0.91038576608736832
B14: BIENES DE CONSUMO | C14: 40258 | D14: =+C14/C$17 -> 9.4309319044244763E-3
B15: SERVICIOS NO PERSONALES | C15: 342280 | D15: =+C15/C$17 -> 8.0183302008207294E-2
B16: BIENES DE USO
B17: Total | C17: =SUM(C13:C16) -> 4268719.19 | D17: =SUM(D13:D16) -> 1
B18: NOTA: Los datos consignados corresponden a la ejecución presupuestaria del año 2001.
B19: FUENTE: Departamento de Contaduría y Oficina de Estadísticas del Poder Judicial de la Nación.