B6: PODER JUDICIAL DE LA NACION
B7: JURISDICCION FEDERAL CORRIENTES
B9: COMPETENCIA PENAL
B10: CUADRO IX
B11: DISTRIBUCION PORCENTUAL SEGÚN EL TIPO DE DELITO DE LAS CAUSAS INGRESADAS, ELEVADAS A JUICIO Y PERSONAS CONDENADAS EN LOS JUZGADOS FEDERALES -AÑO 2001-
C13: CAUSAS | D13: % | E13: CAUSAS | F13: % | G13: PERSONAS | H13: %
B14: DELITOS | C14: INGRESADAS | E14: ELEVADAS | G14: CONDENADAS (*)
B15: DELITOS CONTRA LAS PERSONAS | C15: 15 | D15: =+(C15/C$31) -> 9.6836668818592632E-3 | F15: =+E15/E$31 -> 0 | H15: =+G15/G$31 -> 0
B16: HOMICIDIOS | D16: =+(C16/C$31) -> 0 | F16: =+E16/E$31 -> 0 | H16: =+G16/G$31 -> 0
B17: DELITOS CONTRA EL HONOR | C17: 2 | D17: =+(C17/C$31) -> 1.2911555842479018E-3 | F17: =+E17/E$31 -> 0 | H17: =+G17/G$31 -> 0
B18: DELITOS CONTRA LA INTEGRIDAD SEXUAL | D18: =+(C18/C$31) -> 0 | F18: =+E18/E$31 -> 0 | H18: =+G18/G$31 -> 0
B19: DELITOS CONTRA EL ESTADO CIVIL | D19: =+(C19/C$31) -> 0 | F19: =+E19/E$31 -> 0 | H19: =+G19/G$31 -> 0
B20: DELITOS CONTRA LA LIBERTAD | C20: 14 | D20: =+(C20/C$31) -> 9.0380890897353138E-3 | F20: =+E20/E$31 -> 0 | H20: =+G20/G$31 -> 0
B21: DELITOS CONTRA LA PROPIEDAD | C21: 101 | D21: =+(C21/C$31) -> 6.5203357004519041E-2 | E21: 1 | F21: =+E21/E$31 -> 2.4390243902439025E-2 | H21: =+G21/G$31 -> 0
B22: DELITOS CONTRA LA SEGURIDAD PUBLICA | C22: 76 | D22: =+(C22/C$31) -> 4.9063912201420271E-2 | F22: =+E22/E$31 -> 0 | H22: =+G22/G$31 -> 0
B23: DELITOS CONTRA EL ORDEN PUBLICO | C23: 1 | D23: =+(C23/C$31) -> 6.4557779212395089E-4 | F23: =+E23/E$31 -> 0 | H23: =+G23/G$31 -> 0
B24: DELITOS CONTRA LA SEG. DE LA NACION | D24: =+(C24/C$31) -> 0 | F24: =+E24/E$31 -> 0 | H24: =+G24/G$31 -> 0
B25: DELITOS CONTRA LOS POD. PUBLICOS Y ORDEN CONSTITUCIONAL | C25: 1 | D25: =+(C25/C$31) -> 6.4557779212395089E-4 | F25: =+E25/E$31 -> 0 | H25: =+G25/G$31 -> 0
B26: DELITOS CONTRA LA ADMINISTRACION PUBLICA | C26: 76 | D26: =+(C26/C$31) -> 4.9063912201420271E-2 | E26: 1 | F26: =+E26/E$31 -> 2.4390243902439025E-2 | G26: 3 | H26: =+G26/G$31 -> 3.4482758620689655E-2
B27: DELITOS CONTRA LA FE PUBLICA | C27: 115 | D27: =+(C27/C$31) -> 7.4241446094254357E-2 | E27: 1 | F27: =+E27/E$31 -> 2.4390243902439025E-2 | G27: 9 | H27: =+G27/G$31 -> 0.10344827586206896
B28: INFRACCION LEY 23.737 (ESTUPEFACIENTES) | C28: 159 | D28: =+(C28/C$31) -> 0.10264686894770819 | E28: 18 | F28: =+E28/E$31 -> 0.43902439024390244 | G28: 66 | H28: =+G28/G$31 -> 0.75862068965517238
B29: INFRACCION LEYES ESPECIALES Y DEC. LEYES | C29: =855+19+39 -> 913 | D29: =+(C29/C$31) -> 0.58941252420916723 | E29: 20 | F29: =+E29/E$31 -> 0.48780487804878048 | G29: 9 | H29: =+G29/G$31 -> 0.10344827586206896
B30: D.G.I. | C30: 76 | D30: =+(C30/C$31) -> 4.9063912201420271E-2 | F30: =+E30/E$31 -> 0 | H30: =+G30/G$31 -> 0
B31: TOTAL | C31: =SUM(C15:C30) -> 1549 | D31: =SUM(D15:D30) -> 1 | E31: =SUM(E15:E30) -> 41 | F31: =SUM(F15:F30) -> 1 | G31: =SUM(G15:G30) -> 87 | H31: =SUM(H15:H30) -> 1
B32: REFERENCIAS: (*) En causa tramitadas en los Juzgados de 1ra. Instancia y en los Tribunales Orales en lo Criminal Federal.
B33: FUENTE: Oficina de Estadísticas del Poder Judicial de la Nación.