B6: PODER JUDICIAL DE LA NACION
B7: JURISDICCIÓN FEDERAL CORRIENTES
B8: COMPETENCIA CIVIL
B9: CUADRO XI
B10: DISTRIBUCION PORCENTUAL, SEGÚN EL OBJETO DE LITIGIO, DE LOS EXPEDIENTES INGRESADOS, RESUELTOS O SALIDOS Y SENTENCIAS DICTADAS EN LOS JUZGADOS FEDERALES DE PRIMERA INSTANCIA -AÑO 2001-
B13: OBJETO | C13: INGRESADOS | D13: % | E13: RESUELTOS O SALIDOS | F13: % | G13: SENTENCIAS DEFINITIVAS | H13: % | I13: SENTENCIAS INTERLOCUTORIAS | J13: %
B14: ORDINARIOS | C14: 158 | D14: =+C14/C$27 -> 3.4588441330998247E-2 | E14: 55 | F14: =+E14/E$27 -> 5.7894736842105263E-2 | G14: 45 | H14: =+G14/G$27 -> 2.4590163934426229E-2 | I14: 69 | J14: =+I14/I$27 -> 5.8673469387755105E-2
B15: SUMARIOS | C15: 67 | D15: =+C15/C$27 -> 1.4667250437828371E-2 | E15: 45 | F15: =+E15/E$27 -> 4.736842105263158E-2 | G15: 23 | H15: =+G15/G$27 -> 1.2568306010928962E-2 | I15: 49 | J15: =+I15/I$27 -> 4.1666666666666664E-2
B16: SUMARISIMOS | C16: 152 | D16: =+C16/C$27 -> 3.3274956217162872E-2 | E16: 38 | F16: =+E16/E$27 -> 00.04 | G16: 3 | H16: =+G16/G$27 -> 1.639344262295082E-3 | I16: 81 | J16: =+I16/I$27 -> 6.8877551020408156E-2
B17: EJECUTIVOS | C17: 436 | D17: =+C17/C$27 -> 9.5446584938704032E-2 | E17: 87 | F17: =+E17/E$27 -> 9.1578947368421051E-2 | G17: 63 | H17: =+G17/G$27 -> 3.4426229508196723E-2 | I17: 150 | J17: =+I17/I$27 -> 0.12755102040816327
B18: EJECUCIONES FISCALES | C18: 2735 | D18: =+C18/C$27 -> 0.59873029772329245 | E18: 200 | F18: =+E18/E$27 -> 0.21052631578947367 | G18: 1500 | H18: =+G18/G$27 -> 0.81967213114754101 | I18: 180 | J18: =+I18/I$27 -> 0.15306122448979592
B19: LABORALES | C19: 17 | D19: =+C19/C$27 -> 3.7215411558669002E-3 | E19: 6 | F19: =+E19/E$27 -> 6.3157894736842104E-3 | G19: 14 | H19: =+G19/G$27 -> 7.6502732240437158E-3 | I19: 41 | J19: =+I19/I$27 -> 3.486394557823129E-2
B20: CIUDADANIA | C20: 40 | D20: =+C20/C$27 -> 8.7565674255691769E-3 | E20: 12 | F20: =+E20/E$27 -> 1.2631578947368421E-2 | G20: 32 | H20: =+G20/G$27 -> 1.7486338797814208E-2 | I20: 5 | J20: =+I20/I$27 -> 4.2517006802721092E-3
B21: AMPAROS (LEY 16.986) | C21: 459 | D21: =+C21/C$27 -> 0.1004816112084063 | E21: 105 | F21: =+E21/E$27 -> 0.11052631578947368 | G21: 41 | H21: =+G21/G$27 -> 2.2404371584699455E-2 | I21: 333 | J21: =+I21/I$27 -> 0.28316326530612246
B22: AMPAROS POR MORA | C22: 4 | D22: =+C22/C$27 -> 8.7565674255691769E-4 | E22: 37 | F22: =+E22/E$27 -> 3.8947368421052633E-2 | G22: 18 | H22: =+G22/G$27 -> 9.8360655737704927E-3 | I22: 9 | J22: =+I22/I$27 -> 7.6530612244897957E-3
B23: EXPROPIACIONES | C23: 3 | D23: =+C23/C$27 -> 6.5674255691768827E-4 | E23: 10 | F23: =+E23/E$27 -> 1.0526315789473684E-2 | G23: 9 | H23: =+G23/G$27 -> 4.9180327868852463E-3 | I23: 2 | J23: =+I23/I$27 -> 1.7006802721088435E-3
B24: LEY 24.463 (ART. 15 SEG. SOC.) | C24: 153 | D24: =+C24/C$27 -> 3.3493870402802099E-2 | E24: 77 | F24: =+E24/E$27 -> 8.1052631578947362E-2 | G24: 60 | H24: =+G24/G$27 -> 3.2786885245901641E-2 | I24: 5 | J24: =+I24/I$27 -> 4.2517006802721092E-3
B25: LEYES ESPECIALES | C25: 195 | D25: =+C25/C$27 -> 4.2688266199649737E-2 | E25: 92 | F25: =+E25/E$27 -> 9.6842105263157896E-2 | G25: 21 | H25: =+G25/G$27 -> 1.1475409836065573E-2 | I25: 152 | J25: =+I25/I$27 -> 0.12925170068027211
B26: CAUTELARES | C26: 149 | D26: =+C26/C$27 -> 3.2618213660245185E-2 | E26: 186 | F26: =+E26/E$27 -> 0.19578947368421051 | G26: 1 | H26: =+G26/G$27 -> 5.4644808743169399E-4 | I26: 100 | J26: =+I26/I$27 -> 8.5034013605442174E-2
B27: TOTAL | C27: =SUM(C14:C26) -> 4568 | D27: =SUM(D14:D26) -> 1 | E27: =SUM(E14:E26) -> 950 | F27: =SUM(F14:F26) -> 1 | G27: =SUM(G14:G26) -> 1830 | H27: =SUM(H14:H26) -> 1 | I27: =SUM(I14:I26) -> 1176 | J27: =SUM(J14:J26) -> 1
B28: FUENTE:Oficina de Estadísticas del Poder Judicial de la Nación.