B6: PODER JUDICIAL DE LA NACION
B7: JURISDICCION FEDERAL CORRIENTES
B9: CUADRO III
B10: DISTRIBUCION DE LOS CARGOS PERMANENTES Y CONTRATADOS -AÑO 2001-
C12: Cámara Federal de Apelaciones de Corrientes | E12: Tribunal Oral en lo Criminal Federal de Corrientes | G12: Juzgado Federal de Primera Instancia de Corrientes | I12: Juzgado Federal de Primera Instancia de Paso de los Libres
C13: P | D13: C | E13: P | F13: C | G13: P | H13: C | I13: P | J13: C
B14: Juez (1ª o 2ª
B15: instancia) | C15: 3 | E15: 3 | G15: 1 | I15: 1
B16: Secretario (1ª o 2ª instancia)
C17: 1 | E17: 1 | G17: 5 | I17: 5
B18: Prosecretario Administrativo
B19: Jefe
B20: Prosecretario
B21: de Cámara | D21: 1
B22: Prosecretario Administrativo
C23: 2 | D23: 3 | E23: 1 | G23: 5 | I23: 5
C25: 3 | D25: 3 | E25: 3 | G25: 6 | I25: 5
B26: Oficial Mayor Relator
B28: Oficial
G29: 1 | I29: 1 | J29: 1
B30: Escribiente
C31: 1 | G31: 6 | I31: 6
B32: Escribiente Auxiliar | H32: 1
C33: 1 | G33: 6 | I33: 4
B34: Auxiliar
C35: 1 | D35: 3 | G35: 10 | I35: 5
B36: Auxiliar Administrativo
B38: Jefe de Sección /
B39: Encargado de Sección
B40: Oficial
B41: de Servicio / Medio Oficial | G41: 2
B42: Ayudante
C43: 2 | D43: 1 | G43: 5 | I43: 5
B44: Auxiliar de Servicio
B46: Total | F46: =SUM(F12:F45) -> 0
C47: =SUM(C15:C45) -> 14 | D47: =SUM(D15:D45) -> 11 | E47: =SUM(E15:E46) -> 8 | G47: =SUM(G15:G46) -> 47 | H47: =SUM(H15:H46) -> 1 | I47: =SUM(I15:I45) -> 37 | J47: =SUM(J15:J45) -> 1
B48: FUENTE: División Programación Presupuestaria. Consejo de la Magistratura.
B49: Oficina de Estadísticas del Poder Judicial de la Nación.