B6: PODER JUDICIAL DE LA NACION
B7: JURISDICCIÓN FEDERAL CORRIENTES
B8: CUADRO XII
B9: INDICE DE LITIGIOSIDAD EN LOS JUZGADOS FEDERALES DE PRIMERA INSTANCIA -AÑO 2001-
B12: 1- COMPETENCIA PENAL
B14: Dependencias | C14: Causas ingresadas | D14: Cantidad de habitantes en la | E14: Causas ingresadas
D15: jurisdicción | E15: c/10.000 hab.
B16: Juzgado Federal de Primera Instancia de Corrientes | C16: 826 | D16: 685003 | E16: =+(C16/$D$16)*10000 -> 12.058341350329853
B17: Juzgado Federal de Primera Instancia de Paso de los Libres | C17: 723 | D17: 244233 | E17: =+(C17/$D$17)*10000 -> 29.602879217796122
B18: TOTAL | C18: =SUM(C16:C17) -> 1549 | D18: 929236 | E18: =+(C18/D18)*10000 -> 16.669608151212394
B20: FUENTE: INDEC (Censo Nacional de Población, Hogares y Viviendas 2001 e Instituto Geografico Militar).
B21: Oficina de Estadísticas del Poder Judicial de la Nación.
B23: 2- COMPETENCIA CIVIL
C25: Causas ingresadas | D25: Cantidad de habitantes en la | E25: Causas ingresadas
D26: jurisdicción | E26: c/10.000 hab.
B27: Juzgado Federal de Primera Instancia de Corrientes | C27: 3114 | D27: 685003 | E27: =+(C27/$D$27)*10000 -> 45.459654921219325
B28: Juzgado Federal de Primera Instancia de Paso de los Libres | C28: 1454 | D28: 244233 | E28: =+(C28/$D$28)*10000 -> 59.533314498859696
B29: TOTAL | C29: =SUM(C27:C28) -> 4568 | D29: 929236 | E29: =+(C29/D29)*10000 -> 49.158663676396529
B31: FUENTE: INDEC (Censo Nacional de Población, Hogares y Viviendas 2001 e Instituto Geografico Militar).
B32: Oficina de Estadísticas del Poder Judicial de la Nación.